Kui tollal oli vaid kaunis hüpotees ja geofüüsikaliste uuringutega ( seismoakustiline pidevprofileerimine ) oli enam-vähem usutava tõenäosusega kindlaks tehtud meteoriidikraatrile sarnaneva struktuuri olemasolu , siis tänaseks on kõik see saanud vaieldamatuks reaalsuseks .	usutava	15	Gen
Erandiks oli 1887. aastal nootide vahetuse teel sõlmitud kokkulepe Itaaliaga status quo säilitamiseks Vahemere , Musta , Egeuse ja Aadria mere kallastel ning Põhja-Aafrika rannikul .	1887.	2	Ade
Teiselt poolt tähendab kolmemegabaidine kiri jämedalt võttes 300 tavalist e-kirja .	kolmemegabaidine	3	Nom
Weyrauch aga on isikuks , kelle kaudu käis tõenäoliselt suur osa kahtlastest rahaliikumistest .	kahtlastest	11	Ela
Et kaks kanget korraga peeneks jahvatatakse , ei ole tegijal töö juures pisaratest pääsu .	peeneks	4	Tra
Äärmuslikes olukordades tuleb isegi olla võimeline analüüsima reaalajas - loomulikult sellised tegevused on rangete piiridega ning seeläbi automatiseeritavad .	Äärmuslikes	0	Ine
Mittetraditsioonilist , k.a ajaliselt paindlikku ( ja samas ebastabiilset ) tööhõivet esineb kõige enam teenindussektoris .	paindlikku	4	Par
Vaatamata üleeilsetele massiprotestidele ja üldstreigile ütles Milosevic BBC teatel televisioonis , et tal pole kavatsust astuda kõrvale kavandatud teisest voorust .	üleeilsetele	1	All
Tihti on antud etapi läbiviivaks pooleks juba töö tellinud klient , mitte täitev andmeanalüütik .	läbiviivaks	4	Tra
Kapitali olemasolu võimaldab investeerida ka riigi objektiivse ärikeskkonna parandamisse - st parandada ressursside kasutamise riigisisest organiseeritust ( infokanalite puhastamine , koolitus ) .	riigisisest	14	Par
Venemaa presidendivalimiste veteran Vladimir Zhirinovski peab loobuma oma kolmandast katsest riigipeaks saada , kuna keskvalimiskomisjon keeldus teda registreerimast .	kolmandast	8	Ela
Aga ainult sport jääb minu jaoks kitsaks ja seetõttu tegelen ka teiste asjadega , et leida väljundit oma huvidele , " lausub Karuks .	kitsaks	6	Tra
Saksamaa praegune liidukantsler Gerhard Schröder tänas Euroopa kõiki naaberriike toetuse eest ja meenutas , et just Kesk- ja Ida-Euroopas alanud reformiliikumised käivitasid omal ajal protsessi , mis viis Saksamaa riiklikule ühtsusele .	riiklikule	29	All
1942. aastal Walesis sündinud autodidaktist filmirežissööri metafooriline , jõhkralt erootiline ja mustast huumorist tulvil kujundikeel on maiuspala intellektuaalsele vaatajale .	intellektuaalsele	17	All
” Dr Vello Ilmoja juhib autoriteetset kolleegiumi algusest peale .	autoriteetset	5	Par
Sotsioloogia ja sotsiaalpsühholoogia klassika on tõestanud , et üksik arvamus võib olla väga pindmine nähtus ja sellest hoiakuni on pikk tee .	pindmine	13	Nom
Vähesel määral on ka rahvuslikke ja soolisi erinevusi - eestlased on enam kõrvaltöödega hõivatud kui venelased , mehed veidi enam kui naised .	Vähesel	0	Ade
Lihtsas maaperes sündinud ja 1960. aastatel Karagandõ hiiglaslikus metallurgiatehases sulatusahjude kõrval töötanud mehe kohta on Nazarbajev teinud läbi võimsa tõusu , peaaegu nagu ajalehepoisist miljonäriks .	hiiglaslikus	7	Ine
Siis , kui taheti jõuga haldusterritoriaalset reformi teha . "	haldusterritoriaalset	5	Par
Kontrollrühma kuuluvatel uuritavatel ei olnud pandud kõrgvererõhu diagnoosi , neil esines südame isheemiatõbi ( 4 uuritavat ) , rütmihäired ( 3 uuritavat ) , anamneesis müokardiit ( 5 uuritavat ) , reuma ( 2 uuritavat ) .	kuuluvatel	1	Ade
90. aastatel sai inglise film maailmakuulsaks .	maailmakuulsaks	5	Tra
Eluolukord võib väljenduda kõrvaltvaatajale kummalistes kujundites või olendites .	kummalistes	4	Ine
Singapuri ja Lõuna-Aafrika Vabariigi ajalehed avaldasid uudise Viljandi pensionärist , kes pidas vahakuju elavaks inimeseks .	elavaks	13	Tra
Harmoonilise ühiskonna kujundamisel on Ameerika lahendanud kõige raskema probleemi - eri rasside ja rahvuste integreerimise - tugeva kultuurilise baasiga , kus inimeste rahvuslik jaotamine on lubamatu ühiskonna kõigil tasandeil ja halvaks tooniks inimestevahelises suhtlemises .	halvaks	30	Tra
Siiani on aga sellel käsitlusel põhinevate mõõtmismeetodite otsinguid saatnud ebaõnnestumised .	põhinevate	5	Gen
Geoloogia keskendub maakoore ehituse ja arenguloo uurimisele , eriti pöörates tähelepanu mineraalidele ja mineraalidest koosnevatele kivimitele .	koosnevatele	14	All
Ekspeditsioone korraldatakse ka atmosfääri , eriti stratosfääri sihipäraseks uurimiseks .	sihipäraseks	7	Tra
Ilmselt pole juba ka meil haruldane , et perekonnapea teenib nagu Ameerikaski põhilise tulutoojana 80 protsenti või veelgi enam pere sissetulekust .	põhilise	12	Gen
Alati on võimalik õuna maitsebuketti veelgi võimendada , lisades roogadele - nii soolastele kui magusatele - õuna elegantseid tuletisi nagu üllast calvadosi , kihisevat kuiva õunasiidrit või mahedat õunaäädikat .	kihisevat	23	Par
Nendest sisemistest põhjustest on tõenäoliselt tingitud kümnetes aastates mõõdetavate perioodidega kõikumised ööpäeva pikkuses .	sisemistest	1	Ela
Kõige mahukam neist on meteoroloogia , mida jagatakse veel sünoptiliseks meteoroloogiaks , dünaamiliseks meteoroloogiaks ja klimatoloogiaks .	dünaamiliseks	12	Tra
Protestiti president Evo Moralese autoritaarse juhtimisstiili vastu .	autoritaarse	4	Gen
" Esimesel korral veedad niikuinii üpris palju aega tagumiku peal , " muigas Eesti Suusaliidu lumelauasektsiooni juhataja Siim Silland eelmisel päeval vastuseks küsimusele , et millised riided selga tasub panna ja soovitas vähemalt kolmekihilist riietust .	kolmekihilist	33	Par
Nüüd lasti neid kastist välja jalutama ning nendega tegeles peamiselt pikapatsiline tüdruk .	pikapatsiline	10	Nom
Andmekaevandamine pakub võimaluse töödelda suuremat kliendibaasi rohkema ja kaudsema informatsiooniga , kus tunnusteks on peale traditsioonilise demograafilise bloki ka ostukäitumised ja -harjumused .	kaudsema	8	Gen
Erialases kirjanduses osutusid uurimistulemused kanamunade ja kana-broileriliha rikastamiseks ω-3-rasvhapetega tihti vastuolulisteks .	vastuolulisteks	10	Tra
Rühti parandavas treeningus pole oluline mitte koormuse intensiivsus , vaid harjutuste õige sooritustehnika , sobivate koormuste leidmine ja suurem koormuste arv .	parandavas	1	Ine
Kõige kehvemini on majandusreformid kulgenud n-ö sõjajärgsetes riikides , kus keskvõim pole suutnud inimestele tagada isegi esmaseid hüvesid .	sõjajärgsetes	6	Ine
Suurematest " seltskonnaüritustest " on talle meelde jäänud näiteks kuulsa strippari neiu Eva lahkumispidu enne Soome tööle minekut .	Suurematest	0	Ela
Töö teises osas on kirjeldatud tööturu peamisi trende aastatel 1989-2001/2002 , jaotades tööturu arengu etappideks tööturu põhitrendide - eelkõige tööhõive , töötuse ja osaluse määrade ning tööjõu ja mitteaktiivsuse - muutumise alusel .	peamisi	6	Par
Kui pidada silmas reformi-eestimeelseid kommuniste , siis osaliselt just nende kaasabil taastati Eesti Vabariik .	reformi-eestimeelseid	3	Par
Uneuuringu küsimustiku koostamisel juhindusime Gislasoni ja Jansoni unehäirete epidemioloogilisest uuringust ( 3 ) , Partineni põhjamaade uneuuringu küsimustikust ( 5 ) , Horne-Ostbergi küsimustikust ( 6 ) ning rahvusvahelisest unehäirete klassifikatsioonist .	epidemioloogilisest	8	Ela
Tundmatuid maakohti esmaläbivate maadeuurijate paremad ajad olid eelmisel sajandil ja varem .	Tundmatuid	0	Par
Haiguse prognoos varieerub sõltuvalt eosinofiilse infiltratsiooni tüübist ja ulatusest .	eosinofiilse	4	Gen
On võimatu öelda , kui vana see on , kuid tšetšeenide endi arvates viitavad juba hümni sõnad väga kaugetele aegadele .	kaugetele	18	All
2. LRE portaal on paindlik süsteem , mis võimaldab liitunutel valida erinevate teenuste vahel .	paindlik	4	Nom
Disainerid keskenduvad põhiliselt materjali jagamisele väikesteks objektideks ja nende kirjeldamisele metaandmetega .	väikesteks	5	Tra
Väike trahheaalne ja endobronhiaalne amüloidi kogum põhjustab harva sümptomeid ning harilikult avastatakse see juhuleiuna bronhoskoopial .	trahheaalne	1	Nom
Roheleeguan muudab nahavärvi vastavalt meeleolule : rõõmsad pojad on ilusad erkrohelised , stressis loom muutub aga kiiresti tumedaks , peaaegu mustaks .	mustaks	20	Tra
Nii kaugele tundmatule festivalile olin nõus sõitma kahel põhjusel .	tundmatule	2	All
Sõrme keskmise vererõhu ( KVR ) pidevaks registreerimiseks iga südametsükli kohta kasutati monitorfüsiograafi UT9201 ( 8 ) .	pidevaks	6	Tra
Ettevõtete valimis andsid usaldusväärseid seoseid tööhõivega 2000. a järgmised tegevusalad :	usaldusväärseid	3	Par
" Neid kahte vaadates meenub kulunud tsitaat " Viimsest reliikviast " : mitu korda ma pean üht ja sama meest ... "	Viimsest	8	Ela
Kuuba sai uue sajandi algul , 1901 uueks iseseisvaks riigiks , 1898 sõlmitud rahulepinguga läksid Ühendriikide võimu alla Puerto Rico , Guam ja Filipiinid .	iseseisvaks	8	Tra
Kui ma udusest Sussexist tagasi koju mudasele Baker Streetile jõudsin , tabas mind suur üllatus !	mudasele	6	All
Uuele sajandile vastu minnes ennustas 1900. aastal Saksamaa kantsleriks tõusnud v. Bülow : “ Saabuval sajandil on Saksamaa kas haamriks või alasiks . ”	1900.	5	Ade
4. Uriini väljutustakistust vähendavad lisaks selektiivsetele ja mitteselektiivsetele alfa-blokaatoritele ka lihaslõõgastid ( baclofen , bensodiasepiinid ) ning eesnäärme mahtu vähendavad ravimid .	mitteselektiivsetele	7	All
Maa pöörleb ümber oma telje ja osaleb maailmaruumis toimuvates suhteliselt korrapärastes liikumistes .	toimuvates	8	Ine
73. aastal saatis Hiina 36-liikmelise delegatsiooni eesotsas Ban Chao'ga Läände , Ban Chao asetäitja Gan Ying jõudis Rooma keisririiki ning külastas tagasiteel Pärsia lahe äärseid linnu .	äärseid	24	Par
Järgnevatel aastatel paranes markide kvaliteet oluliselt .	Järgnevatel	0	Ade
Sümmeetrilisi kahekõrvalisi galaktikaid , kui neis on toimunud hiigelplahvatus , võiks justkui pidada normaalseiks .	normaalseiks	13	Tra
Keskmisele jänkile jääb voodis alla ka meie muulane , kuigi veidi vähem .	Keskmisele	0	All
Tuleval aastal vahendab Karuks Pekingist kaheksandat korda olümpiamänge Eesti kuulajatele .	Tuleval	0	Ade
Sikhid ei suitseta ega tarvita narkootilisi aineid ( tõsi , mõnedki on maiad alkoholi järele ) .	narkootilisi	5	Par
Joonisel 4 on näidatud , kuidas ajaliselt on korraldatud andmestringi ( w1 , ... , w9 ) töötlus selles andmeskalaarses protsessoris .	andmeskalaarses	19	Ine
Mitte ainult juhtivad meediaväljaanded , vaid ka poliitilised institutsioonid ja erakompaniid ei liigita inimesi rassilisel , rahvuslikul või usulisel alusel .	rassilisel	14	Ade
Ameerika uurimus iseloomustab rohkem tavamiljonäre ehk sealses mõistes jõukat keskklassi .	sealses	6	Ine
Halvemal juhul aasta pärast Genfis .	Halvemal	0	Ade
Kas jääme pigem vaesteks ja puhasteks eestlasteks või oleme jõukamad koos siia tuleva muu rahva ja mõtteviisidega ?	puhasteks	5	Tra
6. Joonistuses on võimalik fantaseerida ning olla irratsionaalne , teha kentsakaid asju , olla naeruväärne , ilma et keegi mõtleks , et hulle pilte joonistavad ainult hullud .	kentsakaid	10	Par
Diktofon töötab ja mina mõtlen , et keda see jutt Ukraina rahvarindest , korruptsioonist ja kohalikust võimuvõitlusest Eestis huvitab .	kohalikust	15	Ela
Rahvusvahelistele rahumissioonidele sõitvate Eesti sõjaväelaste auastmeid tuleb vahel ajutiselt tõsta , sest vastav ametikoht nõuab kõrgemat auastet .	Rahvusvahelistele	0	All
Ühel sombusel hommikul märkas meie kangelane , et ta pole enam tibu , vaid on kana .	sombusel	1	Ade
Tüüpilise kunstiinimesena ammutab Almer Jansu energiat ja ideid idamaistest kunstidest .	idamaistest	8	Ela
Prantsuse välisminister Théophile Delcassé kartis eriti , et Saksamaa võib seda sõda ära kasutada Prantsusmaa uueks ründamiseks .	uueks	15	Tra
Vene geeniuse rolli hindab näitleja maalähedaseks .	maalähedaseks	5	Tra
Konvektsioonist tingitud perioodilised vönkumised vedelas välistuumas kui elektrit juhtivas keskkonnas põhjustavad magnetilist hõõrdumist sisetuuma pinnal ja sisetuuma ning vahevöö pöörlemiskiiruste väikesi erinevusi .	juhtivas	8	Ine
Andmeskalaarses protsessoris toimub ühe ja sama jadaprogrammi rööpne töötlemine suurt hulka protsessorüksusi sisaldaval kogumil , kasutades hajutatud andmekogumeid .	Andmeskalaarses	0	Ine
Mõnel pööningul võib olla tänini alles mitmekordse värvikihi ja katkise sitsriidega vana sirmiraam , mis on kunagi varjanud pesunurka .	katkise	9	Gen
Nüüd , kui Uuspõld geeniusest prii , võtab ta nädala pausi- ja mõtlemisaega , loeb Shakespeare'i " Kuningas Leari " ja astub draamateatri proovisaali .	prii	5	Nom
Selles järjeloos olen kasutanud primaatide käitumist uurinud , kuid eeskätt publitsistina tuntuks saanud Desmond Morrise töid , mida enamik etoloogidest peab liiga julgeiks ja teaduslikult nõrgalt põhjendatuiks .	põhjendatuiks	26	Tra
Rõõmustav ongi , et sellises keerulises situatsioonis on leitud osapooli rahuldavaid lahendusi .	rahuldavaid	10	Par
See hakkas toimima kinnisena ning nii polnud kahtlasel seltskonnal enam võimalik probleeme tekitada .	kahtlasel	7	Ade
Töö kajastab üht osa unehäirete epidemioloogilisest uuringust , kus on püütud välja selgitada olulisemate unehäirete esinemissagedus Eesti noorte inimeste seas .	epidemioloogilisest	5	Ela
Kolmekümnekilomeetrise tunnikiirusega vastpinnatud teel venimine ei meeldi kellelegi , hilisema mugava sõidu huvides tuleb see aga lihtsalt välja kannatada .	mugava	10	Gen
Näiteks võitis tema Torres Mas la Plana 1979. aastal Cabernet Sauvignon tüüpi veinide degusteerimisel kõiki seniseid maailmakuulsusi ning sai suveräänse esikoha .	seniseid	15	Par
President Nursultan Nazarbajev on 12 võimul oldud aastaga pigistanud riigi oma raudsesse haardesse ja kindlustanud endale pikkadeks aastateks vankumatu “ troonil ” püsimise .	pikkadeks	16	Tra
Suvel põhjaliku remondi läbi teinud Kanepi kirikutornis troonib nüüdsest endise risti asemel ao- ehk koidutäht .	põhjaliku	1	Gen
Ka R. Reisler ( 1998 ) väidab , et toidu mõjul vereplasma kolesteroolisisalduse tõus varieerub indiviiditi ja ainult väikesearvulisel , tõesti kõrge riskiteguriga grupil võib ülemäärane toidu kolesteroolisisaldus põhjustada südame-veresoonkonna haigusi .	ülemäärane	25	Nom
Laplace hüpoteesi järgi tekkis planeedisüsteem kuumast gaasudust ( mitte külmast meteoriitsest ehk tolmudust nagu Kantil ) .	meteoriitsest	10	Ela
Suuremas puuris võib korraga pidada mitut liiki roomajaid : näiteks enamiku ajast puuokstel roomavad leeguanid sobivad kokku seintel ronida armastavate gekodega .	Suuremas	0	Ine
Sõiduta oma pekimägi-käskijanna pargi kõige kaugema aiamajakese , selle hõbedavärvilise juurde !	hõbedavärvilise	9	Gen
Teisipäeval kell 18.20 kihutas joobnud 35-aastane Meelis Konksi oma Mazdaga Kaare tänavas seisnud MAZi veoki esiosa alla .	joobnud	4	Nom
Siiski ei too seadus omavalitsusliitudele tagasi kuldseid aegu : kui kadus ühine rahakott ja ühistegevuseks vajalik raha tuli linnadel-valdadel ise leida , hakkas siin-seal kaduma üksmeel .	kuldseid	6	Par
kogu eestirahvas muutunud on kurvaks sest	kurvaks	4	Tra
Kapitali sissevoolul , selle konkreetsel vormil konkreetsesse ühiskonda , võib olla ka töötust suurendav mõju , kuigi see võib esmapilgul tunduda vastuoluline .	konkreetsel	4	Ade
Sammu tegemiseks kuluv energia suureneb , kui kokkusurutud vedru oma energiavaruga taas lahti kargab ning saapakandjat edasi lükkab .	kuluv	2	Nom
Kas pidada kiilaspead seksikaks või ebameeldivaks , on maitse asi , igal juhul on kiilasjää talvise ilma üks ohtlikumaid nähtusi .	ebameeldivaks	5	Tra
Seitset saab esimeses põikkolmikus paigutada vaid 28-sse , sest teine rida keskmises sektsioonis on täis , s.o kõik kolm arvu on paigas .	keskmises	11	Ine
Nagu meie pealiskaudsele ajastule kahjuks tüüpiline , polnud haruldast külalist vastu võtmas ühtki prominenti ega ajakirjanikku .	pealiskaudsele	2	All
" Ma jäin sirgeks ja ei kummardanud , " ütleb ta .	sirgeks	3	Tra
Pärast eelmise aasta suurt toidukaupade hinnatõusu on sel aastal selgelt näha , et enamik piima- ja lihatooteid on tugevas siseturukonkurentsis mullusest madalama hinnaga .	mullusest	20	Ela
Aune oli tulles uudselt asjalik .	asjalik	4	Nom
Esmast huvi pakkus strateegiline ja kaubanduslik informatsioon , loodusteaduslikul oli rohkem üldise tausta tähendus .	Esmast	0	Par
Järgmisel hommikul kohvilauas jätkasin ülekuulamist .	Järgmisel	0	Ade
-. Uhke kaelkirjakupull Nairobi rahvuspargist Keenias .	Uhke	1	Nom
Hüpoteesi empiiriliseks hindamiseks oleks lisaks töötuse andmetele vajalik teada ka Eesti tööjõu potentsiaalse mobiilsuse näitajaid .	potentsiaalse	12	Gen
Tillukesi dinosauruseid meenutavad roheleeguanid olesklevad kahekesi oma maast laeni ulatuva klaaskodu lae all ja vaatavad tõtt .	ulatuva	9	Gen
Restaurantapäevad juunikuu teisel nädalavahetusel on meie vanamootorrattaklubi UNIC-MOTO korraldatavate Kurtna ( nüüd Tagadi ) restaureerijate päevade Soome analoog .	korraldatavate	8	Gen
Munade ja linnuliha ω-rasvhappelise koostise mõjutamiseks kasutatavad söödad	ω-rasvhappelise	3	Gen
Praegu alles õpitakse olema teistlaadses ametiühingus , pidama palgaläbirääkimisi .	teistlaadses	4	Ine
Mustades ja rohelistes värvitoonides nahar meenutab USA dollarit , kuid rikkalik rahvuslik ornamentika muudab nahari dollarist ilusamaks .	ilusamaks	16	Tra
Selle teevad meile juba varases lapseeas mõistetavaks kõiksugu Cooperi ja IQ kanoniseeritud testid .	varases	4	Ine
Vähesel määral on ka rahvuslikke ja soolisi erinevusi - eestlased on enam kõrvaltöödega hõivatud kui venelased , mehed veidi enam kui naised .	soolisi	6	Par
Seal selgus , et tumesinine masin , mille külgedel ja tagaklaasil olid koolitusfirma Invicta reklaamkirjad , kuulub eelmisel õhtul kadunuks jäänud Urmas Nordenile .	kadunuks	19	Tra
See jaguneb radioloogiliselt solitaar- või mitmesõlmeliseks ja difuusseks alveoseptaalseks parenhümatoosseks amüloidoosiks .	alveoseptaalseks	8	Tra
Kordamine on ju tarkuse ema .	tarkuse	3	Gen
See tähendab , et teises riigis elades hakkavad need inimesed seal küll saama arstiabi võrdsetel tingimustel sealsete kindlustatutega , kuid kindlustajariigina maksab Eesti teisele riigile nende isikute ravikulude eest .	võrdsetel	14	Ade
Mitte kusagil ei ole parlamendiliikme palk seotud keskmise palgaga , rääkimata selle neljakordsest määrast .	neljakordsest	12	Ela
Enno Perel oli probleeme ka enda juhitavas ettevõttes .	juhitavas	6	Ine
Eemal , vanal raudteesillal lõpetan teise bokoskoobi .	vanal	2	Ade
Samas on koolidele veebipõhiseid e-õppe teenuseid arendanud ja pakkunud ka hoopis teistest eesmärkidest lähtuv kogukond , kelle pedagoogiline kontseptsioon ( CSCL , Computer-Supported Collaborative Learning ) väärtustab elektrooniliste konspektide asemel hoopis aktiivõpet Interneti vahendusel .	pedagoogiline	17	Nom
Hoiduda tasuks ka suurest seast , kes lösutas haisvas sulus ega võtnud tagumisi jalgu alla .	haisvas	8	Ine
Oli , kindlasti oli , aga siinsest , igavikku tendeerivast valimikust on selle loo rahvalik-eepiline ja ajalaululik kude tõepoolest taandatud .	tendeerivast	9	Ela
Kui CMPs töödeldakse käsuvoogude erinevaid harusid ( lõimi ) , mis on staatiliselt moodustatud kas programmeerija või paralleliseeriva kompilaatori poolt , siis multiskalaarses protsessoris töödeldakse jadaprogrammi , mida on rikastatud täiendava järjestusinfoga .	paralleliseeriva	17	Gen
Palgatööd otsivatest keskeri- ja kõrgharidusega töötutest otsis 2001. a. vaid 26,7 % haridustasemele vastavat tööd , 73,3 % oli nõus ka madalamat haridustaset nõudva tööga .	otsivatest	1	Ela
Esimene on piimaseks sulatatud Ahja juust ja teine - vanast ajast tuntud magustoit riivleiva , vahukoore ja pohlamoosiga .	vanast	9	Ela
Tšetšeenide liider šeik Mansur kuulutas end kõikide mägirahvaste imaamiks ja suutis Püha Sõja kontseptsiooni esmakordse väljatöötamisega ühendada suurt osa Põhja-Kaukaasia vastuhakust Venemaa vallutustele .	esmakordse	14	Gen
Tähe eluiga sõltub tema algsest massist ja on seda lühem , mida suurem mass on .	lühem	9	Nom
Ta jalasäärte eespinnad on kaetud lamedate ( lihhenoidsete ) punakas-pruunide naastudega , mis on omavahel kohati laatunud .	lamedate	5	Gen
Tartu Ülikooli õppejõud Jüri Ruus on uurinud aastaid kommunistide rolli Eesti tänases ühiskonnas .	tänases	11	Ine
Manuelli mudelis vähendab etteaimatav tehnoloogia muutus olemasolevate ettevõtete turuväärtust , mis põhjustab investeerimise ja töökohtade loomise vähendamise , mille tulemusel omakorda tõuseb tööpuuduse määr .	olemasolevate	6	Gen
" Meie tulubaas ei tule kasvavatele kulutustele järele , " sõnastas vallavanem Kaljo Ahman oma suure mure .	kasvavatele	5	All
" Ei , see imeliku nimega ... "	imeliku	4	Gen
Pärast akna raiumist Euroopasse ehk Peterburi rajamist Nevanlinna kohale 1703. aastal andis ta oma kaupmeestele korralduse kaubelda ainult Peterburis .	1703.	9	Ade
Ammust aega on arutatud , kas võib võistlusmales vajalik talutavuse piirini või vahel üle sellegi küündiv totaalne kontsentratsioon inimese tasakaalust välja viia .	Ammust	0	Par
Kaasaegse inimese taskupõhja ja suukoopasse võiks ära mahutada Diroli firmamärki kandva hõbedasse pakitud VALGE närimiskummi .	kandva	10	Gen
Või kuivõrd ilus on kõik jätkusuutmatu .	jätkusuutmatu	5	Nom
Nagu ta oli endale lubanud , nii ta ka tegi - ta astus kuueks päevaks oma rutiinsest , julmast , ent hinnalisest aegruumist välja .	julmast	18	Ela
Saja aastaga on eestlanna iluideaal muutunud tsaariaja pontsakast emandast kõhnaks igibeibeks .	pontsakast	7	Ela
Shikki euroopalikku ülikonda kandvale peategelasele Mustafale ( kasahhi bariton Oleg Brõjak ) vastanduvad efektselt mustades barandzhaades bei naisalamad ja automaatidega relvastatud laigulistes univormides õukondlased .	kandvale	3	All
Meiepoolsed allakirjutajad aga juhindusid tollal ennekõike omaenda ärihuvidest tollases vara- varakapitalistlikus Eestis .	varakapitalistlikus	10	Ine
Ometi räägiti , et enne uinumist oli ta lubanud ükskord tagasi tulla ja aidata rüütleid nende raskes tõeotsimise töös .	raskes	16	Ine
Meile jõudis see Soomest , kus kunstiteraapiat hakati kasutama 1960ndatel aastatel .	1960ndatel	9	Ade
Paha on vaadata nende Maimikute-Salmikute filme suvalistest pederastidest , kelle loome ei anna praegusele ega tulevasele põlvkonnale midagi .	tulevasele	15	All
Ringi liikus ta riiklikku numbrimärki 32 MBU kandva Toyota Corollaga , mille külgedel samuti kiri " Viru Valge " .	kandva	7	Gen
Seljaaju Th11-L2 segmendi tasemel hallaines paiknevast keskusest saab kusepõis sümpaatilise innervatsiooni , mis laseb põiel täituda .	sümpaatilise	9	Gen
Samuti võib üsna julgelt väita , et enamik praegu riigis praktiseerivatest anestesioloogidest on juubilarilt ühel või teisel viisil saanud erialaseid näpunäiteid .	praktiseerivatest	10	Ela
Ja teist korda 1960.-1970. aastatel , kui Lääne-Berliin oli - tolleaegse Iiri suursaadiku sõnu tarvitades - nagu saareke keset ükskõiksuse ja loiduse merd .	1960.-1970.	3	Ade
Alguse tegijad [ 9 ] ning edasiarendajad [ 1 ] näevad teadmushõivet andmebaasidest järgmisse iteratiivse ning interaktiivse protsessina :	järgmisse	13	Gen
" Kes sa oled ? " küsis sir Bors ja vabastas mehe pea raskest kiivrist .	raskest	13	Ela
Firma nõuab siiski oma konservist kirjutamisel läbivate suurtähtede kasutamist ( SPAM ) ning rõhutab , et pole kunagi tegelenud spämmiga elektroonilises mõttes .	elektroonilises	20	Ine
Riigi pealinnaks sai 1799. aastal Punjabi suurim linn Lahore , kuigi Amritsari eriline pühadus säilis .	1799.	3	Ade
Viimasel ajal on üles kerkinud küsimus väikese massiga ja maapinnalt nähtamatute komeedilaadse päritoluga objektide võimalikust suhteliselt sagedasest langemisest Maa atmosfäari .	võimalikust	14	Ela
Sangla Turba brikett asub kunagises väetisehoidlas , mille firma kohandas briketi ladustamiseks .	kunagises	4	Ine
Igal vabal hetkel räägib Meri telefonitsi kaitseminister Luigega .	vabal	1	Ade
HE : Ka osa akadeemilist kõrgharidust andvatest ülikoolidest on sisult nishiülikoolid .	andvatest	6	Ela
Vanadel headel aegadel tehti silmapaistvaid autosid , aga ei suudetud nendega raha teenida .	Vanadel	0	Ade
Maksusoodustusi pakkuvad pensionifondid on lisaks tavalistele investeerimisfondidele üheks võimaluseks .	pakkuvad	1	Nom
Lisaks traditsioonilisele ametlikest liitudest hoidumise poliitikale kujundas Briti valitsuse meelsust ka Saksamaa maailmapoliitika teine tahk - koloniaalpoliitika .	traditsioonilisele	1	All
Tšetšeeni keele olulisemad murded on ploskost , iton-qälla , melkhin ( siirdedialekt inguši keelde ) , kistin , tšeberloi , akkin .	olulisemad	2	Nom
Vaid üksikud riigid ei ole vältimatu arstiabi osutamisel kehtestanud patsiendi omavastutustasu ja arstiabi on isikule täies ulatuses tasuta .	täies	15	Ine
Möödunud kuul oli väga tihe rebimine ka kõige enammüüduma automudeli osas .	tihe	4	Nom
Seniste juhtumianalüüside põhjal ning patsientide ajalooliste raviandmete analüüsimine võimaldab vastavalt andmekaevanduse olemusele kirjeldada hetkeolukorda täpsemalt ning ehitada prognoosimiseks paremaid mudeleid .	Seniste	0	Gen
Ja seda kõike vaid selle nimel , et põllumaad ei läheks " ei tea kelle " kätte , vaid konkreetsele huvigrupile , kes on ennast kuulutanud ainsateks , kellel on nii moraalne kui tegelik õigus Eestis põllumaad omada .	konkreetsele	19	All
lingvistiline - analüüsida dokumendi süntaksit ning semantikat	lingvistiline	0	Nom
Kui tavaliselt paiknes sellises majas kummalgi korrusel kaks korterit , siis selles on maja paremas , hoovi poole eenduvas tiivas üks suur , läbi kahe korruse ulatuv korter .	kummalgi	5	Ade
Mootorivalik saab olema praegusele üsna sarnane , koosnedes 4- ja 6-silindrilistest turbokompressoriga mootoritest .	4-	8	Gen
