Musiq Soulchildi debüütalbumi esimese loo - " Girl Next Door " - ajal olen kõrvust meeldivalt kõrgele tõstetud : veel üks särav tegelane võimsas nu-soulis !	võimsas	23	Ine
Röögatu arve ei tekkinud siiski kallitest kaugekõnedest või lustiliinidele helistamisest .	kallitest	5	Ela
Inimeste peal sedasama teha oleks mõeldamatu .	sedasama	2	Par
Teisiti arvas J.J Rousseau , kes pidas esiaja inimest õilsaks metslaseks , keda tsivilisatsiooni areng on vaid korrumpeerinud .	õilsaks	9	Tra
Tema sõnum on lihtne -- intsident toimus teenistusvälisel ajal ja " sellel ei ole midagi ühist Holmi teenistusega kaitseväes ega SOG-rühma tegevusega " .	teenistusvälisel	7	Ade
Majanduse madalseisus ( 1999 ) oli peamiseks tööhõive tekitajaks välissektor ( väliskapital kui eksport ) .	peamiseks	6	Tra
Mõnikord kehtib ka ütlus - jäärapäisest omaette tegutsejast miljonäriks .	jäärapäisest	5	Ela
Seda sel lihtsal põhjusel , et Maa liikumine ümber Päikese oleks pidanud kajastuma kinnistähtede asendite näivas muutumises , mida tal aga ei õnnestunud täheldada .	lihtsal	2	Ade
1969. a kaitses ta meditsiiniteaduste kandidaadi väitekirja teemal “ Aordi bifurkatsiooni ja jäsemete magistraalarterite emboolia ja ägeda tromboosi ravist ” .	ägeda	16	Gen
Tänapäevaseski mõttes teadusliku Maa ümbermõõdu määramise võttis ette Eratosthenes ( 276-194 e. Kr. ) .	Tänapäevaseski	0	Ine
Kui asja kas või puhtmajanduslikult võtta , siis kumb on otstarbekam : kas maksta vaesematele maainimestele näljapajukit sotsiaaltoetuste näol või anda neile võimalus ise toime tulla .	vaesematele	14	All
Samuti on naiste vaeghõive kogu vaadeldava perioodi vältel olnud kõrgem kui meestel .	vaadeldava	5	Gen
Säärane piiramatu sõitmine aga lõhub pinnast , reostab maastiku üldilmet ja häirib loomi .	piiramatu	1	Nom
Onupoeg joonistas vesivärvidega tumerohelise aasa , mille serval asus loss .	tumerohelise	3	Gen
Eriti palju söödi tärkliserikkaid kastaneid mägistel aladel , kus teravilja kasvatada ei saanud - talupoegadele oli see talvel peamine toit .	tärkliserikkaid	3	Par
Eriti soodne on alustada investeerimist siis , kui turud langevad , sest varem või hiljem tõusevad nad niikuinii .	soodne	1	Nom
Tegevusaladest ei suuda tööhõivet tekitada kodumaisele turule tootjad ega need , millel on käsil erastamisprotsess ( eelkõige kohaliku omavalitsuse omandisse kuuluvad ettevõtted ) .	kodumaisele	5	All
Võisteldi nagu ikka üksik- ja paarismängudes , kokku 5 mänguliigis .	üksik-	3	Nom
Siga viidi rehealla , seal ta karjus , et mehed ta lahti laseksid , lõpuks jäi hirmsa ohkega vait ning rohkem pole teda nähtud .	hirmsa	16	Gen
Loomulikult andis kindlustatud värav sõjasadama valdajale võimaluse kontrollida ka igat lahte sisenevat alust .	sisenevat	11	Par
Alkoholijoobes 47-aastane Urmas sõitis oma veoautoga ZIL-130 otsa teepeenral kõndinud 63-aastasele Annele .	63-aastasele	10	All
Naatriureetilised peptiidid mängivad kardiovaskulaarse süsteemi regulatsioonis tähtsat rolli .	tähtsat	6	Par
Ta ilmekal näol mängisid tumedad varjud .	ilmekal	1	Ade
Ta arvab , et asi võis alata painutuspirueti uuel tasemel harjutamisest , kus selg lõi valusaks ja närvivalu liikus edasi jalga .	valusaks	15	Tra
Parimad sõdurid , sportlased ja tehnikatundjad - olgu siis tegu motorikša , takso , veoauto või Boeing 747 juhtimisega , tulid sealt .	Parimad	0	Nom
Selles mõttes oleks Kalju Suure pildid nagu vastandlikud igasugusele teadlikule meediamanipulatsioonile .	teadlikule	9	All
Endastmõistetavatel põhjustel on inimesed palgakärpimiste suhtes kahtlevad , nii et palgad on jäigad allapoole laskumise suhtes .	Endastmõistetavatel	0	Ade
Praeguste rahulike toonide asemele peaks tulema midagi hoopis värvilist ja kärtsu .	rahulike	1	Gen
Kupees läheb aina palavamaks , napsust , sõdurpoiste kodusest sakuskast , elust Ukrainas ja Liibüas .	palavamaks	3	Tra
1993. aasta lõpus raporteeriski Post XL-i peatsest sulgemisest : " AS Olümpia direktori Andres Liinati sõnul on nad nõus kaotama klubi käibes ning võitma hotelli prestiizhis .	peatsest	6	Ela
Spetsiifilised küsimustikud sobivad elukvaliteedi hindamiseks grupisisestes tulemi-uuringutes ( 7 ) .	grupisisestes	5	Ine
See on sümbioos heast eesti luulest ATSi kastmes .	heast	3	Ela
Teie eesmärgiks on täita kõik tühjad ruudud arvudega 1 kuni 9 , nii et igas reas , igas veerus ja igas väiksemas jämedama joonega eraldatud 3 x 3-ruutses plokis on parajasti üks number 1 ... 9 .	väiksemas	21	Ine
Loeme õiglaseks ja vältimatult vajalikuks nii vanade kui uute ELi liikmesriikide põllumajandustootjate täielikult võrdset kohtlemist otsemaksete jt rahaliste vahendite kasutamisel alates aastast 2007 .	õiglaseks	1	Tra
Taoliseks teguriks on inflatsioon , mis eeldatavalt võib ( vähemalt lühiajaliselt ) töötust vähendada , kuid on selge , et ta mõjutab negatiivselt teisi süsteemi komponente .	Taoliseks	0	Tra
Eriti puudutab see kehalise kasvatuse tundidest tuttavat kõhulihasteharjutust istesse tõusu .	tuttavat	6	Par
Vastasel korral karistatakse majaomanikke kuni 50 000 euro suuruse trahviga .	Vastasel	0	Ade
Et andmeskalaarses protsessoris rakendatakse spekulatiivtöötlust , siis erilist tähelepanu tuleb pöörata infotöötluse korrektsele ajastatusele .	andmeskalaarses	1	Ine
Ameerika alustas ränkadest vastasseisudest rahvuslikul pinnal ja töötas läbi vere , pisarate ja seadusloome tänase rassiliselt , usuliselt ja rahvuslikult tolerantse riigini , kus ameeriklast määratletakse kodakondsuse alusel .	ränkadest	2	Ela
Olin omale alati ehtsat verekoera himustanud aga poes maksavad need kole palju !	ehtsat	3	Par
Lihaskesta hüpertroofia või eosinofiilsest infiltratsioonist tingitud turse esineb kõige sagedamini mao antrumi ja/või pülooruse piirkonnas ( 12 ) .	eosinofiilsest	3	Ela
Kas seda olukorda majanduse kui terviku seisukohalt ühemõtteliselt positiivseks lugeda , on muidugi teine küsimus .	positiivseks	8	Tra
Sümpaatne asi hammaste vahele visata , pealegi üsna lahedas ümbrises .	Sümpaatne	0	Nom
Rahvusvahelise organisatsiooni “ Arstid Piirideta ” juht Eric Goemaere nimetas aprillis 1996 Vene-Tšetšeenia sõda kõige halastamatumaks sõjaks !	Rahvusvahelise	0	Gen
Loodusvaradelt rikastes maades püüab majandusuuendusi kõige rohkem tõrjuda energeetikasektor , mille võim ületab tihti poliitiliste parteide võimu .	rikastes	1	Ine
Miskipärast ei jätkunud mul sisemist vabadust tegeliku sihtpunkti avalikustamiseks .	tegeliku	6	Gen
Teisel korrusel on skisofreensete inimeste päevarühm nimega Sipsik .	Teisel	0	Ade
Teooria ütleb , et varases täiskasvanueas omandatud kogemused mõjutavad hilisemaid hoiakuid .	varases	4	Ine
" Pärast ülikooli lõpetamist ( Tartu ülikooli 1985. aastal sotsiaalpsühholoogina ) ei leidnud ta endale kohe sobivat tööd .	1985.	7	Ade
Näitena on toodud Rezeknet , kus Tshetsheenia toetusrühma juhtiva parlamendiliikme abi koguvat vabatahtlikke Tshetsheeniasse saatmiseks ja korraldavat nende arstlikku läbivaatust .	arstlikku	18	Par
Kui vererõhu selliste väärtuste korral mõõta tegelikust 5 mm Hg madalam rõhk , siis tooks see USAs kaasa 21 miljoni inimese ravita jätmise , samal ajal kui nihe vastassuunas allutaks ravile 27 miljonit normotoonikut ( 1 ) .	tegelikust	6	Ela
1944. aasta kevadel , kui järg jõudis 1926. aastal sündinud noormeesteni , lamas ta haigevoodis difteeria ja 40-kraadise palavikuga .	40-kraadise	17	Gen
Kuid olulisemad tagajärjed võivad taas tuleneda keerukamate seoste kaudu .	keerukamate	6	Gen
Kui lasta mustadel mõtetel sel teemal lennata , jõuame kiiresti košmaarideni välja .	mustadel	2	Ade
Pole ka ime , omanikud on reeglina keskealised või vanemad kodanikud .	keskealised	7	Nom
Punasel vaibal lamav mees röökis nagu ratta peal .	Punasel	0	Ade
Sel nädalal tuleb riigikogus taas arutusele otsuse eelnõu , mis sätestab kuni 55-liikmelise Eesti kaitseväe üksuse liitumise Euroopa Liidu kiirreageerimisüksuse Põhjala lahingugrupiga , mis on valmis kriisi puhkedes sekkuma maailma kuumades punktides kuni 6000 km raadiuses Brüsselist .	kuumades	30	Ine
Sillutisekivid Raekoja platsil olid sulalumest libedad .	libedad	5	Nom
Kaasajal kasutatavast rasvhapete määramise metoodika võimalustest annavad kujuka ülevaate S. Lopez-Ferreri jt. ( 1999 ) tööd .	kujuka	7	Gen
Olulist rolli sellest arendustegevuses mängivad EL 6. raamprogrammi toel tehtavad uurimis- ja arendusprojektid eMapps , CALIBRATE ja iCamp , millest kahes viimases osaleb lisaks Tiigrihüppe Sihtasutusele aktiivselt ka Tallinna Ülikool .	Olulist	0	Par
Nii et koidulalikus kujundisüsteemis on see ka Koidula veri .	koidulalikus	2	Ine
Sotsiaaldemokraatlik Partei ( SPD ) , kelle liikmed on samuti viimasel ajal segaste rahatehingute tõttu skandaale tekitanud , osutus aga suurimaks võitjaks CDU skandaalis , ja seda rahaliselt .	segaste	12	Gen
Saksamaa kiirteedelt saatis politsei ta väiksematele teedele .	väiksematele	5	All
Rootsiaegse Tartu ülikooli trükitoodang võis ulatuda pooleteise tuhande väljaandeni . "	Rootsiaegse	0	Gen
Riik tõukab ametnike kätega jätkuvalt oma kodakondsete hulgast ära väikest tüdrukut , kes lõpuks ometi on leidnud endale uued vanemad tublis Eesti peres .	tublis	20	Ine
Lihtsas maaperes sündinud ja 1960. aastatel Karagandõ hiiglaslikus metallurgiatehases sulatusahjude kõrval töötanud mehe kohta on Nazarbajev teinud läbi võimsa tõusu , peaaegu nagu ajalehepoisist miljonäriks .	Lihtsas	0	Ine
Tulusid saab küll ühtlustada , kuid osad vallad jäävad paratamatult ikkagi vaesemaks kui teised ning on ka neid , kes ei saagi kuidagi oma tuludega toime tulla .	vaesemaks	11	Tra
Poolautomaatsuse aitaks ära hoida aktsepteeritavate intelligentsete valikute reaalne toimimine .	aktsepteeritavate	4	Gen
vaata ringi meie armsas Urvastes	armsas	3	Ine
Alalhoidlikumad leidsid , et firma laenukoormus on niigi suur ja entusiastlikust Perest tuleks vabaneda ning veehinna edasine tõus tuleb peatada .	entusiastlikust	10	Ela
Positiivsele histoloogilisele leiule peaks üldjuhul järgnema materjali immunohistokeemiline analüüs fibrillide tüübi määramiseks .	histoloogilisele	1	All
Artiklis on käsitletud elukvaliteedi kui tulemiklassi hindamise rakendusvõimalusi ning selgitatud geneerilise ja seisundi-spetsiifilise küsimustiku mõistet , samuti on antud ülevaade olulisematest elukvaliteedi kontseptsioonidest arstiteaduses , tutvustatud erinevate käsitluste eeliseid ja nõrku külgi .	olulisematest	20	Ela
Kultuurne inimene kasvatab kultuurtaimi omaks tarbeks .	Kultuurne	0	Nom
Lääne-Virumaal asuv Porkuni järv on erakordselt kuiva ja kuuma suve ning sademetevaese sügise tõttu peaaegu tilgatumaks kuivanud , hukkumisohus on ka viimased veel üksikutesse lompidesse vangi jäänud kalad .	kuiva	6	Gen
Südamepuudulikkuse ägeda dekompensatsiooni korral on ravi vahetuks eesmärgiks hemodünaamika parandamine : vatsakeste täitumisrõhu vähendamiseks ja südame minutimahu suurendamiseks kasutatakse kiiresti toimivaid ravimeid .	vahetuks	6	Tra
1994. aastal andis Shoemaker-Levy nimeline komeet võimaluse ohutust kaugusest jälgida , kuidas üks taevakeha planeedile kukub .	ohutust	7	Ela
Eesti-suguses elektroonilistele toimingutele pürgivas väikeriigis tähendaks kolmandale teele astumine - isikuandmeteta meditsiiniregistrite rajamine - Maailma Tervishoiuorganisatsiooni eksperdi Hans Stormi sõnul “ kõige hullemat ähvardust rahvatervishoiule ” .	kolmandale	6	All
Eeltoodu näitab , et kalaõli või kalajahu kasutamine linnukasvatus-saaduste rikastamiseks ω-3-rasvhapetega toob enesega kaasa mitmeid arvestamist vajavaid probleeme .	vajavaid	16	Par
Piisab vaid sellest , kui haigele lapsele joota vett ja anda soola .	haigele	5	All
Eri geosfäärides toimuvaid protsesse on senini vaadatud küllaltki väheses omavahelises seoses .	omavahelises	9	Ine
Rahvusvahelise jalgratturite liidu reeglid lubavad startida MK etappidel alates 18. eluaastast , kuid UCI on teinud erandeid 17-aastastele startimaks tippseltskonnas .	17-aastastele	17	All
Elektro- ja ehhokardiograafiliselt võib saada diagnoosi olemasolul küllalt täpset informatsiooni südame haaratusest , mida esineb arvestataval osal süsteemset ALamüloidoosi põdejatest ja mis vastavatel patsientidel on oluliseks prognostiliseks teguriks ( 14 ) .	vastavatel	22	Ade
Eesti presidendi loengul " Traditsioonid ja väärtused muutuvas Euroopas " oli St Johni kolledži saal puupüsti rahvast täis .	muutuvas	7	Ine
1592. aastal kutsuti ta Padua ülikooli matemaatikaprofessoriks ning tema ülesandeks sai Eukleidese geomeetria ja geotsentrilise astronoomia õpetamine meditsiinitudengitele .	1592.	0	Ade
Vahetute ilmastikunähtuste tegevusväljast kõrgemal olevates kihtides toimuvaid protsesse uurivad aeronoomia ja aeroloogia .	olevates	4	Ine
Tal olid väga heledad juuksed ja loomu poolest jumekas nägu , mille naha oli kehv seep , nürid žiletid ja äsja lõppenud talve külmad karedaks muutnud .	karedaks	24	Tra
Strateegilistele investoritele müüdud ettevõtted kujunesid edukamaks kui need , kus omanikuks sai mõni fond , holdingfirma või muu finantsinstitutsioon .	Strateegilistele	0	All
Siledal teel ja suurel kiirusel ( alates 110 km/h ) laskub esiosa 15 ja tagaosa 11 millimeetrit teele lähemale .	Siledal	0	Ade
Mõõdukad - see mitmuse nimetav vorm meenutab natuke mõnda perifeerset bändi nagu Untsakad või Seelikukütid .	perifeerset	9	Par
Salajasele teabele ligi ei pääse , leiutisi ei tee , masse ei mõjuta - isegi kõige igapäevasemates asjades ilmutan lausa professionaalset tähelepanematust .	Salajasele	0	All
Kas oleks võimalik , et diskussioon , kas mitte-eestlaste lahkumine oleks Eestile kasulik , leiaks aset Ameerika juhtivas ajalehes , televisioonis või isegi nn kõmulehtedes ?	juhtivas	17	Ine
Mees , kes eri andmetel oli võimeline tõlkima kuni 80 keelest ning eelistas suurema osa sissetulekust annetada keeleteaduse heaks , liikudes ise ringi tagasihoidlikus maamehekasukas ja karvamütsis .	tagasihoidlikus	23	Ine
Üks heatahtlik tädi küsis murelikult :	heatahtlik	1	Nom
Vahe oli vaid selles , et ühe variandi puhul tuli käia hulga lühem tee , kuid see-eest olulisel määral ebameeldivam .	lühem	12	Nom
Vaadatakse selle kõrvale ka leti kohal rippuvast tohutu ekraaniga televiisorist käimasolevat matði .	rippuvast	6	Ela
Kuigi see sümptom võib viidata tõsis-tele somaatilistele haigustele , jääb põhjus enamikul juhtudest ebaselgeks .	somaatilistele	6	All
Kõik viited reaalsetele isikutele ja sündmustele on juhuslikud ega pretendeeri dokumentaalsele tõepärale .	reaalsetele	2	All
Almer Jansu võtab oma stuudiosse tantsima kõiki soovijaid olenemata nende vanusest või eelnevast treenitusest .	eelnevast	12	Ela
See võib olla mõnel juhul põhjustatud hirmutavast unenäost .	hirmutavast	6	Ela
Neist kraadimõõtmistest suurima , 25o 20' ehk üle 2800 km haaraval kaarel 1816-1855 toimunud ettevõtmise peaosaliseks oli Tartu Observatooriumi ja Pulkovo observatooriumi ( alates 1839 ) direktor Friedrich Georg Willhelm Struve ( 1793-1864 ) .	haaraval	10	Ade
Kuid koledatest sõnadest hoolimata , sõi ta pirukatüki lõpuni ja küsis juurde .	koledatest	1	Ela
Rängast rahvuslikust diskrimineerimisest nõukogude perioodil võiks veel pikalt jätkata , sest vabadustarmastava rahvana olid tšetšeenid üks kõige enam tagakiusatud rahvas N. Liidus .	rahvuslikust	1	Ela
Mussooniootel Amritsar on järjekordne kuum ja tolmune India linn täis masendavas kontsentratsioonis vaesust ja viletsust , paksu ja vedelat .	vedelat	18	Par
Primaadid on ju meile tegelikult väga lähedased , ent katseid nendega paraku ikkagi tehakse .	lähedased	6	Nom
Seejuures moodustab tüüpilise USA miljonäri aastasissetulek keskmiselt alla seitsme protsendi talle kuuluvatest varadest .	kuuluvatest	11	Ela
Geoloogilise arengu aluseks on Maa diferentseerumine raskematest elementidest tuumaks ja kergemast materjalist vahevööks , mis alguses oli ka välispinnaks .	raskematest	6	Ela
Ainult niiviisi võib oodata praegustele miljonäridele korralikku järelkasvu .	praegustele	4	All
Taimsetest toiduainetest on linaseemned kõige suurema ? -linoleenhappe sisaldusega ( Flaxseed … , 1997b ) , mistõttu neid peetakse 21. sajandi toidu üheks perspektiivseimaks koostisosaks .	Taimsetest	0	Ela
Kuigi Martin Lutheri nimega seotud kiriklikust usupuhastusest reformatsioonist eraldab meid pool aastatuhandet , on see teema endiselt hell ning ka 21. sajandi alguses sai usuküsimus üheks väga oluliseks punktiks tulevase Hollandi kuninga abielulepingus .	kiriklikust	5	Ela
Küüslauk on iidsest ajast tuntud ravim- ja maitsetaim .	iidsest	2	Ela
Reegliks on , et süsteemset kemoteraapiat rakendatakse AL-amüloidoosi süsteemsete ja kohalikku vahelesegamist lokaalsete vormide puhul .	süsteemsete	8	Gen
Andmeskalaarne protsessori arhitektuur tugineb MMM-arhitektuursele mudelile ( MMM - Massive Memory Machine ) , mis võeti kasutusele 1980. aastate algul .	MMM-arhitektuursele	4	All
See maailmakuulus , ka kõige tolerantsema inimese tolerantsile taha keerav spagetjas , räbalais sukis ja korsetis kaameks jubedikuks pasteeritud koll ei shokeeri mind oma etendusega .	räbalais	12	Ine
Valehäbi ei luba seda teha kõhukal direktoril ega tüsedal koduperenaisel .	kõhukal	5	Ade
Siseturu nõudluse kasvu kõige ilmsemaks positiivseks mõjuks tööhõivele võib pidada aga töötajate arvu hüppelist kasvu jaemüügis 2002. a .	ilmsemaks	4	Tra
" Selle üle peab mõtlema , " vaatas Jan mehele otsa ja märkas tolle silmis ebatavaliselt tarka ja kelmikat , samas metsikut ja ükskõikset pilku .	kelmikat	18	Par
Auskultatsioonil olid inspiiriumis kuuldavad peened räginad vasaku kopsu alaosas .	kuuldavad	3	Nom
Kummaski riigis valmistas erastamine kokkuvõttes pettumuse .	Kummaski	0	Ine
1991. aasta varasügisel moodustati ülemnõukogu ja Eesti Kongressi liikmetest pariteetsetel alustel 60-liikmeline Põhiseaduslik Assamblee , mis töötas välja põhiseaduse .	pariteetsetel	9	Ade
Odaviskaja tahumatu tuum oli kaetud riigikogust pärit õpitud viisakusega .	tahumatu	1	Nom
Punakat Marssi peeti seevastu aga katkujumala täheks .	Punakat	0	Par
Sügise saabumine teeb lõpu suveajal igapäevasele sebimisele vaheldust pakkunud õhtustele piknikele ja väljasõitudele ning sunnib jälle ahelduma oma igapäevase voodi-töö-kodu-voodi trajektoori kammitsaisse .	igapäevasele	5	All
KT-kontrolluuringul kopsudest alveolaartasandil haiguslikke muutusi ei leidunud , kuid bilateraalselt olid näha tihedad tsentraalsete ( kuni segmentaarseteni ) bronhide seinad .	haiguslikke	3	Par
Nende filmid jooksevad uhketes peatänavate kinodes ja võistlevad vaatajate top ten 'is .	uhketes	3	Ine
Vene keelt purssivast ukrainlannast oligi veel puudus ! "	purssivast	2	Ela
Paljud tapatalgud ei alga veepuuduse pärast , kuid ka see võib olla nõrgim lüli ahelas .	nõrgim	12	Nom
Praegu on Põldsamite miniloomaaias lisaks kodumaistele rästikutele lõgismadulaste sugukonda kuuluvad odapeamaod ja kilplõug .	kuuluvad	9	Nom
Enamasti on põhjuseks see , et õpikeskkonnad põhinevad esituslikul õppeviisil ega arvesta aktiivõppe vajadusi .	esituslikul	8	Ade
Üldlaulupeo uued korraldajad on Helen Jahmastol ja Uuno Vahva , kes üleilmset kuulsust kogunud LIBE-nimeliste stiilipidude ja tantsuõhtute läbiviimisega .	üleilmset	11	Par
Augusti algul tõusis tänavusel Pühajärve Beach Party'lgi osalenud Bomfunk MC'si singel " Freestyler " koguni Euroopa singlimüügi edetabeli esikohale .	tänavusel	3	Ade
Sõlmelised vormid kujutavad endast tüüpiliselt paikset AL-amüloidoosi , difuusne alveoseptaalne vorm on difuusse amüloidoosi väljenduseks .	Sõlmelised	0	Nom
Kõrge tööpuudus võimaldab nii arengu- kui ka tööstusriikides maksta töötajatele üha madalamat palka .	Kõrge	0	Nom
Masspunkti inertsimoment on massi ja pöörlemisteljest loetava kauguse ruudu korrutis .	loetava	6	Gen
Kipub ju liitriikide jagunemine praktikas enamasti traagilisel viisil realiseeruma .	traagilisel	6	Ade
Täiesti valed on nad aga loogilises mõttes , maaelu arengu ja ausa mängu mõttes .	loogilises	5	Ine
Paar aastat tagasi sambaskandaaliga kuulsust kogunud endine Lihula vallavanem juhib lisaks patriootlikule rakukesele FIE-na kanuumatku .	patriootlikule	11	All
Restaureeritud või algupärases seisukorras säilitatud liiklusvahendid läbivad seejärel ekspertiisi ja saavad vastava tunnistuse - nüüd ka meil .	algupärases	2	Ine
Taevas roosatas ning mäed punetasid , üksikud pilvetupsud olid värvunud hõbedaseks .	hõbedaseks	10	Tra
Munade ja linnuliha rasvhappelisest koostisest	rasvhappelisest	3	Ela
Segamini ei tohiks ajada ka sikhe ja Sikkimit , viimane on India kirdeosas Himaalaja mäestikus asuv valdavalt budistlik piirkond .	budistlik	17	Nom
Vene Draamateatri keldris , endistes restoran Astoria ruumides on ennast sisse seadnud Monte-Carlo kasiino .	endistes	4	Ine
Samas eelistab tavainvestor mõõduka riskiga kaasnevat tootlust .	kaasnevat	5	Par
Karjakasvatajad eelistasid kalendri koostamisel lähtuda Kuu näivast liikumisest taevasfääril , põlluharijad eelistasid aga Päikese liikumist .	näivast	6	Ela
2 ) tööhõive kasv eelnimetatud ettevõtetele allhanget tegevates ja neid teenindavates Iiri ettevõtetes , samuti neist multinatsionaalsetest ettevõtetest pungunud VKE-des	teenindavates	10	Ine
Tänu koolile ja legendaarsele õpetajale Aleksander Prikile oskasin mingil tasemel kõiki sportmänge .	legendaarsele	3	All
Tavaliselt on meil ikka mingi eelaimdus , varasemale kogemusele tuginev teadmine , et see geen võib seal DNA piirkonnas asuda .	varasemale	7	All
Juba 80ndate keskel oli selge , et tollases Nõukogude Liidus ja temaga seotud riikides hakkavad aset leidma suured muutused .	tollases	7	Ine
Eesti Ametiühingute Keskliidu esimehe Kadi Pärnitsa hinnangul on Eesti tööinimene streikimiseks liiga alalhoidlik ja kardab juba ette väljaastumise võimalikke tagajärgi .	alalhoidlik	12	Nom
Ajalooline , kultuuriline , majanduslik ja turismialane huvi on olemas .	turismialane	6	Nom
Siinjuures tuleb aga kindlasti arvestada , et tegemist on heterogeensete välisturgudega .	heterogeensete	9	Gen
Keskvangla kibekiiret sulgemist nõuab nii Euroopa Nõukogu kui piinamise ja ebainimliku või alandava kohtlemise või karistamise Euroopa komisjon .	kibekiiret	1	Par
Ta oskas arvestada Venemaa gigantseid mõõtmeid , suuri inimhulki ja majanduslikke ressursse ning karmi kliimat .	gigantseid	4	Par
Edasi muutub võrdlus sisutuks .	sisutuks	3	Tra
Vaatluse alt on välja jäänud ka fakt , et osa kinnisvara praegustest omanikest on ostu finantseerinud laenurahaga , seega on tegemist osalise kohustusega .	praegustest	11	Ela
Hiljaaegu pidi rämpsposti vastu võitlejana tuntud hollandlannast europarlamendi liige Elly Plooij häbiga tunnistama , et saatis tuhandele europarlamendi e-posti aadressile ülisuure , 3-megabaidise rämpskirja .	ülisuure	20	Gen
Tõnu silmitses parajasti seda , kuidagi nukraks muutvat vaatepilti , kui kääbus joostes tuppa tormas .	muutvat	7	Par
Kas pidada kiilaspead seksikaks või ebameeldivaks , on maitse asi , igal juhul on kiilasjää talvise ilma üks ohtlikumaid nähtusi .	seksikaks	3	Tra
Samuti võib töökohtade vähese loomise põhjuseks olla vähene investeerimine uutes ja kasvavates sektorites ( Simonazzi , 1999 ) .	vähene	7	Nom
Ka kommunistlikus ühiskonnas , kõikesuutvate masinate ajastul , jääb püsima füüsiline töö .	kommunistlikus	1	Ine
Selline töö kontseptsioon haarab ka nn " töötuks jäämise kogemuse demokratiseerimise " ( Eesti Inimarengu Aruanne 2002 : 29 ) , st töötuks jäämise riski kui ka hõivesse tagasipöördumise võimaluste ühtlasemat jagunemist suurema hulga inimeste vahel .	töötuks	22	Tra
Lord Janner tegeleb projektiga , mille eesmärk on paigutada Baltimaades teeviidad sõjaaegsete massihaudade juurde .	sõjaaegsete	11	Gen
Seda tendentsi võis näha tööturu üldtrendidest ja samale järeldusele on tulnud ka Mickiewicz ( Mickiewicz , 2001 ) , kes on analüüsinud sektoritevahelise tööjõu ümberpaiknemise ulatust üleminekuriikides ümberstruktureerumise indeksi abil .	sektoritevahelise	22	Gen
Eri geosfäärides toimuvaid protsesse on senini vaadatud küllaltki väheses omavahelises seoses .	väheses	8	Ine
2000. aastat iseloomustasid kõrged allhanke ekspordi näitajad , kõrge tööjõu tootlikkus koos ebasoodsa välisturgude olukorraga .	ebasoodsa	12	Gen
Hansapanka juhtis kõnealusel ajal siseminister Jüri Mõis , kes on korduvalt rõhutanud heade äritavade ja eetilise käitumise tähtsust .	kõnealusel	2	Ade
Vahetute mõõtmiste ja modelleerimise kaudu opereeritakse geofüüsikas geofüüsikaliste suuruste , geofüüsikaliste väljade ja geofüüsikaliste nähtustega .	geofüüsikaliste	7	Gen
Raskest majanduslikust seisust hoolimata oli 1998./1999. aasta talvine hooaeg Väike-Munamäe suusakeskusele edukas .	Raskest	0	Ela
Eraülikoolidest jääb ajapikku järele paar elujõulisemat .	elujõulisemat	5	Par
Seitsmekümnendatel andis selle mulle Jaan Isotamm .	Seitsmekümnendatel	0	Ade
Teine riik esitab haigekassale tegelikud kulud iga isiku eest eraldi teatud vormikohasel tõendil .	vormikohasel	11	Ade
1918 tungisid Põhja-Kaukaasiasse Denikini väed , kes loosungiga “ Ühtse ja jagamatu Venemaa eest ” olid tšetšeenidele vähemalt sama vastuvõetamatud kui bolševikud .	jagamatu	11	Gen
Aga muidu voolasid nende esimesed päevad ja ööd otsekui mingis tundmatus , mõnusalt laisas aegruumis .	tundmatus	10	Ine
Suurem osa pääses trahviga , mõni veetis ja veedab natuke oma noorest elust trellide taga .	noorest	11	Ela
Perilla on mündiliste perekonda kuuluv lillade lehtede ja roosade õitega taim , milline oma kaneeli-mündi segalõhna tõttu on kasutatav kulinaarias ( Brenner , 1993 ) .	lillade	5	Gen
Sel tähtsal päeval oli veel üks suur sündmus : söögiplatsile lauda ette ilmus kukk .	tähtsal	1	Ade
