Nende hõivatute osakaal , kes töötavad uuringunädalal tavalisest vähem , on vaadeldaval perioodil üldiselt veidi kasvanud ja nende osakaal , kes töötavad rohkem üldjoontes veidi langenud .	vaadeldaval	11	Ade
Hoopis hullem on , et norskamist koos hingamispeetusega loetakse praegusajal peamiseks põhjuslikuks mehhanismiks kõrgvererõhutõvele ja südameinfarktile .	peamiseks	10	Tra
Meie saime neist aga suurepäraseid portreevõtteid	suurepäraseid	4	Par
Viit kuldmedalit ihanud Marion Jonesi ajaloolise saavutuse nurjasid nigel kaugushüppetehnika ja kaasmaalannade krobeline teatevahetus 4 x 100 m jooksus .	krobeline	12	Nom
Tänaseks on vanale ja auväärsele piirkonnale arvukalt kibedaid võistlejaid siginenud .	auväärsele	4	All
Eesmärgiks viimasest saadud teadmist edukalt ka mingis kindlas valdkonnas rakendada .	kindlas	7	Ine
Äkki peaksime siis , kui meie geenid kõik kaardistatud , käituma oma geneetilisele koodile vastavalt : olema just nii paksud ja kõhnad , nagu see ette nähtud ?	kõhnad	21	Nom
Juba 1987. aastal oli Ilmoja koos Ellamaa , Korgi , Jaak Herodese , Laur Karu , Enn Roose ja Agu Tammega pannud kokku IME tervishoiuprogrammi .	1987.	1	Ade
Ajaliselt mahuvad leidude hulka nii kiviaegne savinõukild , keskaegsed hammasripatsid , uusaegsed mündid kui ka Teise maailmasõja aegne püstol - kokku ajajärk ( loomulikult vaheaegadega ) alates umbes 3500. aastast eKr kuni 1950. aastateni . "	kiviaegne	5	Nom
Kasvasin väga “ interdistsiplinaarses ” majas : mu üks tädi oli TPI-s kõrgema matemaatika õppejõud , teine tädi Tallinna Keskhaiglas günekoloog ja ema filoloogiharidusega tõlkija .	interdistsiplinaarses	3	Ine
" Silmad pärani kinni " pealkirjastas Jewitt oma artikli , kus ta tuletab meelde , et Maa orbiidiga küllaltki suure tõenäosusega kohtuval trajektooril ringleb umbes tuhat üle kilomeetrisuurust kaljukamakat .	kohtuval	21	Ade
Nii võib selleks olla arenenud struktuuriga arukas mälu ehk IRAM , täiustatud arhitektuuriga kiipmultiprotsessor või teatav tööjaamade võrk .	arukas	6	Nom
Mitmed fotod , mis kannataks leheküljesuurust formaati , on ikkagi pisikesed ; mitmed küljed on täiesti fookusevabad ja koosnevad üksteisega heitlevatest ning üksteist nullivatest valgeraamsetest piltidest .	heitlevatest	20	Ela
Pärast eelmise aasta suurt toidukaupade hinnatõusu on sel aastal selgelt näha , et enamik piima- ja lihatooteid on tugevas siseturukonkurentsis mullusest madalama hinnaga .	tugevas	18	Ine
Halastamatus võitluses hindadega reageerivad firma juhid turuosa ratsionaliseerimise ja laiendamisega .	Halastamatus	0	Ine
Soovime juubilarile palju õnne sünnipäevaks , jõudu ja vastupidavust järgnevateks aastateks !	järgnevateks	9	Tra
See , et minister Kranich ei vähendanud vandeadvokaat Kaasiku mereäärsel kinnistul ehituskeeluvööndit , annab lihtrahvale ehk natukegi lootust , et kõike ei määra raha .	mereäärsel	9	Ade
Eesti elanikkonna heaolu võib vaadelda koosnevana kahest komponendist : mittemateriaalsest ja materiaalsest ehk hindadest tulenevast komponendist .	mittemateriaalsest	9	Ela
Üks päris arusaamatutel asjaoludel .	arusaamatutel	2	Ade
Kõrvuti kliiniliste avalduste ja funktsionaalse seisundiga on krooniliste haigete elu-kvaliteet üks olulistest hinnatavatest tervisetulemi klassidest .	olulistest	11	Ela
Tänu üha soodsamatele elutingimustele ja uutele ravimitele pikeneb inimeste elu-iga .	uutele	5	All
Ja siis korraga muutus sir Parcival kõvaks kui kivi , langes häält tegemata pikali ja jäi liikumatult lebama , otsekui oleks teda tabanud välk .	kõvaks	6	Tra
Kõigest on saanud täiuslik , igavikuline süntees .	igavikuline	5	Nom
Mida atraktiivsemad sümbolid on , seda rohkem suudetakse silma paista .	atraktiivsemad	1	Nom
Regio lumekaart ilmub neljapäevases Postimehes .	neljapäevases	3	Ine
Ta eraldus teistest , sõitis võõra sõdalase poole ning mõlemad kappasid eemale , kadudes uttu .	võõra	5	Gen
Ta ei teinud seda vaatajate petmiseks , see oli lihtsalt tema komme ja nagu öeldakse , kombed on kõik head , kui neid õiges kohas kasutatakse .	õiges	23	Ine
Kes mäletab sellist pikkade juuste ja prillidega leebet noorintellektuaali ?	leebet	7	Par
" Püsti , mõistmatu loom ! " karjus ta hobuse peale .	mõistmatu	3	Nom
Maikeni juhitud WAF-kooli 30liikmeline gospelkoor esitab koos Eesti 17 tuntud lauljaga 17 rohkem ja vähem tuntud kristlikku ( või lihtsalt väga ilusat ja püha ) sõnumit kandvat lugu ning ilmselt leiab igaüks kontserdil endale midagi .	ilusat	21	Par
Ettevõtte tulumaksuerisus Eestis on tõenäoliselt stiimul Soome ja Rootsi väike- ja keskmistele ettevõtetele , kelle potentsiaal veel odavamatele ja kaugemal asuvatele turgudele liikuda on piiratud .	asuvatele	20	All
Neljanda teguri - struktuurifondide toetuste kõrgperiood on möödas , nende praegust mõju ( teede ehitamine jm ) hinnatakse suhteliselt marginaalseks .	marginaalseks	19	Tra
Seetõttu on proovitud lokaalselt toimivaid kortikosteroide ( budesoniid ja flutikasoonpropionaat ) kui ohutumat ja samas efektiivset alternatiivi pikaajalisele süsteemsele kortikosteroidravile ( 1 , 4 , 12 , 19 ) .	pikaajalisele	17	All
Eeskujuks toodi Ungarit , kes tegi 90ndate algul küll läbi suure majanduslanguse , kuid 90ndate lõpus hakkas üleliigsest tööjõust vabanenud tööstus uuesti tööhõivet tekitama .	üleliigsest	17	Ela
Kariloomade käes on 26 % Maa jäävabast pinnast , kolmandikul maailma põldudest kasvab loomasööt ning vajadus liha järele inimkonna kasvades muudkui suureneb .	jäävabast	6	Ela
ML : “ Anarhia ” hakkas 1988. aastal , ehk samal ajal kui poliitiline , ajakirjanduslik , majanduslik jne “ anarhia ” Nõukogude Eestis .	ajakirjanduslik	15	Nom
Lähiajalugu pakub näiteid poolt ja vastu , kokku varisesid vabaturule orienteeritud Mehhiko ja Brasiilia majandus , aga sama juhtus ka karmikäeliselt riigi kontrolli all oleva Lõuna-Korea majandusega .	oleva	24	Gen
Lume olid kirevaks värvinud mäestikuliivad ja kivipuru , mida tuuled ümberkaudsetest kõrbetest pilvede kõrguselt kandsid .	kirevaks	2	Tra
See , et Rapla Dairy on lehmapidajatele kuude kaupa võlgu , pälvis laiemat tähelepanu alles siis , kui riik tahtis firmat juhtivale Afganistani eruohvitserile Jaqub Haidaryle eriliste teenete eest kodakondsuse kinkida .	juhtivale	21	All
Lisaks sellele üritatakse mingil moel jagada klientuuri , eristades rikkamaid ja vähemrikkaid .	vähemrikkaid	11	Par
Tunnine Baltic Filmsi pidu on õieti intiimne soojendus mõni päev hiljem Saksa Läti saatkonnas toimuvale pidulikule Baltic Filmsi ja Scandinavian Filmsi koostöökokkuleppe allakirjutamisele .	pidulikule	15	All
Kuna nimetatud tabel oli otseseks üldistuste tuletamiseks liialt detailne , siis otsustasime teostada vahepealse tunnuste agregeerimise .	detailne	8	Nom
Eelolevast üldlaulupeost tõotab kujuneda tõeline suursündmus , kuna kõik vanad kännud on laulu- ja tantsupeo orgkomiteest minema aetud ja rahvapeo korraldamine on antud noorte ja edumeelsete klubiinimeste kätte .	Eelolevast	0	Ela
Muidugi võib multiskalaarses protsessoris informatsiooni spekulatiivtöötlust kasutada veelgi laialdasemalt .	multiskalaarses	2	Ine
Autoritaarsetel režiimidel tuleks aga kasutada riigi praegust tugevust reformide edukaks alustamiseks ja läbiviimiseks , vältides tagasilööke elanikele .	edukaks	9	Tra
2. Tõsi , praegu kasutatavad tehnoloogiad ei suuda tagada , et andmeskalaarse arhitektuuriga süsteemid suudaksid oma majanduslike näitajate poolest võistelda teiste tänapäevaste kõrgjõudlusega mikroprotsessoritega .	majanduslike	16	Gen
Fookuse allrentnikuks , otse ühes keskväljaku kaunimas hoones magusa suutäie ampsanud firmaks on MC Kasiinod AS .	kaunimas	6	Ine
Ka tavasuhtluses jagame inimesi headeks-halbadeks , ausateks-ebaausateks , otsekohesteks- keerutajateks jne .	headeks-halbadeks	4	Tra
Templikompleksi kohal heljuv kummaliselt hingekriipiv laul vaibub vaid mõneks öötunniks , samuti pühade tekstide vahetpidamatu lugemine Hari Mandiris ning palverändurite vool , usklike muljetavaldavalt harras äraolek …	heljuv	2	Nom
Kes ei mäletaks tema siirast rõõmu uue Omo üle telereklaamis !	siirast	4	Par
Ehk teisisõnu , protestil võib täna väikeses Eestis olla palju kõrgem hind nii tööandjale kui töötajale kui 70. aastate Euroopas .	70.	17	Gen
Tuleb lihtsalt silmadel lasta ringi käia ja otsida võimalusi üheselt määratud arvude leidmiseks või kaheste ( vahel ka kolmeste ) aukude täitmiseks .	kaheste	14	Gen
Nad on depressiivsemad , kinnisemad ja madalama enesehinnanguga .	kinnisemad	4	Nom
Kuid kui arvestada , et sajameetriseid küllalt ohtlikus kauguses tiirutavad objekte on sada korda enam , võib üheprotsendilise tõenäosusega uskuda , et alanud sajandil paiskub Maale üks 300meetrine külaline .	ohtlikus	7	Ine
- Monstrumteleskoobid ( mosaiik- ja mitmepeeglilised ) .	mosaiik-	3	Nom
Ettevõtte tulumaksuerisus Eestis on tõenäoliselt stiimul Soome ja Rootsi väike- ja keskmistele ettevõtetele , kelle potentsiaal veel odavamatele ja kaugemal asuvatele turgudele liikuda on piiratud .	odavamatele	17	All
Vaimusilmas nägin , kuidas need elusat liha läbistavad ning suure verise tüki rebivad , mälumaks seda peeneks ja sülitamaks mulle näkku .	peeneks	16	Tra
Vaimsetelt võimetelt jäävad nad esmakordsetele vangidele kõvasti alla .	esmakordsetele	4	All
-. Geeni toimimist saame siiski jälgida vaid terviklikus organismis , milleks ongi kasutusel muudetud pärilikkusega loomad ja taimed .	terviklikus	7	Ine
Purjetades “ Beagle'il ” ümber maailma , oli Darwin šokeeritud kohtumisest Tulemaa päriselanikega , keda ta kirjeldas kui inimesi nende kõige madalamas ja metsikumas olekus .	madalamas	21	Ine
Ajendatuna patsiendi kaebustest ja anamnestilistest faktidest tehti KT-uuring kopsudest , millel oli näha vahetult bifurkatsiooni kohal trahhea tagaseinas valendikku ulatuv väike lisamass läbimõõduga alla 1 cm ( vt jn 2 ) .	anamnestilistest	4	Ela
Treeningu lõpus ei tohi unustada lõdvestusharjutusi , mille mõte on venitada pingsa töö tõttu lühenenud ning kangeks jäänud sääre- , reie- , tuhara- , selja- ja turjalihaseid .	kangeks	16	Tra
A. O. Ajuyah jt. ( 1991 ) uurisid võrdlevalt rapsi- ja linaseemnete söötmise mõju Hubbardi broilerikrossi broilerite liha rasvhappelisele koostisele .	rasvhappelisele	18	All
" Tartu on oma juhtkonnaga üles näidanud tõelist kolkapatriotismi , " siunas justiitsminister Märt Rask ja nimetas sellist upsakuse ülesnäitamist kahetsusväärseks .	kahetsusväärseks	20	Tra
Parimad mehed olid taas väravavahid - Chocolate'i Mikola Naum ja Kehra Marius Aleksejev .	Parimad	0	Nom
Ei tundnud seda noort näitlejannat provintsist nägupidi veel ükski teatrisõber ega televaataja .	noort	3	Par
Ning Kristina Ðmiguni puhul tulevad ju mängu ka puhtnaiselikud võlud .	puhtnaiselikud	8	Nom
Aga mõnele oli lihtsalt vastumeelne mõte surmajärgsest tuhastamisest või , veel hullem , vaklade söödaks langemisest .	surmajärgsest	6	Ela
Kuigi kõik esinejad on paljad nagu porgandid , ei puudu peolt siiski kaunid ja värviküllased Eesti rahvarõivad .	värviküllased	14	Nom
Tormid avameredel ja piraadid kitsastes väinades oleksid nii laevakaravanidele kui ka meremeestele kiire lõpu teinud .	kitsastes	4	Ine
Samal ajal on üle kuuekümneaastaseid pangamiljonäre meil kaks korda rohkem kui alla neljakümneaastaseid .	neljakümneaastaseid	12	Par
Ütleme siis , et selleks vedavaks jõuks oli veri .	vedavaks	5	Tra
Tavaliselt liiguvad sellisel varjatud moel narkoärist , altkäemaksudest , finantspettustest jt kriminaalsetest tehingutest pärinevad summad ehk tegemist on rahapesuga .	kriminaalsetest	11	Ela
Ta liikus väljaku keskel asuvale lavale .	asuvale	4	All
Aastal 1687 avaldas Newton Maa kuju teooria , milles näitas , et mõõduka kiirusega pöörleva planeedi kuju vastab pöördellipsoidile .	pöörleva	14	Gen
Ott mõtiskles oma häbiväärselt maise käitumise üle , leidis , et see on mingis mõttes inetu , aga ei suutnud ka siiralt kahetseda .	maise	4	Gen
Loomade pärilikkust võib muuta põhimõtteliselt kahel erineval viisil - kas võõraid geene sisse tuues või olemasolevaid välja lülitades .	võõraid	10	Par
Pigem olgu andmekaevanduse definitsioon üldisem ( nagu pakutud - analoogia traditsioonilise kaevandamisega ning väärtusliku informatsiooni leidmine ) , hilisemalt annab alati minna vastavalt täpsemale eesmärgile spetsiifilisemaks .	spetsiifilisemaks	25	Tra
" Omavalitsused , kes on sunnitud tegutsema viletsama majandusliku järjega piirkondades , on järjest halvemasse olukorda jäänud .	viletsama	7	Gen
Müügivõrk on traditsiooniliselt üles ehitatud regionaalsest printsiibist lähtudes .	regionaalsest	5	Ela
Toscana suurvürsti matemaatiku ja filosoofina avastas Galilei 1613. aastal , et Veenusel on nagu Kuulgi faasid , mistõttu peab planeet tiirlema ümber Päikese , mitte ümber Maa .	1613.	7	Ade
Kuigi geoloogia üheks põhilisemaks informatsiooniallikaks on olnud maakoorest leitavad biosfääri säilmed on üldise arusaama järgi geoloogia ikka olnud elutute kivimite teadus vastandina elusorganismidega tegelevale bioloogiale .	põhilisemaks	3	Tra
Esimeseks absoluutselt uueks ja ootamatuks geofüüsikaliseks tulemuseks oli van Alleni kiirgusvööndite avastamine Maa lähedal esimeselt USA satelliidilt .	uueks	2	Tra
Ta avaldas lootust , et seadus võetakse vastu jaanuaris kohe siis , kui koda uuesti tööd alustab , kuid lisas , et see jõustub ilmselt alles 2008. aastal .	2008.	26	Ade
Muidugi peavad sikhid ise oma religiooni maailma parimaks ja täiuslikumaks , teised jälle märgivad , et sikhid on vähe midagi põhimõtteliselt uut loonud .	täiuslikumaks	9	Tra
" Tshervoonnu ruutu ne shukai veetsheramõ ... " ümises oletatav abikaasa ja ei teinud tast väljagi .	oletatav	9	Nom
Pilguke hiljem sammub ta , kott seljas ja kiharad hobusesabaks seotud , reservväelaste ühtlases rivis .	ühtlases	13	Ine
Jänes jooksis neil otse nina eest üle tee ja vaid suure vaevaga suutsid rüütlid end tagasi hoida , et mitte söösta järele sellele ahvatlevale lihatombule , mis maitsenuks neile sel hetkel jumalikult isegi toorelt .	ahvatlevale	23	All
Nähtavale fotole ( sinine , HST ) on lisatud raadiofoto ( punane , VLA ) .	Nähtavale	0	All
Viimased neli aastat olid Timesi laupäevase ajakirjalisa lugejad lugenud ikka sellest , mida tunneb lootusetu vähihaige , 47aastane juudisoost inglise ajakirjanik .	laupäevase	5	Gen
Imeline , et lõpuks sain teda oma käte vahel hoida , " ütles Kaka , kes varem tulnud maailmameistriks , Itaalia meistriks ja Euroopa Meistrite Liiga võitjaks .	Imeline	0	Nom
Kõik , mis soosis võõrast võimu , ja kõik , mida see vägivaldne võim soosis , oli kurjast või äratas vähemasti umbusaldust .	võõrast	4	Par
Pöörases gravitatsiooniväljas ja üha lisanduvas gaasis ei saa olla rahu - akretsiooniketas on mitmes mõttes ebastabiilne , seal tekib tihendeid , lööklaineid ja peaaegu valguse kiirusega paiskuvad välja tohutud gaasipilved .	lisanduvas	4	Ine
McNeali uurimus viitab sellele , et lapsed usaldavad reklaame tavaliselt tunduvalt rohkem kui täiskasvanud , kusjuures kahtlused ja kaitsereaktsioon hakkavad tekkima alles 11-12 aasta vanuses .	täiskasvanud	13	Nom
Mõlemal kohtumisel arutasime Eesti jaoks väga põhimõttelisi küsimusi , mis on seotud Euroopa Liidu ja NATOga .	põhimõttelisi	6	Par
Ta ei osanud võtta juhtunu suhtes mingit arukat seisukohta .	arukat	7	Par
Ei mõisteta värsside " Astusin lihtsate asjade juurde , / toetusin lihtsale heale " suuresõnalisele kommunismi-utoopiale vastanduvat programmilisust , suunanäitu eesti luulele 1950. aastate lõpul .	suuresõnalisele	14	All
Kari paistis koosnevat mõnest täiskasvanud ja ühest noorest loomast .	noorest	7	Ela
Ta läks maja ukse juurde , et pikapatsilisele tema kohustusi meelde tuletada .	pikapatsilisele	7	All
Eosinofiilse ösofagiidi korral on kirjeldatud gastroösofageaalsele reflukshaigusele sarnaseid sümptomeid , nagu düsfaagiat , kõrvetisi või odünofaagiat .	gastroösofageaalsele	5	All
Kuumemas ning kuivemas Rioja Bajas on suurem kaal garnachal , samuti mazuelol .	kuivemas	2	Ine
Pankrotimenetluses Valga Külmutusvagunite Depoo teenib suurema lepingumahu põhjal tehtud arvutuste kohaselt ühe vaguni müümisega Venemaa raudteekompaniile Resbalt 30 090 krooni , teise , Eesti Raudtee käsutuses oleva koopia andmetel aga vaid 9989 krooni .	oleva	26	Gen
Eraülikoolid on juurde toonud konkurentsi ja sundinud avalik-õiguslike kõrgkoole tegema otsuseid kiiremini ja paindlikumalt , ennast sisemiselt reformima .	avalik-õiguslike	7	Par
Sellisel kujul ei esinda heaolu elukvaliteeti ning selle mõõtmine lisab vähe sümptomite hindamisele kliinilistes uuringutes ( 8 , 17 ) .	kliinilistes	13	Ine
Kepler üritas seda ka ise , kuid tema seletused ei osutunud õnnestunuks .	õnnestunuks	11	Tra
Sellele haigusele on iseloomulik seedetrakti erinevate vaevuste ja sümptomite esinemine , eosinofiilsed infiltratsioonid seedetrakti ühes või enamas piirkonnas ning ühes või enamas seinakihis , eosinofiilia muu põhjuse ning seedetraktiväliste eosinofiilsete infiltratsioonide puudumine .	enamas	16	Ine
Õiget lepingut paljundada ja selles olevaid numbreid asendada on Kassajevi sõnul lihtne .	Õiget	0	Par
· Pidas oma elu kõige õnnelikumateks ja viljakandvamateks aastaid 1902-1909 , kui töötas “ ilmalikus kloostris ” - Berni Föderaalses Patendibüroos .	ilmalikus	14	Ine
Rasked aatomid paisatakse maailmaruumi laiali massiivsete tähtede arengutsüklis aset leidvate plahvatuste teel ja paisunud tähtedest lähtuva intensiivse tähetuulena .	massiivsete	5	Gen
Asi hakkas oluliselt muutuma juba enne NSV Liidu lõplikku kokkuvarisemist , siis , kui kahekümnesed hakkasid Sorose programmide raames Läänes õppimas käima .	lõplikku	8	Par
Kummagi tiiva all oli peidus kuus vähkrevat pallikest , kes ainult une ajal paigal püsisid .	vähkrevat	6	Par
Jooga ronis minu juurde ülemisele narile .	ülemisele	4	All
Tema on ka esimene registreeritud presidendikandidaat , kelles võib näha demokraatlikku ja parempoolset alternatiivi presidendi kohusetäitjale Vladimir Putinile .	parempoolset	12	Par
Kegeli harjutusi võib teha , kasutades spetsiaalset nn biofeedback-süsteemi , mille puhul paigaldatakse andur tuppe või pärakusse fikseerimaks vaagnapõhjalihaste kontraktsioone .	spetsiaalset	6	Par
Kurjategija oli süüdanud hoone seina ääres oleva ehitus-prahi hunniku , millest võttis omakorda tuld ka kergestisüttivast materjalist sein .	kergestisüttivast	15	Ela
Isegi kalasabad näivad ühepikkused .	ühepikkused	3	Nom
Ajal , mil Iraak on vajunud kaosesse , on nii USA kui ka teiste maade poliitikameistrid sageli osutanud Afganistanile kui edukale lülile sõjas terrorismiga .	edukale	20	All
Suurfirmad kavatsevad heale ideele lisada ka majandusliku hoova , andes netiklientidele hinnaalandusi .	heale	2	All
On sügavalt ebaõiglane , kui valdav enamik palgatöötajatest võitleb , hambad risti , mõnekümnekroonise palgatõusu eest , aga ühele grupile - rahva teenritele - langevad sülle sajad ja lõpuks tuhanded kroonid .	valdav	5	Nom
Kindlaksmääratud tõenäosusega potentsiaalse teenitava summa teadmisega on võimalik toetada tulevasi investeeringuid .	tulevasi	9	Par
OECD riikide kogemusi arvestades soovitab Maailmapank koondada iga kolmanda õpetaja ja maksta tänu sellele rohkem palka allesjäävatele pedagoogidele .	allesjäävatele	16	All
Et selles mitte just väga mitmekesises muusikas - viimane album on salvestatud majas , kus elas kurikuulus maag Harry Houdini - ja kolli-etenduses on miskit antiteraapset .	kurikuulus	16	Nom
Välkmäludraivi standardne USB-liidese A-tüüpi pistik asub trükiplaadi vasakul küljel .	standardne	1	Nom
Nahi keeltele lähedased on abhaasi-adõgee , kartveli ja dagestani keeled .	lähedased	2	Nom
Samuti plaanib Tartu linn pöörduda kohtusse , sest loa tühistamine üksi võib jääda kasutuks deklaratiivseks aktiks .	kasutuks	13	Tra
Linnatänavatel on rohkesti suuri sõjateemalisi plakateid , mis propageerivad sõjaväelase kohta ühiskonnas .	sõjateemalisi	4	Par
Hipparchose kataloog oli aluseks Ptolemaiose ( 87-165 ) kapitaalsele planeetide liikumise geotsentrilisele mudelile , mille alusel planeetide liikumist rohkem kui 1500 aasta jooksul arvutati .	geotsentrilisele	11	All
Mitmes endises sotsialismiriigis pärssis erastamise tempot hirm , et ettevõtted võivad sattuda ekskommunistide kätte , mõnel pool aga polnud kodumaal rikast ostjat kusagilt võtta .	endises	1	Ine
Siinjuures on ajutiselt teises riigis viibivatele pensionäridele tagatud suuremad õigused : pensionäridel on õigus saada mitte ainult kohe vajaminevat , vaid üldse vajaminevat arstiabi .	viibivatele	5	All
M. Herodes leidis , et Eesti epilepsiahaigetel on kõrge stigmatiseerituse aste ( kr stigma 'arm , märk' ) ja madal hinnang oma tervislikule seisundile korrelatsioonis hoogude sageduse ja -tüübiga ( 4 ) .	tervislikule	22	All
Et reklaamiandjad ründavad järjest rohkem noid mõjukaid noori tarbijaid , ollakse selle tagajärgede suhtes vastakatel arvamustel .	vastakatel	14	Ade
Olin ükskord sõbra pool ja siis tuli hommik ja ta panni kannu tulele ja keetis vee ära ja võttis kapist mingit ilget lahustuvat kohvi ja pani tassi ja valas kuuma vee peale .	lahustuvat	22	Par
Andmed näitavad , et sügeleva naha kratsimine soodustab amüloidi moodustamist degenereeruvatest keratinotsüütidest .	degenereeruvatest	10	Ela
· Kliinilisel kirjeldamisel määrata kognitiivse funktsiooni kahjustust täpsemalt ( mälu , sihipärane tegutsemine , afaasia , apraksia ) , iseloomustada psühholoogilist seisundit ( apaatsus , depressioon , ärevus , psühhootilised sümptomid ) ning kirjeldada igapäevaeluga toimetuleku astet .	Kliinilisel	1	Ade
Lihtsaimaks näiteks on ostukeskused - iga triipkoodiga kassast läbi läinud kaup salvestatakse unikaalselt andmebaasi , nõnda kõikide kassade ning ketis olevate poodidega .	Lihtsaimaks	0	Tra
Küdeva kamina hellitaval paistel süvendas väike seltskond oma tutvust Rioja punaste veinidega , proovides neist nelja .	hellitaval	2	Ade
Elus teed veel suuremaid lollusi ja mõttetusi .	suuremaid	3	Par
Ta õppis Iisaku 7klassilises koolis , 1953. aastal lõpetas Jõhvi Keskkooli .	7klassilises	3	Ine
Looduslikule toidule orienteeritud tarbijad maksavad meelsasti kõrgemat hinda toiduainete eest , mis ei ole keemiliselt töödeldud ega läbi teinud geenitehnoloogilisi muudatusi .	geenitehnoloogilisi	19	Par
Joonisel 3 on toodud kahe mikroprotsessorsüsteemi mudelid : üks neist kujutab traditsioonilist monoprotsessorsüsteemi ( 3a ) , teine aga nelja protsessorüksust ( PÜ1-PÜ4 ) sisaldavat andmeskalaarse protsessoriga süsteemi ( 3b ) .	sisaldavat	24	Par
Kunstnik Herbert Muraueri lavakujundus illustreerib ettekujutust koraani käskudele allutatud patriarhaarsest ja seisuslikust araabia ühiskonnast .	patriarhaarsest	9	Ela
Tervelt kolmandik umbusaldavad kas olemasolevaid erakondi , Riigikogu või ei leia pakutavate kandidaatide seast endale meelepärast .	meelepärast	15	Par
Kommunistide hulgas võis selgelt eristada kahte kihti - konservatiivseid-vanameelseid ja uuendusmeelseid .	konservatiivseid-vanameelseid	8	Par
Peamised tööturu protsesside majanduslikud mõjurid olid seotud ettevõtete kohanemisega turumajanduslike printsiipidega	turumajanduslike	9	Gen
Kuna argumenteerijad esindavad harilikult suurte majandushuvisid ( fossiilkütustel põhinev energeetika ) , on samas stiilis võimalik irvitada majandusprognooside üle : selles keerulises süsteemis saabuvad suured muutused pea alati täiesti ootamatult .	keerulises	21	Ine
Sauelt pärit kroonilisele liiklusrikkujale , 1977. aastal sündinud Jaanusele , keda on alates 1997. aastast karistatud halduskorras 16 korral , neist 11 juhul kiiruseületamise eest , määrati taas 4600 krooni rahatrahvi ning karistati juhtimisõigusest ilma jäämisega 24 kuuks .	kroonilisele	2	All
" Kõhna naist peeti armetuks ja tusaseks , kurvilised tüdrukud olid aga soositud abielukandidaadid - neid peeti leebeloomulisteks ja heatujulisteks . "	leebeloomulisteks	17	Tra
Neis sisaldunud uurimisküsimused on modifitseerunud nii vastavalt saadaolevatele andmetele kui ka töö käigus tekkinud uutele küsimuseasetustele .	saadaolevatele	7	All
Sealsetes orgudes ja mäenõlvadel on veini , ning peaasjalikult just punast veini pruulitud mäletamatutest aegadest .	Sealsetes	0	Ine
Aga Tartus olid samal ajal kaks linnade vaateid kujutavat näitust ja ma arvasin , et see näitus võiks sinna kõrvale sobida .	kujutavat	8	Par
Ei , kutsuvalt mõjus hoopis köök , kus naine oma uue panniga mässas ja kust levis elutuppa ahvatlevat hõngu .	ahvatlevat	17	Par
Korrektori ilmne puudumine on muidugi toonud kaasa mõned piinlikud nimevead muidu armsalt naivistlikes pildiallkirjades .	naivistlikes	12	Ine
Täienduskoolituse hõive ja sellest tulenev inimkapitali juurdekasv sõltub seega suuresti juba olemasolevast individuaalsest kapitalist .	olemasolevast	11	Ela
Bronhoskoopial leiti trahhea alumises viiendikus infiltreeritud ja kasvajakude meenutavate vohanditega kaetud limaskest , sama leid haaras ka bifurkatsiooni .	alumises	3	Ine
Kuigi 94 % Armeenia 3,4 miljonist elanikust on armeenia kiriku liikmed , on religiooni roll tagasihoidlik - nagu enamikus postkommunistlikes maades , kus vabanemine tõi kaasa usklike hulga suurenemise pigem arvult kui hingelt .	postkommunistlikes	19	Ine
