Sõitnud Cambridge'i , ei õnnestunud tal saada oma doktoritöö juhendajaks kumbagi ala parimaist asjatundjaist , ei Stephen Hawkingit ega praegust Inglise kuninglikku astronoomi sir Martin Reesi , kuid piisas töötamisestki sealses ülisoodsas teadusõhkonnas .	parimaist	12	Ela
1960ndatest aastatest kaasajani - televisiooni ja meelelahutustööstuse kiire arenguga saab zhongleerimisest taas nii USAs kui Euroopas populaarne meelelahutustegevus .	1960ndatest	0	Ela
Tänu Niemeyeri kommunistlikele vaadetele oli ta ühena vähestest hinnatud eeskuju ka Nõukogude Liidus .	kommunistlikele	2	All
Seal oli ka pilt lumivalgest loomast .	lumivalgest	4	Ela
Üldse jagunevad siit kuni 1950-date aastate keskpaigani esitatud hüpoteesid Päikesesüsteemi tekke kohta põhimõtteliselt kahte klassi - katastroofihüpoteesid ja rahulikul viisil tekkimise hüpoteesid .	rahulikul	18	Ade
Kui osaajaga töö ja ajutine töö kaldub olema rohkem nende osaks , kes on tööturul üldiselt ebasoodsamal positsioonil ( äärmuslikud vanuserühmad ja naised ) , siis kõrvaltööde dünaamika näitab kõrvaltööde kandumist kõrgematele ametipositsioonidele ja kõrgema haridustasemega töötajate kätte .	äärmuslikud	19	Nom
Töös kasutatud töötuse ja tööhõive käsitlusviisi kohaselt on kõige üldisemaks kategooriaks elanikkonna heaolu ning lähtumine arusaamast , et tööhõive puhul on tegemist pigem vahendiga ning töötust peab optimeerima tegeliku eesmärgi - Eesti elanikkonna heaolu - maksimeerimiseks .	üldisemaks	9	Tra
Kui ta kardinad eest lükkas , avanes talle pilt viie- ja üheksakordsetest majadest .	üheksakordsetest	11	Ela
Kuulsusetu lõpp .	Kuulsusetu	0	Nom
Andmeskalaarses protsessoris toimub ühe ja sama jadaprogrammi rööpne töötlemine suurt hulka protsessorüksusi sisaldaval kogumil , kasutades hajutatud andmekogumeid .	sisaldaval	12	Ade
Kõigist kursustest umbes 1/5 ja tööalastest kursustest umbes 1/3 toimuvad töökohal .	tööalastest	5	Ela
Selge see , et poisi kangelastegu hindavad kodused elu lõpuni , kuid et ka laiem avalikkus tema söakust tunnustab , tuli meeldiva üllatusena .	meeldiva	21	Gen
Suuremad muutused , mis on toimunud üle perioodi , on järgmised : alates 1992. a on kasvanud sotsiaalsete võrgustike kaudu töö leidmine veelgi ja jäänud väikeste kõikumistega 40 % piirile .	Suuremad	0	Nom
Vaatamata välisele näivale mitmekesisusele , kasutatakse USB välkmäludraivides , eriti riistvara osas , üheülbalisi arhitektuurilis-struktuurseid lahendusi .	välisele	1	All
Patsiendi kliinilisele , radioloogilisele , endoskoopilisele ja morfoloogilisele leiule tuginev trahheobronhiaalse ( AL- ) amüloidoosi diagnoos oli ilmselt tõene , kuigi bronhibiopsia preparaatide värvingule Kongo punasega ei järgnenud immunohistokeemilisi analüüse amüloidi tüübi määramiseks .	endoskoopilisele	5	All
Õnneks on hommik õhtust targem .	targem	4	Nom
Kiilasjääks nimetatakse jääkihti , mis tekib niiskele maapinnale ( teele ) , kui saabub järsk külmalaine või kui pärast külmi järsku soojeneb või kui märga lund ( vihma ) langeb külmale pinnale .	külmale	30	All
Kaelkirjaku keha kaunistavad laigud võivad alamliigist sõltuvalt olla vahtralehe- või nurgelise kujuga , terve või sakilise servaga , suured või väiksed , kitsamate või laiemate vahedega .	kaunistavad	2	Nom
Toa valgemal poolel olid laud ja kolm tooli , ja nagu kõigis teisteski tubades , neli seinakappi .	valgemal	1	Ade
Võib arvata , et mitte õilsal eesmärgil .	õilsal	5	Ade
Ta kukkus seljaga vastu alumise reformvoodi serva .	alumise	4	Gen
Lisaks aktiivsele erialasele tegevusele ning pikaaegsele õppejõustaažile on Tähti Saar särav ja meeldejääv isiksus ka väljaspool haigemaja seinu .	erialasele	2	All
Algne idee luua kõikidele haridusturul võrdsed võimalused on õige ja ideaalsel juhul peaks erakõrgharidus tekitama avalikele ülikoolidele arendavat konkurentsi .	ideaalsel	10	Ade
Suusõnalisest lubadusest tasuda 60 päeva jooksul , pole tööstus kinni pidanud .	Suusõnalisest	0	Ela
Omanike viimistlusplaanis mahub 230 ruutmeetri sisse aga kogu maja , ka kelder ja 35ruudune garaazh , mida kuidagi kasulikuks pinnaks pidada ei saa .	kasulikuks	18	Tra
Tehnilistele tingimuste kohaselt suudab mälulülitus TC58DVG02A1 korrektselt täita mitte vähem kui 100 000 programmeerimis-kustutustsüklit .	Tehnilistele	0	All
Vanglas dikteeris Marco Polo üleskirjutajatele oma reisimälestused , mis jäid kuni 17. sajandini eurooplaste peamiseks infoallikaks Sise-Aasia , sealhulgas Kesk- ja Lääne-Hiina kohta .	peamiseks	14	Tra
Välkmälude tormiline võidukäik kuulutab paratamatut kadu vanamoodsatele kohmakatele mürarikastele ja võrdlemisi kapriissetele magnetlinte või -kettaid kasutavaile mäludraividele .	mürarikastele	8	All
Warhol ei pidanud ennast professionaalseks fotograafiks ning enamasti ongi tegu amatööri toodanguga .	professionaalseks	4	Tra
Tema ees seisis kääbus , seljas tilluke raudrüü .	tilluke	6	Nom
Alates aktiivsest tegevusest Püha Liidu juhtiva riigina võis Venemaad lugeda reaktsiooniliste jõudude peamiseks kantsiks , samal ajal kui Prantsusmaa kõikidest revolutsioonidest ja pööretest hoolimata oli ikka olnud vabariikliku , liberaalse või lausa mässumeelse ideoloogia kandjaks .	vabariikliku	27	Gen
Näiteks teatud objekte ( ettevõtte kliente , tooteid ) mõnest kindlast aspektist hindav mudel tuleb realiseerida korduvate ja regulaarsete arvutustöödena turunduse andmebaasides .	hindav	12	Nom
Kasutusele võeti sagedaste episoodide analüüs ( sequential patterns ) , mis olemuselt on assotsiatsioonireeglite leidmine koos lisandunud ajalise mõõtmega .	sagedaste	2	Gen
Nii nagu plastiliinitükist , mis algul on neljakandiline , voolime lõpuks täpselt sellise asja , mis meile meeldib , ” selgitab Külli Loomann	neljakandiline	7	Nom
Selline lähenemine on pärit Põhja-Ameerikast : maksab vaid esikoht , kes tuleb teiseks-kolmandaks , ei lähe absoluutselt korda .	teiseks-kolmandaks	12	Tra
Kui kaht esimest tüüpi mustade aukude korral on praegu monstrumteleskoopide rolli raske näha , siis massiivsetest ja supermassiivsetest mustadest aukudest teame paari aasta pärast kindlasti märksa rohkem .	mustadest	18	Ela
Kuni aga kehtib liberaalse haldusterritoriaalse reformi põhimõte ja vallad liituvad vabatahtlikkuse alusel , võiks valitsus hädatoetuste jagamise üle otsustamisel usaldada kohapealseid olusid tundvate maavanemate arvamust .	tundvate	22	Gen
Programmi töötluse korraldamisel multiskalaarses protsessoris tuleb arvestada asjaoluga , et liikumine CFGs toimub spekulatiivselt , s.t üksikute tegumsammudena ( task-sized step ) ilma peatusteta selleks , et lähemalt analüüsida tegumi üksikuid käske .	multiskalaarses	3	Ine
" Tegelikult pole ma kehvas seisus randme tõttu saanud kolm aastat võrgumängu harjutada , " ütles Ivanov , kes möönis , et kõvakattega väljakul mängitud turniiri finaalikoht oli tema kui seni peamiselt liivaväljakutel tegusid teinu jaoks üllatus .	kehvas	4	Ine
Ning see läks armukadedusest sõgedaks ja mõrvas konkurendi .	sõgedaks	4	Tra
Põhjusi tasub otsida aktsiaturgude ülemaailmsest ebakindlusest .	ülemaailmsest	4	Ela
Noored isamaalased ja eakad maasaadikud võtsid presidendimängu liiga tõsiselt ja kogenud Savisaar mängis nad lihtsalt üle .	eakad	3	Nom
Seetõttu saab päevade arvu jääminekust rukkilõikuseni ning rukki küpsemiseks vajaliku soojuse järgi leida aprilli , mai , juuni ja juuli keskmise temperatuuri ( joon. 3 ) - seega mitte suve ( juuni-september ) temperatuuri tavalises mõttes .	tavalises	34	Ine
Öeldi otse , et nii väheste inimestega pole võimalik tagada elanikele vajalikku turvalisust .	väheste	5	Gen
Linna tseremoniaalsele peateljele projekteeris Niemeyer paraadses ühtluses kümme ministeeriumihoonet , telje lõppu Kongressihoone , justiitsministeeriumi , presidendipalee ja panteoni .	paraadses	5	Ine
Põlispuud heitsid jõeäärsele pargisiilule kollaseid lehti .	jõeäärsele	2	All
Neerupealise säsist eralduv adrenaliin on avariihormoon , millel on oluline tähtsus organismi kõikide osade mobiliseerimisel pinge ehk stressi seisundis .	eralduv	2	Nom
Ka Eesti Panga viimased analüüsid , mis on tehtud aastate 2001 ja 2002 kohta , näitavadki , et majanduskasvu " mootoreiks " on peale 2001. aastat üha enam olnud sisemaine nõudlus .	sisemaine	29	Nom
" Siin on tasakaal : ühelt poolt originaalravimitootjad , kes on suutelised välja töötama uusi ravimeid eluohtlike haiguste vastu , aga kallimalt .	eluohtlike	16	Gen
VR : Tänane EL pole see , millena Churchill ta välja käis - rahuprojekt Saksamaa ja Prantsusmaa vahel on vaid muutunud protektsionistlikuks ja bürokraatlikuks klubiks .	bürokraatlikuks	23	Tra
1798. aastal lõpetas tsaar Paul I ukaas Paldiski staatuse kindluse ja sõjasadamana .	1798.	0	Ade
Jõhvikad ja pihlamarjad on marjarohkel sügisel kena praekaunistus .	marjarohkel	4	Ade
Kui aga sind ennast või kedagi omastest tabab raske haigus , mille ravi oleneb just neistsamadest loomkatsetest , muudad tõenäoselt oma seisukohti .	neistsamadest	15	Ela
Nendest tuntuim sinapiin , mis võib põhjustada pruune mune munevate kanatõugude munades kalamaitset ( sinapiinist moodustub trimetüülamiin , mis siirdub munadesse valgu moodustumise protsessis ) .	munevate	9	Gen
Pullide võitlustes emaste pärast on kõige määravam tegur isaslooma suurus .	määravam	6	Nom
Struktuurselt on multiskalaarse protsessori andmemälu korraldatud ühiskasutatavate vahemälusegmentide ehk andmepankade kogumina ( AP1-APn ) .	multiskalaarse	2	Gen
Tiigrihüppe Sihtasutus võttis suuna digitaalse õppesisu tootmisele ja selle vahendamisele veebi kaudu juba 1990ndate aastate lõpul , mil koostöös Tallinna Pedagoogikaülikooli haridustehnoloogia keskusega rajati haridusportaal Õpetaja Võrguvärav .	digitaalse	4	Gen
Esimesest päevast peale ehitas peatöövõtjana mäge AS Feer .	Esimesest	0	Ela
Paraku läks noorpaari tee mõni aasta pärast Arisdagesi sündi lahku , sest Gregorius eelistas tollase kombe kohaselt kloostrisse minna .	tollase	14	Gen
Praegune täiendkoolituse peamiselt turumehhanismidele tuginev korraldus soosib eelkõige neid elanikkonna kategooriaid , kes on nooremad , kõrgharidusega , paiknevad sotsiaalses ja ametialases hierarhias kõrgemal , kelle materiaalne olukord on parem - kellel on enam kapitali .	ametialases	21	Ine
Võluvõimete varal juhatan tütarlapse õigele teele .	õigele	4	All
Valik jäi pidama Valga haigla noorukesele peaarstile .	noorukesele	5	All
Nendin vist sajandat korda , et tunnen selle ilusa , targa , hapra , särasilmse ja kokkuvõttes kohutavalt seksapiilse tüdruku vastu puhast sõbralikkust .	ilusa	8	Gen
Piltilus neiu uskus Sposato lubadusi teha temast modell , ent hakkas siis kahtlema .	Piltilus	0	Nom
Lossi ette kogunenud rahvas , kes kannatlikult ootas just seda hetke - ei ilmalik ega ka kiriklik abiellumistseremoonia-laulatus polnud suudlemist ette näinud - , oli vaimustuses .	kiriklik	16	Nom
Meile teadaolevatel andmetel Eestis FINAPRES-mõõtureid kasutusel ei ole .	teadaolevatel	1	Ade
Nood ütlesid : loomulikult on kohalikul omavalitsusel ka vanglaküsimuses oma sõna öelda .	kohalikul	5	Ade
Seetõttu usub autor , et antud valdkond peaks jääma alati teatud mõttes poolautomaatseks ning täisautomaatsena oleks süsteemil mõtet ainult ettevõttesisesena ( mille kitsad piirid seadistab eelnevalt siiski spetsialist ) .	poolautomaatseks	12	Tra
Hiljaaegu pidi rämpsposti vastu võitlejana tuntud hollandlannast europarlamendi liige Elly Plooij häbiga tunnistama , et saatis tuhandele europarlamendi e-posti aadressile ülisuure , 3-megabaidise rämpskirja .	3-megabaidise	22	Gen
Põie korduval kateteriseerimisel on siiski mõned võimalikud tüsistused : põieinfektsioon , ureetra trauma , põletik ja striktuur .	korduval	1	Ade
Petrov ukerdas jalgupidi vees , kollane kittel märg ning keha külge kleepunud ja sikutas kaldale suuri kaste ning vaate , mida meri öö jooksul randa kandnud oli .	kollane	5	Nom
Mingis punktis kiired lõikuvad ja oh seda odavat pahandust siis .	odavat	7	Par
Erinevalt headest plaatidest ja kontsertidest ei ole head muusikadokumentaalid nii lihtsalt kättesaadavad .	headest	1	Ela
Kahe suure , kuid praegu mitte koalitsioonipartneri eesmärk on ära hoida , et Jõks uueks ametiajaks õiguskantsleri ametisse jääks .	uueks	14	Tra
Minu jaoks oleks ainuke põhjus selle mittevaatamiseks , kui see muutuks kommertskanalite sarnaseks .	sarnaseks	12	Tra
Sellist linakasvatust võiks ette kujutada põllumajandusmuuseumi juures , kus kaks-kolm peret näitavad turistidele , kuidas XIX sajandil Eestis lina kasvatati .	XIX	15	Ade
Rioja Alavesas paikneva bodegas Palacio tempranillost valmistatud tume , raske ja joovastava aroomiga vein on , nagu etiketilt võis lugeda , pühendatud bodegase rajajale Don Cosme Palaciole .	paikneva	2	Gen
Tšetšeenia puhul on venekeelsetest toorlaenudest loobumiseks hetkel ülimalt sobiv aeg .	venekeelsetest	3	Ela
Sümmeetrilisi kahekõrvalisi galaktikaid , kui neis on toimunud hiigelplahvatus , võiks justkui pidada normaalseiks .	Sümmeetrilisi	0	Par
Kapitalistlikus ühiskonnas mängivad aga just sellised tegurid tohutut rolli , kes hierarhilisel karjääriredelil kui kaugele jõuab , kes kui palju va krabisevat kokku ajab .	hierarhilisel	11	Ade
37 % tadziki rasedatest naistest jääb sünnituseelse arstiabita ja umbes kolmandik sünnitab kodus .	rasedatest	3	Ela
Palgakasvu mõõdukamaks muutmine	mõõdukamaks	1	Tra
413 üliõpilasest hindas oma une kvaliteeti heaks või pigem heaks 69,2 % ( 286 ) ; rahuldavaks 23,7 % ( 98 ) ning pigem halvaks või halvaks 7,0 % ( 29 ) vastanuist ( vt jn 1 ) .	halvaks	26	Tra
See oli lihtne vastus lihtsale küsimusele .	lihtsale	4	All
" Milosevic pidas ähvardava , väga närvilise ja ebastabiilse kõne , " ütles Djindjic .	ähvardava	3	Gen
Ka seal on iga kana kordumatu , aga neid on nii palju koos ja kõik elavad ühesugust elu .	ühesugust	16	Par
REIN KURESOO ( 1959 ) on vabakutseline literaat ja kunstnik	vabakutseline	6	Nom
Eesti infotehnoloogid , jätkake julgelt oma naturaalse mõistuse kasutamist infotehnoloogiliste lahenduste väljatöötamisel !	naturaalse	6	Gen
USAs feministlikke filme levitav Vanessa Domico hangib lühimängu- ja dokumentaalfilme telejaamadele , ka ülikooli loengute abimaterjalideks .	feministlikke	1	Par
Tänavusi majandustulemusi ei soovinud Kiviberg veel avaldada .	Tänavusi	0	Par
Nooruses tugevalt mõjutatud Le Corbusier'st , kellega koos ta projekteeris oma esimese suurema ehitisena Haridusministeeriumi Rio de Janeiros ( 1936 ) , on ta edasises loomingus pidevalt otsinud oma poeetilisele , individualistlikule loomelaadile sobivamat alternatiivi .	individualistlikule	31	All
Sikhid ei usu ka astroloogiat ega muid hämaraid asju , peavad tegema ausat tööd ja mitte sallima rassilist , usulist või soolist diskrimineerimist .	rassilist	17	Par
Kuni 1915. aastani oli too kloosterkirik käärkambrialuse koopana armeenlaste tähtsamaid palverännupaiku .	tähtsamaid	9	Par
Holland on selle vastand , kus töötajate liikumine tööturul on suhteliselt isoleeritud struktuursetest jõudude toimest .	struktuursetest	12	Ela
Kõnesolev kogu annab tooni ka vaadeldavas valimikus .	vaadeldavas	5	Ine
Siseriiklike hüvitiste liigitamisel määruse hüvitisteks tuleb lähtuda hüvitise iseloomust .	Siseriiklike	0	Gen
Ja kui nüüd kusagil kõris või ninas ( need on ka torud ) läheb õhuvoolutee kitsamaks ( mandlid tursunud , adenoidid suured , tavalisest kogukam keelepära jne. ) , suureneb õhuvoolukiirus , mis omakorda kisub kinni selle piirkonna .	kitsamaks	15	Tra
Intervjuus rõhutas Bush vajadust muuta NATO sõjalist strateegiat , mis lähtuks eeldusest , et kõige tõsisem oht vabadust armastavatele riikidele on terrorism .	armastavatele	18	All
1558. aastal alustasid venelased sõda , vallutasid Narva ja viisid oma kaupade peamise lao Viiburisse .	1558.	0	Ade
Lõpuks hinnati ühtsele kujule viidud mudelid kõikide aastate andmete baasil .	ühtsele	2	All
Aga seda kõike meie tibupoeg ei teadnud , ta vaatas kukke imetlusega ning tundis oma noore meelega , et selle olevusega tuleb tal edasises elus arvestada .	edasises	23	Ine
Broileriliha rasvhappelise koostise kohta on toodud andmed tabelis 6 ning võrdlevad andmed rasvhappelise koostise kohta broileriliha kogu rasvas ja fosfolipiidides tabelis 7 .	rasvhappelise	1	Gen
Suurele osale nendest , keda tööandja tööle ei võtnud , oli pakutud töökoht juba hõivatud .	Suurele	0	All
Seevastu imetlesime järgmisel hommikul Thamesi vaadet parlamendihoone rõdul , kus ajaloolise kesklinna taustal kõrgub hiiglaslik vaateratas - Londoni silm .	hiiglaslik	14	Nom
Samuti kardetakse oma tulusid avalikustada seetõttu , et Eestit peetakse liiga kriminogeenseks piirkonnaks , kus kunagi ei või teada , kes teenitud summa suuruse teada saab ning mida säherduse teadmisega edaspidi peale hakkab .	kriminogeenseks	11	Tra
Kuigi teoorias esinesid pruunid kääbused juba mõnda aega õnnestus nende olemasolu kohta faktilist kinnitust saada alles 1995. aastal tänu ülitundlikele infrapunakiirguse vastuvõtjatele .	ülitundlikele	19	All
Need on alati olemas nii looduslikes süsteemides kui nende kombinatsioonides inimtekkeliste süsteemidega .	looduslikes	5	Ine
-. Midagi seninägematut : Chandra röntgenipilt gigantsest elliptilisest galaktikast 3C295 , mille tuumaks olev must auk püüab neelata liiga suurt suutäit .	elliptilisest	7	Ela
Toomingu sõnul tuleb see eelkõige sellest , et kusagil keset Eestit muutub pehmem mereline ilmastik järk-järgult karmimaks mandriliseks .	pehmem	12	Nom
Äikesele järgneb koletu kärgatus , see ei tee kellelegi häda , aga ajab hirmujudinad selga .	koletu	2	Nom
Samas ei tohi CFG alusel läbiviidav infotöötluse korraldus rikkuda töödeldava programmi enda seesmist jadastruktuuri .	seesmist	12	Par
Praeguse töötajate arvu juures pole meil tõesti võimalik iga kuriteoga tegeleda , kuigi on selge , et ükskõik millist kahju kurjategija inimesele tekitas , on see kannatanule tragöödia , mille lahendamisel oodatakse politseilt tulemuslikku abi .	tulemuslikku	33	Par
Psühholoogid õpetavad mõistma ja kasutama kehakeelt , sest ehkki enamik täiskasvanud inimestest on selle oskuse elu jooksul omandanud , on kehalises suhtlemises rohkesti mitmetähenduslikke märke , mida on kerge valesti tõlgendada .	kehalises	20	Ine
Tootmisvõrk ise on keeruline organisatsioon , kus toote arendajad ja vahetud tootjad on ühendatud ühtsesse virtuaalsesse ettevõttesse .	vahetud	10	Nom
Seetõttu on proovitud lokaalselt toimivaid kortikosteroide ( budesoniid ja flutikasoonpropionaat ) kui ohutumat ja samas efektiivset alternatiivi pikaajalisele süsteemsele kortikosteroidravile ( 1 , 4 , 12 , 19 ) .	süsteemsele	18	All
Sügise saabumine teeb lõpu suveajal igapäevasele sebimisele vaheldust pakkunud õhtustele piknikele ja väljasõitudele ning sunnib jälle ahelduma oma igapäevase voodi-töö-kodu-voodi trajektoori kammitsaisse .	õhtustele	9	All
Bronhoskoopiline leid trahheobronhiaalse amüloidoosiga patsiendil ( sama patsient , kes joonisel 2 ) .	trahheobronhiaalse	2	Gen
Poliitilise kultuuri nähtuste puhul ei tohiks ei reakodanike ega eliidi rolli alahinnata .	Poliitilise	0	Gen
Lisaks kindlale pildile Joogast .	kindlale	1	All
See ongi üks peamisi riigi majanduskasvu põhjusi .	peamisi	3	Par
Seejuures tegid nad nii tähtsat nägu , otsekui oleks lumi nende tellimise peale maha sadanud .	tähtsat	4	Par
Kahjustus on suhteliselt healoomuline , kuigi võib progresseeruda ja retsidiveeruda ; on kirjeldatud ka fataalset verejooksu ( 7 ) .	healoomuline	3	Nom
Aeg-ajalt juhtus siiski midagi , mis pakkus väheke lusti ja andis võimaluse oma kangeks jäätunud lihaseid taas vetruvaiks võimelda .	vetruvaiks	17	Tra
Mõni aeg tagasi helistas mulle üks raadiokuulaja , kes oli juba mitmendat korda oma korterist tabanud ühe ja sama alaealise varga .	mitmendat	11	Par
Seetõttu on ootuspärane ka väliskapitali sissevoolu ja ekspordikäibe sarnane ( tugevalt tööhõivet soodustav ) käitumine mõlemal vaadeldaval aastal .	vaadeldaval	16	Ade
Sõitnud Cambridge'i , ei õnnestunud tal saada oma doktoritöö juhendajaks kumbagi ala parimaist asjatundjaist , ei Stephen Hawkingit ega praegust Inglise kuninglikku astronoomi sir Martin Reesi , kuid piisas töötamisestki sealses ülisoodsas teadusõhkonnas .	sealses	30	Ine
Õige ravi põhineb kusepõie funktsioonihäirete täpsel diagnoosimisel .	täpsel	5	Ade
Niisiis , tehakse teadlaste eestvõttel igasuguseid asju - mõttekaid , vähemõttekaid ja paraku ka mõttetuid .	vähemõttekaid	10	Par
Tõusime liftiga 17. korrusele , samas liftis sõitsid ka vene keelt rääkivad punkarisoenguga tätoveeritud noormehed , kes ilmselt olid tulnud Hiina kolkasse Lääne tänavakultuuri esindama .	rääkivad	11	Nom
Vaadatakse selle kõrvale ka leti kohal rippuvast tohutu ekraaniga televiisorist käimasolevat matði .	käimasolevat	10	Par
Nende administratiivset rakendamist puudutavad sätted sisalduvad määruse 574/72 artiklites 16-34 ning 93-95 .	puudutavad	3	Nom
Kumb mees on parem - sel iginaiselikul dilemmal ei ole eestlaste jaoks ühest vastust .	iginaiselikul	6	Ade
Teadlikult taotleti linnaosa puhul saavutada ühtset arhitektuurilist ilmet .	arhitektuurilist	6	Par
Kombineeri nii : alusta viieminutilisest reipas tempos kõndimisest , siis jookse järjest 10-15 minutit ning nii kokku kolm korda .	viieminutilisest	4	Ela
Selle käigus toimus ressursside , sh tööjõu ümberpaiknemine vanadest sektoritest uutesse , produktiivsematesse ja tulusamatesse , vanadelt tegevusaladelt uutele ning avalikust sektorist erasektorisse .	uutele	18	All
Tähtsal kohal puuris on jooginõu .	Tähtsal	0	Ade
Multiskalaarset protsessorit võib vaadelda kui kogumit jadamisi talitlevaist ( skalaarseist ) protsessoreist , mis töötlevad ühiselt üht jadaprogrammi .	skalaarseist	9	Ela
Selektiivsetel T-helper 2 lümfotsüütide tsütokiinide ( IL-4 , IL-5 ) inhibiitoritel ( suplatasttosilaat ) on tõestatud allergeen-indutseeritud eosinofiilset infiltratsiooni , IgE produktsiooni ja karikrakkude metaplaasiat pärssiv toime .	eosinofiilset	17	Par
Pinguta , palju sa pingutad , oktoobri lõpuks on kõigest kõrini ja elus aitab püsida vaid unistus kunagi saabuvatest jõuludest ning veel väga kauges tulevikus kätte jõudvast kevadest-päästjast .	saabuvatest	18	Ela
Tudengist Täht tuli laupäeva hommikul Tallinna asju ajama ning pidi esialgsete plaanide järgi keskpäeva paiku Tartus tagasi olema .	esialgsete	10	Gen
Tänavad tundusid imelikult lagedad .	lagedad	3	Nom
Aastatel 1994--1997 õppis eesti koolides üle 3000 muukeelsest kodust pärit lapse .	muukeelsest	7	Ela
Kui töötaolek on madal , on streigifond suur ja ametiühingud võivad toetada iga streigiähvardust - firmad on sunnitud rahuldama kõrgeid palgatõuse .	kõrgeid	19	Par
Ja kui palju helget ilu oli meister nende kaudu jaganud selle salapärase mängu sõpradele ja austajatele .	salapärase	11	Gen
Edaspidi hakatakse uusi liikmeid nimetama igakevadisel Genfi autonäitusel .	igakevadisel	5	Ade
" Järgmises peatuses , " vastas vana ja tõusis , et taas akna juurde kakerdada .	Järgmises	1	Ine
Erakondlikud raamid jäävad neile kiiresti kitsaks .	kitsaks	5	Tra
Erialases kirjanduses leidub hulgaliselt töid linaseemnete ja linaõli mõju kohta inimeste füsioloogiale ning verenäitajatele .	Erialases	0	Ine
" Me ei suutnud vastase kolmestele ja kiirusele midagi vastu panna .	kolmestele	5	All
Pealegi on allhankel baseeruv tööhõive , eriti kõrgtehnoloogiasektoris , rahvusvahelise majanduskonjunktuuri halvenedes kiirelt vähenev .	baseeruv	3	Nom
Endisest kommunistlikust ühiskonnast jäid ka paljud kombed , eelkõige soov olla rikas ja mõjuvõimas ning püüe mitte millegi eest vastutada .	kommunistlikust	1	Ela
Järgmisel aastal alustab linn mitme uue lasteaia projekteerimist ja taasavatakse lasteaed Tehnika tänaval .	Järgmisel	0	Ade
Naaberukse vahelt piilus sassis peaga nuustikut meenutav vanamammi , jälgis teda veidi aega etteheitval pilgul ja sulgus siis sõnagi lausumata oma pimedusse tagasi .	etteheitval	13	Ade
Lõppevat aastat ( 2005 ) iseloomustab mitmete mind huvitanud tehnoloogiate ja metoodikate tegelik kasutamine .	Lõppevat	0	Par
Mu sportilike ettevõtmiste kalender pole teab mis tihe .	sportilike	1	Gen
Mõlemal oli tarvidus kalendri järele , sest põllumajandus sõltus looduse aastasest regulaarsest rütmist ja karja tuli perioodiliselt ajada uutele rohumaadele .	regulaarsest	11	Ela
Kui varem olid moeloojad orienteerunud vanematele naistele , sest neil oli raha , siis pärast meeste massilist mahanottimist ilmasõjas läks noorus hinda .	vanematele	5	All
Hommikune valgus avas silmad , see oli päevaseks tegevuseks vajalik .	päevaseks	7	Tra
" Näitame Veinimaa filmide festivalil ( Wine Country Film Festival , 15 aastat ) kino vabas õhus kunagises Jack Londoni rantshos .	kunagises	17	Ine
SEB on olekult sinivereline , algusaegade Hansapanga moodi .	sinivereline	3	Nom
Normaalne urineermisrefleks on spinaalne refleks , mida kontrollivad kõrgemad närvisüsteemi keskused .	spinaalne	3	Nom
Nii näiteks ei pruugi uute töökohtade teke vähendada töötust , samas aga võib kaasa tuua suurema liikumise ja ümberpaiknemise , eriti kui pidada silmas hariduslikku ekspansiooni , mis tõenäoliselt toob kaasa edasise vähem haritute väljatõrjumise .	hariduslikku	24	Par
Hollandi verivärske printsess Maxima kirjutas alla karmile ja ebaõiglasele abielulepingule .	ebaõiglasele	8	All
Pööran linna vasemale , kasutan ära inertsi ja juba kulgebki panoraam minu poole .	vasemale	2	All
4. Uriini väljutustakistust vähendavad lisaks selektiivsetele ja mitteselektiivsetele alfa-blokaatoritele ka lihaslõõgastid ( baclofen , bensodiasepiinid ) ning eesnäärme mahtu vähendavad ravimid .	selektiivsetele	5	All
