A csatkarika felirata a " magas " , " ég " , " kő " és " Föld " szójelekből áll .	szójelekből	19	Ela
A Club126 elnevezés már nekem is eszembejutott ( még Tokajban ) , szerintem nagyon állatul hangzik	állatul	14	Ess
A törvény felhatalmazást ad a Kormánynak és az igazságügyért felelős miniszternek a törvényi jogforrási szintet nem igénylő részletszabályok megalkotására , a következő témakörökben :	igazságügyért	8	Cau
Igazi detektívhőshöz hasonlóan szimpatikus , de furcsa zseniről van szó , aki cseppet sem hagyományos módszerekkel dolgozik .	zseniről	7	Del
Gazdagként és szegényként egyaránt szeretheted a pénzt .	szegényként	2	Ess
A lakályos 3 csillagos Hotel Orlando a 24 órás szobaszervizt , a transzfer szolgáltatást és a vegytisztítást kínál .	vegytisztítást	16	Acc
Estre egyébként a gyorskör után elmondta , hogy az autó lenyűgöző , és a fékezéseknél , illetve a gyors kanyarokban szinte ugyanúgy viselkedik , mint a Porsche 911 GT3 R névre hallgató versenyváltozata .	gyorskör	3	Nom
És akkor még nem beszéltünk a fiatal női vezetőknél a gyerekvállalás és az expatrióta pozíció nehéz összeegyeztethetőségéről .	vezetőknél	8	Ade
Mivel sok pogányt megtérített , sok hívével együtt szenvedett a hitért .	hívével	6	Ins
Megváltoztak a jegyvásárlási szabályok a HÉV-vonalakon : a Budapest közigazgatási határán kívüli megállókban csak előre megváltott kiegészítőjeggyel vagy bérlettel lehet felszállni a szerelvényekre , októbertől ennek hiányában pótdíjat kell fizetni - közölte a MÁV Zrt .	pótdíjat	27	Acc
Ráadásul a februári Story-gálán Végvári Ádám és Csepregi Éva mellett Pál Éva is megkapta a Legenda-díjat .	Legenda-díjat	15	Acc
A Firefox átirányító vírus freeware és shareware programok telepítése után jelenhet meg a Firefoxban .	freeware	4	Nom
Persze a kampány választástól választásig folyamatosan tart már , az elkövetkezendő néhány hétben hatalmas dózisban kapjuk majd a pártok politikai üzeneteit .	választásig	4	Ter
Jövőben már nem lehet állami vizsgabázisokra vinni személyautót , nem kell törődni a parkolási mikuláscsomagokkal , de a javaslatok érintik az e-matricák büntetéseit is – közlekedési salátatörvény került a parlament elé .	Jövőben	0	Ine
Nálunk a teljesen fekete , L-es verzió járt , de ebből a modellből létezik valamivel sportosabb stílust kölcsönző piros/fekete változat is .	modellből	12	Ela
Kicsit elkeveredtem a busszal Solymár felé , így némi kerülővel a Kálvária felöl közelítettem a 2. ponthoz .	kerülővel	9	Ins
Az egyetemi oktató azt is elárulta , hogy szeptembertől szakkört is indítanak középiskolás diákoknak , akik saját készítésű eszközzel végezhetnek légköri méréseket vagy adott esetben alváskutatást .	szeptembertől	8	Abl
Ha mellőzzük , akkor inkább használjuk mintás pamutvásznat esetleg vetexel megerősítve .	vetexel	9	Ins
� A jelenleg rendszeres szociális segélyre jogosult személyek ellátásra való jogosultságát a jegyző 2015. január 1. és 2015. február 28. között felülvizsgálja .	segélyre	5	Sub
@ Kullancs1983 : Függ egy csomó dologtól a megadási hajlandóság , pl. a kohéziótól meg ilyenektől .	kohéziótól	13	Abl
Kirúgott abból a képzeletbeli szobából , ahol eddig ültem .	szobából	4	Ela
A díjat a cég alelnökétől , Leo Hamacher-től vettük át .	alelnökétől	4	Abl
A japánban császári jelképnek számító krizantém az irezumiban a hosszú életet és elmúlást jelenti .	jelképnek	3	Dat
Ennek érdekében az i ( i = 1 ,, N J ) munkákhoz hozzárendelem a következı zárolást leíró attribútumokat : J [ i ] .LFS a munka utolsó zárolt végrehajtási lépésének sorszáma .	.LFS	24	Nom
Azt a tiszteletdíjat , amit a brit csapatától kap , emiatt közvetlenül Monacóban fizetik ki .	csapatától	7	Abl
Az egyik első feladat ezért az , hogy ezen élőhelyeket nemzeti listán tűntessék fel abból a célból , hogy az összes többi élőhely számára ún. referencia-helyként szolgáljanak .	referencia-helyként	25	Ess
Ezért jobbnak látjuk , ha nem is veszünk tudomást róluk , igyekszünk a korlátokat kiiktatni az életünkből ... A gyártó minden géphez köteles használati utasítást adni .	életünkből	16	Ela
Legfeljebb 8 általános Szakmunkásképző , szakiskola ( érettségi nélkül ) Szakközépiskola , technikum.% Gimnázium % Főiskola.% Egyetem Tudományos fokozat : PHD , DLA , egyetemi doktor , kandidátus , nagydoktor Nem tudja , nem ismerte , nem élt 6.9 .	szakiskola	5	Nom
Felelős vagyok a gyermekem párkapcsolatáért ?	párkapcsolatáért	4	Cau
Aktivisták ma délután a parlamenti ülés közben „ Nincs biztonságos atomenergia ” feliratú bannert feszítettek ki a sajtópáholyról .	sajtópáholyról	17	Del
Ezek a leggyakoribb kellemetlenségek : – Égő , duzzadt ajkak , zsibbadás , viszketés a szájüregben , garatvizenyő .	viszketés	13	Nom
Azok a beavatottak akik megtapasztalták a következő dimenziót visszajöttek , hogy szeretetet sugározzanak és meghozzák a tudást az alacsonyabb szinteken lévő társaiknak .	szinteken	19	Sup
Amennyiben a megrendelt termékek raktáron vannak cégünknél , egri szállítási cím esetén aznapra vállaljuk a csomag kézbesítését .	cégünknél	6	Ade
Az első lépés az ápoláshoz szükséges eszközök , szerek helyes kiválasztása .	ápoláshoz	4	All
A 1700 mrd-os tárolód nettó kreténsék , ennek töredékéből megoldható a tárolás .	kreténsék	5	Nom
Az uniós agrárpolitika eszközeivel és tagállami intézkedésekkel is meg kell állítani a gazdatársadalom elöregedését – mondta az Agrárminisztérium vidékfejlesztésért felelős államtitkára az M1 aktuális csatorna hétfő reggeli műsorában .	vidékfejlesztésért	18	Cau
3. ) levettük a rácsot az ágyáról .	rácsot	4	Acc
Dolgozz Kőművesként és legyél megbízható szakember !	Kőművesként	1	Ess
A 3%-nál alacsonyabb szervesanyag-tartalmú talajokon ez a gyom - irtási technológia nem alkalmazható .	3%-nál	1	Ade
Jelenleg a kötelező tíz fő egyesületi taglétszámon túl 30 aktív önkéntesünkkel látjuk el feladatainkat .	önkéntesünkkel	10	Ins
Egy angolszász hagyományról beszélünk , amely talán az egyik leghíresebb babonává nőtte ki magát .	babonává	10	Tra
Az 1994-ben �- os csatornázottsági arány 2000-re 74%-ra nőtt , de a szennyvíz elvezetése , kezelése továbbra is a régió , különösen Pest megye központi környezetvédelmi problémája .	74%-ra	7	Sub
Deutsch Tamás az Európai Néppárt két olyan elképzeléséről is beszélt , amelyekről hétfőn tárgyalnak majd .	elképzeléséről	7	Del
A vidék kisvárosai és települései barátságos vendégszeretettel , megszámlálhatatlan programmal , látnivalóval várják a vendégeket : múzeumok , műemlékek , alkotóművészek , kézművesek , népművészek , falusi turizmus-szolgáltatók élménydús ajánlatából választhat az érdeklődő .	ajánlatából	29	Ela
Ezt követően a látogatók az Illyés Gyula Aulában felállított információs standoknál személyesen találkozhattak és beszélgethettek a Kar intézeteinek oktatóival és hallgatóival és szerezhettek információt a KPVK változatos képzési kínálatáról , az egyetemi életről .	intézeteinek	17	Dat
Vegyük inkább sorra azokat az új interpretációkat , amelyek ugyanonnan ( a „ székesegyházi jelenetből ” ) indulnak ki , mégis egészen máshová jutnak el , jóllehet távolról sem ugyanoda .	jelenetből	14	Ela
Fernando Alonso és Nico Hulkenberg is " nyílt sisakos " küzdelmet vívott egymással , ennek következtében kiesett Szergej Szirotkin , a kétszeres bajnok spanyol pedig jöhetett új kerekekért és orrkúpért .	kerekekért	27	Cau
A két fotel és a kanapé bármilyen kombinációban elhelyezhető , 5 személynek biztosít maximális kényelmet .	fotel	2	Nom
Gyakran ragadnak bele szeretői kapcsolatba olyan nők , akiknek gyenge az önbecsülése , önértékelése .	önértékelése	13	Nom
Az Alapjáratnál a két meghatározó szenvedélyem összekötésével egy számomra álomszerű lehetőség vált valósággá .	valósággá	12	Tra
A népi szájhagyomány szerint valamikor a macskamenta főzete a táltosok kedvelt italaként szolgált .	főzete	7	Nom
hogy elméletekké szűkítsék le , legyenek bár látszólag teológiai vagy moralizáló elméletek ... nem .	elméletekké	1	Tra
Mindössze három embertől vettek DNS-mintát a rendőrök a ceglédi négyéves kislány megerőszakolása miatt : a kislány édesapjától , nagyapjától és a nagybátyjától , az utóbbit hazugságvizsgálóval hallgatták ki .	nagyapjától	18	Abl
Kivétel csak egy van : a 0,1 milligrammos hibahatár alatt még nem kell eljárástól tartani .	eljárástól	13	Abl
Igen , a hely szelleme felkavar , az ősi történelem erőt ad , ha a Kemenes vidékére érkezem , a történelem jelene-múltja oly mélyen él a falakban .	falakban	26	Ine
A 2016-os Bramac-Construma kutatás szerint a laikus építtetők legkevésbé az alapozáson ( 89% ) , a vízszigetelésen ( 88% ) , és a hőszigetelésen spórolnának házépítéskor .	alapozáson	10	Sup
A konferencián döntés született arról , hogy a Demokráciák Közösségének elnöki teendőit az elkövetkező két évben az Amerikai Egyesült Államok tölti be .	teendőit	11	Acc
Az idézett részek a buddhizmus alapvető és fatális félreértéséről , és nem ismeréséről tanúskodnak .	félreértéséről	8	Del
A Magyar Mezőgazdasági Múzeum körtermében látható kiállításon a helyi mesterek ízelítőt adnak az immár tízéves hagyományra visszatekintő , rácalmási tökfesztivál hangulatából .	körtermében	4	Ine
Volt idő , amikor nagyon tudtam volna lelkesedni ezért a lemezért .	lemezért	10	Cau
A Felhasználó felelős az adatai frissítéséért , valamint köteles a Szolgáltatónak bejelenteni , ha tudomására jutott , hogy az adataival harmadik fél visszaélt .	frissítéséért	5	Cau
Férfiaknak ajánljuk a szexshop következő termékeit Anális szex férfiaknak -Van két nagyon érzékeny pont a férfi végbélnyílásának környékén .	Férfiaknak	0	Dat
-Akkor csomagoljak?-ugrik fel a tuskóról -Lehet , én is haza megyek csomagolni !- áll fel Tomi is .	-Akkor	0	Tem
A passzív szoláris rendszerek7 tudatos alkalmazása nem csak energetikai kérdés , de építésetikai is .	rendszerek7	3	Nom
Hiteles magyar fordítást készít az Országos Fordító és Fordításhitelesítő Iroda ( a továbbiakban OFFI , Budapest VI. Bajza u. 52. ) , valamint külföldön a magyar külképviselet konzulátusa .	fordítást	2	Acc
Az evo-csoportnak nyújtott szolgáltatások is egyre kisebb részét adják a bevételeknek , korábban a harmadát , idén csak az ötödét – pedig ebben az évben már a csoport marketingtevékenységéért , arculatáért is ők felelnek Bodnár Balázs elmondása alapján .	arculatáért	30	Cau
Több alvállalkozóval állunk kapcsolatban ezért nagyobb volumenű megrendeléseket is tudunk teljesíteni 1 Tonnától-20 Tonnáig .	Tonnáig	13	Ter
AZ Alkonyattól Pirkadatig c.filmet miért nem ( vagy akár melyik másik filmről is lehet szó ) lehet le ellenőrizni sok szorítás előtt ???	Pirkadatig	2	Ter
Ennek az oka az , hogy a SuperWeb LLC nem vállal felelősséget a szponzorált harmadik felek által megjelenített hirdetések , kérdőívek és promóciók okozta problémákért .	problémákért	24	Cau
Kitért arra is , hogy a tanév hosszának növelésekor sok egyéb mellett a költségvetési vonzatokat is figyelembe kell venni , ezért is megfontolandó dolog .	növelésekor	8	Tem
A sor elejére 3 LSZ sormagasítás , a végén pedig 1ERP került.18 centi magasságig így horgoltam a hátát , ez után alakítottam ki a karkivágást , ami a sor elején és végén két-két mintaegység kihagyását jelenti .	magasságig	13	Ter
Az akupresszúrának és a masszázsnak egy speciális kombinációja , de megtalálhatóak benne a jóga bizonyos elemei is .	masszázsnak	4	Dat
Egyrészt a vizsga megszervezéséért és a technikai lebonyolításáért .	megszervezéséért	3	Cau
Élvezd mindkét generáció játékait egyetlen konzolról , legyen szó digitális vagy lemezen kiadott változatról .	konzolról	5	Del
A reggeli szolgálatba álláskor a hét bázison lévő személyzet leellenőrzi a gépet és az egészségügyi felszerelést , majd bejelentkeznek a légi koordinátornak .	álláskor	3	Tem
Najmányi László előadása pályája állomásairól , kutatási irányairól , utazásairól , jelenlegi munkájáról , a változás művészetéről.2006. április 5. 10 óra - Magyar ...	állomásairól	4	Del
Ítéletben mondta ki ma a Szegedi Törvényszék , hogy leírhatjuk : csaltak a szegedi HÖK-választáson .	Ítéletben	0	Ine
megalkotja a Társaság törvényes működéséhez szükséges szabályzatokat , gondoskodik azok betartásáról és betartatásáról , a jogszabályváltozásokra figyelemmel azok aktualizálásáról	jogszabályváltozásokra	15	Sub
Az ő várából kel ki minden átok ezen a világon .	várából	2	Ela
Ki az akit mocskolnak teli torokból manapság ?	torokból	5	Ela
Az alapszolgáltatásért felelős termékmenedzser , Kevin Weil mellett a médiakapcsolatokért felelős vezető , Katie Jacobs Shanton , a fejlesztésért felelős alelnök , Alex Roetter , valamint a Vine minivideós szolgáltatást igazgató Jason Toff egyaránt a lelépés mellett döntött .	médiakapcsolatokért	9	Cau
A Samsung egy újabb mérföldkőhöz érkezett , ugyanis a vállalat műhelyében elkészült egy következő generációs , 10 nm-es osztályú gyártástechnológiára támaszkodó , 64 GB-os adattároló kapacitást kínáló eMMC memóriachip , amely elsősorban mobil eszközökben kap majd helyet .	eszközökben	33	Ine
Az ügyészség a vizsgálat elrendelésekor közölte , hogy formailag egy új , önálló eljárásról van szó .	elrendelésekor	4	Tem
A héten a szocialista párt vezetése megnevezi , kire gondolnak Mádl Ferenc utódaként .	utódaként	12	Ess
A két napos tréning cég specifikus elemekre épül , mely során , a tréningen résztvevő igazgatóval és osztályvezetővel előzetesen egyeztetett illetve a résztvevők által gyűjtött aktuális munkatársi szituációkat dolgoznak fel helyzetgyakorlatokban .	igazgatóval	15	Ins
A krónikához tartozik , hogy Iker Casillas egy ütközés után megsérült , 15 perc után le is kellett cserélni , Diego Lopez pedig kiválóan szállt be a meccsbe , így vélhetően a BL-ben is megkapja a bizalmat Carlo Ancelottitól .	meccsbe	27	Ill
Egy kis segítség azoknak , akik az átlagember irányából közelítették meg a sportot és túrázáshoz szeretnének kutyát vállalni .	túrázáshoz	14	All
@ Scheibe : nem kell a bloggolónak ügyeskednie , és minden egyes pasiért harcolnia , nem erről szól a világ .	pasiért	12	Cau
Az egész öröm ünnep zavarba ejtően hasonlatos egy esküvőhöz ...	esküvőhöz	8	All
Az 1526. augusztus 29-én bekövetkezett mohácsi tragédia utáni időszak , ahogy az egész országra , úgy Buda büszke városára is szenvedést és romlást hozott .	városára	18	Sub
A jóleső kompromisszumok megtalálása , egymás örömének keresése , együtt tevékenykedés az otthonban az otthonért , az öröm közös élménye és értékelése , ettől lesz meleggé a hely , ami otthonná nemesül .	otthonná	30	Tra
Molnár Kálmán 1957–1961 között a Képző- és Iparművészeti Szakközépiskola diákjaként , majd 1963–1967 között a Képzőművészeti Főiskola hallgatójaként folytatta tanulmányait .	diákjaként	9	Ess
Ilyen meggondolásból rendkívül értékes az a vállalkozás , hogy a római Santa Cecilia akadémia együttesei , Antonio Pappano vezényletével , felvételt készítettek Bernstein három szimfóniájából , valamint a Prelude , Fugue and Riffs című jazz-hommage darabból .	vezényletével	18	Ins
A puha , krémesen édesre sült fokhagyma gerezdeket , nyomjuk ki a héjukból , és a húsra kenhetjük , vagy a tepsiben keletkezett szafttal elkeverve , rendkívül finom szószt készíthetünk a húshoz .	tepsiben	21	Ine
4 van de 5 door msalexandrak Rendben van teljesen !	door	4	Tem
- Bizony dönteni kellett , hogy a hosszú távollét után újra munkába állok -e műsorvezetőként .	műsorvezetőként	14	Ess
Általában párban élnek , egészen akisebb csapatokig .	csapatokig	6	Ter
3 an elérhető 1. feladat 20 pont Gyermeke középiskolájában arra kérik Önt , hogy meghívott előadóként tartson előadást a tanulóknak a bőrsérülések következményeiként is gyakran megjelenő helyi gyulladásokról , és azok ellátásáról .	következményeiként	22	Ess
b) általa megtermelt alaptermékből előállított élelmiszerrel közvetlenül a végső fogyasztót , illetve a régión belüli kiskereskedelmi vagy vendéglátó létesítményt látja el ,	alaptermékből	3	Ela
Olvasónk mellékelte adatait , amelyeken az látható , hogy egy hónapos különbséggel kétszer is szerepel a taj számánál a „ hüvelyi szülés patológiás terhesség után epidurális érzéstelenítéssel ” nevű tétel .	számánál	17	Ade
Péter Gábor volt az Államvédelmi Hatóság ( ÁVH ) teljhatalmú vezetője , amely a sok kegyetlenségért , brutalitásért és a politikai tisztogatások végrehajtásáért volt felelős .	brutalitásért	17	Cau
A színes viaszlapból hajtottunk gyertyát .	viaszlapból	2	Ela
Dunántúli barangolásaink során Magyarország legfontosabb történelmi városain keresztül utazunk , dimbes-dombos hegyeken és völgyeken át a sík puszták irányába .	völgyeken	13	Sup
A Sicontact Kft. szakértői szerint a felhasználó böngészőjében elhelyezett , kimondottan bányászásra írt JavaScript kód használata speciális eset , de a torrentoldalon kívül máshol is történt mostanában hasonló .	torrentoldalon	21	Sup
A készülék a Samsung kiemelkedő technológiájára és magas követelményeire épül , így minőségi	technológiájára	5	Sub
Tarantino új westernje nemcsak az amerikai bevételi listát domináló Az ébredő Erővel , de a Megjött Apuci című komédiával szemben is elvérzett .	Erővel	11	Ins
Figyelmetekbe ajánlanánk a szervezésünk alatt álló képzést amelyen Aleksander Makarov fog közös órát tartani október 3-án 17:30-tól 19:00-ig .	Figyelmetekbe	0	Ill
Ez a párna nagyrészben elnyeli az ilyen jellegű nyomásokat.Szükség esetén 2 pontos biztonsági övhöz is használható , de ebben az esetben nem fejti ki a teljes erőelnyelő hatást.A párna mostható .	övhöz	13	All
Megújult a kerítés , a hátsó udvar pedig 2500 m2-en szilárd burkolatot kapott a kommunális gépek tárolására .	burkolatot	11	Acc
A cikkből a ma már megismerhetővé vált tényekből , dokumentumokból sokat tudhatunk meg arról az időszakról , amely az űrhajózás hőskorának egyik legtanulságosabb fejezetévé vált .	fejezetévé	23	Tra
Az Arvisura megismerése óta mindenki számára nyilvánvalóvá vált , hogy Kárpátalja valamennyi őslakosa ugyanattól a csodálatos ikerpár-lénytől származik , a farkánál fogva összenőtt ruszin és magyar Csupakabrától , amelyet ma totemállatként tisztelnek Kárpátalján .	totemállatként	30	Ess
A szívekben ott van az engedelmesség vágya és a lábak , kezek megfeszült mozdulatlansága , a testtartás egyaránt kifejezi a várakozó tettrekészséget .	szívekben	1	Ine
A honlapunk egyszerű megtekintésekor , böngészésekor személyes adatokat nem kezelünk .	böngészésekor	5	Tem
• Amennyiben a pályázó képviselője útján nyújtja be vételi ajánlatát , teljes bizonyító erejű ( két tanúval ellátott ) magánokiratba , vagy közokiratba foglalt meghatalmazást köteles csatolni .	magánokiratba	19	Ill
14. Amikor kijelentjük a vallásszabadság nagy értékét , hálát adunk Istennek , hogy korábban nem látott mértékben megújul most a keresztény hit Oroszországban és Kelet-Európa sok országában , ahol ateista rezsim uralkodott évtizedeken át .	évtizedeken	32	Sup
Visszatesszük a tűzre , felmelegítjük forrásig , és berántjuk .	forrásig	5	Ter
Ha engem kérdeznek , szerintem bizony a huszonegyedik századi Éva nem almát szedne le arról a bizonyos fáról , hanem minimum egy doboz bonbon lenne a ludas minden bűnért és bűntudatért , ami manapság a női nemet sújtja .	bűntudatért	30	Cau
Amikor a római légiók visszavonultak Észak-Európából otthagyták a kutyáikat , és ezek az erős kutyák hasznossá váltak .	Észak-Európából	5	Ela
Nem csak azért , mert messzebbre került Párizsig emigrált sorstársainál .	sorstársainál	9	Ade
Taróczy a Tennis Classics főszervezőjeként köszönetet mondott a három “ fiatalembernek ” , hogy elfogadták a meghívást , és újra együtt lehettek .	főszervezőjeként	4	Ess
Az adatok feldolgozói minden jelölést megszámoltak , és a végeredményről az itt látható kördiagramot készítették. c) Számítsa ki , hogy az egyes sorozatok nézettségére hány jelölés érkezett !	nézettségére	23	Sub
Az oldalon az általam próbált , és ajánlani is mert terápiás módszereket , szakembereket , intézményeket mutatom be egy-egy posztban , blog bejegyzésben , a szellem és a lélek változásáért .	változásáért	29	Cau
Szekvenciális szűrést csak abban az esetben tudunk végezni , ha a kombinált teszt is a centrumunkban történt .	szűrést	1	Acc
Kínában nem csupán fogyasztásra , de szépségápolásra is használják a zöld teát .	szépségápolásra	6	Sub
Sokat tehetünk az egészségünkért , ha a vörös húsok helyett a fehér húsokat ( szárnyasokat , halakat ) részesítjük előnyben .	egészségünkért	3	Cau
Ne tegye ujját a vaku elé a vaku elsütésekor .	elsütésekor	8	Tem
A páncél a kapcsolódó részeknél vékony és puha , így a homár be tudja hajlítani őket és ezáltal képes mozogni .	részeknél	4	Ade
A jelen ÁSZF I. pontjában írtakkal összhangban , a Molnár Dekor és a Felhasználó között csak abban az esetben jön létre szerződés a termékek megvásárlására vonatkozóan , ha kiszállításkor a Felhasználó elfogadja , azaz átveszi a terméket .	kiszállításkor	28	Tem
Ezért ne ostorozd magad , ha valami ? negatívval ? találkozol ? azt a rezgést te kérted , a te lelki-szellemi táplálékod , hogy erősítsen .	negatívval	8	Ins
Csinálom ! ” projekt keretében az ELTE Bárczi Gusztáv Gyógypedagógiai Karon jelen voltunk a Nyitóelőadáson és a Felkészítő tréningen .	Nyitóelőadáson	14	Sup
Nyugodt szívvel állíthatjuk : túlságosan nem sok , tán a legfontosabb : büntetett előéletű ember nem vehet részt ilyen mulatságban .	mulatságban	19	Ine
A hajszárító ionos generátorral van ellátva , mely negatív ionokat bocsájt ki hajszárítás közben , ezzel megszabadítja a hajat a statikus elektromosságtól .	elektromosságtól	21	Abl
Hamarosan Koltai Lajos amerikai debütálásában , az Este c. nagyívű drámában bukkan fel .	drámában	10	Ine
Semmilyen párthoz , csapathoz nem ragaszkodott sohasem , a cél a bármi áron való előrejutás volt eddigi életében .	párthoz	1	All
Emellett a gyáriak szerint elődjénél kulturáltabb is : alacsonyabb zajszintre és kevesebb vibrációra számíthatunk az új technikák alkalmazásának köszönhetően .	elődjénél	4	Ade
Sajtóértesülések szerint Murphy a barátja és alkotótársa iránti szolidaritásból lépett vissza a szereptől .	szereptől	12	Abl
26. A gyermek 3 éves koráig *, ikergyermekek esetén a tankötelessé válás évének (1)- ( 2) bek. végéig , tartósan beteg vagy fogyatékos gyermek után a gyermek 10 éves koráig vehető igénybe ( Cst .	tankötelessé	10	Tra
Olyan funkciókért és szolgáltatásokért fizetsz , amikre nincs is szükséged .	szolgáltatásokért	3	Cau
Alkoholmámor és drogos utazások kísérik éveiket , aztán a végén rádöbbennek , hogy elfogyott mindenük .	éveiket	5	Acc
Persze a kutyáknak jogaik vannak és az állatoknak , hisz azokat szereti a Kárpátok Törpe Géniusza !	Géniusza	15	Nom
Az előadásmód kidolgozására a kezdetektől ügyelni kell , de a már tudott beszéd gyakorlásakor ezt is meg kell tervezni : a ruházatot , a kellékek használatát , a bevonulást , akiállást , a körültekintést , a gesztusokat .	gyakorlásakor	13	Tem
985 g/kg A. RÉSZ Csak gombaölő szerként engedélyezhető a következő növényekhez : üvegházi uborka ( zárt hidropóniás rendszer ) , szilva ( feldolgozásra ) , legfeljebb a következő mértékben : 0,75 kg .	szerként	6	Ess
Téli szállásként kizárólag faodúkat használ .	szállásként	1	Ess
Tamási Áron nr .	nr	2	Tem
A Bárány Attila , Laszlovszky József , Papp Zsuzsanna szerzők által megjelentetett Angol-magyar kapcsolatok a középkorban c. munka az Angolszász hercegek a 11. századi Magyarországon c. fejezetében a következőképp ismerteti az eseményeket :	következőképp	28	Ess
A változatos szövegelemző eljárások önálló használata biztosítja a művek gondolati , erkölcsi , esztétikai jellemzőinek egyre teljesebb megértését , a fejlett kifejezőképesség pedig a következtetések szabatos , az egyéni véleményt , élményt is kifejező bemutatását .	megértését	17	Acc
Egy nagyon szegény kislányt játszottam benne , aki Detroit egyik rossz negyedében él , és az a vágya , hogy szörfözhessen .	negyedében	11	Ine
