Nem csupán rezonőrként jelentek meg a darabban , hanem élő és fontos szereplőkké léptek elő és kimagaslóan énekeltek ők is .	szereplőkké	12	Tra
A cseh k o r m á n y válsága azonban n e m ezt a képet közvetítette a világ felé , ami t o v á b b ront a régió megítélésén .	válsága	9	Nom
Felséged megérti , hogy a betegségemből való felépülés után februárban kezdtem újra dolgozni , s alig tudok eleget tenni valamennyi kötelezettségemnek .	kötelezettségemnek	20	Dat
Azoknak , akik szeretik Orbán Viktort , és hisznek a kormányfőnek , nekik ez egy ünnep , Magyarország megújulásának napja .	kormányfőnek	10	Dat
Szinte szétolvad a szánkban , olyan isteni , vagy mintha édes felhőbe haraptam volna .	szánkban	3	Ine
Az első lehetőség , hogy ezt a ízletes krémlevest egészségbaráttá , azaz olyanná tegyük , hogy a sulphoraphane csodás hatása érvényesülhessen tegyük a következőket :	krémlevest	8	Acc
Katonai szolgálatról , hadifogságról 2.7 .	hadifogságról	3	Del
A kézművesség is csöndes elmélyülésre adott lehetőséget , festettek selymet , dobozból készítettek mécsestartót , batikolással színes pólót .	dobozból	11	Ela
További adalék , hogy pár napja jelent meg egy olyan kérdőív is a portálon , amelyben olyan kérdéseket pedzegettek , hogy az olvasók hajlandóak lennek e a jövőben fizetni az index olvasásáért .	olvasásáért	31	Cau
A Manchester United vezetői már két-három hónapja felvették a kapcsolatot a Wigannel , és az angol sajtóban biztosra vették , hogy a következő szezontól a MU játékosa lesz az ecuadori játékos , aki 34-szer szerepelt már hazája válogatottjában .	szezontól	23	Abl
A tanszék munkatársai az e körben végzett kutatómunkájukról számoltak be , amelyben egyrészt a büntetőjog tantárgy oktatását hasonlították össze a honi jogászképzéssel , illetve az oktatás újabb lehetőségeit ismertették .	kutatómunkájukról	7	Del
( Olvashatóbb , ha kattintasz a táblázatra ! )	táblázatra	6	Sub
A gazdag nem éhezik , nem nélkülözik , és relatíve több szabadsággal rendelkezik a szegényhez képest .	szabadsággal	11	Ins
A 253 méteres szintkülönbséget szinte egy lendülettel , egy meredek szerpentin formájában győzzük le .	szerpentin	10	Nom
A magyar-szerb határszakaszon épülő kerítéssel kapcsolatban az államtitkár úgy fogalmazott :	kerítéssel	4	Ins
Persze egy jó mozi , szinház is mindig jó ötletnek számit .	ötletnek	9	Dat
1989 után oktatott , illetve részt vett a politológia-oktatás megszervezésében a Budapesti Közgazdasági Egyetemen , a Miskolci Egyetemen , a győri Széchenyi István Egyetemen , 2002 óta részfoglalkozású egyetemi tanárként oktat a Berzsenyi Dániel Tanárképző Főiskola Európa Tanulmányok Intézetében .	tanárként	29	Ess
Beltéri mászóterem a sziklamászás egyik speciális formájához a boulderezéshez .	boulderezéshez	8	All
Ezeknél az irodai székeknél feltételezhető a személyek cserélődése - tipikus példát jelentenek az ellenőrző állomások , védőszolgálatok , rendőrség , stb. székei .	székeknél	3	Ade
MAGAS MINŐSÉGŰ ÉS A JÖVŐ ELŐTT JÁRÓ AUTÓIPARI GYÁRTÓ VÁLLALAT RÉSZÉRE KERESÜNK AGILIS MÉRNÖKÖT A KÖVETKEZŐ POZÍCIÓBA Pozíció leírása Siemens S7 rendszerek programozása új készülékeknél ...	készülékeknél	24	Ade
Ráadásul akkor még a zajterhelésről nem is ejtettünk szót , amely ugyancsak az álló helyzetben lévő autó motorjának leállításával csökkenthető jelentősebben például a nagyvárosok zsúfolt forgatagában .	zajterhelésről	4	Del
Az első erős támadás a Liszt Ferenc térnél , a Rendszerváltó Fórum rendezvényének helyszínén érte a felvonulókat .	térnél	7	Ade
En rad szavazok indulj a valasztasokon ! mar ugyis itt voot az ideje a totalis anarchianak !	valasztasokon	5	Sup
Májusban kerül sor a BÁV jubileumi , hatvanadik művészeti aukciójára , amelynek legszebb tételeivel vetítéssel egybekötött előadáson ismerkedhetünk a Falk Art Fórum délutánján .	délutánján	22	Sup
Emberünk debütálásként egy igen erős , …	debütálásként	1	Ess
Felkapta hátizsákját és küszködve kimászott a bozótosból a földútra .	földútra	8	Sub
Szerinte a gazdasági válság politikai-társadalmi válsággá alakult , de Kína összeomlása most is mindent magával ránthat , a gazdaság ugyanis ma globalizáltabb , mint valaha .	válsággá	5	Tra
A feltehetően viadalokon elvadított állatok veszélyesek a fajtársaikra , ezért külön ketrecekben kell őket tartani , ám a kutyatelep így is helyhiánnyal küzd .	viadalokon	2	Sup
Bár nem tudunk mindenki számára külön stílusszakértőt biztosítani , néhány profi tanácsot adhatunk arra az esetre , ha úgy szeretnénk shoppingolni , mint egy stylist !	stílusszakértőt	6	Acc
Fiatal önkénteseink előtt akik tiszta lélekkel és szándékkal járultak hozzá a rendezvény sikeréhez restellem , hogy a politika ilyen csúnyán belerondított a munkájukba .	munkájukba	22	Ill
Itt ugyanis egy meglehetősen népszerű intézkedésről van szó , amely mellett gyülekeznek az állampolgári aláírások is .	intézkedésről	5	Del
Maga a színpadkép engem az industrial zenében utazó Vatafaka együttesre emlékeztetett , a közös pont pedig a felállított vasállvány , illetve az arra rögzített lógó fémtárgyak voltak , melyeken Márton folyamatosan ütötte a ritmust .	együttesre	9	Sub
Gyakran rengeteg teendője miatt csak zárásra érne oda a bevásárlóközpontokba , de az interneten a shopokat minidig nyitva találja .	minidig	16	Ter
A számítást minden forrás-csoportra külön kell elvégezni és ábrázolni .	forrás-csoportra	3	Sub
Igaz , a vászontáskáért még egy eurót kell fizetni .	vászontáskáért	3	Cau
Már nem is lehet követni , hogy hányadik verziónál , hányadik határidőnél , hányadik visszavont – de majd lesz – de mégse – de talán mégis – nem , mégsem – engedélyeztetési bohóckodásnál tartunk .	verziónál	8	Ade
Szimonidesz Hajnalka a mese , vagy az élet esszenciáján vezeti végig képeinek nézőit , így művei a szó jó értelmében véve nemcsak gyönyörködtetnek , hanem bevezetnek minket egy belső , lelki világba ... "	esszenciáján	8	Sup
A diszkriminatív főszerkesztőtől hallottuk még stúdiós korunkban , hogy nagyon picinek érzi magát az ember , amikor egy hatalmas könyvtárteremben látja megbújni vékonyka kötetét. " ...	főszerkesztőtől	2	Abl
2013 januárjáig meghosszabbította az új polgári törvénykönyv előkészítését koordináló Székely László miniszteri biztos megbízatását Navracsics Tibor közigazgatási és igazságügyi miniszter .	januárjáig	1	Ter
A gravírozott gyűrűk így teljesen más értelmet nyernek , és egy nagyon személyes kiegészítővé válnak , amely a maga módján egy bizonyos célt teljesítenek .	kiegészítővé	13	Tra
Az eddig leírtakból kitűnik , hogy a tönkölylisztből készült tésztának kimagasló az élettani hatása .	tönkölylisztből	7	Ela
Az étteremből gyönyörű kilátás nyílik a helyi horgásztóra , valamint a megyében egyedülálló 1HA-os vadasparkra .	étteremből	1	Ela
Nekem ugyan annyira ez nem számít ( nem veszek az iPhone 5s-nél nagyobb telefont ) , de azért különös lesz , ha tényleg nem frissítik a korábban ergonómiai szempontok alapján méretarányaiban tökéletesnek ítélt iPhone-sorozatot .	5s-nél	11	Ade
A viszonylag kevés archív fotóról csak néhány következtetést lehetett levonni .	fotóról	4	Del
Szőlőszemekből készült kivonattal elpusztíthatóak a leukémiasejtek , állítják amerikai kutatók , akik a sejttenyészetben végzett vizsgálatok eredményeit a Clinical Cancer Reports szakfolyóiratban publikálták .	Szőlőszemekből	0	Ela
Fejben már elkezdtem összeszedni egy listát azokról a dolgokról , hogy hogyan lehet magadat lábon lőni kotlinban egész könnyen .	Fejben	0	Ine
Burkolatok , nyílászárók és új konyhabútor is került a házba az új bútorozáson kívül .	bútorozáson	12	Sup
A Kormányzati Ellenőrzési Hivatalnál is nekibuzdulást észlelt az államtitkárság , de onnan megintcsak „ adatvédelmi okokra ” való hivatkozással végül nem adtak ki információt számukra .	Hivatalnál	3	Ade
Kaotikus rendszertelenséggé , amelyből négy ajtó vezet ki : minden családtag számára egy .	rendszertelenséggé	1	Tra
A pályázó köteles a tevékenységi körre , üzleti elképzeléseire és az általa megajánlott bérleti díjra és óvadékra vonatkozóan nyilatkozni a pályázatában .	elképzeléseire	8	Sub
A hőskornak is nevezhető időszak most egyik főszereplőjének személyes történetéből rajzolódik elénk .	hőskornak	1	Dat
A kártevőirtás végén a rovar- és kártevőirtásról mindenre kiterjedő dokumentációt készítünk ( kártevő mentesítési tervet ) a hatóság előírása szerint .	kártevőirtásról	6	Del
A büdzséből áldozni kell erre , máskülönben elveszítjük a lehívható pénzeket – hangsúlyozza az NFÜ elnöke , aki azt is bejelentette , hogy felállítanak egy projektfelügyeleti rendszert .	büdzséből	1	Ela
Nyelvtanára iránti lelkesedésből készítene -e műfordítást szőkeföldi versről ?	lelkesedésből	2	Ela
Három évvel ezelőtt a 2–5-ös uborkáért 175 , a 3–6-osért 115 , az 5–8-asért 60 , a 6–9-esért 40 , a 9–12-esért 17 , míg a 12–14-esért 10 forintot adtak kilónként .	12–14-esért	26	Cau
A vaddisznó , hogy ha rohan , Nem üget , de csörtet - és Bár alakra majdnem olyan Miért más a törtetés ?	alakra	15	Sub
A hitelt az ügyintézéstől és a pozitív hitelbírálattól számítva néhány napon , pontosan maximum öt , minimum három napon belül utalják is a számlára .	hitelbírálattól	7	Abl
...amivel a szekunder tekercsben nagyfeszültséget indukál , amit az egyes hengerek gyújtógyertyáihoz oszt le , miközben a motor fordulatszámának függvényében szabályozza az előgyújtás pillanatát .	gyújtógyertyáihoz	11	All
Ősszel napról napra , hétről hétre , látástól vakulásig dolgoztál , alig léptél ki a konyhából .	vakulásig	8	Ter
Íme az akkori betűsablonok ( 1923-ból ):	betűsablonok	3	Nom
Ezért maradt a szociológia területén , ahol segédmunkatársként kezdett , és 16 év alatt egészen a tudományos osztályvezetőségig jutott .	osztályvezetőségig	17	Ter
A tanszékvezető egyetemi tanár úgy fogalmazott , ha a jogsértések tömegére , az emberi szenvedés változatos formáira gondolunk – a hátrányos megkülönböztetés hétköznapi példáitól kezdve a terrorcselekményeken keresztül a népirtásig -, beláthatjuk : az egyéni jogok érvényesítése folyamatos küzdelem .	példáitól	23	Abl
Ezáltal sem műemléki , illetve egyéb építési megkötések nem korlátozták az új létesítmény kialakítását , sem raktározási gondokkal nem kellett számolni .	gondokkal	17	Ins
Segít megnyugtatni , kiegyensúlyozni , a helyes úton maradni , és energiáink összpontosításában .	összpontosításában	12	Ine
Ha pedig szeretné más kiváló márkák hasonló ajánlatait is tanulmányozni , válogasson a zooplus -on a top-márkák termékei között !	ajánlatait	7	Acc
Nemcsak az uniós tagság következménye tehát , hogy átvettük a közösségi szabályozást , és a gyártók felelősségévé tettük a biztonságos élelmiszerek forgalmazását , hanem az ésszerűségé is .	felelősségévé	16	Tra
A 26 éves lány arra is felhívta a figyelmet , hogy a Spinraza támogatásán túl az egészségbiztosítási alapnak sok dolga lenne az izomsorvadásos betegek alapvető ellátásának javításán .	javításán	26	Sup
És ez az , ami szimbolikusan utal arra a pontra , ahol a társadalmi funkciók „ harmóniája átfordul ellentétté és rivalizálássá ” ( 13. o. ) , hogy később visszafordíthatatlanul bomlásnak induljon .	rivalizálássá	20	Tra
A szülők kifütyülték a kormányhivatal képviselőjét és az egyház szóvivőjét is , és követelték a kérelem visszavonását , de az egyház nem volt ilyen engedékeny .	képviselőjét	5	Acc
Az MKB arról számolt be , hogy nagyságrendileg tíz százalékkal többen érdeklődnek a csokról , az OTP pedig annyit tett hozzá , hogy az élénkülést április második hetétől érzékelik .	hetétől	27	Abl
Ezeket a felszereléseket országúton , autóvontatással szállítjuk a következő állomáshelyre .	állomáshelyre	9	Sub
Schulz azt hangoztatta , hogy Németországnak fel kell ismernie , hogy a „ sokszínűségből csak profitálhat ” .	sokszínűségből	13	Ela
Két éve vagyok az étterem tulajdonosa , előtte pedig társtulajdonosként dolgoztam itt .	társtulajdonosként	9	Ess
Dombnak le , a Kálváriánál és lentebb , a Mészégető után , a pilisborosjenői elágazásnál rendesen lehet haladni , „ csak ” arra kellett ügyelni , hogy a vizes , nyálkás úton meg ne csússzon az ember .	Dombnak	0	Dat
António Guterres ENSZ-főtitkár szerdán közölte a közgyűléssel , hogy a volt chilei államfőt jelöli a tisztségre .	tisztségre	15	Sub
Csillapítatlan és csillapított rezgések [ S4_F ] A csillapítás nélküli egy-szabadságfokú tömeg-rugó rendszer rezgéseivel ellentétben a valóságos rendszerekben mindig jelen van a csillapítás ( súrlódás , légellenállás , stb. ) .	rezgéseivel	13	Ins
Ennek ellentmond , hogy korábban a porcelánmanufaktúra pénzt követelt a névhasználatért a város kulturális intézményeket fenntartó cégétől , a Zsolnay Örökségkezelő Nonprofit Kft-től .	névhasználatért	10	Cau
Az utakat jól ábrázolja az OMP hiking map és az OpenStreetMap is , de ez csak az út megtervezéséhez , az elágazások beazonosításában segít .	megtervezéséhez	18	All
Nem választható könyvvizsgálóvá az Igazgatóság , a Felügyelı Bizottság tagja és ezek közeli hozzátartozója ( Ptk ( b) élettársa ) , valamint a Társaság dolgozója , e minısége megszőnésétıl számított három ( 3) évig .	hozzátartozója	13	Nom
Nagy Anikó , a Heim Pál Gyermekkórház főigazgatója az M1-nek azt mondta : jelenleg három gyereket kezelnek hörgőgyulladással .	hörgőgyulladással	17	Ins
Íz : Mérsékelt pörkölt , gabonás érdesség , opcionálisan enyhétől mérsékelt ecetes savanyúsággal és közepestől magas komlókeserűséggel .	közepestől	14	Abl
És milyen volumennél érdemes egy saját gépbe beruházni ?	volumennél	2	Ade
Legegyszerűbb választásnak a citrom illóolaja mutatkozik , mivel friss illata a tisztaság szimbólumának is tekinthető , de ez valóban egyéni ízlés kérdése .	szimbólumának	12	Dat
Minden nyaraláskor és kiránduláskor több száz fényképet készítesz ?	kiránduláskor	3	Tem
A kukorica gyomirtásakor általában igen vegyes gyomflórát kell kezelnünk , sok esetben megtűzdelve hol több , hol kevesebb évelő fajjal is .	gyomirtásakor	2	Tem
A ma már RIDE néven készülő alumíniumkötések piacvezetőkké váltak , és folyamatosan díjakat szereznek mint a legkönnyebb , a legtartósabb és a legreszponzívabb ( visszacsatolás-kontrollálhatóság ) kötések .	piacvezetőkké	7	Tra
A nettó adó befizetésekből ( C) és juttatásokból ( B) tevődik össze .	juttatásokból	7	Ela
Ebből pedig nem feltétlenül következik az , hogy effektív évtöbblettel kellene számolnunk időszalagunkon !	időszalagunkon	12	Sup
Igaz ez lehetett volna máskép is " - írta emailjében Ádám nevű olvasónk , megnéztük hát , mekkora is a " méhinvázió " .	méhinvázió	21	Nom
Az újításuk abban állt , hogy egy izzót használtak hőmérsékletfüggő ( PTK ) ellenállásként az amplitúdó stabilizáló áramkörben .	ellenállásként	13	Ess
16 esetben reflux , 25 esetben hiatus hernia , 23 betegnél a kettõ együtt képezte a mûtéti indikációt .	kettõ	12	Ins
A szüleim olykor , amikor kevésbé lőttek , napközben is fölmentek percekre a lakásunkba .	lakásunkba	13	Ill
Az pedig akár még igaz is lehet , hogy a vizsgázó gyerekek miatt történt az egész , de ebben az esetben nem irigyeljük szegényeket , hogy már ilyen kora reggel ( 5 órakor ) a számonkérésen kell lenniük .	számonkérésen	35	Sup
Sokszínűségével , és egyedi hangulata illetve remek fellépő listája miatt évről évre rengetegen látogatnak ki .	Sokszínűségével	0	Ins
A válogatott stábjában Marco Rossi másodedzőjeként dolgozó olasz szakember mesélt arról , milyen stílus illik a magyar csapathoz , hogy van -e esélyünk kijutni az Eb-re , és hogy a kapitány melyik tulajdonsága viheti előre leginkább a válogatottat .	másodedzőjeként	5	Ess
A lábam mocskosul égett , és minden porcikám tiltakozott bármilyen mozdulat ellen .	mocskosul	2	Ess
Beállítások/Rendszer képernyőnél kell a MENU gombot nyomni , majd itt az ENTERrel a Szoftver verzióba lépve a GPS sw. verzió alatt találod az s illetve m végződést .	képernyőnél	1	Ade
A kikötőből a sziget egyetlen aszfaltozott útja vezet fel Capraira városkába , de mi ezt kikerülve a gyalogúton indultunk felfelé .	kikötőből	1	Ela
Táplálkozás – környezet – egészségügy – prevenció címmel tartott Miskolcon konferenciát az Egészséges Táplálkozásért Egyesület országjáró körútja egyik állomásán .	Táplálkozásért	13	Cau
Trócsányi László vitaindítójában hangsúlyozta : “ a bírói függetlenség állócsillag a magyar alkotmányosság és demokrácia egén ” , az alaptörvény egyértelműen rögzíti a bírák függetlenségét .	vitaindítójában	2	Ine
„ Franciaország az európai integrációs folyamat egyik meghatározó állama , fontos szereplő a világpolitikában és Magyarországon is jelentős gazdasági jelenléttel bír .	világpolitikában	13	Ine
Tehát , hogy ne csak Éva ugorjon be új szereplőként , hanem Latinovits is .	szereplőként	9	Ess
A város nem a puszta együttélés kedvéért , hanem az emberhez méltó élet céljából alapíttatott Arisztotelész Mi a jelentősége és értéke az emberhez méltó életben a társadalmi élet színteréül szolgáló utcáknak , tereknek ?	színteréül	28	Ess
66. § ( 6) bekezdése alapján a közbeszerzés azon részeiről , melynek teljesítéséhez alvállalkozót kíván igénybe venni , valamint meg kell neveznie az ajánlat benyújtásakor már ismert alvállalkozóit.5 .	benyújtásakor	24	Tem
Szabadtéri rendezvényeknél az időjárás nagyon számít , sajnos az öt napból három volt esős , de az igazi borkedvelők ennek ellenére is jelen voltak .	rendezvényeknél	1	Ade
Ez a nemzetközi szinten népszerű törekvés egyszerre szól a természetbe való elvonulásról , a környezettudatos gondolkodás előtérbe helyezéséről , az építkezésről mint közösségi élményről és nem utolsó sorban - minden romantikus felhangja mellett - a gazdasági racionalitásról is .	elvonulásról	11	Del
József szó nélkül ment vissza a rendőrautóhoz , András csak nézte a visszapillantóban .	rendőrautóhoz	6	All
Az iskolai foglalkozások során a gyerekek a papír előállítására fordított környezeti hatásokat is megismerhették , így jutottak el a szemétpostához , vagyis a postaládákba feleslegesen bedobott reklámújságokhoz .	reklámújságokhoz	26	All
A feketepiacon több tízmillió forintot ér az a kannabiszmennyiség , amelyet egy Zalaegerszeghez közeli hegyi ingatlannál találtak a rendőrök ; a termesztőket előzetes letartóztatásba helyezték – közölte a Zalaegerszegi Rendőrkapitányság vezetője hétfői sajtótájékoztatóján .	letartóztatásba	23	Ill
Táskákból sosem elég	Táskákból	0	Ela
Tudd meg , hogy Jézus a te bűneidet is felvitte a Keresztre , és a te számodra is elég az Ő Vére .	Keresztre	11	Sub
Valószínű hidegzuhanyként érte az atomenergia ellen küzdőket a német energiafordulat hatásairól szóló friss beszámoló .	hidegzuhanyként	1	Ess
Azt hittük , a szelektív hulladékgyűjtéssel sokat tehetünk a környezetért .	környezetért	9	Cau
Amikor a két idegenlégiós , Mincho és Ninho távozott a klubtól , és velük a vezetőedző Artur Melo is , a vezetőség számára elsődleges feladattá vált , hogy minőségi igazolásokkal pótolják a távozókat .	feladattá	24	Tra
“ Az , hogy a hűtés mértéke az alvás nyugalmával párhuzamos volt , azt bizonyítja , hogy az idegrendszer befolyásolásával az álmatlanság kezelhető .	befolyásolásával	19	Ins
Új bérbeadások esetében az önkormányzati határozat előírja a minimum bérleti díjat , a jelenlegi kedvező piaci környezet hatására 2015-ben és 2016-ban magasabb bérleti díjakon kelnek el a helyiségek ” – sorolta .	díjakon	23	Sup
Olvasóinknak ajánljuk az alábbi köteteket :	köteteket	4	Acc
Patkányirtás házilag- Átmeneti megoldás :	házilag-	1	Nom
34 Emlékház-életműkiállítás A kiállítás alapja a művésszé válás és a műveszetteremtés folyamatát rögzítő több mint 300 fotó , amely pillanatnyi voltuk egymásutániságában még élőbbé teszik a tárlat tárgyait .	művésszé	6	Tra
Illóolaja a légző szervrendszerben kiválasztódva fertőtlenítő , köptető és görcsoldó hatást fejt ki .	szervrendszerben	3	Ine
Steven Johnson képviselő FIATALOK KÜLDETÉSSEL ALAPÍTVÁNY Közhasznúsági jelentés	KÜLDETÉSSEL	4	Ins
Az apa nélkül felnőtt , magasan iskolázott fiatalembernek a birodalmukat irányító Wallenbergek – hatalmukat féltve – nem adtak állást .	birodalmukat	9	Acc
A Blick címlapja „ Gála Magyarország ellen ” címmel nyit , alatta pedig kiemelik , Svájc számára már csak egy pont kell a vébéhez .	vébéhez	23	All
Lőrinczy Attila nagyszabású Shakespeare parafrázisa összetett módon ábrázolja az ember esendőségét .	esendőségét	10	Acc
Anna csomagol , búcsúzik az ismerőseitől .	ismerőseitől	5	Abl
A zsűri ezúttal is tíz elismerést osztott ki , a nyertesek a díjon túl kétmillió forintos támogatásban részesülnek .	díjon	12	Sup
A résztvevők elsősorban a leendő elnök várható külpolitikájáról , gazdasági és biztonságpolitikai elképzeléseiről , valamint karakteréről értekeztek .	elképzeléseiről	12	Del
Mindenhol kihangsúlyoztam az AVM akcióit , kezdve Kocsis Máté irodafoglalástól a Csányi utcai lakásfoglaláson át az Üres Lakások Menetéig , az Alkotmány utcai demonstrációig , a Rákosmente Önkormányzatnál zajló tüntetésig és legutoljára a Tarlós István vezette közgyűlés megzavarásáig .	Önkormányzatnál	27	Ade
Minden termék adatlapon megtalálható a termék neve , leírása , ára , kiszerelése , egységára , az esetleges kedvezmény és fotó a termékről .	termékről	22	Del
A szállodai szoba az érkezés napján 14 órától áll a vendégek rendelkezésére , távozáskor a szobákat 10 óráig kell átadni .	távozáskor	13	Tem
A generál kivitelezéskor az építtető megbízza a kivitelezőt az építés vagy felújítással .	kivitelezéskor	2	Tem
A ritka kivételek egyike az aknatelepítés volt , a keskeny csatornákat csak 1500 lábra süllyedve találták el .	aknatelepítés	5	Nom
A legújabb fejlemény a feltaláló-mutyi , de korábban is volt már legalább hét olyan ügye , amikbe egy jogállamban belebukott volna .	jogállamban	18	Ine
Másodszor is előzetes letartóztatásba helyezte a bíróság a hatmilliárdos költségvetési csalással gyanúsított Czeglédy Csabát , a baloldal ügyvédjét , akinek egyszerű gazdasági bűnügyéből politikai ingyencirkuszt csinál a Gyurcsány Ferenc vezette baloldali ellenzék .	bűnügyéből	22	Ela
A bejgli eredetileg Szilézia vidékéről származik és ez a sziléziai kalácsfajta a 14. század óta ismert Európában .	kalácsfajta	10	Nom
A pályázatot pályázati adatlap formájában , 2 példányban , kérjük kitölteni és a mellékletekkel együtt , cégszerű aláírással ellátva a benyújtás határidejéig a GYEMSZI-ETI címére ( 1085 Budapest , Horánszky u. 15. ) megküldeni .	határidejéig	21	Ter
Egy olyan reklámvideó készült , amely szeretetre szólítja fel a muszlimokat a más felekezetekhez tartozók elleni gyűlölet és erőszak helyett .	felekezetekhez	13	All
A jövő évről a főtitkár elmondta , hogy 3 szakmai fórumot terveznek , amelyből az egyik témája már biztosan az asztalos családi vállalkozásokon belüli generációváltás lesz , a másik , pedig a társművészetek és az asztalosság kölcsönhatása .	vállalkozásokon	22	Sup
Az ismeretek körének bővítése az adott versenysportágak hazai élvonaláról , ennek révén a nemzeti öntudat fejlesztése .	élvonaláról	8	Del
A téma magas szinten utoljára Major István , a Külügyminisztérium külgazdasági kapcsolatokért felelős államtitkárának júliusi moszkvai tárgyalásain került szóba .	kapcsolatokért	11	Cau
A 90-es évek végén két éven át miniszteri főmegbízottként irányította az Országos Reumatológiai és Fizioterápiás Intézet és a Budai Irgalmasrendi Kórház újjászervezését .	főmegbízottként	8	Ess
Február közepén az ukrán gázvállalat írásban értesítette Oroszországot kártérítési követeléséről az elkobzott eszközökért , jelezve , hogy amennyiben a vitát tárgyalásos úton nem rendezik , bírósághoz fordul .	eszközökért	12	Cau
- A doni áttörés áldozataira emlékeztek Budapesten Varsót figyelmeztetni kell Hivatalos nyilatkozat a szlovákiai magyar lapok nyelvhasználatáról Hiány Századvég : csak egy pénzmosoda ?	nyelvhasználatáról	16	Del
