Mindez azt jelenti , hogy a szolgáltató adatot nyújt az önkormányzatnak többek között az elfogyasztott ivóvízről , vagy éppen a háztartás szennyvíz-tározójából elszállított szennyvíz mennyiségéről , hogy csak a két legfontosabbat emeljük ki .	ivóvízről	15	Del
Persze el nem hittem volna , hogy abba vizeletet is kevert , de miután beleszagoltam , kénytelen voltam belátni , ő tényleg olyan , mint amilyennek gondoltam .	vizeletet	8	Acc
Az CBS/NYT júniusi közvélemény-kutatásában Clintonra a választók 43 százaléka támogatta , míg Trump 37 százalékon állt .	közvélemény-kutatásában	3	Ine
A woodWOP-pal és a Schnitt Profi(t) -tal történő együttműködése lehetővé teszi a tökéletes adatáramlást az értékesítéstől kezdve a tervezésen át a gyártásig .	gyártásig	21	Ter
A budapesti birkózó-világbajnokságon aranyérmet szerző kötöttfogású klasszis igyekezett feltöltődni , és rápihenni az előtte álló időszakra .	birkózó-világbajnokságon	2	Sup
-- Dal verseinkhez az új évezred morajlása szabja az alapot , míg vágtázó ünnep napjaink hullámai csapkodják a taktust .	verseinkhez	2	All
Tippek a kiváló vélemény megfogalmazásához :	megfogalmazásához	4	All
A 2-es típusú cukorbetegség tablettás kezelése DR. FÖLDESI IRÉN , DR. FARKAS KLÁRA Az oktatóanyag A MAgyAr DiAbetes társaság vezetôsége Megbízásából , A sanofi támogatásával készült készítette A MAgyAr DiAbetes	Megbízásából	20	Ela
Az öreg francia tábornok úgy gondolja , hogy a porosz-francia háborúban elszenvedett francia vereségért most revansot lehet venni , és a francia hadsereg megsemmisíti a német haderőt .	vereségért	13	Cau
Az ünneplés pillanatáról néhány folyóiratba fényképes cikk jelent meg .	pillanatáról	2	Del
Dr. Marada Györgyit váratlanul érte a főigazgató felkérése , nagyon megtisztelőnek , és valódi kihívásnak tartja .	kihívásnak	14	Dat
A középtempós , power-béli elemekkel megfűszerezett heavy metal szerzeményekről az idő előrehaladtával a hangsúly a The Derelict City című új EP dalaira tevődött át .	szerzeményekről	8	Del
Rólunk A dinamikusan fejlődő digitális könyvpiac egyre növekvő kulturális és gazdasági jelentősségre tesz szert .	könyvpiac	5	Nom
A figyelőkutakban és a kialakuló bányatóban egy vízmérce telepítésével havonta mérni kell a vízszintet , a figyelőkutakban és a keletkezett bányatóban évente vízvizsgálatot kell végezni a nyári időszakban vett vízminták elemzésével .	vízmérce	7	Nom
5. § ( 1) bekezdés a) pontjával és a Grt .	pontjával	6	Ins
Este Igen , boldog vagyok , néha annyira boldog , hogy átölelném az egész világot , és néha üvölteni szeretnék a kétségbeeséstõl .	kétségbeeséstõl	21	Ela
Rated 5 out of 5 by Panther from A termék pontosan az , amit régóta kerestemAz egyik ismerősöm ajánlotta ezt a típust .	kerestemAz	15	Nom
Az állami védvonalakon a vízügy , a folyó fővárosi szakaszán pedig a Fővárosi Csatornázási Művek megkezdte a védekezéshez szükséges előkészületeket , erőket és eszközöket csoportosítottak át a legkritikusabb pontokra .	védvonalakon	2	Sup
A jellemző legalsó határ – teljes költséggel számolva – 70–80 ezer forint a charterjáratos utakra .	utakra	14	Sub
Figyelembe kell vennünk viszont , hogy a görögök szájhagyomány útján akár egy évezredig is megőrizték a ősök/hősök dicső dolgait .	évezredig	12	Ter
10. Zsigmond király utasítja a leleszi conventet , hogy a Várdai Miklós és Pelbárd által Moch birtoknak , melyik egyházközséghez való tartozása ügyében Debreczeni László leányai ellen folytatott perben ez utóbbiakat az esztergomi érsek elé idézze .	birtoknak	16	Dat
BÁBOLNA KÖRNYEZETBIOLÓGIAI KÖZPONT KFT. BUDAPEST 1/5 BIZTONSÁGI ADATLAP TALON-B PARAFFINOS RÁGCSÁLÓIRTÓ KORONG 1 .	PARAFFINOS	9	Nom
Ha már Hídnap és a halé a főszerep , többen frissen sült hallal kínálták a vendégeket .	halé	5	Nom
Bízunk benne , hogy az IFRC Regionális Hivatala és Globális Szolgáltató Központja székhelyeként Magyarország tevőlegesen is hozzájárul a Föderáció egyedülálló humanitárius tevékenysége hatékonyságának növeléséhez .	növeléséhez	23	All
1665-ben már Bedford hercegének palotájában lajstormba is vettek néhány pezsgős dugót .	lajstormba	5	Ill
Egy játékfilmnél rövidebb műfaj a koncentráltságánál és erősen egyéni megfogalmazásánál fogva képes intenzív figyelmet felkelteni .	megfogalmazásánál	9	Ade
Alkalmazható a talajélet élénkítésére , talajoltásra , talajkezelésre , állománykezelés és szárbontásra .	élénkítésére	3	Sub
Nem von le egy szemernyit sem elégedettségünkből és örömünkből , hogy a városi közmédia ingerküszöbét idén sem érte el a hivatásos művésztelep léte , amely ugye 2003-tól működik Sárospatakon .	örömünkből	8	Ela
Meg kell , hogy mondjam , maximális fegyelmet tapasztaltam utunk során az összes átjáróban és fénysorompónál .	fénysorompónál	15	Ade
Ezen a kihallgatáson kéri Hunvald , hogy most már kérdezzék az ingatlanügyekkel kapcsolatban is .	kihallgatáson	2	Sup
További információért , és egyéb megjelenésekkor írjon emailt	megjelenésekkor	5	Tem
Lelkemnek ügyével , semmit sem törődtem , bűnöket kedvelő ifjakhoz , szegődtem .	ifjakhoz	9	All
Ennek megfelelően , a falakon sokszor reprodukált vagy ritkán látott képek egyaránt akadnak , a vitrinekben pedig személyes használati tárgyai hozzák emberközelbe a maga korában is népszerű mestert , aki e honban elsőként tudott megélni saját festészetéből .	festészetéből	36	Ela
Bizonyára tudják a kedves olvasók , hogy régóta komoly barátság fűz minket a Velencei Diákotthon lakóihoz .	lakóihoz	15	All
A hidegebb helyeken inkább csak dísznövényként neveljük a gyömbért .	dísznövényként	5	Ess
Hazára találhat -e az övéi között , akikkel történelme és nyelve azonos , mégis idegenként , cseszkóként kezelik ?	cseszkóként	16	Ess
Az eper népszerűségét nem csak finom ízének , de kifejezetten egészséges tápanyag összetételének is köszönheti , különösen amiatt mert kiváló antioxidáns tulajdonságokkal bír .	tulajdonságokkal	21	Ins
A vízellátással sem volt gondjuk , a barlang faláról lecsöpögő víz elég volt a túléléshez , és szerencsére a legtöbb barlang természetes módon szellőzik , így elegendő oxigénhez is jutottak .	vízellátással	1	Ins
Az öreg az egész völgyön híres volt ezermester találmányairól .	találmányairól	8	Del
Hétvégi házi feladatok és az iskolai dolgozatok szabályai A Pedagógiai Programban foglaltak szerint : 2.11 Az iskolai beszámoltatás , az ismeretek számonkérésének követelményei és formái Követelmények : Számon	beszámoltatás	17	Nom
Most vagy az van , hogy leméretezéskor a program által felajánlott élesítést alkalmazod ( NE ! használj sima bicubic-ot ) , vagy csak szimplán túlélesíted .	leméretezéskor	6	Tem
Az ünnepségen részt vett Ternyák Csaba egri érsek , Dobszay Benedek ferences tartományfőnök és Soltész Miklós , az Emberi Erőforrások Minisztériumának egyházi , nemzetiségi és civil társadalmi kapcsolatokért felelős államtitkára .	kapcsolatokért	27	Cau
A Hamlet kapcsán nagyon sok szó esett a politika értelmezhetőségéről .	értelmezhetőségéről	9	Del
Ez a közúti kapacitáson nem csökkent , csak átcsoportosít , azaz érdeket sem nagyon sért .	kapacitáson	3	Sup
Az egészségtudatosságot nagyon fontosnak tartom legyen az akár iskolai , munkáltatói vagy munkavállalói , családi egységekre lebontva .	egységekre	15	Sub
Árpád-tetőtől a Széchenyi térig mozgalmas lelkes magyar élet lüktetett , olyan erőteljes megnyilatkozással , amely könnyekig hatotta meg a felszabadítókat és felszabadulókat. ” [ 1 ]	könnyekig	15	Ter
A Ki , mit visel a vörös szőnyegen ? című játék még a 90-es években kezdődött , de néhány évtized alatt hatalmas biznisszé nőtte ki magát .	biznisszé	22	Tra
Érdi építészként olyan csapatot gyűjtöttem magam köré , melynek tagjai azt tartják a legfontosabbnak , ami Önnek a legfontosabb !	építészként	1	Ess
Az 1956-os forradalom és szabadságharc 61. évfordulóján a zuglóiak a Bosnyák téri emléktáblánál és a Forradalom terén emlékeztek a kerület hőseire és áldozataira .	emléktáblánál	12	Ade
Ezúttal nyilvános értékesítésre 150 ezer darab részvényt kínáltak fel , aminek több mint kétszeresét , 350_732 darabot jegyeztek le a befektetők .	értékesítésre	2	Sub
A szabalyokat persze elobb-utobb megvaltoztatjak - amikor akad egy olyan marha aki kepes evekig pereskedni 5DM miatt .	evekig	13	Ter
Embernek lehetetlen , de Istennél minden lehetséges .	Istennél	4	Ade
A bőséges rakodótér , a példaértékű 496 kilogrammos hasznos teherbírás és az alacsony hátsó rakodóperem jóvoltából elég kicsi a keskeny utcákhoz , miközben elég nagy a munkához .	utcákhoz	20	All
( 5) A (2)- ( 3) bekezdések szerinti határozatot közokiratba vagy ügyvéd - jogkörén belül jogtanácsos - által ellenjegyzett magánokiratba kell foglalni .	magánokiratba	19	Ill
Ha gyakran ismétlődik , érdemes csökkenteni az élelemadagot.Vadászkutyáknál kifejezetten káros .	élelemadagot.Vadászkutyáknál	7	Ade
A bütyök a hímnél jobban fejlett .	hímnél	3	Ade
Ebben meghatározó szerepet játszott , hogy a nemzeti parkok is erdőgazdálkodóként tevékenykednek , és ezáltal szembesülnek a természetvédelmi szempontokat figyelembe vevő erdőgazdálkodás kihívásaival is .	erdőgazdálkodóként	10	Ess
Tizenhétezer család jogosult a gyermekek otthongondozási díjára ( gyod ) , amely jövőre egységesen havi bruttó százezer forintra nő - közölte az Emberi Erőforrások Minisztériumának család- és ifjúságügyért felelős államtitkára Novák Katalin .	ifjúságügyért	27	Cau
( 1) bekezdése alapján , a Médiatanács hatósági határozatban állapítja meg a pályázati eljárás eredményes , vagy eredménytelen voltát , és eredményesség esetén a pályázati eljárás nyertesét .	eredményesség	21	Nom
A film minden szempontból sikert hozott : Mijazaki megalapította a japán legismertebb animációs stúdiójává fejlődő , Ghibli Stúdiót , és a két férfi összebarátkozott .	stúdiójává	13	Tra
Itt akár lehetőség nyílik visszamenni egészen a születésig , fogantatásig , de akár generációs oldás esetén több generáción át is vissza lehet menni .	fogantatásig	9	Ter
Továbbá a CEBIS terminálon beállítható , hogy az adott hidraulikakör aktiváláskor hány szelep legyen nyitva és zárva .	aktiváláskor	10	Tem
A válltámasz kevésbé szögletes vonulatokat kapott , így szállításnál sem okoz kényelmetlenségeket a katona számára .	szállításnál	8	Ade
Remélem ez is egy 45 ° -ban meghajlítható , gagyi szar tokba kerül ...	tokba	11	Ill
Nem lehet tudni , hogy mennyire egységes a párt , így a mostani döntés ellenére lehet , hogy a frakció egy része megszavazza majd az adótörvényeket és a költségvetést , illetve távol marad a szavazáskor .	szavazáskor	34	Tem
A szövetség lehetővé teszi egy újabb gazdaságstratégiai cél gyorsabb elérését , vagyis hogy a Rába futóműüzletága regionális multivá váljon a lehető leggyorsabban – ismertette a külügyi és külgazdasági államtitkár .	multivá	17	Tra
Magyarországon a jövedéki adó 41 százaléka a teljes benzinárnak .	benzinárnak	8	Dat
Ezek szerint a hőszivattyú 1 kW-jához 40-45 liter tárolókapacitás tartozik ( kell a hőszivattyú által megtermelt hő biztonságos elvételéhez , amelyhez a hőcserélő megfelelő mérete is fontos tényező ) .	elvételéhez	18	All
De a hivatalnok munkaköre nem merült ki a száraz adminisztrációs ügyek intézésében .	munkaköre	3	Nom
Akinek a sznob boltokból kell méregdrágán ugyanaz a termék , az menjen az andrássyra , vagy a váci utcába .	boltokból	3	Ela
A szülők aláírásukkal igazolják , hogy megismerték a dokumentumokat .	aláírásukkal	2	Ins
Köztudott , hogy a korábbi években-évtizedekben , az állatihulladék-elszállítás igencsak foghíjas szolgáltatás volt Magyarországon , és sokan emiatt , illetve hanyagságból és/vagy spórolásból inkább elásták , feletették az elhullott állatok tetemét , maradványait más állatokkal .	hanyagságból	20	Ela
A szektorokban volt egy-egy épület a parancsnokságnak konténer típusú szolgálati helyiség , amit az ENSZ épített , ahol napközben dolgoztunk , de a békefenntartóknak a saját szállásukról maguknak kellett gondoskodniuk .	békefenntartóknak	23	Dat
A szülők fellebbeztek a református püspökénél és az oktatási ügyekben illetékes egyházi vezetőnél is , hiába .	püspökénél	5	Ade
Ezt majd egy más - " A gyógyfürdők hatása deréktól lefelé " című - munkámban részletezem .	deréktól	9	Abl
Nem a fizikai helytől függ tehát , hogy mikor dolgozom .	helytől	3	Abl
A magyar és angol nyelvű internetes fotóalbum a népoktatási törvénytől az iskolák államosításáig terjedő időszak pécsi oktatási intézményeinek történetét mutatja be a Janus Pannonius Múzeum Új- és Legújabb Kori Történeti Osztályának fotóin , nyomtatványain keresztül .	államosításáig	12	Ter
Müller Péter hosszasan válogatott , szelektált , mire a szeretethez , a szerelemhez és a szeretkezéshez kapcsolódóan összeállította és újrafogalmazta életművének eszenciáját .	szeretethez	9	All
Annak ellenére , hogy a farkas 1993 óta védett állat Magyarországon és annak elejtője több éves börtönbüntetéssel sújtható , a mai napig érkeznek az állatvédőkhöz hírek farkasok kilövéséről .	állatvédőkhöz	24	All
Én reggel már fél hétkor fent voltam , kirohantam tojásért és kenyérért , majd elkészítettem négy-négy tükörtojást a gázon .	tojásért	9	Cau
( 1) A nem üzleti célú közösségi , szabadidős szálláshely-szolgáltatásról szóló 173/2003. ( X. 28. ) Korm. rendelet ( a továbbiakban : 173/2003 .	szálláshely-szolgáltatásról	9	Del
Örkény István bizonyára ironikusan írna arról , hogy miként lehetséges egy megváltozott világban , hogy a hatalom így ragaszkodik a múlt tévedéseihez , ami két világháborúba vitte az országot , a holokausztban való lényeges részvétellel .	világháborúba	25	Ill
6. Nem esett szó komolyabb ballisztikus rakétákról , radarrendszerekről , műholdrendszerekről - mivel ezek a keleteurópai országoknak nincsenek .	műholdrendszerekről	10	Del
A tegezés a butázással együtt volt igazán húsbavágó .	butázással	3	Ins
Vastagfalú ThermoSafe , 2,3 literes ( 1,5 liter étel ) üvegkehely - a könnyű és biztonságos turmixolásért akár forró levesről , akár jéghideg italról legyen szó .	turmixolásért	16	Cau
Emlékszem egy estre , amikor 70 éves nénit szedtek le a bicikliről a földúton , hazafelé a kertjéből .	bicikliről	11	Del
Bár őt a legkevésbé sem tartják filmes újítónak vagy legalábbis merész alkotónak , tisztes munkát végzett .	újítónak	7	Dat
Szerződött partnereink részére halasztott fizetési határidejű vásárlás lehetőségét is biztosítjuk , ennek részleteivel kapcsolatban forduljon bizalommal munkatársainkhoz .	munkatársainkhoz	16	All
SE : Aki magántanulóként a tanulócsoportunk tagja , az befogadó-elfogadó közösségre lel , barátokat szerez , nem elszigetelten nő fel , hanem egy közösség , csoport tagjaként .	magántanulóként	3	Ess
A 2008. augusztus 18-án kelt levelükben nem az előzőekben ismertetett tényeknek és nem a bértárgyalásokon képviselt álláspontjaiknak megfelelően összegzik a véleményüket a saját bérmegállapodás tervezeteikről .	levelükben	5	Ine
A városvezetés eddigi legnagyobb eredményének tartja a Vízművek kisebbségi részvénycsomagjának visszavásárlásáról szóló megállapodást Budapest főpolgármestere .	részvénycsomagjának	9	Dat
Amikor belevágtam a blogírásba két feladatot tűztem ki célul :	blogírásba	3	Ill
Így a boldogságét .	boldogságét	2	Acc
A Számlatulajdonos az Electra szolgáltatás igénybevételéért , az Electra rendszeren keresztül benyújtott fizetési műveletekért , megbízásokért , illetve az igénybevett szolgáltatásokért díjat , költséget , jutalékot köteles fizetni a Takarékszövetkezet felé .	szolgáltatásokért	20	Cau
A Kaspersky TOTAL Security for Business vírusvédelmet nyújt Mac , Linux és Windows platformokra , és kompatibilis az új Windows 8-as operációs rendszerrel .	vírusvédelmet	6	Acc
A csapvízzel történő vízcseréknél fontos , hogy a csapvízben megtalálható - a halak kopoltyúit irritáló és a szűrőben illetve az aljzatban tenyésző baktériumokra káros klórt és nehézfémeket eltávolítsuk a vízből .	csapvízben	8	Ine
De olyan jó barátnő , hogy egy pillanat alatt lemond egy zürichi fenékplasztikát , hogy a csajokkal legyen .	csajokkal	16	Ins
A teljes munkaidőben adható legkisebb összeg lenne az alap , de feljebb lépve is a minimálbér-rendszer lenne a viszonyítási pont , például a garantált minimálbér is referenciául szolgálna .	referenciául	26	Ess
A házi feladatok a példákhoz kapcsolódnak és alkalmazási területüket tekintve nagyobb részt a gépészmérnöki , mechatronikai illetve biztonságtechnikai szakhoz kapcsolódnak .	szakhoz	18	All
Hogyan oldjuk meg a félelem-harag körforgását , mely végső soron a gyűlölethez vezet , és eltávolít isteni lényegünktől ?	lényegünktől	17	Abl
A tárolás csak kényelmi célokat szolgál , hogy a következő hozzászóláskor ne kelljen automatikusan kitölteni .	hozzászóláskor	10	Tem
Ilyen célt nem érhet el egy olyan munkásosztály , amely egy magát messzetekintő vezetőségként felkínáló párt tudatlan , bizalomteljes kíséretét alkotja .	munkásosztály	7	Nom
A rohadás persze nem kell , hogy mindig világégéssel járjon .	világégéssel	8	Ins
A Tárki legújabb felméréséről az intézet vezető kutatója az InfoRádiónak elmondta : a rövid és hosszú távú munkavállalás célországai elsősorban Ausztria , Németország és Nagy-Britannia .	felméréséről	3	Del
A két tábor ellenérdekelt , a szembenállás okairól lapunk többször is beszámolt .	okairól	7	Del
A kvint-korszak lényegében az a kor volt , amelyben az ember ezt úgy érezte .	kvint-korszak	1	Nom
BETEGSÉG - SZIMBÓLUMOK A TEST - LÉLEK- SZELLEM EGYSÉGÉBEN Hiszünk abban , hogy egészségünk az egész ember multját és jelenét figyelembevevő szelíd módszerekkel megóvható és javítható .	SZIMBÓLUMOK	2	Nom
Érkezés után már elkezdünk ismerkedni a történelmi múltú város nevezetességeivel : megállunk Ó-Panama romjainál , majd a Panama Csatornához megyünk , ahol megtekintjük a zsilipes átkelést a Miraflores-gátnál .	romjainál	13	Ade
Ha mellékútról főútra kanyarodsz jobbra , nem csak balra kell nézned , hogy nem mész be senki elé , hanem meg kell győzödnöd , hogy senki nem előz senkit a főútvonalon - ami bizony történhet tőled jobbra is ...	mellékútról	1	Del
Eredetileg Ni-Cd akku volt a gépemehez , használhatom a gyári töltővel az új Ni-Mh akkumulátort ?	gépemehez	5	All
Az irodától a tornateremig , a havas utcától , a statiszták tömegéig , a körszakálas kisztitkártól , a nyilaskeresztes egyenruhás párttitkárig .	tömegéig	11	Ter
A kastélytól alig 100 méterre , hatalmas gesztenyefák árnyékában áll a volt grófi ménistálló , amely 1860-ban épült .	kastélytól	1	Abl
AZ ÁRPAFŰLÉRŐL PÁR SZÓBAN : Fogyasztási javaslat	PÁR	2	Nom
A The Sun című brit lap úgy értesült , hogy a DFID , amelytől a civil szervezet a forrásokat kapja , azonnal felfüggesztette az állami támogatások átutalását , miután tudomást szerzett a visszaélésekről .	visszaélésekről	32	Del
Ezzel egyszerűsödik az eljárás mind a futamidő végi tulajdonjog átruházáskor , mind az esetleges vételi , visszavásárlási joggal élés esetén .	átruházáskor	9	Tem
Előszeretettel használom minden szakállhosszra , a hűs kellemes friss érzés azonnal magával ragad és a rabjává tesz .	rabjává	15	Tra
A Roma mestere úgy véli , a Fiorentina elleni vereségért csakis önmagát hibáztathatja a csapat .	vereségért	9	Cau
És ezt a jelenséget már nem lehet az egészségügyben dolgozók alulfizetettségével magyarázni .	alulfizetettségével	10	Ins
Egyelőre hátul is jól szűrtünk , a félidő derekáig kevés lehetősége volt a " kanáriknak " .	kanáriknak	14	Dat
124. § ( 4) bekezdésében foglaltakra – csak 50 %-ban helyezzük levonásba , és a biztosítóval ennek figyelembevételével ( tehát nettó+ 50% ÁFA ) számolunk el , és partnerünkre az önerőt továbbterheljük ( mint ÁFA körön kívüli tétel ) !	levonásba	11	Ill
80%-os sűrűségben pedig gombaölő szerként alkalmazhatod .	szerként	4	Ess
Najmányi László : Alváshoz , lehetőség az álomhoz	álomhoz	7	All
A zsilip kezelésére vonatkozó szabályzat elsősorban az árvízi biztonságot tartja szem előtt .	zsilip	1	Nom
Ez a csomagunk tartalmazza alap � ron a legt � bb � tadott fot � t , � gy ezt v � lasztva mindent be fogunk dobni a fot � z � s alatt .	fot	13	Acc
Olajteknőben meg sajnos nincs mágneses csavar .	Olajteknőben	0	Ine
( A behatolásnak egy másik útja , illetve értelmezése Robert Fischer álmába való behatolással van kapcsolatban , amelyről még lesz szó a későbbiekben. )	behatolással	13	Ins
Bátran merem kijelenteni , hogy nem az a megszokott nyáladzós , keménykedős , semmitmondó szar ami mostanság jellemző erre a közegre itthon .	közegre	20	Sub
Nézem a képernyőt , egy rajzfilmből egy robot , legóból .	legóból	9	Ela
Az akkor 17 éves lány és családja elképesztő nehézségek árán elmenekült Szíriából : a többszörös bajnok úszólány egy amúgy 6 fő befogadására alkalmas csónakon volt tizenhetedmagával .	csónakon	23	Sup
Lehet akár az is , hogy Ő gyerekkorában könnyebben jutott hozzá dolgokhoz , lehet , hogy különösebben nem kellett kifejeznie érzéseit , mert nem kapott visszajelzést .	dolgokhoz	11	All
Az időnként álomba , szürreális látomásba forduló jelenetek nagy drámai erővel képesek beszélni a hatalmi és emberi mechanizmusok irracionális működéséről , az emberi érzéketlenségről és kiszolgáltatottságról .	érzéketlenségről	23	Del
Esetünkben a beteg a HK kezelésekor 52 éves volt , az AML a HK kezelést követôen 3 év múlva alakult ki , a beteg kemoterápiát kapott , amely alkiláló ágenst tartalmazott , anamnézisében splenectomia szerepelt .	kemoterápiát	24	Acc
Éjfélkor is érdemes mindenkinek velük tartania , üzeni az EMIH , hiszen az Egységes Magyarországi Izraelita Hitközség szervezésében Budapest legrégebbi zsinagógájában , a megújult Óbudai Zsinagógában különleges kántorkoncert lesz , egyedülálló egyházzenei élménnyel .	Éjfélkor	0	Tem
Éltek a kiváló földrajzi fekvéssel , és sokat fektettek a humán erőforrásokba .	erőforrásokba	11	Ill
Az ár mellett fontos a készülék tudására és minőségére is odafigyelni kiválasztáskor .	kiválasztáskor	11	Tem
A gyerektől függően a két nyelv különböző szerepet tölthet be : némely gyerek jelnyelvben lesz domináns , mások viszont hangzó nyelvben , megint némelyek kiegyensúlyozottan mindkét nyelvben .	gyerektől	1	Abl
Annak érdekében , hogy mindezen szolgáltatásokat minden vendégünk igénybe tudja venni , a Bongo Kids Club Játszóház szakképzett személyzete gondoskodik a gyermekek felügyeletéről és feledhetetlen szórakozásáról .	felügyeletéről	22	Del
Elektromos bicikli akku kínálatunkban kimondottan elektromos járművekbe gyártott ciklikus akkumulátorokat talál .	járművekbe	6	Ill
Én is szeretnék kijutni. egyenlőre tanulom a szakmámat : Szobafestő - mázoló - tapétázót az angolt lerakom a nyáron majd , a saját szakmámban dolgozok egy évet kb mit gondolsz mekkora eséllyel kérelmezem utána meg a letelepedést ?	szakmámban	23	Ine
- Válj az ikonikus posztapokaliptikus harcossá , új felszereléseket , fegyvereket gyártva , vagy a már meglévőket fejlesztve , és vesd be a közelharcban és a fegyverforgatásban szerzett jártas ..	harcossá	5	Tra
Az Apple az idióta szabadalmi perek első számú célpontjává vált az utóbbi években .	célpontjává	8	Tra
Véleményem szerint ezért nem kell leválasztani a játékmenettől a történetet és az audiovizuális megjelenést és külön értékelni azokat művészeti szempontból , mivel azok együttesen határozzák meg az alkotást és közvetítik az élményt .	játékmenettől	7	Abl
Otto F. Kernberg megfogalmazásában : a jó belső és külső tárgyreprezentációk megvédését a rosszaktól .	rosszaktól	13	Abl
– A hajdúsámsoni elkerülő végétől egészen a 471-es debreceni végéig , vagyis a 4-es főútig , – reményeink szerint – kétszer-két sávos lesz a burkolat – ismertette Tasó László .	főútig	14	Ter
Az is igaz , hogy az I. r. felperes kórházi felvételekor sem végeztek ilyen súlybecslő műszeres vizsgálatot , de az alperes orvosa a szülészeti kórházi felvételkor kézi módszerrel megbecsülte a magzat súlyát ?	felvételekor	10	Tem
