A hallgatók a terepgyakorlat során megfigyelik , a különböző területek szakmai munkáját , illetve a tereptanár vezetésével kisebb munkafeladatokat látnak el a gyakorlóhelyen .	gyakorlóhelyen	22	Sup
A dokumentumokból kiderült , hogy az argentin focista a 2020-2021-es szezonig naptári évenként 71_053_846 eurót kap a Barcelonától , aminek a 85 százaléka a fizetése , a maradék pénz pedig a fotókért jár .	fotókért	31	Cau
Az MFT működésével kapcsolatos feladatokat a Szellemi Tulajdon Nemzeti Hivatala szervezeti egységeként működő Iroda látja el ( MFTI ) .	egységeként	11	Ess
A Photoshop 7.0.1 program verzióval együttmûködô bôvítménnyel a fényképészek a digitális fényképezôgép képérzékelôje által rögzített eredeti adatokat közvetlenül módosítva állíthatják elô a képeket .	bôvítménnyel	6	Ins
Most örült igazán , hogy reteszt tetetett az ajtajára , felötlött benne , talán lunátikus van a társaságban , az , aki bejött a szobájába , utóbb meg kinn álldogált a sötét folyosón .	ajtajára	8	Sub
A magyar történelemben példátlan fejlődést és kulturális pezsgést eredményező Kiegyezés évfordulójának évében erre feltétlenül gondolnunk kell .	évfordulójának	10	Dat
Hamar beilleszkedett a Romába Stephan El Shaarawy , aki egy hónap alatt a csapat egyik veszélyes fegyverévé vált a januári érkezése óta .	fegyverévé	16	Tra
Az emerin egy 34 kDa nagyságú protein , amely szekvenciája nagyon hasonlít a nuclearis lamina-associated protein ( LAP2 ) szekvenciájához .	szekvenciájához	19	All
Az egyéni vállalkozói igazolványt formanyomtatványon kitöltött kérelmen kell kérni .	igazolványt	3	Acc
Fontos kiemelni a hardverekkel kapcsolatos pozitív hozzáállását , hiszen szinte minden eszköz esetében meg tud határozni valamilyen játékkategóriát , amelynek futtatására egy vizsgált hardver alkalmas , vagy legalább valamilyen alternatív felhasználási módot javasol .	futtatására	20	Sub
Az iskolaérettség komplex jellegű viszonyfogalom , MERT fogalomkörébe a pszichés funkciók tartoznak .	fogalomkörébe	7	Ill
Ezekre a viszonyulásokra reflektálnak a filmben a képzőművészettel kapcsolatos elmélkedések is .	képzőművészettel	7	Ins
Az oktatáspolitika régi-új ötletével , a kilenc évfolyamra meghosszabbított általános iskolával van tele a sajtó .	iskolával	10	Ins
Amikor kilencvenéves korában elhunyt , barátja , Smuél , tizenkét ruhát szaggatott meg gyászában , s tanítványai egyéves gyászt hirdettek .	gyászt	18	Acc
Egészen pontosan március 15-én választottak Hollandiában , győztesként a Mark Rutte vezette Néppárt a Szabadságért és a Demokráciáért ( VVD ) nevű liberális-konzervatív párt került ki , ám kormányt azóta sem sikerült alakítani .	Demokráciáért	17	Cau
Budapest - Szexuális visszaélés gyanúja miatt előzetes letartóztatásba helyezett egy isaszegi tanárt a Gödöllői Járásbíróság - közölte a Pest Megyei Főügyészség szóvivője kedden az MTI-vel .	letartóztatásba	7	Ill
Június hónapban elindította az önkormányzat a közbeszerzési eljárást , annak lefolytatása elıtt lekontrollálásra került a hitelkérelem közgyőlési döntése és az MFB honlapján lévı feltételek .	lekontrollálásra	12	Sub
A választott ülőhely ára jelenleg 5-7 euró ( ~ 1500-2200 forint ) körül mozog , de a nagy lábterű helyekért akár 16 ezer forintot is elkérhetnek .	helyekért	19	Cau
Szürke lakótelepen lakni most is pont olyan unalmas , mint 40 éve , az iskolában is mindig vannak farmerdzsekis rémek , akiknek persze összefogással és csapatmunkával túl lehet járni az eszén .	eszén	30	Sup
A csillagközi térben ugyanakkor vannak különböző sűrűsödések , ezeket nevezzük csillagközi felhőnek .	felhőnek	11	Dat
Csapatához JUNIOR MÉRNÖK ÜZLETKŐTŐKÉNT !	Csapatához	0	All
Betekintést nyerhetünk néhány fontosabb szereplő személyiségébe , múltjába .	személyiségébe	5	Ill
Kiváló ropogtatni való sör , bor mellé , vagy akár meccsnézéshez is … :)	meccsnézéshez	10	All
Ha egyszer eltűnnél , és egy jótündér csillagokká szórna szét , az olyan széppé tenné az eget , hogy az emberiség beleszeretne az éjszakába .	csillagokká	7	Tra
Akik középkori kódexekből , barokk partitúrákból származó zenét , dalt éppúgy előadtak , mint népénekeket .	kódexekből	2	Ela
Kópházy Mihály szobájától mindössze pár méterre lábadozik a csapat gyúrója , szemben pedig egy játékos , Tullner Evelin fekszik súlyos nyak , és lábsérülésekkel .	szobájától	2	Abl
Amikor Görgei 1849 tavaszán követet küldött a várat védő császári parancsnokhoz , Heinrich Hentzihez : nem indít támadást a Duna felől , ha a császáriak nem lövetik Pest civil lakosságát .	követet	4	Acc
Az Előfizetőt együttműködési kötelezettség terheli a kivitelezés során szükséges környező ingatlanokba való bejutással kapcsolatban .	ingatlanokba	10	Ill
Arra is fény derült , hogy ezeket a baktériumokat célzó antibiotikumokkal és védőoltásokkal elnyomható ez a reakció .	antibiotikumokkal	10	Ins
A szép szülésélmény nem azon múlik , hogy természetes úton , vagy sürgösségi császárral szülünk e , ahogy az anyai érzések sem azon múlnak , hogy a gyermek természetes úton , vagy lombikban , vagy inszeminációval fogant e meg .	lombikban	32	Ine
Adatszolgáltatás a tartós befektetésből származó 2012. évi jövedelemről 12K97-es számú nyomtatvány Az adatszolgáltatás benyújtásának módja , időpontja : Az adatszolgáltatás csak elektronikus úton 1 teljesíthető !	Adatszolgáltatás	0	Nom
• Szakmai önéletrajz , végzettséget igazoló dokumentum másolata , 3 hónapnál nem régebbi erkölcsi bizonyítvány , a pályázó nyilatkozata arról , hogy a pályázatban foglalt személyes adatokat és a pályázati anyagot az elbírálásban résztvevők megismerhessék .	hónapnál	10	Ade
Amikor megfigyeljük ezeket a szinaptikus mediátorokat , valamint koncentrációjukat különböző agyi struktúrákban , más nézőpontba helyezkedünk .	mediátorokat	5	Acc
Nem lett meg az abszolút többség a humanitárius célú vízumok bevezetését kezdeményező határozatról szóló szerdai európai parlamenti ( EP- ) szavazáson , de a jelentéstevő új voksolást szeretne kiíratni , mivel szerinte technikai hiba történt .	határozatról	12	Del
Elengedhetetlen feltétel a hangzatos plakátok és az ügyetlenül varrt zászlók erőteljes rázogatása ( amin általában Evita ragyogóan mosolygós arca tündököl ) valamint az 500 decibelnél potensebb üvöltözésre való képesség .	decibelnél	24	Ade
Az új törvénytervezet sem tartalmaz avultatást , vagyis a használt autókra , az új autókhoz viszonyított alacsonyabb adómértéket .	avultatást	5	Acc
Több kikötőből - Siófok , Balatonfüred , Keszthely , Balatonföldvár - indulnak napi több alkalommal sétahajók .	kikötőből	1	Ela
A mindenkori szereplők érzelmi intelligenciájától , kommunikációs színvonalától , lelki épségétől függ , hogy együttműködés és bizalom , vagy gyanakvás és versengés , esetleg érzelmi pokoljárás jellemzi majd ezt a kapcsolatot .	intelligenciájától	4	Abl
A fehér liszten , cukron és margarinon túllépve azonban ma már szinte mindenki számára elérhetőek azok a hozzávalók , amelyekkel akár a tortákat is a diétájával összeférhetővé tudja tenni , az élvezeti érték csökkenése nélkül .	cukron	4	Sup
A pazar beállítások mindig beledolgoznak az adott jelenet hangulatába , legyen szó álmos , félhomályos reggelekről vagy idegtépő hajszáról .	reggelekről	15	Del
Túl van az öltözködésen , evésen , alváson .	alváson	7	Sup
A nálunk ismert almás pitébe a töltelékként szolgáló nyári almát általában lereszeljük , majd a pitetésztát kicsit megszórjuk zsemlemorzsával , s erre fektetjük a mazsolával , cukorral és fahéjjal gazdagított tölteléket .	töltelékként	6	Ess
A tehetségek gondozása a természettudományos területen a legeredményesebb , de ott vagyunk a legjobbak között helyesírásból , történelemből , sportból , néptáncból , drámából és képzőművészetből .	képzőművészetből	25	Ela
Gyermekünk születésekor egyszerre zárul be addigi életünk , és nyílik egy másik fejezete , amiben minden eddigi szokásunkat feladjuk .	születésekor	1	Tem
250 m2-es rendezvénytermünkben rendszeres szakmai találkozókat és képzéseket rendezünk ügyfeleink részére .	rendezvénytermünkben	2	Ine
Ez az összeg 65 éves korunkban már jóval többet érne : 5,5 százalékos hozamot feltételezve 135 ezer forinttal kapunk majd kevesebbet a nyugdíjbiztosítás lejáratakor .	lejáratakor	23	Tem
( Ugyanis az ökoház megnevezés többnyire hatalmas bevitt energiával és bekerülési költséggel felépített , agyongépesített passzívházakat takar. )	költséggel	11	Ins
Van itt minden , ami a multi-kulti velejárója : antibiotikumok , hormonok , szenvedés , profit , áldatlan vér , élve darálás , csőrözés ,... igazi intenzív materialista - liberális - kapitalista világégés a javából .	csőrözés	23	Nom
A FEZEN Fesztivál 20 éves évfordulója alkalmából az OMSZ munkatársai rengeteg érdekességgel várták a látogatókat , akik megtudhatták például , hogy az elmúlt 20 évben milyen időjárási rekordokat tudhat magáénak a rendezvény .	FEZEN	1	Sup
Élet-kisasszony , kőszivű , Nem látja meg már esdő arcom És csókja nélkül hullok el Ezen a csuf , halálos harcon .	arcom	9	Nom
Ízig-vérig kutató , a valóságot vizsgáló művészegyéniség , akiben univerzális érdeklődés élt a világ megismerésére .	Ízig-vérig	0	Ter
Az utasítás tervezetéről a jogszabályok előkészítésére vonatkozó szabályok megfelelő alkalmazásával a miniszter konzultációt folytat a vállalkozások szakmai érdek-képviseleti szervezeteivel és a fogyasztói érdekek képviseletét ellátó társadalmi szervezetekkel .	tervezetéről	2	Del
A MIÉP nélkül nem maradhat hatalmon a jelenlegi koalíció - fejtette ki a párt március 15-ei ünnepségén Csurka István pártelnök a Hősök Terén .	Terén	22	Sup
További termékinformációkért a Kurzusok témában kérjük , vegye fel a kapcsolatot a Agentura ProLingua s.r.o.-val.A Agentura ProLingua s.r.o. termék-szállítási programjában további termékeket is kínál , mint a Nyelv .	termékinformációkért	1	Cau
Íme , néhány részlet a MiTo biztonsági berendezéseiről és rendszereiről .	rendszereiről	9	Del
Bödeháza Község Önkormányzata képviselő-testületének 29/2015.(IV.28.) határozata gazdasági program jóváhagyásáról Bödeháza Község Önkormányzati Képviselő-testülete az előterjesztésnek megfelelően az Önkormányzat	előterjesztésnek	14	Dat
Warren egy olyan lakosról tudott , aki nyíltan meleg volt , és az is nagyon régen volt .	lakosról	3	Del
Részt vett a házmesterek lakodalmán , és szerelmes volt egy suszterlegény külsejű lámpagyújtogatóba , aki alkonyatnál a ház előtt fellobbantotta a gázlángot .	lámpagyújtogatóba	12	Ill
Király Gábor 102. alkalommal állhat a válogatott kapujába és ezzel már egyedül vezeti a válogatottsági ranglistát , a 101-szeres válogatott Bozsik előtt .	kapujába	7	Ill
( 5) Településrész kiválása és új településsé alakulása esetén - az új polgármesteri hivatal létrejöttéig , illetve az új település anyakönyvvezetőjének megbízásáig - helyettesítő anyakönyvvezetőt kell kijelölni , aki az új település anyakönyvi eseményeit külön anyakönyvben vezeti .	településsé	6	Tra
Szigorú funkcionalitásra törekedve alkalmazok ugyan megkerülhetetlen technikákat , de nem hoz lázba sem a fejlődés , sem a vele szövetséges haladás .	funkcionalitásra	1	Sub
Ma vagy 25 kilométert menetelve Lokatsi városkán keresztül , s tőle pár kilométerre fekvő elszórt faluban mentünk szállásra .	városkán	6	Sup
Közel 50 ingyenes tánc- és mozgásművészeti előadással , gyermekprogramokkal , illetve performanszokkal és táncházzal várják az érdeklődőket a Millenáris Parkban szeptember 30-án 14 órától a 25 éves Nemzeti Kulturális Alap jubileumi programsorozata keretében .	Millenáris	18	Nom
De miért költ az állam adóforintokat egy olyan sportág versenyére , amelyet a világon mindenhol színtiszta piaci alapon , televíziós bevételekből , szponzorpénzekből , jegyeladásokból és termékeladásokból finanszíroznak ?	szponzorpénzekből	22	Ela
A céltudatosságomért és az őszinteségemért utálnak sokan , de ugyanezért szeretnek is sokan .	céltudatosságomért	1	Cau
A pengén alul van egy recézett rész is , ez gondolom inkább csak design elem , mert teljesen sima érzetet nyújt , nem segít a jobb fogásban .	pengén	1	Sup
MEGJELENÉS ÉS STÍLUSSikerünk egyik titka- első benyomáskor döntő tényező is lehet - az ápolt , kellemes megjelenés .	benyomáskor	6	Tem
Lexikonunkkal új , széles rétegek számára nyílik lehetőség a valóság megismerésére , a világban való tájékozódásra .	Lexikonunkkal	0	Ins
Egy ilyen nagy lélegzetvételű összehasonlító tesztet hazánkban bizony nem könnyű megszervezni , így hiába próbáltunk mindent megtenni a legnagyobb mértékű hasonlóság érdekében , mégsem sikerült az összes versenyzőt megegyező karosszériaváltozattal megvendégelnünk .	karosszériaváltozattal	29	Ins
Nyílt levélben kéri az Országos Cigány Önkormányzat elnöke Orbán Viktortól , hogy kezdeményezze azoknak a polgármestereknek , alpolgármestereknek és önkormányzati képviselőknek kizárását a Fideszből , akik településeiknek teret adnak a Magyar Gárdának .	Gárdának	31	Dat
2016-ban jött szembe velem egy poszt a Facebook-on , amiben „ mosolyért cserébe ” fodrászokat kerestek állami gondozott gyerekekhez .	mosolyért	11	Cau
Képzelje el , hogy minden egyes reggel megmártózik masszázsmedencéje lágy , üdítő vizében , majd munka után beiktat egy kis edzést , végül a szaunában piheni ki a nap fáradalmait , vagy levezetésként esetleg visszatér a ...	levezetésként	32	Ess
– Ahol az UV-sugárzás visszaverődik ( víz mellett vagy havon ) még nagyobb a veszély .	havon	9	Sup
Amennyiben a Partner futárszolgálat útján juttatja el neked az Ajánlatot , úgy az erre vonatkozó információt ( beleértve a futárszolgálat nevét és elérhetőségét ) igyekszünk minden esetben már az Ajánlatnál feltűntetni .	Ajánlatnál	29	Ade
Az étterem mellett üzemel a La Trattoria Shop , ahol salátabárból , szendvicsekből , hideg- , és meleg nemzetközi ételkínálatból is választhatnak a vásárlók .	salátabárból	10	Ela
És ezért lettem alapító tagja a „ Melletted a helyem ” országos egyesületnek , mely összefogja a koraszülöttséggel foglalkozó egészségügyi szakszemélyzet , a döntéshozók , a civil szervezetek és a koraszülött gyermekek szüleit képviselő különböző szervezetek munkáját .	egyesületnek	12	Dat
De talán pont ez adhatja meg Angliának azt a kellő nyugalmat , amelynek segítségével akár a vébé döntőjéig is elmenetelhet .	döntőjéig	17	Ter
A jóga , mely évezredekig Férfi-princípum volt , a megnyilvánult világon és testen felülkerekedés eszköze , a Rák szakaszban a Nők számára privilegizált , a fizikai testüket , a nyugalmat és a közösségi élményt megadó foglalkozássá vált :	foglalkozássá	35	Tra
A kivitelezésért felelős projektcég tulajdonjoga átkerül a miniszterhez , kivéve az Európai Bizottsággal való egyeztetés jogát , ez a miniszterelnöknél marad .	kivitelezésért	1	Cau
Hogyan alakul ez filmek kiértékelésénél ?	kiértékelésénél	4	Ade
Részleteket nem , mindössze ennyit közölt a Szócska Miklóssal több mint két órán át , zárt ajtók mögött zajló tárgyalásáról a Magyar Rezidens Szövetség elnöke .	tárgyalásáról	19	Del
A végén természetesen Kirkék kerülnek ki győztesen a harcból , mégis sajnáljuk az ellenfél szimpatikus parancsnokának ( Mark Lenard , aki később Spock apjaként bukkant fel a szériában – lásd előző helyezettünket ) pusztulását .	apjaként	23	Ess
Nagy nekifutás lesz , hosszas előkészítést igényel , de aki nem pusztul bele a mérhetetlen ágyszámcsökkentésekbe , meg a háziorvosok járványos látogatásába , túléli ezt is .	látogatásába	21	Ill
Az Egyesült Államok esetében nem valószínű , hogy az elit függetlenséget ígérne a hazafiak lázadása elleni harcért cserébe , de talán akad a tarsolyukban valami más , ami elnyerheti a tömegek tetszését : a biztonság ígérete .	harcért	16	Cau
Idén rendezik meg negyedszerre a World Spa Awards-ot ( már lehet szavazni ) , melyen nálunk is közkedvelt világmárkák , Spa hotelek , kozmetikák , szalonok és aromaterápiás készítmények küzdenek meg egymással a világelsőségért .	világelsőségért	33	Cau
Nyomodban jár a gondolatrendőrség ?	Nyomodban	0	Ine
Lényegében arról van szó , hogy a tao-zás indulásakor még alapítványok is kaphattak ilyen támogatást , de ezen gyorsan változtattak .	indulásakor	8	Tem
Büszkén hangoztattam – főleg magamban – mennyit mindent tanultam a visszaeséseimből .	visszaeséseimből	10	Ela
Kreatív mód : engedje szabadjára kreativitását az állóképekhez és videókhoz használható közkedvelt effektusok segítségével .	állóképekhez	7	All
1942 nyarán konvojokat kísért a sarkvidéken keresztül Oroszországba , novemberben pedig egyike a szövetséges hadihajóknak , melyek az észak-afrikai partraszállás tüzérségi támogatásának feladatát végezték .	hadihajóknak	14	Dat
A célokhoz használt eszközök , legalábbis amiket mostanáig meghirdetett , teljesen konvencionálisak , más európai jegybankoknál is fellelhetők .	célokhoz	1	All
Ezek az emberi lényben mélyen gyökerező érzések elválaszthatatlanok az egoista állapottól .	állapottól	10	Abl
Fogj bele Te is ennek a letehetetlenül izgalmas , és új világokat megnyitó könyvnek az olvasásába , és rendeld meg itt , a weboldalamon , csak 4950 Ft-ba kerül .	weboldalamon	23	Sup
A Csabacsűdi játszótér felújítása az Önkéntesek Hete keretében című projekt megvalósulása Csabacsűdön Pályázó : Tiszta Környezetünkért Alapítvány Csabacsűd Az Önkéntesség Európai Éve keretében meghirdetett	Környezetünkért	15	Cau
Madarak ezrei röppennek fel és kötik össze őt az égbolttal.Hogyan fordulhatsz a mesterhez ?	mesterhez	12	All
A terület hosszú ideje áll a figyelem középpontjában - elsőként azután kezdték misztikus helyként emlegetni , miután öt harci repülőgép nyomtalanul elveszett a háromszögben .	helyként	13	Ess
A két gitáros hóttnyugodt fejjel nyomta el váltogatva a legdurvább , összetettebb szólókat is , aztán a basszusgitáros is megörvendeztetett minket egy szólóval egy vágódeszkára inkább hasonlító bőgőjén .	bőgőjén	27	Sup
A szabadidő eltöltésének divatos narratívái találkoztak : természetjárás , trekking , internet , high-tech segédeszközök - korszerű rekreáció minden mennyiségben .	eltöltésének	2	Dat
Feladom szolgálatom egészbe vagy részben amit leszületésemkor vállaltam .	leszületésemkor	6	Tem
Ők vajon elgondolkodnak -e azon , mekkora kárt okoztak , milyen hatalmas feszültséget hagytak összegyűlni , amikor eltűrték ( ki tudja , milyen politikai megfontolásból , vagy éppen restségből , tudatlanságból ) , hogy a sumákolás váljék természetes gyakorlattá .	restségből	28	Ela
Az orvos javaslatára a terhesség idejére kiiktattam az étrendemből a szóját , cukrot és glutént tartalmazó élelmiszereket .	étrendemből	8	Ela
13 éve közéleti újságíróként dolgozom , most azonban elsősorban kultúrával foglalkozom .	újságíróként	3	Ess
Az LMP frakciója egy olyan szövetség , amely a magyar politika megújításáért jött létre – mondta keddi , az Országgyűlés alakuló ülését követően tartott sajtótájékoztatóján Szél Bernadett frakcióvezető .	megújításáért	11	Cau
Az Oroszlán pedig kihunyó parázzsal sóvárog utána .	parázzsal	4	Ins
A tervk úgy néztek ki , hogy a legalsó szintről nagyjából 150-160 méter hosszú alagút vezet majd ki az Attila úti bejáratig , ahol a metszetrajzok alapján egy másik látogatóközpont fogadja majd az alapítvány tevékenysége iránt érdeklődő tömegeket .	bejáratig	21	Ter
Reméljük , hogy jó szelet kap a mieink vitorlája , de a legfontosabb , hogy egy hajóban eveznek a különböző szakmák , területek képviselői .	hajóban	16	Ine
Magyarország emiatt azt szorgalmazza , hogy az EU által fenntartott missziókban maradjanak benn a britek , mert ellenkező esetben a missziók nagy részét be is kellene zárni .	missziókban	10	Ine
Béláról , az elefántról hallottatok már ?	elefántról	3	Del
Ezzel a jó hírrel emelkedünk felül minden e világi szokáson , kultikus rítuson , vallásos tévelygésen .	tévelygésen	15	Sup
Némelyik karszalagosnak megfordulhatott a fejében , hogy ha már az oroszok eljöttek a budapesti külvárosokig , s a szüntelen moraj tanúsága szerint tüzérségük is van elegendő , akkor aligha fognak itt megállni , és eljönnek egész a Belvárosig .	külvárosokig	14	Ter
Soha ne húzd az anyagot a gép nyomótalpa alatt , mert a tű elferdülhet varrás közben , és leszúráskor nem a tűlyukon halad át , hanem nekivágódik a tűlemeznek .	leszúráskor	18	Tem
A három nap lehetőséget biztosít izgalmas kapcsolatépítésre , tartalmas szakmai beszélgetésekre is .	kapcsolatépítésre	6	Sub
Miután a Rákóczi hídi fordítónál visszafele kezdtünk futni , magam mögött hagytam azt a néhány embert , akivel addig együtt nyomtam .	fordítónál	4	Ade
A Mannvit már szinte minden típusú épület létesítésénél nyújtott tanácsadói szolgáltatást , a hazai lakóparkoknál , iskoláknál , szállodáknál , sportcentrumoknál , irodaházaknál , gyáraknál , kórházaknál és egészségközpontoknál .	kórházaknál	26	Ade
Aki nemi alapú diszkriminációt tartalmazó , a törvény egyenlő védelmét , az élethez , egészséghez való jogot sértő egyezmény ratifikálása mellett érvel , e mellett áll ki , az bizony számos más áldozat emberi méltóságát sérti .	egészséghez	14	All
Itt már szabályos , de teljesen kívül esik a látótérből és még messze is van .	látótérből	9	Ela
A játszmák nem teszik láthatóvá az igazi problémákat , mert az általánosítások , a másik minősítése és a visszatámadás nem árul el semmit az egyéni igényekről , nem ad kapaszkodót a megoldáshoz , és ellehetetleníti a kommunikációt .	megoldáshoz	31	All
A hűtőszekrényre , különösen a mélyhűtőre szereljünk fel olyan zárat , amit a kicsi nem tud kinyitni .	hűtőszekrényre	1	Sub
Nincs értelme sokáig várni egy ilyen probléma felmerülésekor , hiszen a dugulásnak egyfelől komoly következményei lehetnek a lefolyó szerkezetére nézve , másrészt a dugulás fennállásáig használni sem lehet a mosogatót .	fennállásáig	24	Ter
A pályázattal felhasznált támogatási összegektől eltérően az egyedi , miniszteri keret pénzügyi ellenőrzése hiányos , a keretösszegek egy részének felhasználása nem követhető ben a családpolitika területét érintő egyedi támogatás nem volt .	összegektől	4	Abl
" Az építészet valósága a teste : az , ami konkrét , ami formává , tömeggé , és térré vált .	formává	13	Tra
Az Óvodák és Kollégium főkönyvi könyvelésének alapját az ún. könyvelési támlapok ,- melyek az alapbizonylatok kontírozása alapján készülő összesítő táblázatok- biztosítják .	könyvelésének	5	Dat
Közben azonban az állami kézbe került kórházaknál folyamatosan járnak le a különféle szállítási szerződések .	kórházaknál	6	Ade
Orosvári olyan fontos részletekre is gondolt , hogy olyantól rendeljen , aki biztosítani tudja , hogy minden megyeszékhelyen javítani vagy cserélni tudják majd az ágyakat , ha később erre szükség lenne .	megyeszékhelyen	17	Sup
Miki Satoshi többi filmjéhez hasonlóan ez sem elsősorban a színészi játék terén emelkedik ki , hiszen vígjátékhoz méltóan mindenki egy kicsit túljátsza a szerepét , bár közel sincs akkora grimaszolás , mint a hongkongi komédiákban .	filmjéhez	3	All
Volt idő mikor még nem ez volt a trend , de én is csak ezt látom , ismerősöknél , idegeneknél , imádnak nekem mesélni , minden korosztály .	ismerősöknél	17	Ade
Vágjon bele az előadásába !	előadásába	3	Ill
A Népszabadság kiadója , a Mediaworks szombattól függesztette fel a nyomtatott lap és a Népszabadság Online kiadását “ a lap új koncepciójának kialakításáig , illetve megvalósításáig ” – állt a hivatalos közleményben .	megvalósításáig	25	Ter
A ransomware-ek jellegzetessége , hogy zárolják a gépen tárolt adatainkat , és azokat csak váltságdíjért cserébe oldják fel a támadók .	váltságdíjért	14	Cau
Pillanatig sem csodálkozom , hogy úgy en bloc ez nem segíti elő a véleménypolarozációt .	Pillanatig	0	Ter
Idővel ő is képes lesz kezelni a helyzetet , megtanulja , hogyan kell viselkedni az egyik óvónénivel és hogyan a másikkal .	óvónénivel	16	Ins
A kitelepítésről , internálásról , illetve a katonai munkaszolgálatról 4.3 .	kitelepítésről	1	Del
