Ruotsissa ei varsinaista ehdollista rangaistusta ole käytössä , vaan siellä käytetään ehdollista tuomiota , jossa ei määritellä mitään tiettyä rangaistusta seuraamukseksi tuomitun rikoksesta .	ehdollista	3	Pos
Lapinsirkka ( Melanoplus frigidus ) on Lapissa ja paikoin Kainuussa tavattava vihertävä heinäsirkkalaji .	vihertävä	11	Pos
Suurimman yksittäisen rahoituksen saa dosentti , akatemiatutkija Niklas Wahlbergin johtama tutkimushanke , jonka otsikkona on Diversification of plant-feeding insects over millions of years : what is the role of dramatic climate changes ? ( 226_200 euroa ) .	yksittäisen	1	Pos
Nokian Symbian-käyttöjärjestelmä on jäänyt Androidin ja iOS:n taakse älypuhelinmarkkinoiden kolmanneksi suosituimmaksi käyttöjärjestelmäksi .	suosituimmaksi	10	Sup
Talouden globalisoituminen on tehnyt työelämästä entistä kiihkeätempoisempaa ja kuluttavampaa , ja ilmassa on kollektiivista kaipuuta oravanpyörästä irrottautumiseen .	kiihkeätempoisempaa	6	Cmp
Talveksi se voi muuttaa lämpimämmille alueille .	lämpimämmille	4	Cmp
Tätä kutsutaan moderniksi Cunninghamiksi .	moderniksi	2	Pos
Seuraavalla välitunnilla kukaan ei enää nauranut , vaikka Niko olikin alusvaatteilla ja märillä sukilla alapihan hiekkakentällä .	Seuraavalla	0	Pos
Tämä täyteyhdistelmä oli meille oikein mieluinen ja makujakin oli riittävästi ja mastui hyvälle kylmänäkin	kylmänäkin	13	Pos
Mirian oli naimisissa iberialaisen prinsessan , Aršakiani-dynastian viimeisen hallitsijan Aspagur I:n tyttären kanssa .	iberialaisen	3	Pos
Mitä korkeampi koulutus , sitä vakaampi työura , professori Pekka Neittaanmäki sanoo tiedotteessa .	vakaampi	5	Cmp
hän haluaa kanssani lähempää kontaktia .	lähempää	3	Cmp
Tuloverotuksen kautta varoja uudelleen jakamalla estetään yhteiskunnan luomiskykyisempää osaa toteuttamasta itseään , väitti valtiovarainministeri Heiki Kranich äskettäin Päivälehdessä .	luomiskykyisempää	7	Cmp
ihaninta mitä saatoin kuvitella	ihaninta	0	Sup
Sen iho on tummempi kuin Harmaan tytön , muttei oikeasti musta eikä ruskeakaan .	Harmaan	5	Pos
Se on vieläkin Tukholman kapein katu .	kapein	4	Sup
Joukon painavimmaksi autoksi Pajero pysähtyy kohtuullisen hyvin .	painavimmaksi	1	Sup
Tärkeimpiä Hietasessa toimivia logistiikkayrityksiä ovat Steveco Oy , Nurminen Logistics Oyj ja Wallenius Wilhelmsen Logistics .	Tärkeimpiä	0	Sup
Tunnelma on siellä käsinkoskelteltavan harras ja herkkä .	herkkä	6	Pos
Rikoksen alle 21-vuotiaana tehnyt voidaan tuomita ehdollisen vankeuden tehosteeksi koeajaksi valvontaan , jos tätä on pidettävä perusteltuna tekijän sosiaalisen selviytymisen edistämiseksi sekä uusien rikosten ehkäisemiseksi .	ehdollisen	6	Pos
Naistutkimuksen ainejärjestön F-pisteen toiminta vaikutti sopivan hassulta .	hassulta	6	Pos
Terho oli vielä väsyneempi kuin minä .	väsyneempi	3	Cmp
Helsinkiläinen Ossi Lehtiö tunnisti historioitsijana Acerbin heti , mutta todisteiden kaivaminen osoittautui hankalammaksi .	hankalammaksi	12	Cmp
a ) sellaisten sopimuksen mukaisia tarkoituksia varten tuotanto- tai jakeluketjun eri tasoilla toimivan kahden tai useamman yrityksen välisten sopimusten ryhmiin , jotka koskevat ehtoja , joiden mukaisesti osapuolet voivat ostaa , myydä tai jälleenmyydä tiettyjä tavaroita tai palveluja ;	mukaisia	4	Pos
Touko oli varreltaan toisia lyhyempi ja iholtaan tummempi .	lyhyempi	4	Cmp
Ehkä daamit vain jonakin päivänä tuumivat samppanjan pehmentämissä päissään , että pitäisi keksiä ikään kuin jotakin kivaa .	kivaa	16	Pos
Mainosalan laitkin sanovat sanasensa jatkuvista alennusmyynneistä .	jatkuvista	4	Pos
Integraatio tulee olemaan niin täydellistä , että vauraampien maiden veronmaksajien odotetaan maksavan heikkojen ja epäonnistuvien EU-maiden hyvinvointijärjestelmät ja eläkerahastot , hän kirjoittaa .	vauraampien	7	Cmp
Dieselmoottori tulee olemaan 1.3-litrainen 56 kW:n tehoinen nelisylinterinen common rail -tekniikalla .	tehoinen	6	Pos
Eli voimme tänään todeta , että samalla vuosijaksolla laitamme 60 miljoonaa euroa fissioon , laitamme 15 miljoonaa euroa uusiutuviin energialähteisiin ja laitamme 200 miljoonaa euroa fuusioon , ja tästä saamme hyvän käsityksen Euroopan unionin harjoittamasta todellisesta politiikasta .	uusiutuviin	18	Pos
Lauantai 19. toukokuuta oli jaettu kahteen osaan : aamupäivällä esiintyivät helsinkiläinen power/thrash metal -yhtye Venia , ylistarolainen tekninen thrash/death metal -yhtye Luotettava Todistus , nurmijärveläinen heavy metal -yhtye Oratorio ja viimeisenä saksalainen death metal -yhtye Sacrificium .	nurmijärveläinen	24	Pos
Tuorein tapaus on viime perjantailta .	Tuorein	0	Sup
teoria joutuu kohtaamaan parempansa .	parempansa	3	Cmp
Työkaveri , mukava ja ystävällinen , meillä useasti käynyt , jatkoi .	ystävällinen	4	Pos
Teknisistä syistä istunnon puhemiehen näyttämät ja ilmoittamat nimenhuutoäänestyksen tulokset eivät vastaa tarkkaan äänestysjärjestelmän tallentamaa todellista lukua .	Teknisistä	0	Pos
Koetuista tunteista yleisin on pelko .	yleisin	2	Sup
Siinä ei ajatella nykyistä laajentumissuunnitelmaa pidemmälle .	pidemmälle	5	Cmp
Keskustaa halutaan parantaa kymmenin eri keinoin viihtyisämmäksi paikaksi , -- .	viihtyisämmäksi	6	Cmp
Laajempi yhdentyminen toisi mukanaan myös poliittista vastustusta , kun kansallisvaltiot joutuisivat luopumaan itsemääräämisoikeudestaan .	Laajempi	0	Cmp
Hänelle suurin unelma on jonakin päivänä kiivetä maailman korkeimmalle vuorelle ilman happilaitteita .	korkeimmalle	8	Sup
Hyväksyminen voidaan antaa kymmeneksi vuodeksi , mikäli kaikki kyseisen direktiivin 3 a artiklan mukaiset edellytykset täyttyvät .	kyseisen	8	Pos
Ja ovat onnellisia siitä , ettei tämmöinen ikävä tapahtuma aiheuttanut sitä tiettyä ikävää lisää tiettyihin ikäviin tilastoihin .	ikävä	7	Pos
American Photo Magazinen lukijat äänestivät Markin kaikkien aikojen vaikutusvaltaisimmaksi naisvalokuvaajaksi .	vaikutusvaltaisimmaksi	8	Sup
Bysantin keisari Herakleios ( hallitsi 610–641 ) lähti lopulta raivokkaaseen vastahyökkäykseen liitossa kasaarien kanssa ja valtasi Tbilisin vaikean piirityksen jälkeen vuonna 627 .	raivokkaaseen	9	Pos
Turun yliopiston kasvitieteellinen puutarha on saanut merkittävänä testamenttilahjoituksena kesämökkikiinteistön Kiikalasta .	merkittävänä	6	Pos
Teekkaritalolta sai kiinteämpää vatsantäytettä joten pitihän sielläkin vielä käydä ennen taistoja .	kiinteämpää	2	Cmp
Kai se aloite tuli tuolta kaupungin korkeimmasta johdosta .	korkeimmasta	6	Sup
Toisilla taas vähän lyhyempi .	lyhyempi	3	Cmp
Lindan mielestä kauneinta hänessä ovat huulet .	kauneinta	2	Sup
Onneksemme festi-isännät lainasivat hänelle sikäläiset epäluonnon valkoiset haalarit , eikä Jupsun mönjät päässeet leviämään .	sikäläiset	4	Pos
Tunnustukset jaettiin keskiviikkona tiedekunnan tilaisuudessa , jossa katsottiin myös turkulaisen humanismin tilaan .	turkulaisen	9	Pos
Se tuoksui naiselta – ei sellaiselta puhtaalta , vaan vahvalta , tummalta ja vaaralliselta .	puhtaalta	6	Pos
Samalla yhtiö voisi nykyään niin tärkeässä " asiakasläheisyydessä " nostaa profiilinsa korkeammalle tasolle kuin yksikään kilpailija .	korkeammalle	11	Cmp
Herättävät mielenkiinnon ehtymätöntä uuden virtaa kohtaan .	ehtymätöntä	2	Pos
Auto on täysin sopimaton enää mihinkään kovempaan kisaan .	kovempaan	6	Cmp
Todellinen valta siirtyy pääsihteerille ja sihteeristölle .	Todellinen	0	Pos
Arabiantimali on kooltaan lähes kulorastaan luokkaa ja se on läntisen paleartisen alueen kookkain pensastimalilaji .	kookkain	12	Sup
Omaa koulua Kottilassa ei ollut vaan koulua käytiin läheisen Räihärannan kylän koulussa .	Omaa	0	Pos
Polven nivelsiteet ovat muljahtaneet niin , että Lindros joutunee lepäämään pahimmassa tapauksessa koko marraskuun .	pahimmassa	10	Sup
Trokarit tai venäläisittäin jobbarit hankkivat leveämpää leipää ostamalla turisteilta länsitavaraa ja myymällä sitä huikeaan hintaan maanmiehilleen .	leveämpää	5	Cmp
Saloniemi , Kaipiainen ja Saari puhelivat yhä , mutta kielet jo kankeampina .	kankeampina	11	Cmp
Molla oli meidän nuorin lehmä , vasikoita lukuunottamatta , ja se oli aina hermostunu samalla lailla liiasta metelöinnistä , just niinku härät hermostuu ku ne näkee punasta .	nuorin	3	Sup
( EN ) Arvoisa puhemies , pitkäaikaisena asian esittelijänä parlamentissa suhtaudun myönteisesti EU:n ja Intian huippukokoukseen , joka pidetään hyvin pian .	pitkäaikaisena	6	Pos
136 matkustajaa on evakuoitu ; seitsemäntoista heistä kerrotaan saaneen lieviä vammoja .	lieviä	9	Pos
Lisättäköön tähän , että itse asiassa M45 eli Plejadit ( Seulaset ) ovat kirkkain syvän taivaan kohde ( avoin tähtijoukko ) , mutta tähän aikaan en siitä ollut tietoinen .	kirkkain	13	Sup
Tiedot sisältävät tarvittaessa niitä aikaisempia neljännesvuosia koskevat tiedot , joista on aiemmin toimitettu vain väliaikaisia tietoja .	aikaisempia	4	Cmp
Ne , jotka oli aina säästetty tytöistä nuorimmalle , hänelle .	nuorimmalle	7	Sup
Eurooppa olisi kilpailukykyisempi palvelun tarjoaman koulutuksen vuoksi , ja palvelun suorittaneista tulisi aktiivisempia , asioista enemmän perillä olevia ja kilpailukykyisempiä kansalaisia .	kilpailukykyisempi	2	Cmp
haaste on ilmeisesti vielä paljon kovempi kuin keväällä osattiin kuvitella .	kovempi	5	Cmp
Anttonen muistutti kuulijoille , että Venäjän markkinat ovat tärkeitä suomalaisille alueellisille palvelusektorin brandeille .	tärkeitä	8	Pos
Hän piti tiedemiesten uusia otsaryppyjä lupaavana merkkinä , mutta samalla häntä huolestutti , että osa aiemmista rypyistä oli selvästi oikeamassa .	aiemmista	15	Pos
Toivottavasti olen väärässä , mutta vaikuttaa siltä , että uusimmissa kansainvälisen yhteisön päätöksissä Iranin johdon sallitaan edelleen toimia oman mielensä mukaan .	uusimmissa	9	Sup
Maalasimme erikokoisia mukulakiviä täplikkäiksi mustapunaisiksi ja laitoimme niitä ympäri pihamaata .	mustapunaisiksi	4	Pos
Jotkut vertaavat sitä rakastumisen tunteeseen , mutta paljon , paljon vahvempaan sellaiseen , Kuypers sanoo tiedotteessa .	vahvempaan	10	Cmp
Uraanipitoista radioaktiivista nestettä on vuotanut rikkinäisestä maanalaisesta putkesta .	maanalaisesta	6	Pos
Yksinkertaisen huopakatetun mallin saa puolta halvemmalla .	halvemmalla	5	Cmp
Portin toisella puolella oli menneisyyden maailma , jossa ainoat älylliset olennot olivat ihmisiä .	älylliset	9	Pos
Blake Edwardsin Victor/Victoria on ohjaajansa onnistuneimpia teoksia .	onnistuneimpia	5	Sup
Perjantaina oltiin isohkolla porukalla Jensillä grillibileissä , jotka sujuivat kuuluisan Looping Louie- juomapelin tahdissa ja muuten juhliessa .	isohkolla	2	Pos
Toivon , että voimme sovittelumenettelyssä löytää tähän sellaisen terveeseen järkeen pohjautuvan ratkaisun , joka auttaa meitä keskittämään toimet ongelmallisimpiin aloihin sen sijaan , että kulutamme aikaa , rahaa ja energiaa kansanterveysriskin kannalta vähemmän ongelmalliseen pohjaveden hallintaan .	ongelmalliseen	33	Pos
Toyota oli hyvin vaativa isäntä ja sen ylimpään johtoon oli saatava aikaan henkilökohtaiset suhteet .	ylimpään	7	Sup
Tummanharmaa rajauskynäni loppui muutama viikko sitten ja ajattelin testata , olisiko tästä sen korvaajaksi . :)	Tummanharmaa	0	Pos
Siitä mitä on arvovapaa opetus ja tutkimus voisi keskustella paljonkin	arvovapaa	3	Pos
Oma mieheni sanoo jo ihan suoraan , että ” onko pakko lähteä noin antavassa asussa ulos ” ja tulee korjaamaan paitapuseroni ylimmänkin napin kiinni .	Oma	0	Pos
Vanhempi konstaapeli Kallio löytää tohtorin omenapuun alta torkkumasta vanhassa lepotuolissa , hellehattu silmillään .	Vanhempi	0	Cmp
Poika oli pelannut viime lauantaina ystävineen läpi yön uutta Wrath of the Lich King -lisäosaa , joka on Svenska Dagbladetin mukaan ollut huolenaihe muidenkin pelaajien vanhemmille .	vanhemmille	25	Pos
Olen edelleen sitä mieltä , että kanadalaiset olivat oikeassa , koska kalat eivät ymmärrä , missä 200 merimailin raja päättyy ja kansainväliset vedet alkavat .	kansainväliset	21	Pos
Isännöitsijä valitaan yleensä pyytämällä tarjouksiä isännöinnistä useammalta eri isännöitsijätoimistolta .	useammalta	6	Cmp
Isompi kuin kumpikaan meistä .	Isompi	0	Cmp
Älypuhelinmarkkinat kasvoivat huhti-kesäkuussa 73 prosenttia vuodentakaisesta 107,7 miljoonaan myytyyn puhelimeen .	vuodentakaisesta	5	Pos
Oikeisto tarkoittaa konservatismia kannattavia poliittisia ryhmittymiä .	poliittisia	4	Pos
Tasanteella mennään ohi pahimmasta ruuhkasta ja otetaan tiukka vasen .	pahimmasta	3	Sup
Isommalle piti antaa jotakin suuhun samalla kun hän imetti nuorinta .	Isommalle	0	Cmp
Rakennuksen napa on nyt iso tyhjä aula , josta lähtee joka suuntaan pitkiä käytäviä , näiden varsille ihmiset katoavat eivätkä koskaan kohtaa toisiaan .	tyhjä	5	Pos
* 1. tammikuuta – Bulgaria ja Romania liittyivät Euroopan unioniin , joka laajeni 27 maan laajuiseksi .	laajuiseksi	15	Pos
Puissa , pensaissa ja hangilla näyttäisi olevan kuin kalleimpia timantteja , jotka kimaltavat katuvalojen loisteessa .	kalleimpia	8	Sup
Ylivilkkaus on tavallisimpia oireita .	tavallisimpia	2	Sup
AOP on vuosittain Turuxin Turussa järjestämä seminaaritapahtuma , jonka tarkoituksena on korostaa avoimien ohjelmien käyttöä ja tuoda esiin ihmisten kokemuksia tällä saralla .	avoimien	12	Pos
Löylyssä oli mukava rentoutua ja samalla tuli laulettua ne tuttua tutummat laulutkin .	tutummat	10	Cmp
Jalmari hämmästyi huomiokykyään , mutta tajusi sen saman tien johtuvan suurimmalta osin naisen erikoisesta ulkonäöstä .	suurimmalta	10	Sup
Mediatalo Ilkka kertoi odotuksia suuremmasta tuloksesta sekä valoisista näkymistä loppuvuodelle .	suuremmasta	4	Cmp
Silloin lintuinfluenssa vaati 25-vuotiaan naisen hengen .	25-vuotiaan	3	Pos
Hiukan eilistä lämpimämmällä säällä vauhtihirmu olisi varmasti hätyytellyt Ride The Nightin nimissä olevaa SE:tä 14,4 .	lämpimämmällä	2	Cmp
Luonnosta käsitellään parhaillaan toisessa avoimessa kuulemismenettelyssä sidosryhmien kanssa .	avoimessa	4	Pos
Kesänaapuriemme nuorin tyttö vietti kesiä Saksassa ja jäi sinne naimisiin .	nuorin	1	Sup
( 4 ) Perussäännön 5.1 artiklassa edellytetään , että EKP kerää kansallisten keskuspankkien avustuksella tarvittavat tilastotiedot joko toimivaltaisilta kansallisilta viranomaisilta tai suoraan taloudellisilta toimijoilta EKPJ:n tehtävistä huolehtiakseen .	taloudellisilta	22	Pos
Mikä vieläkin kauheampaa , heidän komission kanssa tekemiensä osa-aikaista työtä koskevien sopimusten vuoksi vaikuttaa- – saamani asiakirjan mukaan – siltä , että " opettajille ei myönnetä työttömyyskorvausta , varhaiseläkettä tai sosiaaliturvaa " .	kauheampaa	2	Cmp
Vihreässä kirjassa korostetaan , että maahanpääsyssä sovellettavien menettelyjen on perustuttava vakaaseen kotouttamispolitiikkaan .	vakaaseen	10	Pos
Olemme PPE-ryhmässä tyytyväisiä siihen , että suotuisten puitteiden ja kannustimien tärkeyttä koskeva tutkimus jaetaan kahteen osaan .	suotuisten	6	Pos
Mikäli vastaus olisi myöntyvä , vanhus ja vieras sovittivat kellonajan ottelulle , joka oli yleensä vasta auringon laskeuduttua .	myöntyvä	3	Pos
Virheellisiä oletuksia tai teorioita korjataan uusilla tuloksilla , jotka ovat tosia tai ainakin vähemmän virheellisiä kuin aikaisemmat .	aikaisemmat	16	Cmp
Tuntuu vähän siltä , että mitä mustempi iho , sen vaikeampi on saada työtä .	mustempi	6	Cmp
Kotimaassaan hän edusti Kotkan Jäntevää toiseksi korkeimmalla sarjatasolla vuosina 1951 ja 1955 sekä SM-sarjassa vuosina 1952–1954 .	korkeimmalla	6	Sup
Ei ole siis mikään sattuma , että kiinnitämme erityistä huomiota ennennäkemättömään sortoon Afganistanissa , missä naisten tilanne Talebanin panttivankeina on kaikista huonoin .	huonoin	21	Sup
Christina , 29 , Julianan ja Bernhardin neljästä tyttärestä nuorin , avioitui viime vuonna kuubalaisen Jorge Guillermon kanssa .	nuorin	9	Sup
Arvoisa komission jäsen , haluamatta toistaa kaikkea , mitä muut jäsenet ovat jo sanoneet , toivon lisäksi , että kaikki nämä näkökohdat todellakin sisällytetään soveltamisalaltaan ratkaisevasti laajempaan ohjelmaan , jotta Eurooppa voi toimia kansainvälisesti johtavassa asemassa myös lentoturvallisuuden alalla .	laajempaan	26	Cmp
– Se voi olla niitä uusia ekologisia kierrätyskirjeitä .	ekologisia	6	Pos
Hän vilkaisi kompassia , muisteli karttaa ja korjasi suuntaa yhä pohjoisemmaksi .	pohjoisemmaksi	10	Cmp
Technics-koneisto on digitaalipianojen parhaita .	parhaita	3	Sup
− Akateemisen tutkimuksen ja liiketoiminnan välinen suhde on bioalalla kiinteämpi kuin muilla aloilla .	kiinteämpi	9	Cmp
4 ) Lisätään 7 artiklaan kohta seuraavasti , jolloin nykyisestä ainoasta kohdasta tulee 1 kohta :	nykyisestä	9	Pos
Kanelille maistuvia makeita raejuusto-ohukaisia tulee aina silloin tällöin paisteltua ... .	makeita	2	Pos
Tänä vuonna järjestämisvastuu oli Oulun paikallisella tietoteekkarikillalla joten matkastamme tulisi pitkä , mutta sitäkin hauskempi .	hauskempi	14	Cmp
Sillä jos leivän ylin kerros määrittää lätyn luonteen , niin silloinhan on äärimmäisen tärkeää asettaa leikkele päällimmäiseksi .	ylin	3	Pos
Miksi ne valtiot , joiden oletetaan hyväksyneen direktiivit neuvostossa , ovat sitten kuitenkin vastahakoisia soveltamaan niitä ?	vastahakoisia	13	Pos
Haagin ohjelman mukaan yhteisiin perusperiaatteisiin perustuvien puitteiden olisi muodostettava pohja EU:n tuleville aloitteille , joissa määritellään selkeät tavoitteet ja arviointikeinot .	tuleville	11	Pos
Pitää sitä jotain hyvääkin olla , majuri Nurminen sanoo .	hyvääkin	3	Pos
Tutkimusten mukaan ilmastonmuutos koettelisi pahiten kaikkein köyhimpiä maita .	köyhimpiä	6	Sup
Tuloksia tulkitessa on hyvä muistaa , että 70_000 euron bruttovuosituloilla kotitalous on vielä keskituloinen , jos tulonsaajia on perheessä useampia .	useampia	19	Cmp
On nimittäin myös huomannut , että joskus kirkkainkin aurinko pimenee .	kirkkainkin	7	Sup
Herlinien teollisuussukuun kuuluva 26-vuotias Minna Nurminen siepattiin kotoaan 27. toukokuuta 2009 ja vapautettiin 13. kesäkuuta .	26-vuotias	3	Pos
- Sinulla on yksi kuula ja meitä on kolme , parrakas ryöväri totesi .	parrakas	10	Pos
Nyt harkinta eri asumisvaihtoehtojen välillä on aiempaa visaisempaa : Taloussanomien Suomen Rahatiedolta tilaama selvitys osoittaa , että omistusasunnon ostajan lasku on paisunut vuoden aikana kuin varkain .	visaisempaa	7	Cmp
Jos on siistiä , on mukavampi olla	mukavampi	5	Cmp
Maahanmuutto on varsin uusi ilmiö varsinkin uusille , mutta myös joillekin vanhoille jäsenvaltioille .	vanhoille	11	Pos
Grande finalen pitää olla grande , eikä pienestä lurituksesta tule muuta kuin kiukkuiseksi .	kiukkuiseksi	12	Pos
Finnjet valmistui Helsingissä vuonna 1977 ollen aikanaan maailman nopein ja suurin autolautta .	nopein	8	Sup
- tiedonantajat toimittavat kansallisille keskuspankeille tarkoituksenmukaiset tiedot arvostuskäytännöstä , mukaan lukien määrällinen arviointi siitä , miten suuri prosenttiosuus niiden hallussa olevista kyseisistä instrumenteista on arvostettu eri arvostusmenetelmiä käyttäen ,	kyseisistä	21	Pos
Yhtä innostunut on opettaja .	innostunut	1	Pos
Menestystä turkulaiselle biodiversiteettitutkimukselle	turkulaiselle	1	Pos
Ja luolamies mittaa mittaamistaan , että kaikki on suorassa , niin perkeleen suorassa , että saa muut isännät näyttämään metroseksuaaleilta siviilipalvelusmiehiltä .	metroseksuaaleilta	19	Pos
Höyryveturi kaksine vaunuineen oli siitä vanhimmasta päästä .	vanhimmasta	5	Sup
Oli luonnollista , että vähän isommat hoitivat pienempiään .	pienempiään	7	Cmp
Viimeisimpänä tapauksena on Qatarin ja Arabiemiirikunnat yhdistävän kaapelin poistuminen käytöstä .	Viimeisimpänä	0	Sup
Euroalueen ostopäällikköindeksi laski heinäkuussa 50,4:ään eli alimmilleen sitten lokakuun 2009 .	alimmilleen	6	Pos
Usein nämä alueet ovat vuoristoisia ja heikommin kehittyneitä syrjäisimpiä alueita .	syrjäisimpiä	8	Sup
Kukaan ei lähde itselleen kuljettamaan tuommoista lastia .	tuommoista	5	Pos
Vuoden mittaan saattaa tulla ja tuleekin elämään kuuluvia eripuraisuuksia joko syystä tai tyhjästä , mutta jouluna muistetaan kaikki se hyvä , mitä on toisilta saatu .	tyhjästä	12	Pos
Ajetaan taajamissa öisin hiljaisia katuja pitkin keltaisten katuvalojen alla ja tehdään muistoja , jotka peittävät alleen talven .	keltaisten	6	Pos
Ei tarvitsisi kuulla isän ainaista valitusta ja pikkuveljen sydäntäraastavaa itkua .	ainaista	4	Pos
– Monesti näkee , että velkaantunut henkilö keskittyy hoitamaan jotakin yhtä tiettyä velkaa ja unohtaa samalla kaiken muun , Helsingin talous- ja velkaneuvonnan Pekka Mäki sanoo .	tiettyä	11	Pos
Index panostaa vuoden aikana myös perinteisiin tapahtumiin , joihin viime vuoden lopulla toteutetun palautekyselyn tulosten perusteella on kysyntää .	perinteisiin	5	Pos
Tulla käymään kirjojen palauttamisen tarkoituksessa on kaikkein epäilyttävintä .	epäilyttävintä	7	Sup
Jos on siisti , on mukavampi olla	mukavampi	5	Cmp
Julkiselle vallalle on ominaista , että se on luonteeltaan yksipuolista : valtaa käyttävällä on oikeus tehdä lainvoimainen oikeustoimi ilman toisen osapuolen suostumusta .	yksipuolista	9	Pos
Vihreät taas voittivat neljä uutta paikkaa , joten puolue nousi 21 paikallaan Helsingin kaupunginvaltuuston toiseksisuurimmaksi puolueeksi ohi SDP:n , jonka paikkamäärä on nyt 16 .	toiseksisuurimmaksi	14	Sup
Päällänsä ilmestyksellä oli kirkkaan keltaiset , punaisilla viiruilla koristellut housut , mokkasiinit , ja paita jossa kokoa varmastikin kolme numeroa enemmän kuin tarve vaatisi .	punaisilla	6	Pos
Se perustuu iranilaisvaikutteisiin karlukkilais-uiguurilaisiin murteisiin , joiden pohjalta kehittyivät myöhemmät uzbekin ja uiguurin kielet .	iranilaisvaikutteisiin	2	Pos
Hän oli valmis uuteen päivään tuttuine rutiineineen , tunsi lempeän lämpimän tuulenvireen rinnassaan ja olisi kiittänyt aurinkoa verbaalisesti , jos olisi ollut vähäjärkisempi .	vähäjärkisempi	22	Cmp
Viimeisin tilinpäätös on vielä kesken , mutta toistaiseksi Doranin jäljiltä ei ole ilmennyt mitään väärinkäytöksiä .	Viimeisin	0	Sup
Huono työntekijä , huono ihminen .	Huono	0	Pos
Se on kosteaa ja terävää ja pehmeää , hapuilevaa ja määrätietoista .	kosteaa	2	Pos
Lain muutosehdotus sisältää myös määräyksen , että tie on pidettävä 10 vuotta kunnossa ulkopuolistenkin kulkea .	ulkopuolistenkin	13	Pos
Eri kurssit eri oppiaineissa eivät toki ole täysin vertailukelpoisia .	vertailukelpoisia	8	Pos
2. Edellä 1 kohdassa tarkoitettujen tietojen sekä tarvittaessa kyseisiin tietoihin perustuvien taulukoiden toimittamista koskeva menettely vahvistetaan 10 artiklassa säädettyä menettelyä noudattaen .	kyseisiin	8	Pos
Kun puuvarastot alkavat kasvaa , metsänomistajien on pakko tyytyä halvempaan hintaan , jos aikovat saada puunsa kaupaksi .	halvempaan	9	Cmp
− Venäjää on Suomessa tapana tarkastella yleensä hyvin suomalaisesta näkökulmasta , sanoo Moskovan suurlähettiläs Anttonen .	suomalaisesta	8	Pos
Ajatukset muuttuvat kangastuksiksi , jos on varomaton .	varomaton	6	Pos
Sekoita kuivat aineet keskenään ja lisää ne joukkoon vatkaimella kevyesti vatkaten .	kuivat	1	Pos
Järven jää on ruman väristä , taivaalla ei näy valoa , kaikkialla on hämärää , juuri inhottavan hämärää .	hämärää	13	Pos
Tulos ei tietenkään riipu pelkästään meidän hyvästä tahdostamme - ja se on oikeastaan kaikkien näiden töiden varsinainen este , teollisen yhteistyön alallakin - vaan se riippuu myös kumppanivaltioiden hyvästä tahdosta .	varsinainen	16	Pos
Mikä siinä on , että myyjien on niin vaikea keskittyä palvelemaan ihan tavallista , nuorta asiakasta ?	nuorta	14	Pos
Lantanidikelaattejen käyttö merkkiainemolekyyleinä bioaffiniteettimäärityksissä on mahdollistanut erittäin herkkien menetelmien kehittämisen esimerkiksi kliiniseen diagnostiikkaan .	kliiniseen	11	Pos
Siksi yhteinen tietoja suodattava ja koostava kiintopiste , joka voisi toimia myös tietojenvaihtokeskuksena , olisi erittäin hyödyllinen EU:n toimielimille ja jäsenvaltioille , niin päätöksentekijöille kuin yleisöllekin .	hyödyllinen	16	Pos
Mielenterveyshäiriöiden hoito puolestaan kasvattaa terveydenhuoltomenoja ja rasittaa julkista taloutta .	julkista	7	Pos
Uusien siltayhteyksien vuoksi liikenne Linnansillalla on vähentynyt huomattavasti .	Uusien	0	Pos
Eurooppa olisi kilpailukykyisempi palvelun tarjoaman koulutuksen vuoksi , ja palvelun suorittaneista tulisi aktiivisempia , asioista enemmän perillä olevia ja kilpailukykyisempiä kansalaisia .	aktiivisempia	12	Cmp
Von Sydowin myöhemmän maineen pohjusti pääsy Bergmanin ympärilleen keräämään kiinteään työryhmään , jonka muita näyttelijäjäseniä olivat muun muassa Gunnar Björnstrand , Erland Josephson , Ingrid Thulin , Harriet Andersson ja Bibi Andersson .	myöhemmän	2	Cmp
Suomessa omaksuttua periaatetta loppusijoittaa ydinjätteet kallioperään voidaan pitää oleellisesti parempana ratkaisuna .	parempana	9	Cmp
Kari Louramo juoksi Lahden Kalevan kisoissa 19. elokuuta 2000 100 metrillä alkuerissä ajan 10,40 , joka oli silloin Suomen toiseksi paras aika Tommi Hartosen ajan 10,27 jälkeen ja nykyään se on kaikkien aikojen neljänneksi nopein suomalaisaika .	nopein	34	Sup
Tunnetuin virhetyyppi on kokonaan väärä kirjain .	Tunnetuin	0	Sup
Varpuspöllön yleisintä ruokaa ovat myyrät .	yleisintä	1	Sup
Lupaan olla seuraavat 25 vuotta varovaisempi .	varovaisempi	5	Cmp
