Pientä painostusta ilmassa , jos nyt rehellisiä ollaan .	rehellisiä	6	Llinen
Positiivinen suvaitsevaisuus tarkoittaa esimerkiksi tilannetta , jossa ollaan päästy sellaiseen yhteiskunnalliseen tilaan , ettei asioita kansalaisten välillä enää tarvitse sovitella ja ihmiset hyväksyvät toistensa erilaisuuden .	yhteiskunnalliseen	10	Llinen
Pitkä kitaraintro ryydittää akkujen latailua , eikä hysteerinen naapurin rouva ja hänen paikalle saapunut miehensäkään onnistu pilaamaan lepoani .	hysteerinen	7	Inen
- " tavarakuljetukseen tarkoitetulla tieliikenteen moottoriajoneuvolla " tarkoitetaan tavarakuljetukseen tarkoitettua yksittäistä tieliikenteen ajoneuvoa ( kuorma-auto ) tai tieliikenteen ajoneuvojen yhdistelmää , eli perävaunuyhdistelmää ( perävaunullinen kuorma-auto ) tai yhdistelmäajoneuvoa ( puoliperävaunullinen vetoauto ) ;	puoliperävaunullinen	30	Llinen
Real Snacks on vuonna 1979 perustettu pyhäntäläinen yritys .	pyhäntäläinen	6	Lainen
d ) ' matkatavaralla ' tarkoitetaan , jollei sitä ole toisin määritelty , Montrealin yleissopimuksen 17 artiklan 4 kohdassa olevan määritelmän mukaista sekä kirjattua että kirjaamatonta matkatavaraa ;	kirjaamatonta	25	Ton
Tällainen itseluottamus on sekä naisesta että miehestä hyvin kiihottavaa .	Tällainen	0	Lainen
Erilaisten tarkkailuryhmien pitäisi myös tehdä nykyistä tiiviimmin yhteistyötä .	Erilaisten	0	Lainen
Mies oli rehellinen ja vastasi , että ” helvetin hyvä perse ja sääret ” .	rehellinen	2	Llinen
Asmo Koskinen ylläpitää ja kehittää vakinaisen toimensa ohella Noormarkussa koulun päätejärjestelmää .	vakinaisen	5	Inen
Sellaista tuskin kestää yksikään puoluejohtaja .	Sellaista	0	Lainen
Tuli jotenkin tosi itsetietoinen olo siitä , miten puhuu , ja sanat ei kuulostanut yhtään omaan suuhun sopivilta .	itsetietoinen	3	Inen
Mahdollinen lakko voi aiheuttaa muutoksia lähtöaikoihin , joten oman lennon tilannetta kannattaa seurata esimerkiksi lentoyhtiön tarjoaman tekstiviestipalvelun kautta .	Mahdollinen	0	Llinen
Mahdollinen lapseni on jo aikuinen ja ymmärtää motiivini kapinaikänsä jälkeen .	Mahdollinen	0	Llinen
Myös suomalaisille yrityksille ja yhteisöille on sijaa kaupungistuvassa Kiinassa .	suomalaisille	1	Lainen
Tiettömänä synnytään , kiivaasti tietä etsitään eikä löydetä ja kun lopulta hoksataan se , lauhdutaan .	Tiettömänä	0	Ton
– Grillimakkaraa kannattaa nykytiedon valossa pitää harvinaisena herkkuna .	harvinaisena	6	Inen
– Esimerkiksi turistiripulin ensisijainen lääkehoito on joillakin alueilla käyttökelvoton .	ensisijainen	3	Inen
Aitojamakuja.fi-sivusto on elintarvikealan yritysten oma , valtakunnallinen hakupalvelu , jossa esittäytyvät erityisesti pienet ja keskisuuret elintarvikeyritykset .	valtakunnallinen	6	Llinen
Outoilijan kannattaa muutenkin olla huomaavainen ei-kaistapäitä kohtaan , mutta yliopisto on omanarvontuntoinen eikä henkilönvastaisena tai vakavana häiriönä koettu tempaus välttämättä kohtaa huumorintajua .	huomaavainen	4	Inen
Vaatimuksena on vähintään kaksi vuotta päätoimista isännöintiä tai viisi vuotta päätoimista vastaavaa kokemusta kiinteistöalalta .	päätoimista	5	Inen
Makuuhaavoja esiintyy sellaisissa ruumiinosissa , jotka joutuvat maatessa paineen alaisiksi , kuten esimerkiksi ristiluu , lantio sekä olka- ja kantapäät .	alaisiksi	9	Inen
Intia on kehittymässä menestyksekkäästi talouskasvualueeksi , jolla on merkitystä , ja meidän onkin pohdittava , mitä vaikutuksia on eurooppalaisten työpaikkojen ulkoistamisella Intiaan .	eurooppalaisten	18	Lainen
Tämä ei ole ongelma , koska pilarirakenne on ainoastaan yleinen luokittelujärjestelmä , ja kaikissa kolmessa pilarissa on järjestelmiä , joissa varoja maksetaan yksittäisille edunsaajille .	yksittäisille	22	Inen
Luin laajenevista pupilleista sanat ” jumalauta kuinka hyvännäköinen muija ” .	hyvännäköinen	7	Inen
Anttonen muistutti kuulijoille , että Venäjän markkinat ovat tärkeitä suomalaisille alueellisille palvelusektorin brandeille .	suomalaisille	9	Lainen
Kaksinkertaiselle Mannerheimristin ritarille jätti jäähyväiset joukko ritariveljiä itsensä jalkaväenkenraali Adolf Ehrnroothin johdolla .	Kaksinkertaiselle	0	Inen
Minusta tähän asiaan liittyy perusongelma : se on todennäköisesti laitonta , mutta tämä asetus kuitenkin itse asiassa kattaa sen .	laitonta	9	Ton
e ) ' erityisellä nosto-oikeudella ' tarkoitetaan Kansainvälisen valuuttarahaston määrittelemää erityistä nosto-oikeutta ;	erityisellä	3	Inen
Toisen maailmansodan aikana kaupunki oli vuoroin saksalaisten , vuoroin italialaisten valvonnassa .	Toisen	0	Inen
Yhdysvaltalaisen laivameklarin US Shipbrokersin mukaan alankomaalaisen Club Cruise -yhtiön omistuksessa ollut GTS Da Vinci eli Finnjet olisi lähtenyt tiistaina Italiasta Punaistamerta kohti , jossa se luovutettanee toukokuun puoliväliin mennessä uusille omistajille .	Yhdysvaltalaisen	0	Lainen
Tämä sama toimielin vaatii yritysmaailmaa toimimaan sosiaalisesti vastuullisella tavalla , ja kuitenkin tapa , jolla se on hoitanut tätä asiaa , on tähän mennessä ollut sosiaalisesti täysin vastuuton .	vastuuton	27	Ton
Tämä asetus on kaikilta osiltaan velvoittava , ja sitä sovelletaan sellaisenaan kaikissa jäsenvaltioissa .	sellaisenaan	10	Lainen
Teillä on täällä äärettömän valoisaa vuorokauden ympäri .	äärettömän	3	Ton
KTM-tallissa ajoi kaudella 2008 11-kertainen maailmanmestari sekä 2-kertainen GNCC sarjan mestari Juha Salminen , sekä nelinkertainen maailmanmestari Samuli Aro , ja maailmanmestari Marko Tarkkala .	nelinkertainen	15	Inen
Hän moitti muslimeja tietämättömiksi ja sanoi islamilaisen maailman alennustilan johtuvan muslimeista .	islamilaisen	6	Lainen
Siirtymäriitit eivät myöskään rajoitu tavallisesti uskonnollisiksi miellettyjen asioiden piiriin .	uskonnollisiksi	5	Llinen
Turun yliopiston kaksi monitieteistä tutkijakollegiumia kokoontuivat keskiviikkona 10.3. yhteiseen seminaariin Caloniassa .	yhteiseen	8	Inen
( Olisin tietenkin voinut kävellä alastikin , mutta matkalla pitää ohittaa kadulle antava ikkuna ja olisi ollut kiusallista katsoa alasti jotain viatonta ohikulkijaa silmiin . )	viatonta	21	Ton
Ympäristömme tahallista saastuttamista ei voida sen avulla torjua kunnolla .	tahallista	1	Llinen
Mikä siinä on , että myyjien on niin vaikea keskittyä palvelemaan ihan tavallista , nuorta asiakasta ?	tavallista	12	Llinen
Tähän on olemassa oma hyvä syynsäkin kuten Aamulehden toimittaja Riitta-Liisa Pirttikoski toteaa : " Ja miksi , sillä paras on sama : omintakeinen itsellisyys , jonka avulla seistään pystyssä , toi tuleva mitä tahansa "	omintakeinen	22	Inen
RIM:n maailmanlaajuinen myynti kasvoi kuitenkin Latinalaisen Amerikan vetämänä , missä RIM on markkinajohtaja 28 prosentin osuudellaan .	maailmanlaajuinen	1	Inen
Ne kohdistuvat kaikkein viattomimpiin siviileihin , yhteiskunnan viattomiin ihmisiin , erityisesti lapsiin , jotka ovat kaikkein haavoittuvimpia .	viattomimpiin	3	Ton
Sen alle oli maalattu säteilevä lamppu , jonka päällä oli punainen raksi .	punainen	10	Inen
Lehden mukaan taiwanilainen Android-valmistaja HTC kiri Nokian ohi .	taiwanilainen	2	Lainen
Kansalliset keskuspankit varmistavat , että näillä tiedonantomenettelyillä tuotetaan vaaditut tilastotiedot ja että niiden perusteella voidaan myös tarkistaa asianmukaisesti 3 kohdan mukaisten tietojen toimittamista , tarkkuutta , käsitteellistä vastaavuutta ja tarkistuksia koskevien vähimmäisvaatimusten noudattaminen .	käsitteellistä	26	Llinen
Tai sitten ostan vain ne aivan välttämättömät jutut , kuten valtavan kasan maitoa .	välttämättömät	6	Ton
Teos lupaa tarjota uudenlaisen näkökulman suomalaiseen kasvatus- ja koulutushistoriaan .	suomalaiseen	5	Lainen
Smetanaa lukuunottamatta varsin terveellistä herkkua . :)	terveellistä	3	Llinen
Olen saanut kasaan jonkinlaisen listauksen .	jonkinlaisen	3	Lainen
Toivon myös , että jäsenmaat omaksuvat kompromissin kasvattamalla huomattavasti tätä ohjelmaa ainakin 10 prosentilla vuodessa , jotta muutamassa vuodessa voitaisiin taata , että kaikki 18-25 -vuotiaat nuoret voivat päästä vapaaehtoispalveluun , josta tulisi siten luonnollinen osa Euroopan kansalaisten elämää .	luonnollinen	34	Llinen
- " rekisteröidyllä " tarkoitetaan jäsenvaltion virallisen laitoksen ylläpitämään tieliikenteen ajoneuvojen rekisteriin kuulumista riippumatta siitä , liittyykö tällaiseen rekisteröintiin rekisterikilpien antaminen .	tällaiseen	17	Lainen
Hietasen saarelle perusti sahan viipurilainen yritys Paul Wahl & Co. vuonna 1874 , joka siirtyi Enso-Gutzeitin omistukseen vuonna 1909 .	viipurilainen	4	Lainen
6. Myynti- , hallinto- ja muita kustannuksia sekä voittoa varten lisättyjen määrien on perustuttava tosiasialliseen tietoon , joka pohjautuu tutkittavana olevan valmistajan tai viejän samankaltaisen tuotteen valmistamiseen ja myyntiin tavanomaisessa kaupankäynnissä .	tosiasialliseen	14	Llinen
Antisemitistisiä ajatuksia ja kirjoituksia oli niilläkin , jotka eivät puolueeseen kuuluneet .	Antisemitistisiä	0	Inen
- Tällaiselle palvelulle on jo kysyntää Suomessa ja Venäjällä , Åfelt kertoi .	Tällaiselle	1	Lainen
Uusi ihminen tuli maailmaan keskiaasialaisen Kazakstanin yllä , kun ruotsalaisnainen synnytti tyttövauvan Finnairin lomalennolla Thaimaan Bangkokista Helsinkiin .	keskiaasialaisen	4	Lainen
McCain puolestaan sanoi Obaman talousmielipiteitä senaatissa vasemmistolaisiksi , äärimmäisen liberalistisiksi .	vasemmistolaisiksi	6	Lainen
Omaehtoisen , miellyttävän elämän puolesta puhuminen on nimittäin yhteiskunnallisesti vastuutonta .	vastuutonta	9	Ton
Se sinun ihmeellinen Lassesi pistää rahasi kurkustaan alas ja juottaa vielä muita naisia .	ihmeellinen	2	Llinen
Siellä esiintyy samanaikaisesti arktisia , pohjoisia , itäisiä , eurooppalaisia ja siperialaisia lintulajeja .	eurooppalaisia	9	Lainen
Vanhalle tasavallalle uskolliset senaattorit perustivat Kapinaliiton joka ryhtyi vastarintaan Impperiumia vastaan .	uskolliset	2	Llinen
Silloin tällöin kuitenkin näkisit hänet , ja aina sydämesi kompassi menisi sekaisin , ensimmäisestä kerrasta siihen viimeiseen asti .	ensimmäisestä	13	Inen
Howard Henry Baker , Jr. ( s. 15. marraskuuta 1925 ) on yhdysvaltalainen republikaanisen puolueen poliitikko .	republikaanisen	13	Inen
Saksa on yhä lähempänä saavuttaa Otto von Bismarckin unelman Euroopan laajuisesta taloudellisesta imperiumista , Oborne kirjoittaa .	taloudellisesta	11	Llinen
Hänellä on vaimonsa kanssa kaksi alle kouluikäistä lasta .	kouluikäistä	6	Inen
Ihan tavis voikkari savukinkusta , tehty tällaisilla suhteilla ... .	tällaisilla	6	Lainen
Absoluuttinen kirkkaus 11.6 .	Absoluuttinen	0	Inen
Microsoft-pohjaisten laitteiden markkinaosuus maailman älypuhelinmarkkinoilla oli vaivaisen prosentin suuruinen .	vaivaisen	6	Inen
Syömisten ja juomisten jälkeen pääsemme itse asiaan eli kuulemaan , mikä oikein on Accenture -niminen firma , ja miksi moinen pulju voisi Filen lukijoita kiinnostaa .	-niminen	14	Inen
– Semmoisen paperisenko ?	paperisenko	2	Inen
Ensinnäkin kansallisten yhteyspisteiden oikeudellisessa asemassa ja erikoistumisaloissa ja niiden käyttöön annetuissa henkilöstö- ja rahoitusresursseissa sekä teknisissä laitteissa esiintyy huomattavaa kirjavuutta , joten yhteyspisteiden sitoutumisasteet ovat myös erilaisia .	oikeudellisessa	3	Llinen
Komission ehdotuksessa , joka koskee Euroopan sosiaalirahaston toimikautta 2007–2013 , keskitytään erityisesti parantamaan vähempiosaisten yhteiskunnallista osallisuutta .	yhteiskunnallista	14	Llinen
Esimerkiksi juuri brittien yksityistämiskampanja lähti liikkeelle erilaisesta tilanteesta kuin se , missä Suomi on nyt	erilaisesta	6	Lainen
Lopuksi haluaisin todeta ja painottaa sitä , miten suuren merkityksen olen mietinnössä halunnut antaa mahdollisille muille kuin kaupallisille käyttötarkoituksille , joita takavarikoiduille tavaroille voidaan löytää .	kaupallisille	17	Llinen
Yliluonnollisen olennon tai hahmon kokenut pyrkii Hännisen mukaan selittämään asiaa usein normaaliksi .	Yliluonnollisen	0	Llinen
Ajomatkan pelottavat tapahtumat ja yllätykselliset valaistumiset saivat tauon eräällä Kiboililla , josta löytyi olutta .	yllätykselliset	4	Llinen
Ilmeisesti kirjoittajan huonosta tiedotuksesta tai edellisen päivän randombileistä / flunssa-aallosta johtuen laajasta pelaajaringistä paikalle selvisi vain neljä Digitin pelaajaa .	edellisen	5	Llinen
Onhan tuollainen oljesta tehty koira täysin tarpeeton , sotkee eteiseni , eikä siitä ole edes yhtään seuraa , mutta kun ajattelee hyviä puolia , niin sitä ei tarvitse kouluttaa , ulkoiluttaa eikä ruokkia .	tarpeeton	6	Ton
Päädyin tähän , kun ryhdyin miettimään miten monta luontaista uudistumisen hetkeä vuodessa onkaan .	luontaista	8	Inen
Jos ehdollista vankeutta yksinään on pidettävä riittämättömänä rangaistuksena rikoksesta , voidaan sen ohessa tuomita sakkoa , tai jos ehdollinen vankeus on vuotta pidempi , tuomita vähintään 20 ja enintään 90 tuntia yhdyskuntapalvelua .	ehdollinen	18	Llinen
Työ nuhraantui hikisissä käsissä , eikä edistynyt .	hikisissä	2	Inen
Tällä hetkellä asianomaista lentoliikennettä säännellään kahdenvälisillä open skies -sopimuksilla .	kahdenvälisillä	5	Inen
Onneksemme festi-isännät lainasivat hänelle sikäläiset epäluonnon valkoiset haalarit , eikä Jupsun mönjät päässeet leviämään .	sikäläiset	4	Lainen
Vaikka Iberian Khosroiani-kuninkaat olivat kristittyjä , he pysyivät yleisesti ottaen uskollisina iranilaisille herroilleen , kunnes Vakhtang I Gorgasali ( hallitsi 447–522 ) käänsi kelkkansa vuonna 482 ja toi maansa ja kirkkonsa lähemmäs Bysanttia .	iranilaisille	11	Lainen
Index panostaa vuoden aikana myös perinteisiin tapahtumiin , joihin viime vuoden lopulla toteutetun palautekyselyn tulosten perusteella on kysyntää .	perinteisiin	5	Inen
Se sisältyy muun muassa heprealaiseen , foinikialaiseen , aramealaiseen ja arabialaiseen kirjaimistoon .	aramealaiseen	8	Lainen
Leikilliset akateemiset kepposet ovat perinteisesti seuranneet tekniikan opiskelijoita Yhdysvaltojen itärannikon MIT:stä Otaniemeen .	Leikilliset	0	Llinen
Alinen on kuitenkin arvaamaton , ja se voi olla myös vaarallinen ihmiselle , joka ei tiedä varmaksi mitä on tekemässä .	vaarallinen	10	Llinen
Ennen perjantaista kuolemaa edellinen uhri oli viime kuulta .	edellinen	3	Llinen
Jos saisin viikonlopuksi joukon ihmisiä raivaamaan turhat puskat , ruman saniaismaan ja portin peittävän kuusivanhuksen , pihaan mahtuisi jopa kohtalaisen kokoinen nurmikko ja kaunis pikkuruinen kukkamaa .	kohtalaisen	19	Lainen
Tšeljabinskin hallinto ei häpeile käyttää veronmaksajien rahoja pystyäkseen huijaamaan Googlea ja venäläistä Yandex-hakukonetta .	venäläistä	11	Lainen
Kolmen A:n valtioiden hallintoa pidetään vakaina ja niiden velkakirjoja pidetään turvallisina .	turvallisina	10	Llinen
Liettualaisessa Žalgiris Kaunasin joukkueessa Möttölä oli mukana voittamassa maan mestaruutta ja cupia vuonna 2007 .	Liettualaisessa	0	Lainen
Meidän on varmistettava , että sääntelymekanismimme toimivat , ja meidän on tarkoin käsiteltävä riskejä ja uhkia sekä ratkaistava oikein tekniset pulmat .	tekniset	19	Inen
Ehdollisen vankeuden koeaika on vähintään vuosi ja enintään kolme vuotta .	Ehdollisen	0	Llinen
Sen voi tehdä esimerkiksi parin edellisen ja parin tulevan kuukauden tuloja ja menoja tarkastelemalla : paljonko rahaa tulee kuukaudessa sisään ja paljonko velkoja on maksettavana .	edellisen	5	Llinen
Seuraamme tietysti myös tämän foorumin työtä ja teemme aloitteita Barcelonan konferenssissa ensisijaiseksi asetettujen tavoitteiden mukaisesti .	ensisijaiseksi	11	Inen
Innostukseni oli vilpitön .	vilpitön	2	Ton
He lähettivät sanansaattajia kaukaisiin maihin ja kirjoittivat pitkiä artikkeleita vierasmaalaisiin lehtiin saadakseen edes pienen vinkin .	vierasmaalaisiin	9	Lainen
Maan pääkaupunki on Lutenblag , muita suuria keskuksia ovat Svetranj , Vajana , Bardjov , eteläinen Gyrorik , Lublova , rajakaupunki Sasava , teollistunut Sjerezo ja kaivoskaupunki Jdzerbo .	eteläinen	15	Lainen
Jokainen on toivon mukaan päässyt osaksi oman ainejärjestönsä toimintaa jokaiselle jäsenjärjestölle tunnusomaisen toiminnan muodossa – olipa se sitten toimintaa hallituksessa tai normaalina rivijäsenenä .	tunnusomaisen	11	Inen
Tunnilla mietin kuinka me olisimme voittamaton kaksikko kun Niko hyökkäisi ja minä puolustaisin .	voittamaton	5	Ton
Kansallisten yhteyspisteiden kahdenväliset yhteydet ovat lisääntyneet verkoston toiminnan edetessä .	kahdenväliset	2	Inen
Sodan alussa hän oli 28. saksalaisen jalkaväkirykmentin esikunnassa , ja palveli myöhemmin 83. jääkärirykmentissä , 704. jalkaväkidivisioonassa ja vielä 104. jääkäridivisioonassa .	saksalaisen	5	Lainen
Kielellistä esittämistapaansa voi käyttää myös etäännyttämiskeinona .	Kielellistä	0	Llinen
Tosiasiallisessa julkisen vallan käytössä oikeussuhteita ei sen sijaan muuteta van toteutetaan jokin käytännön toimi , esimerkiksi häirikön poistaminen julkisesta sisätilasta .	Tosiasiallisessa	0	Llinen
Teknologiansiirtoasiantuntija Timo Huttunen Turku Science Parkista kertoi yritysten eurooppalaisesta teknologiayhteistyön verkostosta .	eurooppalaisesta	8	Lainen
Vahvasti esillä tapahtumassa on myös cosplay eli anime- , peli- ja muiden kuvitteellisten hahmojen esittäminen pukeutumisen avulla .	kuvitteellisten	12	Llinen
Ajatus , että teknologian kehitys olisi siunauksellista hoitaessaan osan epämiellyttävistä tehtävistä ja lisätessään mahdollisuuksia vapaa-ajan viettoon , on naiivi virhepäätelmä .	siunauksellista	6	Llinen
Etenkin monet keskeiset suuret kaupungit kuten Strasbourg , Reims , Amiens , Caen , Périgueux ja Toulouse muuttuivat vasemmistojohtoisiksi .	vasemmistojohtoisiksi	18	Inen
Herättävät mielenkiinnon ehtymätöntä uuden virtaa kohtaan .	ehtymätöntä	2	Ton
Ne kohdistuvat kaikkein viattomimpiin siviileihin , yhteiskunnan viattomiin ihmisiin , erityisesti lapsiin , jotka ovat kaikkein haavoittuvimpia .	viattomiin	7	Ton
Chávez sai tahtonsa läpi : Venezuelan presidentin valtakausien määrä rajattomaksi	rajattomaksi	9	Ton
Tilalle oli kuitenkin tuotu kaloja sellaisilta tiloilta , joilla ei kalojen tuontihetkellä ollut direktiivin 91/67/ETY 5 eikä 6 artiklan mukaista hyväksyntää .	sellaisilta	5	Lainen
Yliluonnolliset kokemukset kuulostavat usein pelottavilta ja saavat helposti negatiivisen sävyn .	Yliluonnolliset	0	Llinen
Olen sitä mieltä , että meidän pitäisi soveltaa tätä pidätysmääräystä erittäin vakaviin rikoksiin , eikä pelkästään paljon vaatimattomampiin rikoksiin , joissa pitäisi soveltaa ensisijaisesti kansallista oikeutta .	kansallista	24	Llinen
Suomen Antifasistinen Komitea tukee venäläisen Naši-nuorisojärjestön aikomusta järjestää 23. maaliskuuta 2009 mielenosoitus Viron Helsingin suurlähetystön järjestämään seminaaria vastaan , jossa järjestäjien ilmoituksen mukaan käsitellään Neuvostoliiton rikoksia Viroa kohtaan .	Antifasistinen	1	Inen
Ihan älytön tunnelma , ihmiset vaan huusi ja lauloi , kaikki oli niin iloisia ja aidosti innoissaan , halaili tuntemattomia ja juhli yhdessä .	älytön	1	Ton
Tekninen kehitys on tällä alueella erittäin nopeaa , eikä lainsäädäntö pysy mukana .	Tekninen	0	Inen
* 13. lokakuuta 2009 : Urheiluopistosäätiötä käytetty laittomaan SDP:n rahoittamiseen	laittomaan	7	Ton
Yhdistyneen Euroopan täytyy pysyä avoinna myös näiden keski- ja itäeurooppalaisten kaupunkien asukkaille .	itäeurooppalaisten	9	Lainen
Toisella neljänneksellä Microsoft-pohjaisia laitteita myytiin 1,5 miljoonaa kappaletta , 52 prosenttia vähemmän kuin viime vuoden huhti-kesäkuussa .	Toisella	0	Inen
Silti se on edelleen addikti – ja vielä toivoton sellainen .	toivoton	8	Ton
- kansallisen tavaraliikenteen osalta : käsittää liitteen G mukaisen koodauksen ;	kansallisen	1	Llinen
( 6 ) On tarpeen muuttaa lentoliikenteen harjoittajien korvausvastuusta onnettomuustapauksissa 9 päivänä lokakuuta 1997 annettu neuvoston asetus ( EY ) N:o 2027/97 ( 5 ) sen saattamiseksi Montrealin yleissopimuksen mukaiseksi ja luoda näin korvausvastuuta kansainvälisissä ilmakuljetuksissa koskeva yhtenäinen järjestelmä .	yhtenäinen	37	Inen
Samaan aikaan kun Android- ja iOS-pohjaisten laitteiden menekki on liitänyt aina vain korkeammalle , on Microsoftin käyttöjärjestelmällä varustettujen älypuhelinten myynti laskenut viime vuodesta .	iOS-pohjaisten	5	Inen
Pääesiintyjät olivat norjalainen Frosthardr ja alankomaalainen Slechtvalk , jolle tapahtuma oli osana At the Dawn of War -kiertuettaan .	norjalainen	2	Lainen
Lainsäädännössä edellytetään isännöitsijältä ainoastaan , ettei hän ole vajaavaltainen ( alle 18-vuotias tai edunvalvonnan alainen ) eikä konkurssissa ja että hänellä on asuinpaikka Euroopan talousalueella .	vajaavaltainen	8	Inen
Nyt vielä on liian kylmä värkätä lämmittämättömässä työtilassani .	lämmittämättömässä	6	Ton
Sillä minä ja kaikki kaltaiseni nurkkapöytäläiset vain istumme ja juomme samat kahvit kuin muutkin .	kaltaiseni	4	Inen
Kyrillisiä näppäimistöjä käytetään kyrillisin kirjainmerkein kirjoitettujen kielten kirjoittamiseen .	Kyrillisiä	0	Llinen
Hän kertoi , että jonkin aikaa kolmikantasopimuksen tekemisen jälkeen komission oikeudelliselta yksiköltä kysyttiin , oliko tällainen takuu mahdollinen .	oikeudelliselta	10	Llinen
– Jos se on joku vähävarainen ja sillä on vain tämä yksi kirje .	vähävarainen	5	Inen
Monipuolinen ruokavalio turvallisin	turvallisin	2	Llinen
Tällaisesta turmeltuneesta taipumuksesta on joissakin valtioissa tullut jopa todellinen kansallista urheilua .	kansallista	9	Llinen
He olivat tyytyväisiä koulutuksen työelämäläheisyyteen , laadukkaaseen opetukseen sekä omaan ammatilliseen kehittymiseensä .	ammatilliseen	10	Llinen
Ajatukset muuttuvat kangastuksiksi , jos on varomaton .	varomaton	6	Ton
Maksuttoman palvelun avulla käyttäjä voi arvioida allergiaoireidensa yhteyttä siitepölymääriin .	Maksuttoman	0	Ton
Naisten syrjinnän poistamista koskeva CEDAW-sopimus on 30-vuotiaana yhä hyvin ajankohtainen .	ajankohtainen	9	Inen
Tavallinen tapa torjua gambiitti on pelata 2 ... Lc5 .	Tavallinen	0	Llinen
Joku Roti Records ( lyh. JRR ) on lappilainen hip hop -musiikkiin keskittynyt levy-yhtiö .	lappilainen	8	Lainen
Kirsti Marjatta Hollming ( 2. marraskuuta 1932 Heinola – 3. lokakuuta 1978 Siilinjärvi ) oli suomalainen , Kansallista Kokoomusta edustanut poliitikko .	Kansallista	17	Llinen
Alinen on kuitenkin arvaamaton , ja se voi olla myös vaarallinen ihmiselle , joka ei tiedä varmaksi mitä on tekemässä .	arvaamaton	3	Ton
Eikä siitä ole epäilystäkään , mikäli on alkuvuoden upean aktiivisiin hallituslaisiin ja teihin jäseniin uskominen .	aktiivisiin	9	Inen
Ensimmäinen kolmelta viimeiseltä kierrokselta karsiutuja oli Zelezny .	viimeiseltä	2	Inen
Alun perin brittiläinen talli muuttui kesällä 1990 sveitsiläiseksi , ja tallin nimi muutettiin Monteverdiksi .	sveitsiläiseksi	7	Lainen
meillä voisi olla tarve tukea ja kannustaa sitä , mikä meidän suomalaisessa kulttuurissamme on hyvää , niin filmissä kuin kirjallisuudessa kuin paljossa muussakin .	suomalaisessa	11	Lainen
( 4 ) Perussäännön 5.1 artiklassa edellytetään , että EKP kerää kansallisten keskuspankkien avustuksella tarvittavat tilastotiedot joko toimivaltaisilta kansallisilta viranomaisilta tai suoraan taloudellisilta toimijoilta EKPJ:n tehtävistä huolehtiakseen .	taloudellisilta	22	Llinen
Kesäyliopiston idea on kerätä eurooppalaisia nuoria pariksi viikoksi yhteen viettämään unohtumatonta kesää .	unohtumatonta	10	Ton
Älytavaroideni epätoivoinen vaikerrus kaikui syyttävänä korvissani .	epätoivoinen	1	Inen
[ pic ] | EUROOPAN YHTEISÖJEN KOMISSIO | Bryssel 28.11.2005 KOM(2005) 606 lopullinen VIHREÄ KIRJA EUROOPAN MUUTTOLIIKEIDEN VERKOSTON TULEVAISUUDESTA ( komission esittämä )	lopullinen	12	Llinen
Kolmanneksi tässäkin raportissa ympäristönäkökohtien sisällyttäminen Lissabonin strategiaan vaikuttaa todella pelkältä nimelliseltä eleeltä .	nimelliseltä	10	Llinen
Leikkaa levyistä kevyesti reunat pois -> samalla levyt tulevat varmasti samankokoisiksi .	samankokoisiksi	10	Inen
Kirjakielet perustuivat arabialaiseen kirjaimistoon , joka soveltui huonosti turkkilaisten kielten äänteiden merkitsemiseen .	arabialaiseen	2	Lainen
Intialainen Abhinav Bindra voitti kilpailun 700,5 pistellä .	Intialainen	0	Lainen
Tai se on - en oleta sitä teidän osalta , mutta niiden , jotka tekivät sopimuksen sillä tavalla ja jotka myös soveltavat turvallisuuslauseketta niin yksipuolisesti - kyynistä asianomaisen väestön ongelmien ylenkatsomista .	asianomaisen	27	Inen
Tää on nyt ihan täysin turvallisuuden takia , miettikää jos mun Eurooppalainen sairaanhoitokortti jäisi kotiin kun kaadun ( taas ) pyörällä ja kukaan ei suostuisi hoitaa mua sairaalassa ? ?	Eurooppalainen	11	Lainen
Mirian oli naimisissa iberialaisen prinsessan , Aršakiani-dynastian viimeisen hallitsijan Aspagur I:n tyttären kanssa .	iberialaisen	3	Lainen
Antibiooteilla kyllästetyssä lihassa on lääkkeelle vastustuskykyisiä bakteereja , jotka voivat siirtyä lihan syöjään , kirjoittaa Aamulehti .	vastustuskykyisiä	5	Inen
Lajin kanta on elinvoimainen .	elinvoimainen	3	Inen
Terveellinen , hyvää tekevä ruoka on myös herkullista .	herkullista	7	Llinen
Vaikka työt aloitettiinkin julkisin varoin , yksityinen rahoitus kattoi lopulta valtaosan puiston kustannuksista .	julkisin	3	Inen
Norjan ja Suomen asemat ovat toiset .	toiset	5	Inen
