Poliisi sai tiedon ruumiista tuntemattomasta vihjeestä .	tuntemattomasta	4	Ton
Sitä pidetään Dolenjskan alueen taloudellisena ja kulttuurillisena keskuksena .	taloudellisena	4	Llinen
( Olisin tietenkin voinut kävellä alastikin , mutta matkalla pitää ohittaa kadulle antava ikkuna ja olisi ollut kiusallista katsoa alasti jotain viatonta ohikulkijaa silmiin . )	kiusallista	17	Llinen
Arvoisa puhemies , joka vuosi juhlimme kansainvälistä naistenpäivää ja joka vuosi päädymme samaan surulliseen johtopäätökseen : tasa-arvo , siinä määrin kuin se on toteutunut , koskee vain vähemmistöä kaikista maailman naisista .	surulliseen	13	Llinen
Hän mainitsi vielä esimerkkinä nämä silikoniotsaiset tieteenharjoittajat , jotka olivat koettaneet huiputtaa itsensä huipulle .	silikoniotsaiset	5	Inen
Binderup ei usko liberaaleissa autonomisissa yhteiskunnissa koskaan tultavan sellaiseen pisteeseen , etteikö suvaitsemattomuutta enää ilmenisi tai asian ympärillä käytäisi jonkinlaisia kamppailuja .	jonkinlaisia	19	Lainen
Juuri tuollainen tyypillinen tapaus , joka on vähän käynyt potkimassa jossain itsepuolustustunneilla , sitten iskenyt joltain toiselta lähiöpermanentilta hampaat narikkajonossa sisään koska vinot viikset kasvattanut poikaystävä on duunannut sitä jossain kusisessa vessassa .	tyypillinen	2	Llinen
Esimerkiksi Siperian shamanismissa kosmos on kolmikerroksinen : alimpana sijaitsee alinen — maailma , joka sisältää kaaosmaisia , järjestymättömiä ja jäsentymättömiä olentoja ja voimia .	jäsentymättömiä	19	Ton
– Meillä on hyvät moraalinen , poliittinen ja laillinen oikeutus Libyan laillisena , itsenäisenä ja suosittuna hallituksena , informaatioministeriön kirjoittamassa kirjeessä kirjoitetaan .	laillisena	11	Llinen
Pinkka kulkee kädestä käteen hörähdysten seuraamana : monet antavat sen tottumuksesta eteenpäin ennen kuin huomaavat saaneensa ohjeet , kuinka suorittaa klo 12.40 toimenpidevapaa ” opiskelijamoraalin parantaminen ja akateemisten muistojen valmistus näennäis-spontaanilla aerodynamiikan demonstraatiolla . ”	akateemisten	27	Inen
Täytyy myöntää , että huoneeseeni päästyä kiedoin kerran käytetyn pyyhkeen pitkiin hiuksiini ja peitin puhtaan varteni kylpytakilla , mutta jos olisin lyhythiuksinen ja kiireinen , olisin voinut aivan hyvin vain pyyhkäistä hiukseni kuivaksi ( käsipyyhkeeseen ) ja pukeutua samantien .	kiireinen	23	Inen
Junassa matkustamisesta on tullut yhtä hienoa ja liikemiesmäistä kuin lentämisestä .	liikemiesmäistä	7	Inen
Kuvanauhan perusteella hän piti hallussaan ja käytti laitonta puhelinlaitetta ohjelmassa .	laitonta	7	Ton
* Albumin alkuperäinen tarkoitus oli ilmestyä DVD:nä , mutta yhtye ei ollut tyytyväinen videon laatuun , joten keikka tyydyttiin julkaisemaan CD:nä .	alkuperäinen	2	Inen
Pakko alkaa lukemaan ranskankielisiä lehtiä ja kirjoja ja mentävä jollekin kurssille syksyllä , oli sen verran traumaattinen kokemus toi kielen unohtaminen .	traumaattinen	16	Inen
Esimerkiksi tanskalaiset tuotantoeläimet saavat kaksi kertaa enemmän antibiootteja kuin suomalaiset eläimet .	tanskalaiset	1	Lainen
Se tuoksui naiselta – ei sellaiselta puhtaalta , vaan vahvalta , tummalta ja vaaralliselta .	vaaralliselta	13	Llinen
– Myös tällaisessa tilanteessa tulevaa pitäisi jaksaa ennakoida ja ottaa yhteyttä velkojiin mahdollisimman nopeasti .	tällaisessa	2	Lainen
Paul Gallagher ( s. 9. elokuuta 1984 Glasgow , Skotlanti ) on skotlantilainen jalkapalloilija , joka edustaa Englannin Valioliigassa pelaavaa Blackburn Roversia .	skotlantilainen	12	Lainen
Suuri osa suomalaisista sanoo yhä pysyvänsä luterilaisen kirkon yhteydessä lähinnä “ kasteen , häiden ja hautajaisten ” vuoksi .	luterilaisen	6	Lainen
Pohjois-Amerikasta listalle kuuluu Yhdysvaltain lisäksi Kanada , muuten AAA-kerho on hyvin Eurooppa-keskeinen lukuun ottamatta Uutta-Seelantia ja Singaporea .	Eurooppa-keskeinen	11	Inen
* 12. toukokuuta – Hartwall-areenalla Helsingissä pidettyjen kolmipäiväisten Eurovisionin laulukilpailun finaalissa voittajaksi valittiin Serbian edustaja Marija Šerifović kappaleella Molitva .	kolmipäiväisten	7	Inen
Kalifornialainen psykiatri Ronald C. Thurston taas arvioi , etteivät potilaat osaa kovinkaan hyvin arvioida hoitoon tarvittavien teknologioiden ja taitojen merkitystä .	Kalifornialainen	0	Lainen
* Kultaisen ordan türki , jota käytettiin 1300-luvulta lähtien tataarien kaanikuntien virallisena kielenä Volgan alueella sekä Syrdarjan alajuoksulla .	virallisena	11	Llinen
Tapahtuma tarjoaa järjestäjien mukaan kävijöilleen paljon mielenkiintoista ohjelmaa kolmen euron pääsymaksulla .	mielenkiintoista	6	Inen
Hänen mielestään tarvittaisiin puolueeton taho arvioimaan , toteuttaako YLE julkisen palvelun tehtävää , ja ratkaisemaan mahdollisia kiistoja siitä , onko jokin YLEn toiminta julkista palvelua .	puolueeton	3	Ton
Ruotsissa ei varsinaista ehdollista rangaistusta ole käytössä , vaan siellä käytetään ehdollista tuomiota , jossa ei määritellä mitään tiettyä rangaistusta seuraamukseksi tuomitun rikoksesta .	ehdollista	11	Llinen
Punkalaitumella on päädytty vastakkaiselle kannalle ja päätetty säilyttää kunnan kunnallinen itsenäisyys .	kunnallinen	9	Llinen
Emme voi sivuuttaa tätä , vaan meidän täytyy vaatia tämän epäinhimillisen politiikan lopettamista .	epäinhimillisen	10	Llinen
Se ei ole näkökanta , jossa ajettaisiin alan markkinoiden rajoittamatonta , eriyttämätöntä avaamista , vaan se on näkökanta , joka edustaa rautatieliikenteen järkevää eurooppalaistamista .	rajoittamatonta	9	Ton
Turvallisuutta enemmän tarpeeton tavara tuo levottomuutta ja ahdistuneisuutta .	tarpeeton	2	Ton
Grafiikka on onnellisessa asemassa siinä , että sekä kaupallisilla että aatteellisilla että taiteellisilla yhteisöillä on intressinsä juhlia omiaan .	aatteellisilla	10	Llinen
( 8 ) Sisäisillä ilmailumarkkinoilla ei enää erotella kansallisia ja kansainvälisiä kuljetuksia , minkä vuoksi Euroopan yhteisön sisällä on aiheellista soveltaa samantasoista ja -luonteista korvausvastuuta sekä kansainvälisissä että kansallisissa kuljetuksissa .	kansallisissa	28	Llinen
Se pyörä oli kyllä ihan rämä , ketjut ruosteessa , tais olla siinä puun juurella maannu edellisistä tulvista saakka .	edellisistä	16	Llinen
2 ) Jäämien enimmäismäärät voidaan vahvistaa vasta , kun eläinlääkekomitea on tutkinut kaikki asiaan liittyvät tiedot kyseisen aineen jäämien turvalllisuudesta eläinperäisten elintarvikkeiden kuluttajalle ja niiden vaikutuksesta elintarvikkeiden teolliseen jalostukseen .	teolliseen	27	Llinen
Enintään kahden vuoden vankeusrangaistus voidaan määrätä ehdolliseksi , jollei rikoksen vakavuus , rikoksesta ilmenevä tekijän syyllisyys tai tekijän aikaisempi rikollisuus edellytä ehdottomaan vankeuteen tuomitsemista .	ehdolliseksi	6	Llinen
Keski-Aasian türkiin ovat vaikuttaneet myös kiptšakkilaiset ( nykyiset kazakin ja karakalpakin kielet ) sekä itäoguusilaiset murteet ( nykyinen turkmeeni ) , khorasaninturkki sekä uzbekin kielen oguusilaismurre .	itäoguusilaiset	14	Lainen
Albert Edelfeltin maalaus Chez l'Artiste myytiin eurooppalaiselle taidekauppiaalle 413_000 euron hinnasta New Yorkin taidehuutokaupassa tiistaina .	eurooppalaiselle	6	Lainen
* 1969 – Kylmä sota : neuvostoliittolainen sukellusvene K-19 ja yhdysvaltalainen sukellusvene USS Gato törmäsivät Barentsinmerellä .	neuvostoliittolainen	6	Lainen
Vuoden ensimmäisellä neljänneksellä yksiöiden keskivuokra oli 19,28 euroa neliöltä .	ensimmäisellä	1	Inen
Tästä syystä neuvotteluissa keskityttiin jäsenvaltioiden , komission ja muiden sidosryhmien esiin tuomiin asioihin , jotka voisivat mahdollisesti aiheuttaa vaikeuksia direktiivin saattamisessa osaksi kansallista lainsäädäntöä ja jotka voisivat johtaa direktiivin erilaisiin tulkintoihin jäsenvaltioissa .	erilaisiin	29	Lainen
Useimmat jäsenvaltiot ovat määrittäneet tämänkaltaiset erilliset säännökset Yhdysvaltojen kanssa .	erilliset	5	Llinen
Julkisiin palveluihin kuuluvat televisiotoiminnan ohella radio , Internet-palvelu ja mobiilipalvelut .	Julkisiin	0	Inen
Hyväksyminen voidaan antaa kymmeneksi vuodeksi , mikäli kaikki kyseisen direktiivin 3 a artiklan mukaiset edellytykset täyttyvät .	kyseisen	8	Inen
Hallintovirkamies hymyili tyytyväisenä .	tyytyväisenä	2	Inen
Kuivasin siis itseni käsipyyhkeeseen , löysin onnekseni kodinhoitohuoneesta puhtaat ja silitetyt alushousut ja kävelin onnellisena kuivana huoneeseeni ilman turhaa suurta pyyhettä .	onnellisena	14	Llinen
Tämä asetus tulee voimaan kolmantena päivänä sen jälkeen , kun se on julkaistu Euroopan yhteisöjen virallisessa lehdessä .	virallisessa	15	Llinen
Kun seuraavan kerran huomaan nukkuneeni läpi tilastotieteen luennon , imuroineeni viimeksi kuukausi sitten tai vaihtavani tenttikirjat kriittisellä hetkellä Facebookiin , voin unohtaa raastavat itsesyytökset ja tuudittautua seuraavaan ajatukseen : Työnteko on niin last season .	kriittisellä	16	Inen
Sitä kutsutaan myös horezminturkiksi ja kiptšakkilais-oguusilaiseksi kirjakieleksi .	kiptšakkilais-oguusilaiseksi	5	Lainen
5. Kustannukset lasketaan tavallisesti tutkimuksen kohteena olevan osapuolen kirjanpitomerkintöjen perusteella sillä edellytyksellä , että nämä merkinnät on tehty kyseisessä maassa yleisesti hyväksyttyjen kirjanpitoperiaatteiden mukaisesti ja ne antavat kohtuullisen hyvän käsityksen kyseisen tuotteen valmistukseen ja myyntiin liittyvistä kustannuksista .	kohtuullisen	27	Llinen
Myös muualla maailmassa savugeneraattoria käytettiin paljon ; amerikkalaiset asensivat niitä hävittäjiin ja saattuehävittäjiin , koska savuverho oli tehokas keino eritoten tutkattomia tai enintään heikkotasoisen tutkan omaavia japanilaisia sotalaivoja vastaan .	japanilaisia	26	Lainen
Risperidonin kemiallinen kaava on C23H27N4FO2 , moolimassa 410,485 g/mol ja CAS-numero 106266-06-2 .	kemiallinen	1	Llinen
Erityistä huomiota on kiinnitettävä Euroopan unionin 284 saaren 9,4 miljoonaan asukkaaseen : kolme prosenttia koko väestöstä asuu 95_000 neliökilometrin kokoisella alueella .	kokoisella	19	Inen
Vartin venähdettyä yllättäen kolminkertaiseksi riennän myöhässä yliopistolle omatunto kolkuttaen siitä , etten ehtinyt edes lukea sanomalehteä – joudun julkeasti astumaan ulkomaailmaan tietämättä tämänpäiväisestä maailmantilasta mitään !	tämänpäiväisestä	22	Inen
Kyseessä täytyy olla jotain erityistä , jos kaksi turkulaisen ainejärjestölehden toimittajaa on eksynyt Länsi-Venäjälle asti jutuntekoon .	turkulaisen	8	Lainen
Türki ( 1000-luvulta lähtien türkčä tai türk tili , myöhemmin türkī ) on eräiden turkkilaisten kansojen historiallisista kirjakielistä käytetty nimitys .	turkkilaisten	14	Lainen
Maastrichtin yliopistossa Hollannissa aloitetaan tutkimus ekstaasin käytön myönteisistä vaikutuksista .	myönteisistä	7	Inen
Jos haluaa nähdä ja kokea yöttömän yön ei pidä jäädä junasta Tampereella ja ryhtyä kiukuttelemaan laskevalle auringolle .	yöttömän	5	Ton
Ma oon ollu , sillon tällön tollasessa , erilaisis tilaisuuksis niin ku säestämässä , jotai yksillaulajaa tai , sellasta , esimerkiks jossai häissä mä oon olluj ja , tommosissa	tommosissa	28	Inen
Tekninen puoli on tekstin lopussa , eli jos koodi kiinnostaa , mene suoraan sinne :)	Tekninen	0	Inen
Olisi ollut mukava saada jonkinlainen arvio rahoituksesta .	jonkinlainen	4	Lainen
Japanilaisten autojen myynti oli vuonna 2007 alimmillaan sitten vuoden 1973 .	Japanilaisten	0	Lainen
( 4 ) GATT-sopimuksessa vahvistettujen oikeuksien ja velvollisuuksien tasapainon säilyttämiseksi näitä sääntöjä sovellettaessa on erittäin tärkeää , että yhteisö ottaa huomioon sen , miten sen pääasialliset kauppakumppanit tulkitsevat niitä ;	pääasialliset	25	Llinen
Ja tästä seuraa helposti , että katsoja on se , joka menee riman alta uskollisena taiteen pyhäinjäännöksille .	uskollisena	14	Llinen
* 27. huhtikuuta 2009 : Ennakkoäänestyksellä ennätyksellinen suosio USA:n presidentinvaaleissa	ennätyksellinen	6	Llinen
Mahdollisia sivumääriä oppimispäiväkirjalle olivat siis 1 , 2 , 11 ja 22 .	Mahdollisia	0	Llinen
- kyseisellä lennolla sovellettavasta lentoliikenteen harjoittajan korvausvastuun rajasta kuolemantapauksessa tai loukkaantumisen yhteydessä , jos tällainen raja on olemassa ,	tällainen	14	Lainen
Kolmantena rallissa on 8,1 sekunnin päässä Hirvosesta norjalainen Henning Solberg .	norjalainen	7	Lainen
Sinä sanoit , että meillä on Suomessa kolmenlaisia huijareita .	kolmenlaisia	7	Lainen
Järvenselkää pitkin taivalsi lintu , erikoisen näköinen otus .	näköinen	6	Inen
Komissio on toiminut häpeällisellä tavalla .	häpeällisellä	3	Llinen
Kun väistämätön markkinoiden laskusuhdanne alkoi , jotkin varannoista osoittautuivat riittämättömiksi .	riittämättömiksi	9	Ton
Suomalaisista 46 prosenttia pitää sormenjälkiä henkilökohtaisena tietona .	henkilökohtaisena	5	Inen
Ehkä se on se , ettei ole puhunut muille ihmisille virallisempaa suomen kieltä pitkään aikaan , vaan höpöttelee ainoastaan tutuille ...	virallisempaa	10	Llinen
On se Eurooppa sen verran verkkainen liikkeiltään .	verkkainen	5	Inen
Åsbrink työskenteli 1997 Punaisen Ristin edustajana Bakussa ja kuuli asukkailta heidän muistojaan Nobeleista .	Punaisen	3	Inen
200_000 dollaria maksava Diablo oli luokkansa autoksi yllättävän askeettinen , CD-soitinkin oli lisävaruste , sähköikkunoita tai sähkötoimisia penkkejä ei ollut saatavilla , eikä myöskään lukkiutumattomia jarruja .	askeettinen	8	Inen
Muutaman kerran ujosti sanot ' moi ' kun törmäätte koulunkäytävillä ja melkein myyt maailmasi , kun saat tietää hänen olevan sellainen , tiedättehän , helposti muiden matkaan menevä .	sellainen	20	Lainen
Muista asiakirjoista käy ilmi täysin tavanomainen kielikoulutuksen suunnittelu ajanjaksolle 2004–2005 , mutta yhtäkkiä , kesäkuussa 2004 , opettajat saivat kuulla äkillisestä irtisanomisestaan .	tavanomainen	5	Inen
Sen sijaan että orjuuttaisimme itseämme hamassa tulevaisuudessa epämääräisesti häämöttävän palkinnon toivossa , tulisi meidän vapautua suorituspaineistamme , karistaa ylimääräinen vastuuntunto harteiltamme ja ryhtyä nauttimaan raukeasta elämästä .	ylimääräinen	18	Inen
Turkulaisten toimijoiden lisäksi keskeisiä yhteistyökumppaneita ovat esimerkiksi tukholmalaiset yliopistot Karolinska Institutet ja Kungliga Tekniska högskolan .	tukholmalaiset	7	Lainen
– Koko Eurooppa on erittäin vaarallisessa tilanteessa .	vaarallisessa	5	Llinen
Kaksoistorneihin kohdistettu hirveä attentaatti sai aikaan sen , että vihdoinkin tämän eurooppalaisen pidätysmääräyksen luomisessa alettiin edistyä , mutta kun näen , että sitä sovelletaankin " kanavarkaiden " kohdalla , tulen jotenkin surulliseksi .	surulliseksi	31	Llinen
Voinen tässä vaiheessa jo turvallisesti todeta , että Iron Sky tulee olemaan eräs tunnetuimmista suomalaisista elokuvista ja se tasoittaa tietä kaikille muille vastaaville nyt tekeillä oleville ( esimerkiksi The Cosmonaut ) sekä tulevaisuudessa vastaavalla tavalla tehtäville elokuville .	suomalaisista	14	Lainen
Georgialainen historioitsija Giorgi Melikišvili on kuitenkin epäillyt khosroidien iranilaista alkuperää ja pitänyt heitä paikallisena dynastiana , joka keksi itselleen myyttisen ulkomaalaisen alkuperän , mikä ei ollut vastaavissa tilanteissa lainkaan epätavallista .	iranilaista	8	Lainen
Ruotsalaisen Husabergin osto vuonna 1995 ja uusi " hard enduro " -konsepti puri ostajiin ja KTM valmistaa nykyään noin 80_000 moottoripyörää vuosittain liikevaihdon ollessa lähes puoli miljardia euroa .	Ruotsalaisen	0	Lainen
Iltapäivällä Espanjan valtion kymmenvuotisen lainan korko oli noussut 6,39 prosenttiin ja ero Saksan liittovaltion vastaavan lainan korkoon levinnyt 399 korkopisteeseen .	kymmenvuotisen	3	Inen
* 31. toukokuuta 2009 : Venäjän liittyminen Euroopan unioniin ei saa kannatusta suomalaisilta eurovaaliehdokkailta	suomalaisilta	12	Lainen
Yritykset ja yhteisöt , joiden vuosittainen liikevaihto on yli 400_000 euroa , maksaisivat mediamaksua noin kolminkertaisen määrän .	kolminkertaisen	15	Inen
Stalinin ja Hitlerin kaltaiset diktaattorit ovat kohdelleet vastarannankiiskejä erityisen kovilla otteilla .	kaltaiset	3	Inen
Tietenkin Chinaski on fiktiivinen henkilö ja tietenkin Bukowskin on täytynyt kirjoittaa hänen saavan jostain rahaa , mutta hän voisi aivan hyvin olla todellinen , eikä siksi ole väärin verrata itseäni häneen .	todellinen	22	Llinen
Inflaatio nousee , ja Euroopan keskuspankin epätavalliset liikkeet eurokriisissä lyövät vettä myllyyn .	epätavalliset	6	Llinen
Koneellinen ilmastointi pitää huolen siitä , että kapselissa vetää ja suhisee kaiken aikaa .	Koneellinen	0	Llinen
Toiminta perustuu tuhansiin vapaaehtoisiin nuoriin , jotka järjestävät kansanvälistä ohjelmaa .	vapaaehtoisiin	3	Inen
Mitalin myöntämisestä päättävän lautakunnan perustelu mitalin myöntämiselle oli , että Vuorio on huomattavalla tavalla toiminut Turun yliopiston henkisten päämäärien hyväksi ja aineellisen vaurastumisen edistämiseksi .	aineellisen	21	Llinen
Ongelmaksi muodostuu se , että vähemmistöt joutuvat marginaaliin usein vain koska valtaväestö ei pidä niistä , vaikka niillä olisikin laillisesti tasa-arvoiset oikeudet .	tasa-arvoiset	20	Inen
Oli muutenkin aurinkoinen ja nätti päivä , joten kadut olivat ihan täynnä porukkaa jotka vaan juhli ja tanssi :)	aurinkoinen	2	Inen
Vapaan kaupankäynnin turmiolliset seuraukset ovat helposti nähtävissä tässä asiassa eikä 38 kohta tässä suhteessa ole riittävä .	turmiolliset	2	Llinen
Räisäsen mukaan suhdannepoliittiset toimenpiteet olivat taantuman aikaan liian vaatimattomia ja ne tulivat liian myöhään .	vaatimattomia	8	Ton
Usein nämä alueet ovat vuoristoisia ja heikommin kehittyneitä syrjäisimpiä alueita .	syrjäisimpiä	8	Inen
Ei vielä julkaistu virallisessa lehdessä .	virallisessa	3	Llinen
Tämä rajoitus ei voi hyötykuorman osalta olla yli 3,5 tonnia eikä yksittäisen ajoneuvon suurimman sallitun massan osalta yli 6 tonnia .	yksittäisen	11	Inen
Näin sen selvästi , kuinka avuttomat ja nauhattomat lenkkitossut upposivat taas kuralammikon pohjalle .	nauhattomat	7	Ton
Jäähyväiset ovat sietämättömiä .	sietämättömiä	2	Ton
Useat asiantuntijat ja johtavat taloustieteilijät ovat sanoneet euroalueen kriisin johtuvan rakenteellisista valuvirheistä .	rakenteellisista	10	Llinen
Kirjakielet perustuivat arabialaiseen kirjaimistoon , joka soveltui huonosti turkkilaisten kielten äänteiden merkitsemiseen .	turkkilaisten	8	Lainen
Peli on näissä muunnelmissa usein rauhallisempaa kuin klassisemmissa muunnelmissa .	rauhallisempaa	5	Llinen
Ennen kuin Jalmari huomasikaan , hän seurasi ilmassa leijailevaa reipasta rallatusta , joka lopulta opastaisi hänet jonkinlaiselle vaatturille .	jonkinlaiselle	16	Lainen
Kreviini-nimitystä alkoivat käyttää latvialaiset ( latviaksi krieviņi , alunperin tarkoittanut " venäläisiä " ) .	venäläisiä	11	Lainen
Näin ollen Index peittoaa kirjaimellisesti vaikutuspiiriinsä kaikki yhteiskuntatieteellisen tiedekunnan yksittäiset oppiaineet .	yksittäiset	9	Inen
Tämä on minusta erittäin mielenkiintoista , sillä kun lentoemännät ovat flunssassa eivätkä voi työskennellä lentoyhtiön lennoilla , henkilöstövajaus on täytettävä välittömästi tällaisissa tilanteissa .	tällaisissa	21	Lainen
( 14 ) Onnettomuuksien uhrien ja heidän huollettaviensa lyhyen aikavälin taloudellista tilannetta on toivottavaa helpottaa välittömästi onnettomuuden jälkeen .	taloudellista	10	Llinen
Viimeiset kaksi vuotta Suomen Moskovan suurlähettiläänä toiminut Matti Anttonen esitteli vierailuluennollaan Turun kauppakorkeakoulussa erilaisia näkökulmia nyky-Venäjään ja sen talouteen .	Viimeiset	0	Inen
CEIOPS:llä on kuitenkin tärkeä direktiivin 21 artiklan 2 kohtaan liittyvä tehtävä , ja valvojien " on tehtävä tiivistä yhteistyötä ammatillisia lisäeläkkeitä tarjoavien laitosten toiminnan valvonnan helpottamiseksi " .	ammatillisia	19	Llinen
Eteläsaari , joka on harvempaan asuttua , on järistyspotentiaaliltaan aktiivisempaa , mutta maan ollessa suhteellisen pieni ja ohkainen tutinan kyllä tuntee – puhumattakaan mahdollisesta jälkitsunamista .	aktiivisempaa	9	Inen
Inhimillisten erehdysten takia laskeutumisalus tuhoutui saapuessaan Marsin kaasukehään , hajoten pieniksi paloiksi kamaralle .	Inhimillisten	0	Llinen
3. Komissio voi julkaista asianomaiselle jäsenvaltiolle lähettämänsä ilmoituksen sisällön Euroopan yhteisöjen virallisessa lehdessä , ja se toimittaa sen viipymättä kaikille osapuolille , jotka tätä pyytävät .	virallisessa	11	Llinen
Palkintoperusteluissa todetaan , että Pekka Kääpä on ollut avainhenkilönä Turun yliopiston lääketieteellisessä tiedekunnassa vuosina 2001–2008 toteutetussa opintouudistuksessa .	lääketieteellisessä	11	Llinen
Olemme PPE-ryhmässä tyytyväisiä siihen , että suotuisten puitteiden ja kannustimien tärkeyttä koskeva tutkimus jaetaan kahteen osaan .	suotuisten	6	Inen
5. Edellä 4 kohdassa tarkoitetun siirtymävaiheen päättymispäivä vahvistetaan 10 artiklassa tarkoitettua menettelyä noudattaen heti kun tekniset edellytykset mahdollistavat tehokkaan alueellisen koodauksen sekä kansallisen että kansainvälisen tavaraliikenteen osalta liitteessä G olevien 1 ja 2 kohdan mukaisesti .	kansallisen	22	Llinen
Kansalliset keskuspankit varmistavat , että näillä tiedonantomenettelyillä tuotetaan vaaditut tilastotiedot ja että niiden perusteella voidaan myös tarkistaa asianmukaisesti 3 kohdan mukaisten tietojen toimittamista , tarkkuutta , käsitteellistä vastaavuutta ja tarkistuksia koskevien vähimmäisvaatimusten noudattaminen .	Kansalliset	0	Llinen
Myös kuningattaren siirrot 2...Df6 ( Norwalden muunnelma ) ja 2...Dh4+ ( Keenen puolustus ) ovat mahdollisia , mutta johtavat valkean etuun .	mahdollisia	15	Llinen
Sen vuoksi lopullinen vastuu on jäsenvaltioilla .	lopullinen	2	Llinen
Ensimmäinen ihminen kenet löysin , oli ikäiseni oloinen nainen .	ikäiseni	6	Inen
Poliittisena stunttina sivusto on ollut alusta lähtien näkyvästi julkisuudessa , eikä ole piilotellut toimintaansa .	Poliittisena	0	Inen
HC K:n kokoonpano oli muuten entisenlainen , eli Aki Halonen , Lasse Saarinen ja Maija Isoluoma mutta Tuukka Urpin tilalle oli tullut pelaamaan Antti Halonen , joka sai heti liikanimen Nätti-Urpi .	entisenlainen	5	Lainen
Virheellisiä oletuksia tai teorioita korjataan uusilla tuloksilla , jotka ovat tosia tai ainakin vähemmän virheellisiä kuin aikaisemmat .	Virheellisiä	0	Llinen
Emme voi olla tyytyväisiä tällaiseen tilanteeseen .	tällaiseen	4	Lainen
Lauantain ohjelmassa oli meidän kaikkien elitistikakaroiden eliittijuhlat elitistisessä Finlandia-talossa. ( Varoitus : sarkasmia )	elitistisessä	7	Inen
Se paloi muuttumattomana , reagoimatta millään tavalla liikkeeseen tai muuhun valaistukseen .	muuttumattomana	2	Ton
- Meillä on tarjota lähinnä kesätöitä , mutta aina on olemassa mahdollisuus , että opiskelija saa kesätyön jälkeen vakinaisen työpaikan , sanoi henkilöstöpäällikkö Jari Rajala .	vakinaisen	18	Inen
Vihdoin näin sinut väkijoukossa muiden saartamana , olit jotain uskomatonta tummansinisessä paljettimekossasi , ja hymyillen lähdin sekoittelemaan omenalikööriä , josta joskus kerroit minulle tykkääväsi ( silloin joskus aloin pitämään siitä itsekin ) .	tummansinisessä	10	Inen
Uutta verotustapaa ei saatu heti toimeenpannuksi epätäydellisen maanmittauksen ja epävarmojen rajojen vuoksi .	epätäydellisen	6	Llinen
Moitimme : Sangen huonoa pöytäratkaisua ja mitäänsanomattomia penkkejä	mitäänsanomattomia	6	Ton
( 5 ) toissijaisuusperiaatteen mukaisesti yhteisten tilastostandardien laatiminen yhdenmukaisten tietojen tuottamiseksi on toimintaa , joka voidaan toteuttaa tehokkaasti ainoastaan yhteisötasolla , vaikka tiedot kerätään kussakin jäsenvaltiossa virallisten tilastojen laatimisesta vastaavien virastojen ja laitosten johdolla ,	virallisten	26	Llinen
Jan etsii paikkoja , joihin on asetuttu : mauttomia puutarhatonttuja ja koristeellisia portteja , linnun muotoisia tuuliviirejä , tai lentokoneen , kivikkopuutarhoja , pihakeinuja .	koristeellisia	11	Llinen
Varhaiskeskiaikaisen georgialaisen perinteen mukaan ensimmäisen khosroidikuninkaan Mirian III:n ( hallitsi 284–361 ) nosti Iberian valtaistuimelle hänen isänsä , johon kronikat viittaavat nimellä " Khosroes " , Iranin suuri kuningas .	Varhaiskeskiaikaisen	0	Inen
Yhtä haitallista on syödä paljon pitkälle jalostettuja lihatuotteita , kuten makkaraa .	haitallista	1	Llinen
Näistä huiputtajista olikin tulossa uuden hännänhuippuyliopiston arvostetuimpia tiedemiehiä , sillä vanhasta otsanryppyihin perustuvasta arvomaailmasta irtautuminen oli jo osoittautunut mahdottomaksi .	mahdottomaksi	18	Ton
Jossakin tilaisuudessa oli naisille ja miehille eri kakut , ja miehet saivat kerrankin kokea millaista on olla syrjityssä asemassa .	millaista	14	Lainen
Tuskallisen odotuksen jälkeen hän kakisteli , että ” oli kiva että menit tavalliseen työpaikkaan ” .	Tuskallisen	0	Llinen
Siitä tulee normaali käytäntö , ja oleellinen ero ulkoisen ja sisäisen luokituksen välillä on se , että sisäinen luokitus on jäsenvaltioissa rahoitusvalvonnan alainen mutta ulkoinen luokitus ei ole .	oleellinen	6	Llinen
Mantukimalaiselle maistuu hyvin monenlaisten kukkien mesi .	monenlaisten	3	Lainen
Biaudet on tyytyväinen Helsingin hovioikeuden joulukuiseen tuomioon , jossa kaksi miestä tuomittiin henkisesti kehittymättömän naisen ihmiskaupasta .	kehittymättömän	13	Ton
