Kun väistämätön markkinoiden laskusuhdanne alkoi , jotkin varannoista osoittautuivat riittämättömiksi .	väistämätön	1	Ton
Nyt on käyty empiirinen testi läpi ja todettu , että ilman yhteistä finanssipoliittista kykyä koko rakenne on epävakaa .	empiirinen	3	Inen
Ihan yksinkertaista perustäytekakkua , kerma sellaista ...	yksinkertaista	1	Inen
Jos matkustaja kuolee tai loukkaantuu , lentoliikenteen harjoittajan on suoritettava ennakkomaksu välittömistä taloudellisista tarpeista huolehtimiseksi 15 päivän kuluessa siitä , kun korvaukseen oikeutettu henkilö on yksilöity .	välittömistä	11	Ton
Lailliseen maahanmuuttoon ja kolmansien maiden kansalaisten kotouttamiseen kiinnitetään paljon huomiota laajentuneessa Euroopan unionissa .	Lailliseen	0	Llinen
Saapuessaan tiedotuskeskukseen Mikkonen oli tyytymätön häntä tervehtineen kersantin käytökseen ja vaati tältä muodollista herroittelua .	tyytymätön	4	Ton
Tiedusteltaessa erään abin mielenkiintoa informaatioteknologiaa kohtaan , Asteriskin varapuheenjohtaja Haapanen vastaanottaa armottoman iskun kasvoihinsa , ” Ei ” .	armottoman	11	Ton
Siitä määrättiin kuninkaallisella kirjeellä kamarikollegiolle 27. heinäkuuta 1762 .	kuninkaallisella	2	Llinen
( 3 ) Eräitä lopullisia tavoitteita ei ole pystytty saavuttamaan 15 päivän marraskuuta 2005 mennessä , jolloin päätöksen 1999/730/YUTP voimassaolon on määrä päättyä , ja toisia tavoitteita olisi vahvistettava edellä mainitun päivämäärän jälkeen .	lopullisia	4	Llinen
Coloradon yliopiston säätieteilijät veikkaavat tämänvuotisesta hurrikaanikaudesta pahinta 20 vuoteen .	tämänvuotisesta	4	Inen
Georgialainen historioitsija Giorgi Melikišvili on kuitenkin epäillyt khosroidien iranilaista alkuperää ja pitänyt heitä paikallisena dynastiana , joka keksi itselleen myyttisen ulkomaalaisen alkuperän , mikä ei ollut vastaavissa tilanteissa lainkaan epätavallista .	ulkomaalaisen	20	Lainen
Vaikka taktiikka oli paikoin melkein väkivaltaista , taisi tyrmäys olla liiankin tekninen kun tamperelaiset Nahkamansikat voittivat joukkueemme osalta viimeisen pelin .	väkivaltaista	5	Inen
Kuinka erilaiselta maailma sieltä näyttikään .	erilaiselta	1	Lainen
Tällaisissa tapauksissa tehdään oikaisuja tuonnin ja jälleenmyynnin välisten kaikenlaisten kustannusten , myös verojen ja tullien , ja voittomarginaalin huomioon ottamiseksi luotettavan vientihinnan laskemiseksi yhteisön rajalla .	Tällaisissa	0	Lainen
Biaudet on tyytyväinen Helsingin hovioikeuden joulukuiseen tuomioon , jossa kaksi miestä tuomittiin henkisesti kehittymättömän naisen ihmiskaupasta .	joulukuiseen	5	Inen
Ongelmalliseksi tunteista puhumisen ja analysoimisen tekee kuitenkin se , että länsimaisessa diskurssissa tunteet on monesti tulkittu muun muassa eläimellisiksi , irrationaalisiksi ja feminiinisiksi .	eläimellisiksi	18	Llinen
Mielestäni olisi todellinen erehdys olla kunnioittamatta tätä neuvoston luomaa tasapainoa ja muuttaa sitä .	todellinen	2	Llinen
EMEA-alueella ( Eurooppa , Lähi-itä ja Afrikka ) myytiin 35,0 miljoonaa ja Pohjois- ja Latinalaisessa Amerikassa myytiin yhteensä 32,9 miljoonaa älypuhelinta .	Latinalaisessa	14	Lainen
Siinä syntyi tavattoman intensiivisiä ja innovatiivisia ideoita , ehdotettiin korkean tornin rakentamista yliopiston huipuksi , koko yliopiston siirtämistä korkean kallion päälle ja huiputuksen ottamista yliopiston ydinosaamisohjelmaan .	tavattoman	2	Ton
Hän oli syntynyt Beuthenissa , ja taisteli ensimmäisessä maailmansodassa .	ensimmäisessä	7	Inen
Hänen panostuksensa koulutuksen laadun kehittämiseen on johtanut myös Korkeakoulujen arviointineuvoston Turun yliopiston lääketieteelliselle tiedekunnalle myöntämään laatuyksikkö 2010–2012 -nimitykseen .	lääketieteelliselle	12	Llinen
Santti pohjusti , että menestyneille suomalaisille bioalan akateemisille ryhmille on ollut ominaista teoreettinen työ , samanaikainen laite- ja menetelmäkehitys sekä kiinnostus tulosten kaupalliseen soveltamiseen .	suomalaisille	5	Lainen
Valitettavasti luennosta jäi käteen hieman kaupallisen esittelyn maku , eikä taloudellisia tai eettisiä näkökohtia käsitelty kovinkaan kattavasti .	eettisiä	12	Inen
Siitepölypäiväkirja tuottaa kuvaajan allergiaoireista verrattuna ilman todellisiin siitepölymääriin ja siitä voi itse arvioida , kuinka herkkä on saamaan oireita .	todellisiin	6	Llinen
EU tukee jäsenvaltioiden kotouttamistoimia lukuisilla rahoitusvälineillä .	lukuisilla	4	Inen
Meidän pitää ajatella naisia , joita uhkaa syrjiminen , työttömyys , puutteenalaisuus , ja kaikkia naisia joka puolella maailmaa , jotka kärsivät ja ovat huonompiosaisia .	huonompiosaisia	24	Inen
Arvioimme , että myönteiset vaikutukset johtavat toistuvaan käyttöön , joka voi olla vahingollista pitkällä aikavälillä , Kuypers jatkaa .	vahingollista	12	Llinen
Tony Harris pelasi viimeisenä elinvuotenaan brasílialaisessa koripallojoukkueessa , Universio BRB:ssa .	brasílialaisessa	5	Lainen
( 16 ) Taseeseen sisältynyt erillinen luokka " rahamarkkinapaperit " poistetaan ja sulautetaan luokkaan " liikkeeseen lasketut velkapaperit " vastattavaa-puolella ,	erillinen	5	Llinen
Hän pitää rusinoista , kuorettomista nakeista , pianoista , hiuksistani ( ehkä ) , kukkien kastelemisesta , hyvinä päivinä töistään , karttapallosta , lapsistaan , koivuista , lämpimästä vedestä , maksalaatikosta , antiikkisista kynttilänjaloista , keltaisesta ja pihlajakaramelleista .	antiikkisista	32	Inen
Silloin tunsin oudon kosketuksen , se oli Niko , mutta aurinkoa vasten seistessään hän näytti joltain yliluonnolliselta .	yliluonnolliselta	16	Llinen
Ihmismassan seassa kohti Elielinaukiota suuntaa kaksi Filen toimittajaa , jotka suuntaavat välillä karttaa vilkuillen , mutta silti päämäärätietoisen oloisesti kohti Ruoholahtea .	päämäärätietoisen	17	Inen
Pakko laittaa tämä toinenkin asukuva tänne , sillä tuollaista jäykkää puutarhatonttu-poseerausta on vaikea tehdä tahallaan ! :D	tuollaista	8	Lainen
Avaussanoissaan oikeustieteellisen tiedekunnan dekaani , TIAS:n hallituksen jäsen , professori Jukka Mähönen totesi , että vaikka nyt vuoden toiminnassa olleet tutkijakollegiumit toimivat eri aloilla , niillä on paljon yhteisiä haasteita .	oikeustieteellisen	1	Llinen
Yliluonnollisia kokemuksia kokeneet pelkäävät usein sosiaalisten stigmojen eli negatiivisten leimojen saamista itseensä .	Yliluonnollisia	0	Llinen
Minkä ikänen olit ku alotit lätkän ?	ikänen	1	Inen
Asuntojen hinnat puolestaan laskettiin Tilastokeskuksen velattomien neliöhintojen perusteella vuoden toisella neljänneksellä .	toisella	9	Inen
3 ) Eläinperäisissä elintarvikkeissa olevien eläinlääkejäämien enimmäismääriä vahvistettaessa olisi määriteltävä ne eläinlajit , joissa jäämiä voi esiintyä , sallitut pitoisuudet jokaiselle hoidetusta eläimestä saadulle lihakudokselle ( kohdekudos ) ja jäämien valvonnan kannalta merkityksellisen jäämän luonne ( merkkijäämä ) .	merkityksellisen	32	Llinen
Salamapuheista mieleen jäivät ainakin Effi ry:n esittely ja mielenkiintoinen avoimen lähdekoodin Ajatus-CRM .	mielenkiintoinen	8	Inen
Ph.D Kirsi Hänninen luennoi väitöskirjaansa " Narrative Construction of Self in Finnish First-Person Supernatural Encounter Narratives " pohjautuen siitä , miten yliluonnollisista kokemuksista tehdään ymmärrettäviä .	yliluonnollisista	21	Llinen
Nyt on siis myös tilaisuus miettiä tässä puhtaasti kaupallisuuteen perustuvassa kulttuurissamme vallitsevia taloudellisia mekanismeja ja niiden turmiollisia seurauksia .	turmiollisia	16	Llinen
Onhan tuollainen oljesta tehty koira täysin tarpeeton , sotkee eteiseni , eikä siitä ole edes yhtään seuraa , mutta kun ajattelee hyviä puolia , niin sitä ei tarvitse kouluttaa , ulkoiluttaa eikä ruokkia .	tuollainen	1	Lainen
Toisella neljänneksellä Microsoft-pohjaisia laitteita myytiin 1,5 miljoonaa kappaletta , 52 prosenttia vähemmän kuin viime vuoden huhti-kesäkuussa .	Microsoft-pohjaisia	2	Inen
Yrittäjät ja keskustavoittoinen yleisö pommittivat ministeriä myös valtion tukimarkoista , palkkaperusteisten sivukulujen leikkauksesta sekä arvonlisäverosta .	keskustavoittoinen	2	Inen
Viimeksi samanlainen kriisi koettiin Isossa-Britanniassa 1970-luvulla , jolloin sen talousjärjestelmä oli vaarassa kaatua .	samanlainen	1	Lainen
Vaikka Iberian Khosroiani-kuninkaat olivat kristittyjä , he pysyivät yleisesti ottaen uskollisina iranilaisille herroilleen , kunnes Vakhtang I Gorgasali ( hallitsi 447–522 ) käänsi kelkkansa vuonna 482 ja toi maansa ja kirkkonsa lähemmäs Bysanttia .	uskollisina	10	Llinen
( 3 ) Yhteisön tuen saamisen edellytyksenä on olennaisten edellytysten täyttäminen ja erityisesti Eurooppa-sopimuksiin sisältyvien sitoumusten noudattaminen ja edistyminen Kööpenhaminassa vahvistettujen arviointiperusteiden täyttämisessä .	olennaisten	8	Inen
Sekoita korppujauho nesteeseen ja sekoita sitten kaikkien muiden ainesten kanssa tasaiseksi seokseksi .	tasaiseksi	10	Inen
TM testasi kaikki tuotteet sekä tutkimuslaboratorioissa että aistinvaraisin testein .	aistinvaraisin	7	Inen
Euroopan unioni joutuu käyttämään velkamaiden pelastukseen epätavallisen järeitä toimia .	epätavallisen	6	Llinen
yö , tuo tunturimaailman loputtoman päivän tuskin tupakkatauon mittainen hengähdyspaussi , jolloin aurinko hiipuu pohjoisen äärellä ollen silti hereillä ja valvoen valtakuntansa elämää .	loputtoman	4	Ton
Punaiseksi lihaksi lasketaan muun muassa nauta , sika ja lammas .	Punaiseksi	0	Inen
Albumeilla Pain of Mind ja The World as Law yhtye soitti crust/hardcore punkia , mutta tämän jälkeen tyyli on ollut lähinnä kokeellista metallimusiikkia , johon on otettu vaikutteita monista tyyleistä , esimerkiksi ambientista , doom metalista ja hardcoresta .	kokeellista	21	Llinen
* 7. kesäkuuta 2009 : Chávez sai tahtonsa läpi : Venezuelan presidentin valtakausien määrä rajattomaksi	rajattomaksi	14	Ton
Hoskinsin esiintymiset brittiläisissä elokuvissa Pitkä pitkäperjantai ( 1980 ) ja Mona Lisa ( 1986 ) saivat kriitikkojen hyväksynnän , ja myöhemmin hän oli ehdolla parhaan miespääosan esittäjän Oscar-palkinnon saajaksi .	brittiläisissä	2	Lainen
Kyseessä lienee siis nettovoitto , josta voimme oppia yksityiskohtien tärkeyttä kokonaisuudelle mutta myös valmistautumista odottamattomaan : englantia puhuvien opiskelijoiden suuri määrä pakotti improvisoituun käännöstyöhön , ja siivoojien kärryjen kanssa tuli tiukkaa , joskin he suhtautuivat asiaan hyvin ymmärtäväisesti .	odottamattomaan	14	Ton
Kansalliset yhteyspisteet ovatkin vuoden 2005 puoliväliin mennessä vieneet tietokantaan yli 1_700 julkaisua , ja lisäksi on indeksoitu kyseisellä alalla toimivien järjestöjen ja yksittäisten ihmisten oikeudellisia asiakirjoja ja yhteydenottoja .	yksittäisten	22	Inen
Lopullinen rauha galaksiin saatiin vasta Yuussa Vongh-invaasion jälkeen 32 vuotta Yavin taistelun jälkeen .	Lopullinen	0	Llinen
” Älä stressaa ” on hyödytön neuvo , eikä laiskuuteen yllyttäminen sekään kuulosta kovin vastuulliselta .	vastuulliselta	14	Llinen
Oli kyse sitten Yhdysvaltain kaltaisesta suuresta maasta tai Kreikan kaltaisesta pienestä maasta , sen on lopetettava ylellinen elämäntapansa ja palattava tiukkaan taloudenpitoon , jos se ei halua kansallisen velan paisuvan kestämättömälle tasolle ja räjähtävän .	ylellinen	16	Llinen
Se on erinomainen .	erinomainen	2	Inen
Vanhus kääntyi hitaasti akselinsa ympäri , tepasteli pitkin rantaa ja iskeytyi päivittäiseen tapaansa ruokalaan syömään päivällistä .	päivällistä	15	Llinen
Mitä tapahtuu , jos itäeurooppalaiset ja keskieurooppalaiset vallan keskukset kerran siirtyvät ?	keskieurooppalaiset	6	Lainen
Pidättäytymisemme äänestämästä osoittaa vastalauseemme pankkijärjestelmän niin kansallista kuin eurooppalaista järjestelmää vastaan .	kansallista	6	Llinen
Viesti voi välittyä lähes samanaikaisesti lukemattomiin kohteisiin , ja sitä paitsi tavattoman halvalla	tavattoman	11	Ton
Lisäksi EU:n lentoyhtiöiden mahdollisuudet valvoa tehokkaasti yhdysvaltalaisia lentoyhtiöitä ovat edelleen rajalliset huolimatta omistusoikeutta koskevista kattavista säännöksistä .	yhdysvaltalaisia	6	Lainen
Oheinen laskelma ( ks. alla ) osoittaa , että 30 neliön vanhan kerrostaloasunnon Helsingissä ostava joutuu ottamaan keskimäärin runsaat 118_000 euroa lainaa asuntonsa rahoittamiseksi .	Oheinen	0	Inen
Nuoret tutkijat -tapahtuma antaa itsenäisesti erikoistöitään laatineille mahdollisuuden kertoa paitsi yleisölle myös toisilleen , millaisten asioiden parissa laboratorioissa on ahkeroitu .	millaisten	14	Lainen
Tarkoitus on arvioida , miten tiedekunta näkyy yliopiston ulkopuolella ja millaisena se näyttäytyy muun maailman silmissä .	millaisena	10	Lainen
– Nyt näemme , millaista budjetin tasapainotus todella on .	millaista	4	Lainen
Romaanissa on eloisaa ja havainnollista kuvausta ajasta , tavoista ja miks ei mentaliteeteista	havainnollista	4	Llinen
Saapuessaan tiedotuskeskukseen Mikkonen oli tyytymätön häntä tervehtineen kersantin käytökseen ja vaati tältä muodollista herroittelua .	muodollista	12	Llinen
Itse asiassa tunne oli jälleen hieno , kun itse omin silmin näki ” järjettömän ” kaukana olevan kohteen — vaikkakin se näytti vain utuiselta läiskältä .	järjettömän	13	Ton
Tunsin , kuinka alkukantaiset vaistot heräilivät sisälläni , kuinka palasin satojen vuosien taakse heimoyhteisöjen villiin ja säälimättömään maailmaan .	säälimättömään	16	Ton
Lounasseuran lisäksi iloitsimme mahtavasta ranskalaistyylisestä lounaasta .	ranskalaistyylisestä	4	Inen
Bryssel oli ainakin omiin hollantilaiseen maisemaan tottuneisiin silmiin todella ranskalainen kaupunki .	hollantilaiseen	4	Lainen
Urakehitys mittaa inhimillistä kasvua .	inhimillistä	2	Llinen
Sen estäminen edellyttää uusia mekanismeja , joilla pystytään entistä aikaisemmin puuttumaan esimerkiksi holtittomaan velkaantumiseen ja valtioiden verotusjärjestelmiinkin , Aunesluoma sanoo .	holtittomaan	12	Ton
Täydellinen päivä nurtsilla makoilulle !	Täydellinen	0	Llinen
Keittiössä oli nostalgisia vanhanaikaisia kodinkoneita .	vanhanaikaisia	3	Inen
San Stefanossa sovittiin itsehallinnollisen Suur-Bulgarian ruhtinaskunnan luomisesta .	itsehallinnollisen	3	Llinen
" Ei kaatuneita tuoleja , ei rikkoutuneita astioita , surmaaja on tehnyt täydellisen yllätyksen tai Sonja Mikkola on tuntenut hänet niin hyvin , ett ei ole edes ujostellut " , Salakka sanoo .	täydellisen	12	Llinen
( 10 ) Turvallisessa ja nykyaikaisessa ilmakuljetusjärjestelmässä matkustajien kuolemantapausten ja loukkaantumisten yhteydessä on aiheellista soveltaa rajoittamattoman korvausvastuun järjestelmää .	nykyaikaisessa	5	Inen
Niiden perustana on tšagatain kieli , johon sulautui paikallisten turkkilaisten kielten aineksia .	turkkilaisten	9	Lainen
Väärennetyillä tavaroilla tarkoitetaan tavaroita , mukaan lukien niiden pakkaukset , jotka on luvattomasti valmistettu tavaramerkillä , joka on samanlainen kuin asianmukaisesti rekisteröity merkki .	samanlainen	18	Lainen
Ehdollinen rangaistus on yleisesti eri oikeuskulttuureissa tehokkaaksi ja edulliseksi havaittu tapa puuttua lähinnä ensikertalaisten tai nuorten rikoksiin .	Ehdollinen	0	Llinen
( 10 ) on tarpeen säätää yksinkertaistetusta menettelystä tämän asetuksen täytäntöönpanemiseksi ja sen mukauttamiseksi taloudelliseen ja tekniseen kehitykseen , ja	taloudelliseen	14	Llinen
Kun täydelliset ilmoitukset on saatu , komissio tutkii jäsenvaltioiden täytäntöönpanotoimet , mikä voi myöhemmässä vaiheessa johtaa jäsenyysvelvoitteiden noudattamatta jättämistä koskeviin menettelyihin , mikäli direktiivi on pantu täytäntöön väärällä tavalla .	täydelliset	1	Llinen
Tässä Potenssin syväluotaavassa artikkelissa tutustutaan Yliopistonmäen isoimpiin saleihin ja selvitetään , missä saleissa ja millaisilla luennoilla kannattaa aikaansa viettää .	millaisilla	14	Lainen
Otaniemen säätila takasi kostean olon myös holittomalle osalle festiväkeä , jota vahvisti kuraisella ruohikolla pelattu parijalkapallo .	holittomalle	6	Ton
Sumuisena syysaamuna äiti poltti mentholtupakkaansa laiturilla istuen , niin kuin hän oli jo vuosia tehnyt , ja katsoi kuinka joki vain jatkoi virtaamistaan , ei sitä kukaan voisi pysäyttää .	Sumuisena	0	Inen
Kaksi kesää olen haaveillut vanhanaikaisten puisten kattotikkaiden tekemisestä tai parin puutarhahuonekalun rakentamisesta , mutta vielä ei ole ehtinyt ...	puisten	5	Inen
Suurimmat muutokset suomalaisessa koulutuksessa alkoivat tapahtua 1700-luvun lopulla ja 1800-luvulla .	suomalaisessa	2	Lainen
Elokuvasta tekee erilaisen se , että yhteisö on päässyt osallistumaan sen tekemiseen ( crowd sourcing ) .	erilaisen	2	Lainen
Enemmistö turkulaisista taisi vielä jäädä majoitukseen parantelemaan oloaan kun hätäisimmillä oli jo kiire hakemaan menovettä heti laillisen myyntiajan alettua .	laillisen	16	Llinen
Latinalaisen Amerikan nopeimmin kasvava kaupunki	Latinalaisen	0	Lainen
Yleisradion rahoitusta pohtinut työryhmä antoi tänään viestintäministeri Suvi Lindénille ( kok. ) raporttinsa , jossa ehdotetaan jokaisen kotitalouden maksettavaksi noin 175 euron vuosittaista mediamaksua .	vuosittaista	22	Inen
Periaatteena oli pukeutua joka luennolla vaaleanpunaiseen paitaan , mutta siitä lipsuttiin loppua kohden .	vaaleanpunaiseen	5	Inen
Eiköhän oteta vielä toiset .	toiset	3	Inen
Säkö muistelee oman rekrytointiprosessinsa sujuneen esimerkillisen rivakkaan .	esimerkillisen	5	Llinen
- On ilmeisesti tosi outoa alkaa höpötellä tuntemattomille ystävällisessä hengessä ja selvänä .	ystävällisessä	8	Llinen
Turkkilaiset kollegani suuresta Turkin kansalliskokouksesta harmittelevat samoin tätä epäkohtaa , nimittäin että kukaan ei halua ilmeisesti puhua heidän kanssaan , ei kansallisista hallituksista tai parlamenteista eikä myöskään lähes kaikista eurooppalaisista instituutioista .	eurooppalaisista	29	Lainen
Islantia uhkaa joutuminen Kansainvälisen valuuttarahaston holhoukseen .	Kansainvälisen	3	Inen
Joka tapauksessa georgialainen perinne on saattanut liioitella Mirianin sukutaulua , jotta hän vaikuttaisi Iranin kuninkaiden kuninkaan jälkeläiseltä .	georgialainen	2	Lainen
Hänen seuransa on helsinkiläinen HIFK Hockey .	helsinkiläinen	3	Lainen
Vanhemmat historialliset saunat olivat kaikki savusaunatyyppisiä , osassa savu johdettiin ulos puisen hormin - lakeisen - kautta tai seinässä olevasta aukosta eli " räppänästä " .	historialliset	1	Llinen
Raumalle saavuttaessa bussin takaosasta alkoi kuulua selittämätöntä huutoa .	selittämätöntä	6	Ton
Aikuisviihteen osalta taas saksalaiset olivat todellisia suurkuluttajia , sillä siellä vertaisverkkojen kaistasta käytettiin 13 % pornografisen materiaalin jakamiseen .	pornografisen	15	Inen
Mel Funn ( Brooks ) -niminen ohjaaja ilmoittaa Studiopomolle valmistavansa mykkäelokuvan , mutta saadakseen mykkäelokuvan suosituksi , hänen täytyy hankkia siihen kuuluisia näyttelijöitä .	-niminen	5	Inen
Eckerö Linen Nordlandialla ja Translandialla kulki heinäkuussa 130_005 matkustajaa , joka oli seitsemän prosenttia enemmän kuin edellisenä ennätyskuukautena vuosi sitten .	edellisenä	16	Llinen
Collection on ruotsalainen Magnus Ugglan vuonna 1985 julkaistu kokoelmalevy .	ruotsalainen	2	Lainen
Mitali myönnettiin myös tunnustuksena pitkäaikaisesta nuhteettomasta ja erittäin ansiokkaasta toiminnasta Turun yliopiston palveluksessa .	nuhteettomasta	5	Ton
Tutkinto saatetaan mieltää samantasoiseksi AMK-perustutkinnon kanssa .	samantasoiseksi	3	Inen
Turun yliopiston kaksi monitieteistä tutkijakollegiumia kokoontuivat keskiviikkona 10.3. yhteiseen seminaariin Caloniassa .	monitieteistä	3	Inen
Tämä täyteyhdistelmä oli meille oikein mieluinen ja makujakin oli riittävästi ja mastui hyvälle kylmänäkin	mieluinen	5	Inen
Hodgkinsonin mukaan suoriutuisimme töistämmekin tehokkaammin , jos erilaisten nautintojen ravitsemina ja kroonisesta stressistä irrottautuneina pitäisimme energiatasomme tasaisesti katossa koko päivän ajan .	erilaisten	7	Lainen
Perustuslakien perusoikeudet ja kansainväliset ihmisoikeudet määrittelevät ensisijaisesti julkisen vallan ja yksityisten henkilöiden välisiä vertikaalisia suhteita .	yksityisten	10	Inen
Kirjassa mietitään , millaisia koulutuksellisia ja kasvatuksellisia tarpeita aateluus , pappeus , porvarius ja talonpoikainen maatalous asettivat säätyihin kuuluville ja toisaalta niihin pyrkiville pojille ja tytöille .	koulutuksellisia	4	Llinen
Se sisältyy muun muassa heprealaiseen , foinikialaiseen , aramealaiseen ja arabialaiseen kirjaimistoon .	foinikialaiseen	6	Lainen
( 7 ) Bulgarian on tarpeen huolehtia , että sillä on liittymistä valmistelevien yhteisön varojen ohjelmointiin , koordinointiin , hallinnointiin , valvontaan ja arviointiin tarvittavat oikeudelliset ja hallinnolliset rakenteet ,	hallinnolliset	27	Llinen
EMN:n alkuperäisen tehtävänmäärityksen mukaan sen ensisijaisena tavoitteena on tarjota yhteisölle , jäsenvaltioille ja aikanaan myös yleisölle objektiivista , luotettavaa ja vertailukelpoista tietoa maahanmuutto- ja turvapaikkatilanteesta koko unionissa ja jäsenvaltioissa .	objektiivista	16	Inen
Meillä ei ole hahmotelmaa yhteiseurooppalaisesta talous- ja kauppapolitiikasta .	yhteiseurooppalaisesta	4	Lainen
Profiilimme esiintyisi tv:ssä vielä monta , monta kertaa , mutta aivan toisenlaisissa merkeissä .	toisenlaisissa	11	Lainen
Näin tehtyäni pohdin muutaman hetken siirtymistä kofeiinipitoisen aamiaisen pariin keittiöön , mutta huoneilman hyytävä kylmyys ja jäsenieni uninen kohmeisuus pakottavat minut palaamaan peiton alle vielä viideksitoista minuutiksi .	kofeiinipitoisen	6	Inen
Albumi on nimetty Marx-veljesten komediaelokuvan Päivä kilpa-ajoissa englanninkielisen nimen mukaan samoin kuin edellinenkin albumi A Night at the Opera .	edellinenkin	12	Llinen
Suhteellisen absurdia oli lukea aamubussissa metro-lehdestä juttua tapahtumasta , josta oli vasta tulossa kotiin :D	Suhteellisen	0	Llinen
Toiset ovat ohuet musta ja toiset pitsiset .	pitsiset	6	Inen
Kaiken kaikkiaan lajin sosiaalinen elämä on hyvin monimutkaista .	monimutkaista	7	Inen
Hän työskentelee Turun yliopistossa lastentautiopin opettajana ja lääketieteellisen koulutuksen tutkimus- ja kehittämisyksikön johtajana .	lääketieteellisen	7	Llinen
Vähäisiä julkisen vallan käyttömahdollisuuksia on delegoitu lailla myös yksityisille kansalaisille ( esimerkiksi kalastuksenvalvojat ) , julkisomisteisille liikelaitoksille ja yksityisille yhteisöille ( esimerkiksi yksityiset perusopetuksen antajat ) .	yksityisille	18	Inen
Dieselmoottori tulee olemaan 1.3-litrainen 56 kW:n tehoinen nelisylinterinen common rail -tekniikalla .	tehoinen	6	Inen
Hän pitää rusinoista , kuorettomista nakeista , pianoista , hiuksistani ( ehkä ) , kukkien kastelemisesta , hyvinä päivinä töistään , karttapallosta , lapsistaan , koivuista , lämpimästä vedestä , maksalaatikosta , antiikkisista kynttilänjaloista , keltaisesta ja pihlajakaramelleista .	kuorettomista	4	Ton
Kääpä toimii Lääketieteen koulutuksen yhdistyksen puheenjohtajana ja on lisäksi yhteistyökumppani monissa kansainvälisissä lääkärikoulutukseen liittyvissä tieteellisissä verkostoissa .	kansainvälisissä	11	Inen
Tällainen perspektiivin kaventaminen on meidän mielestämme vaarallinen ja väärä teko , ja siksi olemme päättäneet äänestää Packin SOKRATES-ohjelmaa koskevaa mietintöä vastaan .	vaarallinen	6	Llinen
Keskustelussa palattiin vapun jälkeiseen arkeen puhumalla talousvaikeuksiin vajonneelle Kreikalle vahvistuneesta talousapupaketista sekä tilanteen kirvoittamista kysymyksistä liittyen EU-politiikan tulevaisuuteen .	jälkeiseen	3	Inen
Ensinnäkin kansallisten yhteyspisteiden oikeudellisessa asemassa ja erikoistumisaloissa ja niiden käyttöön annetuissa henkilöstö- ja rahoitusresursseissa sekä teknisissä laitteissa esiintyy huomattavaa kirjavuutta , joten yhteyspisteiden sitoutumisasteet ovat myös erilaisia .	teknisissä	15	Inen
Onnellinen arkipäivä ei tarkoita tiukkaa dieettiä missään merkityksessä , vaan itsestään huolehtimista .	Onnellinen	0	Llinen
Rajoitukset ovat seuraavanlaiset :	seuraavanlaiset	2	Lainen
Mithridateen isä oli antanut tyttärensä Laodiken Kappadokian kuninkaan Ariarathes VI:n vaimoksi , ja Mithridates itsekin oli jo aikaisemmin sekaantunut Kappadokian sisäisiin asioihin .	sisäisiin	20	Inen
Vappuna piipahdimme Jyväskylässä ihmettelemässä sukuumme ujuttautuneita englantilaisia jalkapallohuligaaneja ja heidän ystäviään .	englantilaisia	6	Lainen
Se sisältyy muun muassa heprealaiseen , foinikialaiseen , aramealaiseen ja arabialaiseen kirjaimistoon .	arabialaiseen	10	Lainen
Bunkkerimaiset betonielementtiseinät yhdistettynä taiteelliseen puurimastoon käyvät mielenkiintoista arkkitehtonista dialogia .	taiteelliseen	3	Llinen
Nokian irtisanomiset eivät hetkauttaneet jyväskyläläisten tieto- ja viestintätekniikan ammattilaisten työtilannetta , kertoo Jyväskylän yliopiston tuore raportti .	jyväskyläläisten	4	Lainen
Samantekevää ei kuitenkaan ole , millaista tietoa ja missä muodossa potilaalle tarjotaan .	millaista	5	Lainen
Makuuhaavoja esiintyy sellaisissa ruumiinosissa , jotka joutuvat maatessa paineen alaisiksi , kuten esimerkiksi ristiluu , lantio sekä olka- ja kantapäät .	sellaisissa	2	Lainen
Natsipuolueeseen kuulumattomana , mutta ideologialtaan natsina Wolters mainitsi filosofi ja matemaatikko Oskar Beckerin , jonka sodanjälkeisten oppilaiden hän totesi olleen tietämättömiä opettajansa taustasta .	kuulumattomana	1	Ton
sehän on ollu jonkullaine helpotushan se on ollu siis	jonkullaine	3	Lainen
