( 3 ) komissio julkaisi 22 päivänä tammikuuta 1997 vihreän kirjan " Yhteisön kilpailupolitiikasta ja vertikaalisista rajoituksista " , joka käynnisti laajan julkisen keskustelun perustamissopimuksen 81 artiklan 1 ja 3 kohdan soveltamisesta vertikaalisiin sopimuksiin ja yhdenmukaistettuihin menettelytapoihin ,	vertikaalisista	15	Ela
Leikkaa levyistä kevyesti reunat pois -> samalla levyt tulevat varmasti samankokoisiksi .	samankokoisiksi	10	Tra
On vaikea löytää asuntoja , joita vuokrataan halvalla .	halvalla	7	Ade
Mies sanoi : et menisi niin herkästi mukaan , tulet niin pahalle mielelle .	pahalle	11	All
Ja nyt kun hän oli löytänyt mitä halusi tehdä , alkoholin kulutus runsaana joskin hallittuna ei ollut haitaksi hänen kutsumukselleen .	runsaana	12	Ess
Äsken oli puhetta kolmansissa maissa vallitsevista vaikeista olosuhteista .	kolmansissa	3	Ine
Edellytyksenä takautuvalle soveltamiselle on se , että järjestelyn ehtoja on muutettu .	takautuvalle	1	All
Kolmanneksi tässäkin raportissa ympäristönäkökohtien sisällyttäminen Lissabonin strategiaan vaikuttaa todella pelkältä nimelliseltä eleeltä .	nimelliseltä	10	Abl
Tomaattiset keitto-ohjeet jatkuvat ... .	Tomaattiset	0	Nom
Rehtori , joka oli avarakatseinen uudistaja , kehotti heitä kokeilemaan sitä ideaa ja niin kaikki tiedemiehet kantoivat kaiken tiedon sylissään yhteiseen kokoukseen katsoakseen , miten iso kasa ja korkea huippu siitä tulisikaan .	yhteiseen	20	Ill
Harjun Nuorten Kuoron äänenmuodostus on näin nuoreksi kuoroksi hämmästyttävän täyteläinen ja aikuismainen .	täyteläinen	9	Nom
Voi eiks oo naurettavaa .	naurettavaa	3	Par
Autonomisessa Suomessa ei enää riittänyt , että vain ylimpiin säätyihin lukeutuvat poikalaset saatettiin koulutielle .	ylimpiin	8	Ill
Oulun kaupunginteatteri haihduttaa jumalten hajut tehokkaimmalla vastamyrkyllä , mitä näytelmätaiteen historiasta voi löytää .	tehokkaimmalla	5	Ade
Mitä kauemmas vuosissa mennään , sitä kivemmalta muoti tuntuu ja näyttää .	kivemmalta	6	Abl
Hän laulaa kuolemaisillaankin kovalla äänellä	kovalla	3	Ade
He lähettivät sanansaattajia kaukaisiin maihin ja kirjoittivat pitkiä artikkeleita vierasmaalaisiin lehtiin saadakseen edes pienen vinkin .	vierasmaalaisiin	9	Ill
Niinistön asema julkisuudessa on ollut huomattavasti asiallisempi , ellei peräti kuivakas .	asiallisempi	6	Nom
Humanistisen tiedekunnan tilaisuudessa julkistetut humanistitohtorin ja humanistiteon kunniamaininnat liittyvät osaltaan siihen , miten tiedekunnan kasvatit ja tutkimus näkyvät yhteiskunnassa .	Humanistisen	0	Gen
Visualisoinnit ovat erillisellä sivulla .	erillisellä	2	Ade
Hyviä professoreja koulutetaan vain omakohtaisen tieteellisen työn yhteydessä .	Hyviä	0	Par
Puisto on tunnettu mm. sen laella sijaitsevasta C. L. Engelin 1810-luvulla suunnittelemasta tähtitornirakennuksesta sekä perinteikkäästä Turun kesäteatterista .	perinteikkäästä	14	Ela
Ylemmän tutkinnon suorittaneet ovatkin nyt " esimerkkityöllistyjiä " ja viitoittavat tietä uusille opiskelijoille ja tutkinnosta valmistuville .	Ylemmän	0	Gen
Backlink tarkoittaa käytännössä niiden ulkopuolisten linkkien lukumäärää , jotka osoittavat tietylle sivustolle .	tietylle	10	All
On apupukkeja , tonttuja , porokuskeja , mopoilevia pukkeja , raittiita pukkeja ja sitten vielä niitä vähemmän raittiita .	raittiita	17	Par
Voinen tässä vaiheessa jo turvallisesti todeta , että Iron Sky tulee olemaan eräs tunnetuimmista suomalaisista elokuvista ja se tasoittaa tietä kaikille muille vastaaville nyt tekeillä oleville ( esimerkiksi The Cosmonaut ) sekä tulevaisuudessa vastaavalla tavalla tehtäville elokuville .	vastaaville	22	All
Lapset kuuntelivat kiinnostuneina .	kiinnostuneina	2	Ess
Puffaus kuului pieneen pisteeseen kuroutuneen naisen tussahtamisesta savuisena pölähdyksenä ulos äsken muodostamastaan pisteestä , synnyttäen kellertävän pilven jossa oli punaisia raitoja .	savuisena	7	Ess
On vaikea löytää halvalla vuokrattavia asuntoja .	halvalla	3	Ade
Teatterikesän kunniavieras George Tabori lennähti Suomeen lomailemasta nykyisestä kotimaastaan Itävallasta .	nykyisestä	7	Ela
Islantia uhkaa joutuminen Kansainvälisen valuuttarahaston holhoukseen .	Kansainvälisen	3	Gen
Vaikken insinööritieteitä opiskele , tehtävä ei osoittautunut mahdottomaksi .	mahdottomaksi	7	Tra
Ja nyt Pyro vahtii postiluukkuani , ikäänkuin suojellen minun huomistani ikäviltä kirjeiltä .	ikäviltä	10	Abl
Kesän kuuma uutuus saattaa olla nyt ensiesittelyssä oleva surf bike , jota suomalaisittain kutsutaan vesifillariksi .	kuuma	1	Nom
( 2 ) Montrealissa saavutettiin sopimus 28 päivänä toukokuuta 1999 uudesta yleissopimuksesta eräiden kansainvälistä ilmakuljetusta koskevien sääntöjen yhtenäistämisestä , jossa vahvistetaan uudet maailmanlaajuiset säännöt korvausvastuusta kansainvälisissä ilmakuljetuksissa tapahtuvien onnettomuuksien yhteydessä .	kansainvälisissä	25	Ine
Vierailu ja sitä seurannut luontoretki olivat mukavia .	mukavia	6	Par
Useimmilla henkiinjääneillä ei ole kotia johon palata eikä mitään syötävää .	henkiinjääneillä	1	Ade
Tätä kutsutaan moderniksi Cunninghamiksi .	moderniksi	2	Tra
Soveltuva kolmas maa , joka on markkinatalousmaa , valitaan hyväksyttävällä tavalla ottaen huomioon kaikki valintahetkellä käytettävissä olevat luotettavat tiedot .	hyväksyttävällä	9	Ade
Jo ovella tulee niin huumaavan eksoottinen tuoksu vastaan , että tuntuu kuin olisi lomalla Etelä-Ranskassa .	eksoottinen	5	Nom
On sillä koulupäivällä mittaa ekaluokkalaiselle , joka matkustaa kodin ja koulun väliä n. 2 tuntia päivässä .	ekaluokkalaiselle	4	All
Vaikka yhtäältä on totta , että viisi jäsenvaltiota hylkäsi olennaisilta osin ajatuksen Euroopan unionin ulkopuolella olevista leireistä , toisaalta on totta , että käsiteltäväksenne tulevassa raportissa mainitaan turvapaikkahakemusten käsittely Euroopan unionin ulkopuolella yhteistyössä kolmansien maiden kanssa .	olennaisilta	9	Abl
Aloin Nokialle erityisopettajaksi tultuani pitää Päivähoitolassa kehitysvammaisille puheterapiaa .	kehitysvammaisille	6	All
Pudonneista joukkueista Jyrki Pulliainen ja Takapaksin Palomiehet käyttivät rautaista taktiikkaa , jossa kapteenin omin sanoin ” voitamme teknisellä tyrmäyksellä ” .	Pudonneista	0	Ela
Presidenttiin on tyytyväisiä 70 % kansalaisista .	tyytyväisiä	2	Par
Kävivätpä eräät heistä naapurimaassa , ottivat siellä silikoniruiskeita otsaansa paisuttamaan ja teettivät kirurgeilla näin syntyneeseen pulleaan otsaan syvimpiä uria , mitä siinä yliopistossa oli koskaan nähty .	pulleaan	15	Ill
UND Adriyatik oli matkalla Turkin Istanbulista Italian Triesteen , kun se syttyi suunnilleen 24 kilometrin päässä Kroatian rannikolta tuntemattomasta syystä palamaan .	tuntemattomasta	18	Ela
Puheenjohtajan toive pikaisesta paluusta liigaan ei ole täysin vailla perusteita .	pikaisesta	2	Ela
Seuraavissa taulukoissa annetaan tietoja sekä EU:n että jäsenvaltioiden kotouttamispolitiikasta .	Seuraavissa	0	Ine
Ihmiset juovat olutta , ovat hilpeitä , lapset juosta vilistävät pöytien välissä ja leikkivät keskenään .	hilpeitä	5	Par
Arabiantimalit rakentavat pesänsä pensaaseen tai puuhun 1–7 metriä korkealle ja rakentavat aina hyvin suojaisaan paikkaan latvustoon tai pensaan sisälle .	korkealle	8	All
Jokaisen maan pitäisi toteuttaa toimenpiteitä suojautuakseen aggressiiviselta vienniltä tarkastamalla ja valvomalla tuontituotteita järjestelmällisesti ja soveltamalla tarvittaessa suojalausekkeita .	aggressiiviselta	6	Abl
Vartiovuorenmäki onkin valittu yhdeksi valtakunnallisesti merkittävistä kulttuurihistoriallisista ympäristöistä .	merkittävistä	5	Ela
Nyt vakiona pystyn säätämään ajan 0,1-9,9 sekuntia 100 millisekunnin välein .	vakiona	1	Ess
Sanotaan että ne ovat muka niin limaisia .	limaisia	6	Par
Ajoneuvoon asennettu anturi aktivoituu törmäyksen vaikutuksesta ja lähettää Euroopan laajuisen hätänumeron 112 kautta tiedon ajoneuvon sijainnista , nopeudesta ja omistajasta lähimmälle poliisille , palolaitokselle ja sairaanhoitopalveluun .	lähimmälle	20	All
tästä samasta vanhasta asiasta	vanhasta	2	Ela
Kyse on 10 vuoden mittaisesta korkotuesta .	mittaisesta	4	Ela
Ota siis rohkeasti yhteyttä AEGEE-Turun hallitukseen ( aegee-turku@utu.fi ) ja lähde viettämään ikimuistoista kesää !	ikimuistoista	12	Par
Kotitalousvähennys on keskituloisten ja vauraiden käyttämä etuisuus , Aamulehden teettämä kysely kertoo .	keskituloisten	2	Gen
Päällänsä ilmestyksellä oli kirkkaan keltaiset , punaisilla viiruilla koristellut housut , mokkasiinit , ja paita jossa kokoa varmastikin kolme numeroa enemmän kuin tarve vaatisi .	punaisilla	6	Ade
Ketään ei uskottu vaan hänet kerrottiin nähdyn siellä ja siellä huonoilla teillä .	huonoilla	10	Ade
Myönteisen käytöksen laukaisevia neurologisia tekijöitä seurataan magneettikuvauksin .	neurologisia	3	Par
Viimeisessä osuudessa piti heittää palloilla jotain mörköä .	Viimeisessä	0	Ine
Vaikka suomen kieltä on puhuttu Ruotsin nykyistenkin rajojen sisäpuolisella alueella aina .	sisäpuolisella	8	Ade
Ajatus , että hän ei tule , tuntui ikävältä .	ikävältä	8	Abl
Tuskallisen odotuksen jälkeen hän kakisteli , että ” oli kiva että menit tavalliseen työpaikkaan ” .	kiva	9	Nom
Ootte te mahtavia jätkiä .	mahtavia	2	Par
Mikä mahtaa olla tilanne jälkimodernissa länsimaalaisessa yhteiskunnassa ?	jälkimodernissa	4	Ine
* 31. tammikuuta – Kirill " Kirka " Babitzinin äkkinäinen kuolema sairauskohtaukseen oli koko Suomen surunaihe .	äkkinäinen	9	Nom
Eilen halusin vielä ryypätä , koska jokainen lukemani " viini " sana sai minut muistelemaan suloista punaista nestettä , mutta tänään minusta on alkanut tuntua , kuin kaikki Chinaskin juoma alkoholi vaikuttaisi minussakin ja saisi minutkin kärsimään kroonista krapulaa .	suloista	15	Par
Lars Binderup luennoi perjantaina suvaitsevaisuuden eri tasoista filosofiselta kannalta katsottuna .	filosofiselta	7	Abl
annettakoon tässä vielä yksityiskohtaiset ohjeet , miten rusetti syntyy kätevän miehen hyppysissä .	kätevän	9	Gen
kaikki paitsi purjehdus on turhaa .	turhaa	4	Par
Työ nuhraantui hikisissä käsissä , eikä edistynyt .	hikisissä	2	Ine
Kerrostalokaksio vaikuttaa aika vaatimattomalta ollakseen vakituinen asuntonne .	vaatimattomalta	3	Abl
Kerran kuitenkin , taas erään sateen jälkeen kun olin yksin maalailemassa leppäkerttujen siipiä ehyiksi .	ehyiksi	13	Tra
yks tarkimmista suunnittelijoista kuka noita miettii .	tarkimmista	1	Ela
Haagin ohjelman mukaan yhteisiin perusperiaatteisiin perustuvien puitteiden olisi muodostettava pohja EU:n tuleville aloitteille , joissa määritellään selkeät tavoitteet ja arviointikeinot .	yhteisiin	3	Ill
b ) maatalousajoneuvot , sotilasajoneuvot sekä julkiselle keskus- tai paikallishallinnolle kuuluvat ajoneuvot , lukuun ottamatta julkisille yrityksille ja erityisesti rautatieyrityksille kuuluvia tavarakuljetukseen tarkoitettuja tieliikenteen moottoriajoneuvoja .	julkisille	15	All
Kovin lähellä varkautelainen Olli ei Haataisen lukemia liiku , sillä eilen hän jäi kakkoseksi tuloksella 78,64 .	varkautelainen	2	Nom
Heilautin hajamielisesti kättäni sen perään , ja katselin haikeana , kun sivistyksen viimeinen merkki katosi tien kaarteeseen .	haikeana	8	Ess
Yhdysvaltalaisen laivameklarin US Shipbrokersin mukaan alankomaalaisen Club Cruise -yhtiön omistuksessa ollut GTS Da Vinci eli Finnjet olisi lähtenyt tiistaina Italiasta Punaistamerta kohti , jossa se luovutettanee toukokuun puoliväliin mennessä uusille omistajille .	alankomaalaisen	5	Gen
Minulle oli aikoinaan kerrottu Floridaan , että Kaisu odotti täällä lasta ; Taisto sitä uutista oli tuonut tultuaan Suomesta , jossa oli käynyt peräämässä vanhoilta velallisiltaan saamisiaan .	vanhoilta	24	Abl
Pääoppositiopuolue keskustalle mielipidemittauksen luvut lienevät epämiellyttävää luettavaa .	epämiellyttävää	5	Par
vapaille ja demokraattisille vaaleille otolliset olosuhteet voidaan luoda kahdesta kolmeen kuukaudessa .	vapaille	0	All
Ettäs kehtaakin , ihan vieraalle ihmiselle hymyillä !	vieraalle	4	All
Samalla kun pornokaupan omistaja kertoo olevan ajan esitellä uusi sirkusprinsessa , intimihierojat joutuvat kauppaamaan itseään keski-ikäisille lihaville miehille .	lihaville	16	All
Siitä on myös saatavilla graafisella käyttöliittymällä varustettuja versioita , joissa on muun muassa valikot ja tuki hiirelle .	graafisella	4	Ade
Kukat ovat kauniita katsella , mutta myös maukkaita maistella .	maukkaita	7	Par
Mitä sinulla nyt voisi hätänä olla , vakavasti , terveellä nuorella ihmisellä ?	nuorella	10	Ade
Mutta oppaan tehtävä olisi varoittaa tuommoisista , niin asiakkaat eivät poukkoile turhaan lehtien perässä .	tuommoisista	5	Ela
Ensi vuonna lennonjohtajien palkkoja korotetaan 1. elokuuta alkaen 2,8 prosentin suuruisella yleiskorotuksella .	suuruisella	10	Ade
| D05 | valtuuskunta EU:n ja Moldovan parlamentaarisessa yhteistyövaliokunnassa : 14 jäsentä	parlamentaarisessa	7	Ine
Yhdysvaltain presidentti Bill Clinton , joka toimii keulakuvana tupakoinnin vastaisessa kampanjassa , ei itse ole päässyt täysin eroon pahasta tavastaan .	vastaisessa	9	Ine
Se suuntaus Ruotsissa , joka halusi sanoutua irti nationalismista ja romanttisesta idealismista , havaitsi kontaktit Suomeen antoisiksi : Suomi tuli tietyssä määrin muodostamaan kahdeksankymmentäluvun radikalismin tukialueen .	antoisiksi	16	Tra
Paasikivi oli suorastaan vauhkona .	vauhkona	3	Ess
a ) aiheuttaa konkreettisesti tai muulla tavalla vakavaa häiriötä tavaroiden vapaalle liikkuvuudelle estämällä , viivyttämällä tai hankaloittamalla niiden tuontia jäsenvaltioon , niiden vientiä jäsenvaltiosta tai niiden kuljettamista jäsenvaltion kautta ,	vapaalle	10	All
Terveisiä kaikille uusille ja vanhoille tuttavuuksille , toivottavasti saadaan pian uusi miitti vireille .	uusille	2	All
uskomattoman ruman sävyinen kangas	sävyinen	2	Nom
Maku vaihtelee lajikkeittain makeahkoista happamiin .	happamiin	4	Ill
Tämä on minusta erittäin mielenkiintoista , sillä kun lentoemännät ovat flunssassa eivätkä voi työskennellä lentoyhtiön lennoilla , henkilöstövajaus on täytettävä välittömästi tällaisissa tilanteissa .	tällaisissa	21	Ine
Mistä lie johtuu , mutta Sibelius-viulukilpailun yleisökoostumus ei ole ollut aivan nuorimmasta päästä .	nuorimmasta	11	Ela
Useita järjestämiämme tilaisuuksia on viime aikoina moitittu liian rohkeiksi .	rohkeiksi	8	Tra
* 3yy - kopioi kursorin alla oleva rivi ja kaksi seuraavaa riviä	seuraavaa	10	Par
Paratiisimäki-niminen tila on lounaisrinteessä luonnonkauniilla paikalla kalliomännikköisen mäen juurella .	Paratiisimäki-niminen	0	Nom
Maalta laukaistavat strategiset ohjukset eivät ole enää turvassa siiloissaan olivat ne panssaroitu kuinka vahvoiksi tahansa .	vahvoiksi	13	Tra
Pitkän aikaa Maija luki aamupalalla Kalevaa .	Pitkän	0	Gen
Parhailla pihamailla on ruokaillut jo kymmeniä peippoja yhtäaikaa .	Parhailla	0	Ade
e ) ' erityisellä nosto-oikeudella ' tarkoitetaan Kansainvälisen valuuttarahaston määrittelemää erityistä nosto-oikeutta ;	erityisellä	3	Ade
no ihan miten vaa kuha saahaan se mahollisimman pikaisest .	mahollisimman	7	Gen
Niiden , joiden paino vaihteli koko ajan , kuolleisuus oli korkeampi kuin vakaan pysyvästi ylipainoisten ihmisten .	ylipainoisten	14	Gen
Storsjön legendaarinen hirviö kuvattu	legendaarinen	1	Nom
Meillä ei kuitenkaan ole varaa tuhlata aikaa vaan tehtävä on suoritettava nyt , etenkin , jos aiomme vakavissamme voittaa työttömyyden .	vakavissamme	17	Ine
Kirja kannattaa kuitenkin lukea , jollei muuten niin herttaisena muistona kaikin puolin radikaalilta kuusikymmentäluvulta .	radikaalilta	12	Abl
Pitkille lomareissuille ei arvaa lähteä , kun työt jäisivät tekemättä .	Pitkille	0	All
Hänet valittiin eduskuntaan eduskuntavaaleissa 1975 Turun läänin pohjoisesta vaalipiiristä .	pohjoisesta	7	Ela
Mutta mikä olet sinä tai kukaan muukaan nimittämään toisten pyhinä pitämiä totuuksia pakanauskonnoiksi ?	pyhinä	9	Ess
Olen tuota prototyyppiä kehittänyt nyt huiman yhden päivän , oikeastaan muutamia tunteja ellei koodaamista lasketa mukaan .	huiman	5	Gen
EMN:n alkuperäisen tehtävänmäärityksen mukaan sen ensisijaisena tavoitteena on tarjota yhteisölle , jäsenvaltioille ja aikanaan myös yleisölle objektiivista , luotettavaa ja vertailukelpoista tietoa maahanmuutto- ja turvapaikkatilanteesta koko unionissa ja jäsenvaltioissa .	ensisijaisena	5	Ess
Henkisiltä kyvyiltään hän oli keskinkertainen mies niin karismaattinen kuin olikin .	Henkisiltä	0	Abl
Vaikka Accenture onkin valittu kahdesti peräkkäin Great Place to Work Institute Finlandin järjestämässä tutkimuksessa Suomen parhaaksi työpaikaksi suurten yritysten sarjassa , ei kai työ aina voi olla pelkkää ruusuilla tanssimista ?	suurten	17	Gen
Kännitzer on tietokoneohjelma , joka muuttaa annetun tekstin sellaiseksi , kuin se olisi kirjoitettu kännissä .	sellaiseksi	8	Tra
Yli puolella suomalaisista on yhä väärä käsitys matkapuhelimeen soittamisen hinnasta .	väärä	5	Nom
12-tuntisiksi venyviä päiviä ei suosita , mutta välillä itse kunkin täytyy olla valmis joustamaan ajastaan .	12-tuntisiksi	0	Tra
Komissio julkaisi ensimmäisenä toimenaan vihreän kirjan taloudellisista syistä tapahtuvan maahanmuuton hallinnassa sovellettavasta EU:n strategiasta .	taloudellisista	6	Ela
Suomalaisista 46 prosenttia pitää sormenjälkiä henkilökohtaisena tietona .	henkilökohtaisena	5	Ess
Vuosittain professorit kokoontuivat keskinäiseen tuloskeskusteluun , jossa he mittasivat toistensa otsaryppyjen syvyyttä ja sitten taputtivat kohteliaasti niille , joilla oli kaikkein syvimmät rypyt .	keskinäiseen	3	Ill
Jos hakija näyttää lupaavalta , pyydetään hänet esittelemään itsensä paikan päällä , minkä lisäksi työnhakijaa odottaa kaksi noin tunnin mittaista haastattelua .	lupaavalta	3	Abl
Ongelmana oli se , että kyse oli erittäin suuresta osakemäärästä .	suuresta	8	Ela
Pari vuotta sitten Suomessa vieraillut The Ragga Twins on typerästä nimestään huolimatta kelvollinen tanssijalan liikuttaja .	typerästä	9	Ela
Tähän suureen saliin mahtuu tarvittaessa suurikin määrä opiskelijoita , mutta leveytensä vuoksi salissa ei ole autiota kovin pienelläkään ihmismäärällä .	pienelläkään	17	Ade
Sivusta katsottuna peli näytti ihan mallikkaalta : omat aloitukset olivat myrkkyä vastustajalle ja nopeat hyökkäykset päätettiin kunnon iskulyönteihin .	mallikkaalta	5	Abl
Luento : Nimettömäksi jääneen luennoitsijan " Yhdysvaltalainen poliittinen ajattelu 1900-luvulla "	Nimettömäksi	2	Tra
Antaa kuitenkin suuntaa siitä , mitä pitäisi tehdä saadakseen koodin toimimaan ihan fyysisessä maailmassa .	fyysisessä	12	Ine
Perjantaina oltiin isohkolla porukalla Jensillä grillibileissä , jotka sujuivat kuuluisan Looping Louie- juomapelin tahdissa ja muuten juhliessa .	isohkolla	2	Ade
Isonenäisellä oli pelkkä puunuija ja parrakkaalla oli kädessään ruosteinen kirves .	parrakkaalla	5	Ade
McCain puolestaan sanoi Obaman talousmielipiteitä senaatissa vasemmistolaisiksi , äärimmäisen liberalistisiksi .	vasemmistolaisiksi	6	Tra
Minulla oli hihaton pusero paksusta yönsinisestä silkistä .	paksusta	4	Ela
Lapset ovat nykyisessä kovien arvojen yhteiskunnassa jäämässä pahasti toisarvoiseen asemaan .	nykyisessä	2	Ine
Why did you do this to me !? Colin valitti itkuisen humalaisella äänellä .	itkuisen	10	Gen
Arduino on hyvin suosittu ympäri maailmaa , koska se on halpa , helppo ja nopeasti opittava alusta , jolla voi kehittää vaikka mitä yksinkertaisesta ledin vilkuttelusta 3D-tulostimiin saakka .	suosittu	3	Nom
Ennen kuin Jalmari huomasikaan , hän seurasi ilmassa leijailevaa reipasta rallatusta , joka lopulta opastaisi hänet jonkinlaiselle vaatturille .	reipasta	9	Par
Lehden testissä 14-karaatin sormusta vastaan olisi saanut summan , joka olisi ollut noin puolet sen sisältämän kullan todellisesta arvosta .	todellisesta	17	Ela
jätteen laitos- tai ammattimaisesta hyödyntämisestä ja käsittelystä	ammattimaisesta	3	Ela
Puun latva oli lanannut koko kuistin matalaksi ja itse makasin vanhan ja viisaan , joskin väsyneen puun alla poikittain vastaten :	matalaksi	6	Tra
ei 1932 ilmestynyt ainoatakaan kotimaista kaunokirjallista uutuutta .	kaunokirjallista	5	Par
Voidaan huomata , että on käynnissä siirtyminen loppupalkan perusteella määritellyistä perinteisistä etuusperusteisista eläkkeistä eläkejärjestelmiin , joiden kuluja voidaan helpommin valvoa .	etuusperusteisista	11	Ela
Entä : onko kookkaiden lainojen ottaminen epävakaina talousaikoina järkevää ?	epävakaina	6	Ess
Seisoin paikoillani niin pitkään että takana kävelevä keski-ikäinen liikenainen rykäisi käteensä jokseenkin leipääntyneen oloisena .	leipääntyneen	12	Gen
Tunnustakaamme syntimme taivaalliselle Isällemme ; avatkaamme sydämemme kaikkitietävälle Jumalalle .	kaikkitietävälle	7	All
Hintojen odotetaan vuoden kuluessa kuitenkin kohoavan tämänhetkisestä tasosta .	tämänhetkisestä	6	Ela
En sanonu Jussille mitään , mielestäni häne käytös tällaisella ilmalla oli ollut hieman törkeetä .	tällaisella	8	Ade
Makeat kahvilatuotteet nostavat veden kielelle - näitä on ihan pakko maistaa !	Makeat	0	Nom
Harjun Nuorten Kuoron äänenmuodostus on näin nuoreksi kuoroksi hämmästyttävän täyteläinen ja aikuismainen .	nuoreksi	6	Tra
Uusiseelantilaiset katsovat kuten minä , suurista lasikatakombeista hiljaiselle Tyynellemerelle .	suurista	5	Ela
Kolmen A:n valtioiden hallintoa pidetään vakaina ja niiden velkakirjoja pidetään turvallisina .	turvallisina	10	Ess
Tuli jotenkin tosi itsetietoinen olo siitä , miten puhuu , ja sanat ei kuulostanut yhtään omaan suuhun sopivilta .	omaan	15	Ill
En kuitenkaan tuntenut oloani yksinäiseksi , mutta silti oli koko ajan sellainen fiilis , että odotin jonkun saapuvan .	yksinäiseksi	4	Tra
ILO UUDESTA TUOKSUSTA :_)	UUDESTA	1	Ela
Santti pohjusti , että menestyneille suomalaisille bioalan akateemisille ryhmille on ollut ominaista teoreettinen työ , samanaikainen laite- ja menetelmäkehitys sekä kiinnostus tulosten kaupalliseen soveltamiseen .	kaupalliseen	22	Ill
Väljissä ja moninaisilla kirkkailla väreillä sisustetuissa tiloissa jotkut ovat selvästi istuneet samalla paikalla pidempäänkin , kun taas toiset ovat kuin läpikulkumatkalla : tänään tällä tuolilla , huomenna jossain muualla .	moninaisilla	2	Ade
Nyt vielä on liian kylmä värkätä lämmittämättömässä työtilassani .	lämmittämättömässä	6	Ine
Toiseen peliin joukkue tuli terveenä ja hyvin harjoitelleena .	terveenä	4	Ess
Kuudennella aistillako hän päättelee , kumpi on parempi : .	Kuudennella	0	Ade
Mutta avot kun me maataan maassa nenä turpeessa ja pelätään ja vaihdetaan lipasta ; se on tuskaisen hidas operaatio .	tuskaisen	16	Gen
Suomalaisille vahtikoira tuo mieleen terhakan pystykorvan .	Suomalaisille	0	All
Åkeby jätti tehtävänsä seuran valmennuksessa mestaruuskauden 2003 jälkeen ja siirtyi tanskalaisen Aarhus GF:n peräsimeen .	tanskalaisen	10	Gen
Matkustajan viivästymisen aiheuttamien vahinkojen osalta korvausvastuu rajoitetaan 4150 erityiseen nosto-oikeuteen ( likimääräinen summa paikallisena valuuttana ) .	erityiseen	8	Ill
Varsinkin avioerojen raatelemat suomalaiset ovat löytäneet Kauniista ja Rohkeista ihanteen itselleen .	Kauniista	6	Ela
Ratkaisut on mukautettava jäsenvaltioiden erilaisiin eläkejärjestelmiin .	erilaisiin	4	Ill
Mikäli kaikki menee hyvin , myöhemmin on tiedossa vielä toinen haastattelukierros , ja jos senkään jälkeen ei ole onnistunut vakuuttamaan haastattelijoita olemattomista kyvyistään , voi työsopimus olla kourassa hyvinkin pian .	olemattomista	21	Ela
Jos tavoite on se , että juhannuksena pitäisi olla vatsa timmissä , niin nyt alkaa olla jo kiire .	timmissä	10	Ine
kuinka paljon rahaa saa kulua hallintoon jotta mahdollisimman paljon kerätyistä varoista ohjautuu varsinaiseen tarkoitukseen .	varsinaiseen	12	Ill
Näyttelijälle vaikeinta on oman itsensä uskottava esittäminen .	uskottava	5	Nom
Laatu osoittautui jollei korkeaksi niin ainakin tasaiseksi	tasaiseksi	6	Tra
Välttämättä nykyinen lakikielemme ei ole ymmärrettävyydeltään selkeämpää ja sanonnaltaan iskevämpää kuin Ruotsin valtakunnan lain vanha suomennos .	selkeämpää	6	Par
Oli kyse sitten Yhdysvaltain kaltaisesta suuresta maasta tai Kreikan kaltaisesta pienestä maasta , sen on lopetettava ylellinen elämäntapansa ja palattava tiukkaan taloudenpitoon , jos se ei halua kansallisen velan paisuvan kestämättömälle tasolle ja räjähtävän .	kaltaisesta	4	Ela
Eurooppalaisten viranomaisten seurantaraportin mukaan salmonella- ja kampylobakteerien antibioottien vastustuskyky on hyvin tavallista Suomen , Ruotsin ja Norjan ulkopuolella .	Eurooppalaisten	0	Gen
Esitys : Päätettäneen määrätä seuraavalle pro gradu -tutkielmalle tarkastajat : --	seuraavalle	4	All
Tästä syystä koko euroalue on nyt valtavissa vaikeuksissa , jotka pääsivät syntymään vain siksi , että aikanaan oli epäkorrektia epäillä pyhän euroideologian puhtautta .	epäkorrektia	18	Par
Suunnitelmat ovat herättäneet osin voimakasta ärtymystä .	voimakasta	4	Par
Kaljulla ryövärillä oli sentään jalkajousi , mutta vain yksi vääntynyt nuoli .	Kaljulla	0	Ade
Ilta oli ollut miellyttävä .	miellyttävä	3	Nom
Tarjoa kuumana tai kylmänä kermamaidon kanssa .	kuumana	1	Ess
Kun Bogomoloffin ehdottamista korjauksista ei enää jaksettu äänestää , yön pelastajaksi kasvoi myöhäisestä radio-ohjelmastaan kuuluisa Pekka Sauri ( vihr ) .	myöhäisestä	12	Ela
( Suullinen tarkistus hyväksyttiin . )	Suullinen	1	Nom
