Tällaiselle lyhyehkölle ihmiselle sopii muutenkin nudet ( korkeat ) kengät , näyttää vähän pidemmältä .	Tällaiselle	0	All
Olin itse ilmeisen alitajuisesti pessimistisenä liikkeellä , koska tulin autolla eikä skumppaa ollut kylmässä .	pessimistisenä	4	Ess
Lännessä on ollut yleinen virheellinen luulo , että Neuvostoliiton romahdettua karhu muuttuisi demokraattiseksi ja lempeäksi ystäväksi .	lempeäksi	14	Tra
Naamani valahtaa tomaatin punaiseksi , kun veri lähtee kiertämään poskissani vinhaa vauhtia .	punaiseksi	3	Tra
Tämä Suomessa ainutlaatuinen katettu piha .	katettu	3	Nom
pyhäjärvinen metsäkoneyrittäjä , reservin luutnantti Martti Kauranen	pyhäjärvinen	0	Nom
Päivällinen jäi Lassilalta syömättä , sillä ohjelmassa oli vielä isännyys yksityisellä illallisella KOP:n juhlatiloissa .	yksityisellä	10	Ade
Helsingin käräjäoikeus tuomitsi NN:n törkeästä huumausainerikoksesta vankilaan jo alkutalvesta .	törkeästä	4	Ela
Hänelle suurin unelma on jonakin päivänä kiivetä maailman korkeimmalle vuorelle ilman happilaitteita .	korkeimmalle	8	All
paksu paperisäkki jollaisissa torilla myydään perunaa .	jollaisissa	2	Ine
Huomio kiintyy lähes kuvan keskellä näkyvään pieneen , soikeaan Billy-kraatteriin .	pieneen	6	Ill
Oikeusasiamies katsoo että loput eli siis peräti 1500 kanteluista ovat aiheettomia .	aiheettomia	10	Par
Rankka väite : Viranomaiset ovat lisänneet pitkäaikaistyöttömyyttä	Rankka	0	Nom
Hän ei ollut varma oliko sillä raapiva vai kutittava vaikutus …	kutittava	8	Nom
Laekenissa joulukuussa 2001 kokoontuneen Eurooppa-neuvoston puheenjohtajan päätelmissä komissiota kehotettiin “ kehittämään eurooppalaista järjestelmää turvapaikkaa , maahanmuuttoa ja lähtömaata koskevien tietojen vaihtamiseksi ” .	eurooppalaista	11	Par
mikäli jokin tekstin kohta tuntuu epäselvältä , on sitä yhä syytä verrata esim. englanninkieliseen versioon .	englanninkieliseen	13	Ill
Mummi itki , että Veikko ei ole vielä edellisestäkään sodasta tullut takaisin .	edellisestäkään	8	Ela
paistileikkeet tuntuivat aika suolaisilta makuumme ja niissä oli aika reilusti mausteitakin , siki pastalisuke maustettu miedommaksi .	suolaisilta	3	Abl
Mustasta wokpannusta pölähtää tymäkkä pilvi kerrostalon keittiöön .	Mustasta	0	Ela
Ilmeisesti tällä hetkellä mikään maa ei ole kokonaan pimennossa , mutta koko Lähi-idässä netti kärsii merkittävästä kokonaiskaistan vähenemisestä vaikka liikenne saadaankin reititettyä yhä ehjänä olevien yhteyksien kautta .	ehjänä	23	Ess
Josko nyt vois arvella että se kestäs noin tunnin tai jotain sen tapasta .	tapasta	12	Par
( 3 ) komissio julkaisi 22 päivänä tammikuuta 1997 vihreän kirjan " Yhteisön kilpailupolitiikasta ja vertikaalisista rajoituksista " , joka käynnisti laajan julkisen keskustelun perustamissopimuksen 81 artiklan 1 ja 3 kohdan soveltamisesta vertikaalisiin sopimuksiin ja yhdenmukaistettuihin menettelytapoihin ,	vertikaalisiin	32	Ill
Aseta näyttö sellaiselle tasolle , että katsot sitä alaspäin .	sellaiselle	2	All
– Lisäksi Suomessa on tehty paljon taudinvastaista työtä , eli hävitetty maasta eläintauteja kokonaan. , lääkealan turvallisuus- ja kehittämiskeskus Fimean eläinlääkäri Fia Westerholm sanoo .	taudinvastaista	6	Par
Lipponen viittasi siihen , että Virossa valtio ostaa oman turvallisuutensa hoitamiseksi turvallisuuspalveluja yksityisiltä yrityksiltä .	yksityisiltä	12	Abl
| ACP | valtuuskunta AKT:n ja EU:n yhteisessä parlamentaarisessa edustajakokouksessa : | 77 jäsentä	parlamentaarisessa	8	Ine
Kausi 1998 ei sujunut Turun Palloseuralta toivotulla tavalla , ja myös Kaijasillalla oli vaikeuksia löytää parasta maalijyväänsä .	toivotulla	6	Ade
kaupan ketjut keskittävät kuljetustoimintonsa erilliseen yhtiöön ja alkavat markkinoida kuljetuspalveluja kuin ammattimaiset kuorma-autonyrittäjät ikään .	erilliseen	4	Ill
( 3 ) Yhteisön tuen saamisen edellytyksenä on olennaisten edellytysten täyttäminen ja erityisesti Eurooppa-sopimuksiin sisältyvien sitoumusten noudattaminen ja edistyminen Kööpenhaminassa vahvistettujen arviointiperusteiden täyttämisessä .	olennaisten	8	Gen
Kun seuraavan kerran huomaan nukkuneeni läpi tilastotieteen luennon , imuroineeni viimeksi kuukausi sitten tai vaihtavani tenttikirjat kriittisellä hetkellä Facebookiin , voin unohtaa raastavat itsesyytökset ja tuudittautua seuraavaan ajatukseen : Työnteko on niin last season .	kriittisellä	16	Ade
Suomalaisille vahtikoira tuo mieleen terhakan pystykorvan .	terhakan	4	Gen
Kun sen yhdistää päivittäiseen liikkumiseen , tulevat ruuan maut esille aivan uudella tavalla .	uudella	11	Ade
Pidän heitä mukavina .	mukavina	2	Ess
No niin , minkäslaista asiaa .	minkäslaista	3	Par
Se iso ulkomainen tikkuaski ulkohyyskän nurkassa !	ulkomainen	2	Nom
Samantyyppisen asunnon sai viime vuonna vastaavaan aikaan vajaat 8_000 euroa pienemmällä lainasummalla .	pienemmällä	10	Ade
* 31. toukokuuta 2009 : Venäjän liittyminen Euroopan unioniin ei saa kannatusta suomalaisilta eurovaaliehdokkailta	suomalaisilta	12	Abl
Isot ovat kömpelöitä , joita pienet pystyvät jallittamaan , eivät varmasti aina , mutta ainakin joskus .	kömpelöitä	2	Par
Vaunut putosivat raiteilta ilmeisesti siksi , kun juna ajautui väärälle raiteelle ja vauhtia oli liikaa .	väärälle	9	All
Se ajatus tuntuu jostain syystä olevan otsalohkoni päällimmäisenä .	päällimmäisenä	7	Ess
( 4 ) Perussäännön 5.1 artiklassa edellytetään , että EKP kerää kansallisten keskuspankkien avustuksella tarvittavat tilastotiedot joko toimivaltaisilta kansallisilta viranomaisilta tai suoraan taloudellisilta toimijoilta EKPJ:n tehtävistä huolehtiakseen .	toimivaltaisilta	17	Abl
Luonnehäiriöisillä saattaa ilmetä vaikeita tilannehallinnan menetyskohtauksia .	Luonnehäiriöisillä	0	Ade
Jos Picasso onkin nyt yleisesti tunnustettu kolmiotaiteilija , ei tulevia suuruuksia kannata käydä ennakoimaan .	tulevia	9	Par
joten kaikki vaan ostamaan asuntoja käteisellä tai korkeintaan muutaman vuoden mittaisella lainalla .	mittaisella	10	Ade
Keskellä kohosi matalia kumpuja tai kivikasoja , niin samanlaisia että jonkun oli täytynyt ne tehdä .	matalia	2	Par
Päätös osoittautui erinomaiseksi , sillä kaudella 2002 Kaijasilta tulitti peräti 13 osumaa , ja sijoittui siten Veikkausliigan maalipörssissä peräti kolmannelle sijalle Allianssin sijoittuessa lopulta sarjassa neljänneksi .	neljänneksi	25	Tra
Toivon , että teillä kaikilla on ollut erinomainen loma , ja toivotan teille antoisaa työskentelyjaksoa tänä parlamenttimme vaalikauden viimeisenä vuonna .	antoisaa	13	Par
Kuusiston ohella peräti viidellä muulla pelaajalla on kokemusta ylimmältä sarjatasolta .	ylimmältä	8	Abl
Hyvin lupaavaksi katsottu transito on nyt vaikeuksissa .	lupaavaksi	1	Tra
Esineet ovat varsin laajalta muslimialueelta .	laajalta	3	Abl
The Registerin mukaan petoksen lisäksi Doranin tilillä oli entisen poikaystäväänsä ampuminen sekä rattijuopumuksia joihin kuului myös yliajon jälkeen paikalta pakeneminen .	entisen	8	Gen
sievä vaaleatukkainen virkailija	sievä	0	Nom
Kehumme : Hyviä muistikuvia	Hyviä	2	Par
( 8 ) tilastotietojen asianmukainen levittäminen on varmistettava ,	asianmukainen	4	Nom
Näin menetellessään virkamiehet toimivat tahallaan liikennevaliokunnan ja eduskunnan selkeän tahdon vastaisesti .	selkeän	8	Gen
Useita meidän järjestämiämme tilaisuuksia on viime aikoina moitittu liian rohkeiksi .	rohkeiksi	9	Tra
pääministeri kokosi narrigallerian selvittämään kansakunnan henkistä tilaa .	henkistä	5	Par
Siellä täällä oli opaskylttejä , kaikissa lähes venäläistä tekstiä .	venäläistä	7	Par
Talven määrittelyjen mukaan valtaosa suomalaisista kuuluu läntiseen kulttuuriin , joskin maan itäosan ortodoksisilla alueilla kulttuuri-identiteetti on itäinen .	läntiseen	6	Ill
Hän ajatteli , että hänellä ja Mairella voisi olla mukavaa Invernessin kukkuloilla tai Porto Santon loputtomalla hiekkarannalla .	loputtomalla	15	Ade
Panu näytti äkkiä pelästyneeltä .	pelästyneeltä	3	Abl
Tuolloin – rautaesiripun jakaessa Eurooppaa – tuntui yllättävältä , että Talve katsoi myös mm. Viron ja muiden Baltian maiden kuuluvan läntiseen kulttuuriin .	yllättävältä	7	Abl
Toisella vuosineljänneksellä työttömyysaste oli 13,5 prosenttia .	Toisella	0	Ade
Eräs sileäotsainen opiskelija , mieli vielä vapaana tiedon kahleista , totesi kilpailuvastauksessaan , että huippuyliopisto se on hännänhuippuyliopistokin .	sileäotsainen	1	Nom
Joulukuussa 2006 Oulun yliopiston tutkijat eivät uusissa maatutkaluotauksissaan enää löytäneet näyttöä suuresta metalliesineestä .	suuresta	11	Ela
( 10 ) Turvallisessa ja nykyaikaisessa ilmakuljetusjärjestelmässä matkustajien kuolemantapausten ja loukkaantumisten yhteydessä on aiheellista soveltaa rajoittamattoman korvausvastuun järjestelmää .	nykyaikaisessa	5	Ine
Uskon siis , että ponnistelumme ovat nyt hyvässä vaiheessa ja että meidän ei tarvitse pelätä , että työmme ei tuottaisi vastaavaa tulosta .	vastaavaa	20	Par
Matti Penttilä piti käsikirjoituksesta ja halusi rahoittaa sen mutta piti sitä liian kalliina .	kalliina	12	Ess
vanhempien lasten kohtelu	vanhempien	0	Gen
Bunkkerimaiset betonielementtiseinät yhdistettynä taiteelliseen puurimastoon käyvät mielenkiintoista arkkitehtonista dialogia .	taiteelliseen	3	Ill
Jos sattumalta tavataan , niin voin näyttää aika laihalta ja pitemmän näköiseltä kuin vuosi sitten .	näköiseltä	11	Abl
- Tämä on niin sanottu kolmiodraamatilanne , jossa julkisen vallan toimenpide on myös osa yksityisten subjektien välistä riitaa , sanoi Rosas .	julkisen	8	Gen
Yksityisen kansalaisen kuin myös kansanedustajan ottaessa puhelimitse yhteyttä niin ministeriöön kuin eri virastoihinkin käy usein niin , että .	Yksityisen	0	Gen
Vitsit sentään pitävät hyvällä tuulella , vaikk eivat liiemmin nauratakaan .	hyvällä	3	Ade
Hän kasvoi isoksi pojaksi .	isoksi	2	Tra
Leipä on tosi tiukalla .	tiukalla	3	Ade
Paikalla on tosin ollut asutusta esihistorialliselta ajalta lähtien .	esihistorialliselta	5	Abl
Vain meistä riittävän etäällä olevissa maissako ja meille vieraissa maallisissa ideologioissa kirkon sopii asettua syrjään sysityn ihmisen rinnalle ?	vieraissa	8	Ine
Tällä kertaa vain erona oli se , että yksittäisiä esineitä ei tarvitse tunkea liian pieneltä tuntuvaan kaappiin , vaan niistä pitäisi saada kasattua kaukoputki .	pieneltä	14	Abl
Yhtä innostunut on opettaja .	innostunut	1	Nom
Jos nainen näyttää liian varmalta kyvyistään tehdä mies villiksi , se saattaakin pelottaa miestä .	villiksi	8	Tra
Sitä sovelletaan kuudennestakymmenennestä päivästä sen jälkeen , kun se on julkaistu .	kuudennestakymmenennestä	2	Ela
Suomalaisilta meni melko varma EM-titteli tänä syksynä sivu suun .	Suomalaisilta	0	Abl
Se tuoksui naiselta – ei sellaiselta puhtaalta , vaan vahvalta , tummalta ja vaaralliselta .	sellaiselta	5	Abl
Hevonen kuului viipurilaiselle liikemiehelle Fritz Buttenhofille .	viipurilaiselle	2	All
Myös eräät yhdyssanat suositetaan korvattaviksi samanmerkityksisellä yhdyssanalla .	samanmerkityksisellä	5	Ade
Mithridates oli Pontoksen merkittävin kuningas ja Rooman valtakunnan vaarallisin vihollinen ensimmäisellä vuosisadalla eaa ..	ensimmäisellä	10	Ade
Paavin arvovaltaisin käskymuoto kiertokirje oli haudattuna Vatikaanin arkistoihin , kunnes belgialaiset historioitsijat löysivät sen mikrofilmiltä Yhdysvalloista .	arvovaltaisin	1	Nom
Ovessa oli vanhanaikainen lukko , jonka Valdas avasi metallisella avaimella .	metallisella	8	Ade
Onko henkilöstä annettu etsintäkuulutus , koska hänellä on laiton ase ?	laiton	8	Nom
Dublinissa tutustutaan liikennepoliittisiin näkemyksiin ja Lontoossa tutustutaan tiehankkeiden yksityiseen rahoitukseen .	liikennepoliittisiin	2	Ill
Silloin minulle annettiin mahdollisuus työskennellä yhdessä mantereellemme paljon antaneiden suurten miesten kanssa .	suurten	9	Gen
Downshiftaamista on ansaitusti arvosteltu hedonistisen eliitin etuoikeudeksi , johon köyhällä kansanosalla ei ole varaa .	köyhällä	9	Ade
Toiseen erään vaihtopelaajien määrää vähennettiin , ja tulostakin alkoi tulemaan .	Toiseen	0	Ill
Normaalilta peltorinteeltä se pintapuolisesti vilkuillen näyttää , tarkentaa Vuorinen .	Normaalilta	0	Abl
Joku Sonkajärvellä keksi kutsua paikalle kokonaisen naistoimittajien ryhmän , koskapa myös ruotsalaisissa ja norjalaisissa lehdissä on nähty " skuuppeja " ainutlaatuisesta kantotapahtumasta .	norjalaisissa	13	Ine
Se olisi ison talousmaantieteellisen muutoksen lopputulos .	talousmaantieteellisen	3	Gen
Ikivihreät peittoperennat menestyvät parhaiten varjoisessa kosteahkossa kasvupaikassa .	varjoisessa	4	Ine
Sen ilma tuntui tunkkaiselta , hiekkaiselta ja betoniselta .	betoniselta	7	Abl
Osin jopa harhaanjohtavat nimikkeet hankaloittavat työnhakua , kun työnantajalle pitää juurta jaksaen selittää , mistä on kyse .	harhaanjohtavat	2	Nom
Niin huvittavalta kuin se kuulostaakin , koiran voi totuttaa käyttämään korvatulppia .	huvittavalta	1	Abl
Tähän Jussi melkein päivänselvään tapaan tokaisi , että odottaa kirjettä pääkaupungissa sijaitsevasta koulusta ja haluaa hakea sen sit nopeesti .	päivänselvään	3	Ill
Ehdolliseen tuomioon liittyy koeaika , jonka kuluessa ilmenevistä uusista rikoksista tuomitaan ankarampi rangaistus sen johdosta , ettei ehdollisesti tuomittu ole parantanut tapojaan .	Ehdolliseen	0	Ill
Tietojen keruu- ja käsittelymenetelmät on suunniteltava siten , että jäsenvaltioiden toimittamat tilastolliset tulokset täyttävät tarkkuutta koskevat vähimmäisvaatimukset , joissa otetaan huomioon jäsenvaltioiden tieliikenteen rakenteelliset ominaisuudet .	rakenteelliset	23	Nom
Se ei viitsinyt edes soittaa ovikelloa vaan astui sisään muina miehinä omilla avaimillaan , mikä minusta ei ollut erityisen korrektia .	omilla	11	Ade
Kun GLP-1 -nimisen proteiinin tuotanto estetään , rotat ahmivat itsensä muodottomiksi .	muodottomiksi	10	Tra
Pitikö FIA:n pomojen olla näin jääräpäisiä , että eivät vähemmästä uskoneet .	vähemmästä	9	Ela
Paavolainen piti Mannerheimin päiväkäskyn sanavalintoja epäsuomalaisina ja epäaitoina .	epäsuomalaisina	5	Ess
Seuraavalla välitunnilla kukaan ei enää nauranut , vaikka Niko olikin alusvaatteilla ja märillä sukilla alapihan hiekkakentällä .	märillä	12	Ade
Anttonen muistutti kuulijoille , että Venäjän markkinat ovat tärkeitä suomalaisille alueellisille palvelusektorin brandeille .	alueellisille	10	All
Jesuiittatuomarit totesivat hänet syylliseksi " kohtuuttomuuteen ja tottelevaisuuden puutteeseen " .	syylliseksi	3	Tra
Uutta verotustapaa ei saatu heti toimeenpannuksi epätäydellisen maanmittauksen ja epävarmojen rajojen vuoksi .	epävarmojen	9	Gen
Turkkilaiset kollegani suuresta Turkin kansalliskokouksesta harmittelevat samoin tätä epäkohtaa , nimittäin että kukaan ei halua ilmeisesti puhua heidän kanssaan , ei kansallisista hallituksista tai parlamenteista eikä myöskään lähes kaikista eurooppalaisista instituutioista .	Turkkilaiset	0	Nom
Vaan minä näytän vain ja ainoastaan hyvin nuorelta ja suloiselta tytöltä , jonka silmistä valuu pyöreitä ja tasaisia kyyneleitä .	pyöreitä	15	Par
Eilen halusin vielä ryypätä , koska jokainen lukemani " viini " sana sai minut muistelemaan suloista punaista nestettä , mutta tänään minusta on alkanut tuntua , kuin kaikki Chinaskin juoma alkoholi vaikuttaisi minussakin ja saisi minutkin kärsimään kroonista krapulaa .	kroonista	37	Par
Siinä hän esittää Edmond Burkea , miestä , joka on lopen kyllästynyt nykyiseen elämäänsä ja päättää lähteä öisille kaduille katsomaan , mitä vastaan tulee .	öisille	17	All
Mitä tapahtuu , jos itäeurooppalaiset ja keskieurooppalaiset vallan keskukset kerran siirtyvät ?	itäeurooppalaiset	4	Nom
Yliluonnollisia kokemuksia kokeneet pelkäävät usein sosiaalisten stigmojen eli negatiivisten leimojen saamista itseensä .	sosiaalisten	5	Gen
Tämä ei vaikuttanut oikein terveeltä .	terveeltä	4	Abl
Mikkelinsaaret koostuvat avoimista ulkoluodoista sekä puustoisista sisäsaaristomaisista saarista .	puustoisista	5	Ela
Koko sukupolvi on jatkuvassa liikkeessä .	jatkuvassa	3	Ine
Niin yksinkertaiselta se kuulostaa ; Bostonin voittaminen .	yksinkertaiselta	1	Abl
Työ- ja elinkeinoministeriön tutkimusjohtaja Heikki Räisäsellä on rankka väite : viranomaistoimet ovat lisänneet pitkäaikaistyöttömyyttä .	rankka	7	Nom
Täällä sitä vain nukutaan kuin viattomat porsaat .	viattomat	5	Nom
Ensimmäinen kolmelta viimeiseltä kierrokselta karsiutuja oli Zelezny .	viimeiseltä	2	Abl
Ei se tee ihmisestä mitenkään itsevarmemman , coolimman tai muuten vaan elämässä menestyneen näköistä jos näyttää koko ajan siltä , että tässä nyt masistellaan ja kyllä tympii kaikki !	coolimman	7	Gen
Arafatin tekemät mielivaltaiset muutokset asettavat koko vaalien uskottavuuden kyseenalaiseksi .	kyseenalaiseksi	8	Tra
Tämä vuosikertomus olivatpa mietinnön esittelijän ansiot ja ponnistelut minkälaisia hyvänsä näyttää joka kerran edellisen toistolta , sovinnaiselta ja melko joutavalta .	sovinnaiselta	16	Abl
− Legitimiteetti saattaa kyseenalaistua , mikä on jäänyt keskustelussa liian vähälle huomiolle .	vähälle	10	All
Nyt pystyy vetämään rennosti kisoissa ja silloin suksi kulkee ja laskeminen tuntuu helpolta , Poutiainen kommentoi .	helpolta	12	Abl
Jalmari hämmästyi huomiokykyään , mutta tajusi sen saman tien johtuvan suurimmalta osin naisen erikoisesta ulkonäöstä .	suurimmalta	10	Abl
Tämän lisäksi osa rahoituksesta pyritään keräämään tulevalta yleisöltä ( crowd funding ) .	tulevalta	6	Abl
Aamulla tyttö herää kuumissaan ja kärttyisenä , lakanat tahmeina pitkin lattioita .	kärttyisenä	5	Ess
( 19 ) On tarpeen säätää erityisesti siitä , että vientihinnat ja polkumyyntimarginaalit on arvioitava uudelleen , jos viejä ottaa tullin tietynlaisen tasoitusjärjestelyn perusteella kantaakseen ja jos tulleja ei siirretä niiden tuotteiden hintoihin , joita yhteisön toimenpiteet koskevat ;	tietynlaisen	21	Gen
Suuresta makuuhuoneesta muihin huoneisiin , taas takaisin .	Suuresta	0	Ela
mitä tapahtuu jos/kun Suomi julistetaan luottokelvottomaksi	luottokelvottomaksi	5	Tra
Vuoden 2009 TTW järjestettiin 24. ja 25. lokakuuta välisenä yönä kello 3.30 ( suomen aikaan ) .	välisenä	8	Ess
Olen vasta toisen vuoden opiskelija , joten ehkä ajattelukykyni on vielä hieman puutteellinen , mutta minun silmiini nuo kolme eri kurssia vaikuttaisivat jakavan opintopisteensä hyvin erilaisiin työmääriin perustuen .	puutteellinen	12	Nom
Mediatalo Ilkka kertoi odotuksia suuremmasta tuloksesta sekä valoisista näkymistä loppuvuodelle .	suuremmasta	4	Ela
Tästä voisi saada sen vaikutelman , että on olemassa eräänlainen herrasmiessopimus siitä , että Turkin liittymisestä puhutaan vain salaa hiljaisissa kabineteissa .	hiljaisissa	19	Ine
Yhtiöiden autoja ja muuta kalustoa , jopa kokonaisia öljynjalostamoja verhottiin presidenttiä tukeviin punaisiin kampanjajulisteisiin .	punaisiin	12	Ill
Istahdin kokeeksi sohvalle , joka tuntui kovalta ja karkealta .	kovalta	6	Abl
" Olemme ollut suopeita sellaisissa tapauksissa , että työntekijä on ollut selvästi väsynyt . "	sellaisissa	4	Ine
Hän tuli asiasta hyvin iloiseksi .	iloiseksi	4	Tra
Bussi oli puolillaan iloisia ihmisiä .	iloisia	3	Par
Kestilä arvioi liikkeen varastot niin suuriksi , että niitä oli hyödynnettävä järkevämmin kuin vain metreittäin myytävänä .	suuriksi	5	Tra
Ei korkea älykkyysosamäärä ole aina edes suotava , Leo Sutinen huomauttaa .	suotava	6	Nom
KTM-tallissa ajoi kaudella 2008 11-kertainen maailmanmestari sekä 2-kertainen GNCC sarjan mestari Juha Salminen , sekä nelinkertainen maailmanmestari Samuli Aro , ja maailmanmestari Marko Tarkkala .	11-kertainen	4	Nom
- Henkilö voi kokea itsensä normaaliksi kertomalla yliluonnolliseen liitettyjä tunteita .	yliluonnolliseen	7	Ill
Mistä lie johtuu , mutta Sibelius-viulukilpailun yleisökoostumus ei ole ollut aivan nuorimmasta päästä .	nuorimmasta	11	Ela
Panu näytti äkkiä pelästyneeltä .	pelästyneeltä	3	Abl
Sanotaan että urheilija ei tervettä päivää näe .	tervettä	4	Par
Tämä täyteyhdistelmä oli meille oikein mieluinen ja makujakin oli riittävästi ja mastui hyvälle kylmänäkin	kylmänäkin	13	Ess
Euroopan neuvoston lista ylijalostetuista koirista saikin monet koiraihmiset ensin vain raivostumaan .	ylijalostetuista	3	Ela
Jos Yhdysvallat kieltäytyy jatkossakin tekemästä myönnytyksiä , EU:n on pysyttävä lujana .	lujana	10	Ess
Ongelmalliseksi tunteista puhumisen ja analysoimisen tekee kuitenkin se , että länsimaisessa diskurssissa tunteet on monesti tulkittu muun muassa eläimellisiksi , irrationaalisiksi ja feminiinisiksi .	eläimellisiksi	18	Tra
6_000 miehen vahvuinen YK:n joukko	vahvuinen	2	Nom
Turvamieheksemme oli otettu eräs opexilaistyttö , joka suojeli meitä pelottavilta feministeiltä .	pelottavilta	9	Abl
Leipäpalat voidaan paistaa voissa , ne voidaan myös paahtaa tai tarjota sellaisenaan kylminä tai lämpiminä .	kylminä	12	Ess
Niistä juontuvat mahdollisuudet suvaitsemattomuuteen , negatiiviseen suvaitsevaisuuteen ja positiiviseen suvaitsevaisuuteen .	negatiiviseen	5	Ill
Thomas ( " Thom " ) Edward Yorke ( s. 7. lokakuuta 1968 Wellingborough , Northamptonshire , Englanti ) toimii laulajana-laulunkirjoittajana sekä kitaristina ja pianistina englantilaisessa Radiohead-nimisessä yhtyeessä .	Radiohead-nimisessä	26	Ine
Varovaisen mutta todenmukaisen arvioni , joka perustuu laserin lailla leikkaavaan tarkkailukykyyni , mukaan 75 % toiseen naiseen liittyvistä riidoista eivät liity millään tavalla mustasukkaisuuteen .	todenmukaisen	2	Gen
Jos sattumalta tavataan , niin voin näyttää aika laihalta ja pitemmän näköiseltä kuin vuosi sitten .	laihalta	8	Abl
Miehelle ikääntyminen on selvä ongelma , koska yli kolmekymppisillä naisilla on pääsääntöisesti lapsia ja myös se lapsikiintiö täynnä .	kolmekymppisillä	8	Ade
Suomen syöpäyhdistyksen ylilääkäri Katja Aktan-Collan haluaa keskustelua punaisen lihan suuresta osuudesta ruokavaliossa .	suuresta	9	Ela
54-vuotias merimies seilasi 1987 tanskalaisessa Gerda Vesta -aluksessa Kolumbian ja Yhdysvaltain väliä .	tanskalaisessa	4	Ine
Näin yritetään soveltaa avoimuuden ja osallistumisen kriteerejä myönteisellä tavalla .	myönteisellä	7	Ade
MM-kyykän hieman erilainen urheiluhenki tiesi sen , että doping ei tässä kisassa auttanut , vaikutus oli pikemminkin päinvastainen .	päinvastainen	17	Nom
John McCain ( rep. ) ja Barack Obama ( dem. ) kohtasivat ensimmäisessä vaaliväittelyssään Mississippin yliopistolla perjantai-iltana .	ensimmäisessä	12	Ine
Se 80-luvun tasohan oli kuplatalouden aikaa , aivan epätodellista maailmaa .	epätodellista	8	Par
Entinen kulttuuriministeri Carmen Calvo sosialistisesta työväenpuolueesta sekä Yhdistyneen vasemmiston johtaja Gaspar Llamazares kritisoivat niitä kovin sanankääntein .	sosialistisesta	4	Ela
Nuorempana olin kysellyt Herkolta , että se kuvailisi sitä ja sitä neitosta , mutta --	Nuorempana	0	Ess
Pakkohan upeaa voittoa oli lähteä juhlimaan stadiin , jonne sitten pikku taxisäätöjen jälkeen päästiinkin .	upeaa	1	Par
Onneksi yliopiston rehtori , kaiken itsekin kokenut nuorekas vanharouva , näki tämän huiputuksen lävitse ja määritteli saman tien silikoniotsaisille ihan omat urasyvyysvaatimukset .	silikoniotsaisille	18	All
Joskus prosessi lähtee väärille urille sen jälkeen , kun valtion päämies kieltäytyy alistumasta vaalitulokseen , kuten tapahtui Togossa .	väärille	3	All
Ylemmän tutkinnon suorittaneet ovatkin nyt " esimerkkityöllistyjiä " ja viitoittavat tietä uusille opiskelijoille ja tutkinnosta valmistuville .	uusille	11	All
Tšerepanov oli tehnyt edellisellä kaudella Venäjän liigan tulokkaiden maaliennätyksen ( 17 ) .	edellisellä	3	Ade
Hinta vaikuttaa hyvälle .	hyvälle	2	All
He muuttivat kesäksi reheviin Saarikyliin .	reheviin	3	Ill
Se on kertomus vapaasta kanasta , elävästä , hienosta yksilöstä omine tarpeineen .	hienosta	8	Ela
- En minä tuohon pieneen arkkuun mahdu , Jaakko vastusteli .	pieneen	4	Ill
Tämän kaiken huomioon ottaenkin törmää yliopistolla jatkuvasti tapauksiin , joissa saman oppiaineet samantasoisille opiskelijoille suunnatut kurssit vaativat selkeästi erilaisen työmäärän , mutta antavat työstä saman määrän opintopisteitä .	samantasoisille	12	All
- Se näyttää Suomesta katsoen varsin erikoiselta , hän huomautti .	erikoiselta	6	Abl
Pian koko katu ympäröityy mustavalkoisella usvalla , täysin läpipääsemättömällä oudolla nesteellä .	mustavalkoisella	4	Ade
Minunkin tuttavistani on masentuneita 18 % ja silti käyvät työssä ja juovat joskus viinaa , kerta haluaisivat tulla iloisiksi .	iloisiksi	18	Tra
Unenpuute tekee tunnollisestakin vähitellen hyödyttömän .	tunnollisestakin	2	Ela
Minun kai pitäisi hehkuttaa uuden viran puolesta , mutta aihetta on korkeintaan pidättyväiseen hymyyn .	pidättyväiseen	12	Ill
suo lemusi märiltä kasveilta .	märiltä	2	Abl
Mittaus oli nopeaa .	nopeaa	2	Par
Koko päivän ajan omatuntoni ruoskii minua käsiin levinneistä aikatauluista , koulutöiden aloittamisen siirtämisestä ja muusta yleisestä saamattomuudesta .	yleisestä	15	Ela
Ravitsemisliikkeen saa pitää auki kello kahden ja viiden välisenä aikana .	välisenä	8	Ess
Eräille tärkeille viroille ei oltu määritelty kelpoisuusvaatimuksia lainkaan .	tärkeille	1	All
Olisin valmis tulemaan kuuluisaksi .	kuuluisaksi	3	Tra
Miksi aina minä , on normaali kysymys .	normaali	5	Nom
