Syyttäjä vaatii naispuoliselle auervaaralle rangaistusta törkeästä petoksesta .	naispuoliselle	2	All
Tällä tarkoitetaan erityisesti leimaantumista mielenterveysongelmaiseksi .	mielenterveysongelmaiseksi	4	Tra
CEIOPS:n ammatillisten lisäeläkkeiden komitea laatii parhaillaan asiaan liittyvää luonnosta monenväliseksi yhteistyöpöytäkirjaksi .	monenväliseksi	9	Tra
iljettävältä kuulostava litinä ja lätinä lähtee jokaiselle tutusta vesimelonista .	iljettävältä	0	Abl
Kilpailuun sai osallistua jokainen , joka oli yliopistolla töissä tai opiskelemassa , ja kilpailun voittajalle luvattiin palkinnoksi maallista yltäkylläistä hyvää .	maallista	17	Par
Kolmantena päivänä äiti soittaa kertoakseen asiasta .	Kolmantena	0	Ess
Tanskassa saa sikailla halvalla	halvalla	3	Ade
Kirjassaan Leimu matkailee Euroopan halki tarkastellen kansankulttuurien piirteitä edellä mainitussa viitekehyksessä ja ennen muuta suomalaisesta ja ruotsalaisesta näkökulmasta käsin .	ruotsalaisesta	16	Ela
Korostan , että meidän on taattava , että meriturvallisuus pidetään yhä mahdollisimman korkealla tasolla , mikä tapahtuu kielloilla , rajoituksilla ja takuilla .	korkealla	12	Ade
Se saa kyllä helpolla leipänsä se jätkä loppujen lopuksi jumalauta .	helpolla	3	Ade
Toisin sanoen Persianlahden tai Aasian kaltaisella suhteellisen tuottoisalla vaikutusalueella toimiva lentoliikenteen harjoittaja suuntaa enemmän voimavaroja lentoyhtiönsä turvallisuuteen .	tuottoisalla	7	Ade
Pienillä koululaisilla täytyisi olla mahdollisuus osallistua ohjattuun toimintaan .	Pienillä	0	Ade
toivoisin pääseväni puhumaan seuraaville kielitieteen päiville	seuraaville	3	All
Turun seudun vapaiden ohjelmien käyttäjien ryhmä , Turuxi , järjesti ICT-talolla 8.3. Avoimien ohjelmien päivän .	vapaiden	2	Gen
Minä haluan kuuluisaksi	kuuluisaksi	2	Tra
Jutut olivat aina hurjempia .	hurjempia	3	Par
Juuri kun olin astumassa tukevalle lattialle takaisin , sain huomata tuon venäläisen yrittävän työntää minua hissikuiluun kokonaan .	tukevalle	4	All
Joulun suurin tarkoitus on muistuttaa meitä suurimmasta rakkaudesta .	suurimmasta	6	Ela
Mutta sainpa erinomaiset eväät kirjoittajan uralle : Eino Jutikkalan opetuksen , että talonpoika on Euroopan jalusta . Matti Lauerman muistutuksen , että huolto voittaa sodan . Helge Pohjolan-Pirhosen lempeän humanistisen huomautuksen , että eurooppalaisuus tarkoittaa yhteistä kulttuuripohjaa .	erinomaiset	2	Nom
Annettakoon neuvottelukunnalle työrauha ja vältettäköön kärkevää julkista keskustelua tästä asiasta .	julkista	6	Par
Karismaattiseen liikkeeseen kuuluva Luis Palau saarnasi täpötäydessä jäähallissa jenkkiläiseen tyyliin ihmiset lähes pyörryksiin .	jenkkiläiseen	8	Ill
– ( Epäilyksenalaisten eurooppalaisten ) maiden on tehtävä niin rivakoita toimia omassa talouspolitiikassaan , että ne takaavat maan tervehtymisen .	Epäilyksenalaisten	2	Gen
Käteni suojelevat arkaa ja jäätynyttä sydäntäni , eivätkä jalkani enää herää ikuisesta roudastaan .	ikuisesta	11	Ela
Astronauttien mukana punaiselle planeetalle lähti sankka joukko rohkeita bakteereja , joiden matka avaruuden halki kesti yli kaksikymmentätuhatta sukupolvea .	punaiselle	2	All
Globaten Teemu Välimäki puhui vapaiden ohjelmien taloudellisista ja eettisistä eduista yritykselle .	eettisistä	8	Ela
Neuvottelut alkanevat 27. marraskuuta , ja ne pidetään sotilashenkilöiden välisinä .	välisinä	9	Ess
Baker oli vuonna 1980 ehdolla presidentiksi , mutta putosi kilvan varhaisessa vaiheessa .	varhaisessa	10	Ine
Yleensä aseelliset interventiot eivät ole olleet pelkästään humanitäärisiä interventioita vaan niillä on myös ollut poliittisia pyrkimyksiä .	aseelliset	1	Nom
Eija antaa kiitoksen hyvälle markkinoinnille , kuin myös tanssittaville lauluille .	tanssittaville	8	All
Silmä venyi ja sen aukosta alkoi työntyä ulos valtava ruskea sukkula .	ruskea	9	Nom
Siinä syntyi tavattoman intensiivisiä ja innovatiivisia ideoita , ehdotettiin korkean tornin rakentamista yliopiston huipuksi , koko yliopiston siirtämistä korkean kallion päälle ja huiputuksen ottamista yliopiston ydinosaamisohjelmaan .	innovatiivisia	5	Par
Miten jotkut osaavatkaan elää onnellisina , hän ajatteli .	onnellisina	4	Ess
Pekkarinen tunnustaa olevansa hulluna leluihin .	hulluna	3	Ess
Hauskaa nähdä heidän uusi kotinsa ja toivottavasti tutustua uusiin ihmisiin siellä .	uusiin	8	Ill
− Yliopistot elävät voimakkaassa muutoksessa , mutta perustehtävät pysyvät keskeisinä .	keskeisinä	9	Ess
Radioaktiivinen vilja sotketaan puhtaan viljan kanssa seokseksi , joka viranomaisten mukaan ei ole vaarallista , Bujval irvistää happamasti .	puhtaan	3	Gen
Harmaan graniitin louhintaa on lupa jatkaa seuraavat kymmenen vuotta Kurun Petäjälammin kylässä .	Harmaan	0	Gen
Nykyiseen luonnonmukaiseen elämäntapaan koira sopii jotenkin paremmin .	Nykyiseen	0	Ill
tulla rempseäksi , miehekkääksi ja tatuoiduksi	miehekkääksi	3	Tra
Edunvalvontasektorilla Index on esittänyt hallituksen opintosihteeriä Saku Lehtistä yhteiskuntatieteellisen tiedekunnan kopo-koordinaattoriksi .	yhteiskuntatieteellisen	8	Gen
kolmiloikkaaja kompuroi Paavo Lipposen isoihin jalkoihin .	isoihin	4	Ill
kuvasivat auringonlaskuja kaikilta mahdollisilta kallioilta kaikissa mahdollisissa turistirysissä .	mahdollisilta	3	Abl
Voinen tässä vaiheessa jo turvallisesti todeta , että Iron Sky tulee olemaan eräs tunnetuimmista suomalaisista elokuvista ja se tasoittaa tietä kaikille muille vastaaville nyt tekeillä oleville ( esimerkiksi The Cosmonaut ) sekä tulevaisuudessa vastaavalla tavalla tehtäville elokuville .	vastaavalla	33	Ade
Haluan myös antaa hänelle tunnustusta siitä tehokkaasta tavasta , jolla hän on etsinyt teollisuuden mielipiteitä ja myös ottanut niistä vaikutteita , mikä on mielestäni järkevää .	tehokkaasta	6	Ela
Sarjan hahmot liittyivät suurimmalta osin julkisuuden henkilöihin liittyviin imitaatioihin .	suurimmalta	3	Abl
Sen yläpuoliselle levylle laskettiin erityistä savutusöljyä - käytännössä puhdistettua naftaa - jolloin muodostui paksua savua .	yläpuoliselle	1	All
Vähäisiä julkisen vallan käyttömahdollisuuksia on delegoitu lailla myös yksityisille kansalaisille ( esimerkiksi kalastuksenvalvojat ) , julkisomisteisille liikelaitoksille ja yksityisille yhteisöille ( esimerkiksi yksityiset perusopetuksen antajat ) .	yksityisille	8	All
Esimerkiksi kolikkoautomaateilla panokset pysyvät pieninä , ja suuren velan kerryttäminen on vaikeampaa , Pajula sanoo .	pieninä	4	Ess
Egyptissä kaaos sijoitettiin polttavalle aavikolle , joka reunusti hedelmällistä Niilin laaksoa , siis ihmisten maailmaa .	polttavalle	3	All
soitan sulle tällasesta asiasta kun sä olet tutkinut naisten kieltä .	tällasesta	2	Ela
* 7. kesäkuuta 2009 : Chávez sai tahtonsa läpi : Venezuelan presidentin valtakausien määrä rajattomaksi	rajattomaksi	14	Tra
Metallican Death Magnetic -albumi putosi ykkössijalta kolmoseksi , sillä sen eteen kiilasi myös kotimainen Popeda vastajulkaistulla Täydelliset Miehet -levyllään .	Täydelliset	16	Nom
semssi aktiivissi nuari metsästäji	nuari	2	Par
Eikö äitisi ole mennyt uusiin naimisiin ?	uusiin	4	Ill
Lapsena Wright leikki maineikkailla pedagogisilla leluilla , Fröbelin palikoilla , ja tämä jätti häneen jälkensä .	pedagogisilla	4	Ade
Tuskallisen odotuksen jälkeen hän kakisteli , että ” oli kiva että menit tavalliseen työpaikkaan ” .	Tuskallisen	0	Gen
kuvasivat auringonlaskuja kaikilta mahdollisilta kallioilta kaikissa mahdollisissa turistirysissä .	mahdollisissa	6	Ine
Amerikkalaisille vieraillemme valmistimme kiitospäiväksi kalkkunaa ja englantilaisille jouluksi vanukasta .	Amerikkalaisille	0	All
Iteki olin siitä kiinnostunu , mut se halus tän mun kaverin ja mun piti vaan päästä siitä yli ja pääsinki ku kuulin millanen se oli .	kiinnostunu	3	Nom
Naistutkimuksen ainejärjestön F-pisteen toiminta vaikutti sopivan hassulta .	hassulta	6	Abl
Yleisöä kiinnostivat esimerkiksi kuninkaallisten arkeen kuuluneet julkiset peseytymiset ja pukeutumiset , peruukkien käyttö ja lasten kohtelu pikkuaikuisina .	pikkuaikuisina	16	Ess
Euroopan unionista ei saa tulla sulkeutunutta " Onnellisten kansakuntien kerhoa " , josta Tshekin presidentti Václav Havel hiljattain varoitti .	Onnellisten	7	Gen
Tallinnan ja Helsingin välisessä liikenteessä tehtailtiin heinäkuussa liuta ennätyksiä .	välisessä	3	Ine
Auto on täysin sopimaton enää mihinkään kovempaan kisaan .	kovempaan	6	Ill
Serbien kolmen lentokoneen ilmaisku oli seurausta siitä , että Kroatian armeija oli edennyt Lounais-Bosniassa katkaisten serbien tärkeän huoltoreitin Krajinan pääkaupungista Kninistä Bosnian serbialueille .	tärkeän	16	Gen
Tätä nimetään kansallisessa historiassa " kuninkaalliseksi ongelmaksi " .	kansallisessa	2	Ine
Syntymän jälkeen hänestä tuli Belgian prinssi ja 31. tammikuuta 1910 Kuningas Albert I myönsi nuorelle prinssille erään Euroopan vanhimmista arvonimistä , Flanderin kreivin arvon ,	vanhimmista	18	Ela
Iltapäivän konsertissa esiintyivät vaasalainen melodinen death metal -yhtye Hilastherion , oululainen rockmetalliyhtye Lumina Polaris ja melodinen metalliyhtye Sacrecy , jonka edellisvuoden yleisö äänesti esiintymään toistamiseen .	oululainen	10	Nom
Eikö tahdossa löytää itse se tapa , jolla eläminen tekee kaikkein onnellisimmaksi , ole kunnianhimoa kerrakseen ?	onnellisimmaksi	11	Tra
Hän on ollut puolisen vuorokautta kuolleena	puolisen	3	Gen
Siihenkö sitä nyt ollaan rakastuttu , kaupungin kauneimpaan naiseen ?	kauneimpaan	7	Ill
Myös talouden asiantuntijoiden taholta kuuluu soraääniä : jos kaikki ryhtyisivät tasapuolisesti joutilaiksi ja työskentelisivät vain minimimäärän , millaiset vaikutukset tällä olisi kansantaloudelle ja hyvinvoinnille ?	joutilaiksi	11	Tra
Ihana tunne huomata , ett ei ole hullu , korkeintaan lievästi harhainen .	harhainen	11	Nom
Ylemmän ammattikorkeakoulututkinnon huono tunnettuus vaikeuttaa tutkinnon suorittaneiden etenemistä uralla .	Ylemmän	0	Gen
Uusiseelantilaiset katsovat kuten minä , suurista lasikatakombeista hiljaiselle Tyynellemerelle .	hiljaiselle	7	All
Oli kyse sitten Yhdysvaltain kaltaisesta suuresta maasta tai Kreikan kaltaisesta pienestä maasta , sen on lopetettava ylellinen elämäntapansa ja palattava tiukkaan taloudenpitoon , jos se ei halua kansallisen velan paisuvan kestämättömälle tasolle ja räjähtävän .	suuresta	5	Ela
Hän aloitti armenialaisen prinssin Vardan I Mamikonianin kanssa avoimen kapinan sassanideja vastaan ja jatkoi epätoivoista , lopulta tuloksettomaksi jäänyttä kamppailuaan elämänsä loppuun saakka .	tuloksettomaksi	17	Tra
Ruskistin kyljykset paistinpannulla tilkassa öljyä ( kaksi kyljystä mahtui just ja just ruskistumaan samanaikaisesti isolle pannulle ) + ripsottelin mustapippurirouhetta ja suolaa lihoille ja lisäsin samalle pannulle ruskistumaan omenalohkot ja otin ne sitten lautaselle odottamaan ... .	isolle	14	All
Tapahtuman vähemmän raskasta antia esitti oululainen , raskasta rockia soittava Ristinolla .	oululainen	5	Nom
Max esitteli meille Michelin , touhottavan , mutta minusta mukavan oloisen partaniekan , jolla oli pienet uteliaat oliivisilmät .	oloisen	10	Gen
Valtaa on siirtynyt markkinoille eli yritysjohtajille ja virkamiehille sekä ylikansallisille poliittisille elimille .	ylikansallisille	9	All
Keskuspuolustajaksi suhteellisen lyhyenä ( 5'11" , n. 180,5 cm ) hän ei taistellut ensisijaisesti korkeista keskityspalloista , vaan luotti parhaimmillaan häikäisevään nopeuteensa ja vahvaan taklauspeliin .	häikäisevään	20	Ill
Kädessään hänellä on hohtavan valkoinen , suuri kello , jonka viisarit kulkevat epänormaalin nopeasti .	hohtavan	3	Gen
Minulla on fanaattinen himo riisua joulu kodista aika pian joulun jäätyä taakse .	fanaattinen	2	Nom
Testiryhmä suosittelee asua viikonloppukelkkailijoille ja kalareissuille , miksei myös lyhyille safareille .	lyhyille	9	All
Viikko tuntuu lyhyeltä ajalta tutustua edes osaan saaren menneisyydestä .	lyhyeltä	2	Abl
Se tuoksui naiselta – ei sellaiselta puhtaalta , vaan vahvalta , tummalta ja vaaralliselta .	tummalta	11	Abl
Olen psyykannut itseni siihen , että nyt on aika luopua turhista tavaroista oikein suurella marginaalilla .	turhista	10	Ela
Partiomiehenä kuului Määttäselle toiminta kaukana vihollisen selustassa ja hänen pisimmän aikaa kestänyt partionsa oli tasan kuukauden mittainen ja tämän matkan aikana taivallettiin yli kaksisataa kilometriä jalkaparikassa .	pisimmän	9	Gen
Puitteiden kulmakiviä ovat ehdotukset konkreettisiksi toimiksi , joilla yhteiset perusperiaatteet pannaan täytäntöön , sekä useat niitä tukevat EU:n järjestelmät .	konkreettisiksi	4	Tra
Kanerva ei pidä kysymystä tällä hetkellä millään muotoa ajankohtaisena .	ajankohtaisena	8	Ess
Suomalaisen luonto on semmoinen , ettei se helposti anna itsensä joutua naurunalaiseksi muiden silmissä .	naurunalaiseksi	11	Tra
Kirjeenkirjoittamispuuhassa yleisön keskuudessa ihmeellisimpänä pidettiin kirjoitusvälinettä .	ihmeellisimpänä	3	Ess
Sen jälkeen kun homoja muutenkin alkoi telkkarissa olla ihan omana itsenään ?	omana	9	Ess
Lahtivalas kasvaa noin kymmenen metrin pituiseksi ja jopa kymmenen tonnin painoiseksi .	painoiseksi	10	Tra
Laulua saatiin kuulla paljon ja korkealta ; joku epäili lokiin eräiden miespuolisten festeilijöiden kivesten kadonneen .	korkealta	5	Abl
´ kuntalaisten yhteinen osuus on 4_600 mk ´	kuntalaisten	1	Gen
Se on Suomen neljänneksi korkein tunturi , korkeudeltaan yli 1240 metriä .	neljänneksi	3	Tra
Se on varmalla tapaa kaunis .	varmalla	2	Ade
Edellisestä illasta uupuneet sankarit saivat uutta nostetta pelin tiukoista käänteistä , ja päätimme lähteä kaupungille pörräämään ja ihmettelemään kaikkea .	Edellisestä	0	Ela
Ensin peseytyisin , kampaisin ja pukeutuisin puhtaisiin , sitten heittäisin myrkyt kurkkuuni ja kääriytyisin peitteeseen .	puhtaisiin	6	Ill
Ennen virallisen ohjelman alkamista Saara käytti minua koe-eläimenä irtoripsitutorial-esitystään varten .	virallisen	1	Gen
Punkalaitumella on päädytty vastakkaiselle kannalle ja päätetty säilyttää kunnan kunnallinen itsenäisyys .	vastakkaiselle	3	All
Mansikoihin emme saaneet koskea emmekä vattuihin , viinimarjoistakin vain happamia punaisia olisi saanut vapaasti syödä .	happamia	9	Par
Tšeljabinskin kaupunki Venäjällä yrittää puhdistaa mainettaan yhtenä maan saastuneimmista kaupungeista .	saastuneimmista	8	Ela
Tässä jutussa haastatellut ihmiset esiintyvät väärillä nimillä .	väärillä	5	Ade
Mahtavasta varjosta työntyi esille suuri hymyilevä aurinko , joka tuijotti alaisiaan ääneti ainokaisella silmällään .	hymyilevä	5	Nom
Euroopan unionin jäsenyys tai se , haluaako Nato meitä vai ei , on ollut tähän asti hämärää .	hämärää	16	Par
Muista Jallu eräät kuuluisat radiopuheet .	kuuluisat	3	Nom
megaluokan nimiä ei Tammerfestiin ole tulossa , mutta ei myöskään pelkkiä tuntemattomuuksia .	pelkkiä	10	Par
Yläraajat nykivät kärsimättöminä ja tekee mieli hyppiä ilmaan .	kärsimättöminä	2	Ess
Lappilainen joiku on toinen Suomen alueella vaikuttanut lauluperinne , mutta varsinaiseen suomalaiseen musiikkiin se ei perinteenä ole vaikuttanut .	varsinaiseen	10	Ill
Lopuksi haluaisin todeta ja painottaa sitä , miten suuren merkityksen olen mietinnössä halunnut antaa mahdollisille muille kuin kaupallisille käyttötarkoituksille , joita takavarikoiduille tavaroille voidaan löytää .	kaupallisille	17	All
Näin jääkiekon maailmanmestaruuden ( joita ilmeisesti tulee vain 16 vuoden välein ) ohella on mukava nostaa esiin suomalaisten harrastelijoiden ( tai ei ehkä enää pelkkien harrastelijoiden ) tekemä pioneerityö , jolla he pyrkivät uudistamaan tapaa , jolla elokuvia tehdään .	pelkkien	24	Gen
Koti on varsinkin illansuussa monenlaisten tunteiden sulattamo	monenlaisten	4	Gen
Hän piti tiedemiesten uusia otsaryppyjä lupaavana merkkinä , mutta samalla häntä huolestutti , että osa aiemmista rypyistä oli selvästi oikeamassa .	lupaavana	5	Ess
enemmistö tämän päivän suomalaisista elää kaupungeissa .	suomalaisista	3	Ela
Innostuin juoksemaan vastakkaisella seinällä olevalle sohvalle .	vastakkaisella	2	Ade
Ottamatta tässä huomioon kansallisten yhteyspisteiden varsinaiseen perustamiseen liittyviä henkilöstö- , toimitila- ja tietotekniikkajärjestelyitä , EMN:n toiminnan keskeiset tulokset vuodesta 2002 aina tähän hetkeen voidaan noiden periaatteiden pohjalta esittää seuraavasti :	varsinaiseen	5	Ill
Hän on kaukana niin suomalaisesta kuin venäläisestäkin mentaliteetista .	suomalaisesta	4	Ela
Siellä hän karismallaan sai useita nuoria miehiä kiinnostumaan jesuiittaurasta , minkä lisäksi hänestä itsestään tuli vaikutusvaltainen henkilö Portugalin hovissa .	vaikutusvaltainen	15	Nom
Muistui mieleen muutaman vuoden takaa eräät naispuoliset kuntonyrkkeilijät kuuluisalla salilla .	kuuluisalla	8	Ade
Täällä kriittinen pohdiskelu pyritään leimaamaan jollain tavalla kelvottomaksi .	kelvottomaksi	7	Tra
Silppu värjäytyy kauniin punaiseksi taideteokseksi .	punaiseksi	3	Tra
Suurimman yksittäisen rahoituksen saa dosentti , akatemiatutkija Niklas Wahlbergin johtama tutkimushanke , jonka otsikkona on Diversification of plant-feeding insects over millions of years : what is the role of dramatic climate changes ? ( 226_200 euroa ) .	yksittäisen	1	Gen
Enimmäkseen hän törmää nuoriin perheisiin , joissa ei ole ennen lapsen tuloa tehty ruokaa edes itselle .	nuoriin	3	Ill
Sinne oli kova työ päästä , kalliot olivat yöpakkasesta liukkaat .	liukkaat	9	Nom
Myytissä kerrotaankin , kuinka Esi-isät loivat myös ensimmäiset ihmiset ja antoivat heille tiedon , millainen luotu kosmos on ja kuinka siinä tulee elää ja toimia .	millainen	14	Nom
Hän ajatteli , että muotitoimittajana istun vain nättinä studiossa ja ajan heti työpäivän jälkeen kotiin .	nättinä	7	Ess
Olin ennen avajaisia miettinyt kovasti että pääsisinkö laajennusosaan töihin , vai joutuisinko pysymään vanhemmalla alueella .	vanhemmalla	13	Ade
Herra Gary Titley viittasi siihen , että toimintasuunnitelma ei ole mikään uusi väline , se ei ole mikään uusi ohjelma , vaan sillä sovitetaan yhteen nykyisiä toimia ja se on Euroopan unionin yhtenäinen väline ja yhtenäinen suunnitelma .	nykyisiä	25	Par
jos kevät oli ollut myöhässä , niin tuo tuolla vastapäisen talon seinustalla nojaileva lehmus oli ollut sinä kohtalokkaana perjantaina lehdetön .	kohtalokkaana	17	Ess
Tos oli Hesaris nimittäi savolaisista juttuu ja savolaisesta murrest	savolaisesta	7	Ela
Kumia voi ottaa pois kulutuspinnan alapuolisista kerroksista , ei itse pinnalta .	alapuolisista	5	Ela
Suurelle kentälle oli levitetty pilsneritölkkejä joita kolmikko lähti etsimään .	Suurelle	0	All
Alankomaalainen Club Cruise hankki aluksen viime vuoden marraskuussa ja toi sen Bahamalta Italian Genovaan kasino- tai risteilykäyttöön muutettavaksi .	Alankomaalainen	0	Nom
Kävin nuorempana paljon mettällä , tuli hirviäkin teurastettua , tuumaa Sulo .	nuorempana	1	Ess
Vuoden mittaan saattaa tulla ja tuleekin elämään kuuluvia eripuraisuuksia joko syystä tai tyhjästä , mutta jouluna muistetaan kaikki se hyvä , mitä on toisilta saatu .	tyhjästä	12	Ela
Ilo kuitenkin säilyi , luinpa mitä tahansa versiota , vaikka selvältä tuntuukin , että Liisan seikkailut on niitä kirjoja , joiden luonne ajan myötä muuttuu .	selvältä	10	Abl
Mustan elokuvan renessanssi ?	Mustan	0	Gen
hallituksen jäsenyys konkurssiin menneessä rakennusliike Hakassa uhkasi tehdä hänestä kirjattoman ja karjattoman tai pikemminkin autottoman ja talottoman miehen .	karjattoman	11	Gen
Toki joukkoon on mahdutettu myös jokunen ikivihreä ei-kurulainen tango .	ikivihreä	6	Nom
6. Myynti- , hallinto- ja muita kustannuksia sekä voittoa varten lisättyjen määrien on perustuttava tosiasialliseen tietoon , joka pohjautuu tutkittavana olevan valmistajan tai viejän samankaltaisen tuotteen valmistamiseen ja myyntiin tavanomaisessa kaupankäynnissä .	tavanomaisessa	29	Ine
* 1988 – Neuvostoliiton avaruussukkula Buran teki miehittämättömän lennon kiertäen Maan kahdesti .	miehittämättömän	7	Gen
Olin taas töissä nuhaisena	nuhaisena	3	Ess
ulkomaalaisten korvissa Nokia ei kuulosta suomalaiselta , vaan japanilaiselta .	suomalaiselta	5	Abl
Eilisellä kotimatkalla , kun raahasin miljoona laukkujani / kassejani / pussukoitani rautatieasemalta kotiin , vasenta jalkaani alkoi vihloa .	vasenta	14	Par
Dora oli kirjoittanut kalligrafialla punaisella musteella ylelliselle kermanvalkoiselle vesiviivapaperille --	kermanvalkoiselle	7	All
Miksi joensuulainen nukketeatteri Vunukka esiintyi Suovanlahdella , pienellä syrjäisellä kylällä ?	syrjäisellä	8	Ade
Saksa on yhä lähempänä saavuttaa Otto von Bismarckin unelman Euroopan laajuisesta taloudellisesta imperiumista , Oborne kirjoittaa .	laajuisesta	10	Ela
Hänen oli tarkoitus lopettaa uransa joka tapauksessa kauden 2008 jälkeen , mutta hieman tyylikkäämmällä tavalla .	tyylikkäämmällä	13	Ade
Kun lapsi alkaa lähestyä puberteetti - ikää , tulee näkyväksi muutos .	näkyväksi	9	Tra
Kansainvälisillä toimijoilla tilaa kaupungistuvassa Kiinassa	Kansainvälisillä	0	Ade
Ihmisen muisti on siitä hyvä , että se säilyttää hyvät muistot paremmin kuin huonot .	huonot	13	Nom
Hänen elämäntyylinsä ei kuitenkaan ollut jesuiitta-aatteen mukaista , minkä vuoksi veljeskunnan johtajaksi kohonnut Loyola joutui vaatimaan häntä kuuliaisuuteen useilla kirjeillä .	useilla	18	Ade
Mies , joka oli opittu yhdistämään kiinteästi Pahkasika-lehteen ja sen ei-mihinkään-liittyvään huumoriin julkaisi tasokkaan romaanin .	ei-mihinkään-liittyvään	10	Ill
Lapsi rakasti minut ehjäksi .	ehjäksi	3	Tra
mä pidin itteeni semmosena fiksuna ja sen takia oli pää auki aina ja joka paikassa ja .	fiksuna	4	Ess
silloin on jo liian myöhäistä tehdä mitään .	myöhäistä	4	Par
Toivottavasti ette saa minusta liian pehmeää ja filosofeeraavaa kuvaa .	pehmeää	5	Par
Ikivihreät peittoperennat menestyvät parhaiten varjoisessa kosteahkossa kasvupaikassa .	varjoisessa	4	Ine
Saattaa olla , että poliittisella puolella ei ole täysin ymmärretty tätä , kuinka tärkeä asia perusvoimaratkaisu teollisuudelle on .	poliittisella	4	Ade
Suurelta naistutkimus kaatui kuitenkin liian naiiviin yksinkertaistettuun provosointiin ja propagandaan , mikä aiheutti vain kielteisen vastareaktion .	Suurelta	0	Abl
Sellainen keskustelu voi ehkä myötävaikuttaa myös keskuudessamme elävien turkkilaisten siirtolaisten integroitumiseen .	turkkilaisten	8	Gen
Muut kolmesta suurimmasta puolueesta menettivät vielä enemmän valtuustopaikkoja .	suurimmasta	2	Ela
Mykkänen makasi silmät kiinni aamun harmaassa viimassa .	harmaassa	5	Ine
Välillä taantuma laskee tunnelmaa , mutta uutteralla työllähän siitäkin selvitään .	uutteralla	6	Ade
Jälkimmäinen pääsee varmasti ahkeraan käyttöön ja läheiset kotona ja sen ulkopuolella pääsevät nauttimaan uusista herkuista .	ahkeraan	3	Ill
Täytyy myöntää , että huoneeseeni päästyä kiedoin kerran käytetyn pyyhkeen pitkiin hiuksiini ja peitin puhtaan varteni kylpytakilla , mutta jos olisin lyhythiuksinen ja kiireinen , olisin voinut aivan hyvin vain pyyhkäistä hiukseni kuivaksi ( käsipyyhkeeseen ) ja pukeutua samantien .	kuivaksi	32	Tra
Hallintovirkamies hymyili tyytyväisenä .	tyytyväisenä	2	Ess
Tuntuuko mukavalta ihan sitte .	mukavalta	1	Abl
Niinpä hän on yhä sellaisessa kunnossa , että kelpaa rohkaisevaksi malliksi nuoremmilleen .	nuoremmilleen	11	All
Varsinaiselta ammatiltaan hän on ulosottomies .	Varsinaiselta	0	Abl
Vain harvalle meistä on mahdollista ottaa lomaa laihdutuksen ajaksi , vaan meidän on suoriuduttava jokapäiväisistä töistämme .	jokapäiväisistä	14	Ela
Kala-altaissa on kirjolohta , jota yli sata kustavilaista jalostaa edelleen kaupunkilaisille syötäväksi .	kustavilaista	7	Par
Lapsi , kuinka isoksi sinä oletkaan kasvanut !	isoksi	3	Tra
Mitali myönnettiin myös tunnustuksena pitkäaikaisesta nuhteettomasta ja erittäin ansiokkaasta toiminnasta Turun yliopiston palveluksessa .	pitkäaikaisesta	4	Ela
Valmiina mäelle rakennettu puisto soveltui tuon ajan muodikkaille harrastuksille – julkiselle kävelylle ja idyllisten maisemien katselemiselle .	muodikkaille	7	All
Sen muistan etten maksanut siitä paljoa , en olisi laittanut vähäisiä varojani kalliiseen olkikoiraan .	kalliiseen	12	Ill
Penelope Livelyn kaksi aikaisempaakin romaania ovat myös olleet Booker-ehdokkaina .	aikaisempaakin	3	Par
Kauniilla ilmalla voin pitää työni täällä vintillä , koska tänne tulee hyvin valoa .	Kauniilla	0	Ade
EU:n naapurimaille on tehtävä selväksi , millaiset edellytykset niiden on täytettävä , jotta viisumimenettelyjä ensiksikin aidosti yksinkertaistetaan ja toiseksi jotta pakollisesta viisumivaatimuksesta jonakin päivänä luovutaan .	pakollisesta	20	Ela
b ) maatalousajoneuvot , sotilasajoneuvot sekä julkiselle keskus- tai paikallishallinnolle kuuluvat ajoneuvot , lukuun ottamatta julkisille yrityksille ja erityisesti rautatieyrityksille kuuluvia tavarakuljetukseen tarkoitettuja tieliikenteen moottoriajoneuvoja .	julkiselle	6	All
Nerokkainkin huippuosaaja aloittaa Accenturella uramallin alkupäästä , mutta vastineeksi ura etenee vuosien mittaan tasaisesti ja ennakoitavasti , ja sama koskee palkkapussia .	Nerokkainkin	0	Nom
Amerikkalaisille vieraillemme valmistimme kiitospäiväksi kalkkunaa ja englantilaisille jouluksi vanukasta .	englantilaisille	6	All
Mårten oli sen sijaan päättänyt jättää itsestään pysyvän muiston jälkipolville lahjoittamalla Tukholman saksalaiseen kirkkoon uuden alttaritaulun .	saksalaiseen	12	Ill
